Keyword,User,Tweet,Language,Time,User Location,Hashtag,Polarity,Likes,Retweet,Sentiment
anime,curs3dvampire,black clover is a simple shonen animemanga I dont know why people were expecting so much from it,en,2022-04-15,he/him • multifandom,[],positive,0.0,0.0,0.0111111111111111
anime,ImBlue4S,RT PlatinumOra I was rewatching some ReZero episodes and I have to say season 2 episode 4 is one of my favorite episodes of all time Th,en,2022-04-15,,[],positive,0.0,42.0,0.5
anime,kaliuwu_,RT westjett1 Riot Games did a really good job with Arcane Now its time to make a Valorant Anime and have Jett and Viper kiss,en,2022-04-15,"Barcelona, CataluNYA",[],positive,0.0,233.0,0.7
anime,Reyhanfsh,RT ShonensPicture Anime is for kids,en,2022-04-15,Los Angeles,[],neutral,0.0,2898.0,0.0
anime,DumDrip,RT JustSpicy Anime girls are not limited by laws of physics,en,2022-04-15,,[],positive,0.0,88.0,0.0357142857142857
anime,dellycroix,RT sharanicolelynn 1 I am a person lmfao Black people will stay voicing in anime whether you like it or not 2 Yall can go and blo,en,2022-04-15,"Kraków, Polska",[],negative,0.0,14738.0,-0.2083333333333333
anime,IuIu_ebooks,top 10 anime fights,en,2022-04-15,,[],positive,0.0,0.0,0.5
anime,SirenWen,RT hanipreeng The Heroine Tarumono Anime Episode 2 Broadcast Commemoration Login Bonus is being held until 400 JST on 421Login du,en,2022-04-15,"Barranquilla, Atlántico",[],neutral,0.0,1.0,0.0
anime,bhavinderjit7,RT ShonensPicture Anime is for kids,en,2022-04-15,"Bandar Lunas, Kedah",[],neutral,0.0,999.0,0.0
anime,shfln_,just watching the 1st episode of tpn and the heck was that anime about,en,2022-04-15,,[],neutral,0.0,0.0,0.0
anime,ugochytino,RT thegreatola 2x Yugennft WHITELIST SPOT Courtesy of the team TO ENTER Follow hangoutDao Yugennft amp thegreatola Like,en,2022-04-15,"Abu Dhabi, United Arab Emirate",[],neutral,0.0,318.0,0.0
anime,bendale204,hey not new to anitwt likert to be moots i lovevinland saganarutolaingrand blueaotgintamanichijoudororocote animebanana fishdeath notekon,en,2022-04-15,"Snack Smile, Edo ",['anitwt'],positive,0.0,0.0,0.2286931818181818
anime,rx_ofrecio,RT CloneX7100 WL GIVEAWAY 3x WLs for BoardGamersNFT courtesy of the team How to enter Follow BoardGamersNFT amp 0xFalcott,en,2022-04-15,,[],neutral,0.0,1088.0,0.0
anime,one_jay_one,RT Pochitadoll the most unnecessary sequel to a animemanga ever,en,2022-04-15,"Ottawa, Ontario",[],positive,0.0,526.0,0.0499999999999999
anime,Yuri_bc4,RT VisualAnimes One of the biggest anime glow ups,en,2022-04-15,Manaus,[],neutral,0.0,1683.0,0.0
anime,aunknown_blue,RT deriannop Anime One Piece,en,2022-04-15,in the bluest sea,[],neutral,0.0,268.0,0.0
anime,KamisamaBratz,RT whatcler people will call anime weird then watch 27 year olds play highschoolers on netflix,en,2022-04-15,United States,[],negative,0.0,36492.0,-0.5
anime,Mxmbmt,RT AoTJewels Return to Shiganshina is one of the greatest arcs in anime history,en,2022-04-15,,[],positive,0.0,3325.0,1.0
anime,dailyanimecon,RT poemsbleach a little bit later but thank you all for all these times the bleach poems page has finally come to an end time has go,en,2022-04-15,Japan,[],negative,0.0,13.0,-0.0625
anime,TakakuraKen24,SirBlackReaper cincojayy Only anime rodney ever watched was initial D,en,2022-04-15,,[],neutral,0.0,0.0,0.0
anime,araceli50668305,RT Lokokabooster2 Ai Anime Kaguyasama Love is War s3 Ultra Romantic,en,2022-04-15,,[],positive,0.0,34.0,0.25
anime,KyameronKing,random7s Its from an anime called Magus Bride his name is Elias,en,2022-04-15,@ClayAhktar ♡,[],positive,1.0,0.0,0.5
anime,linksgruenLeon,RT sharanicolelynn 1 I am a person lmfao Black people will stay voicing in anime whether you like it or not 2 Yall can go and blo,en,2022-04-15,Freiburg im Breisgau,[],negative,0.0,15442.0,-0.2083333333333333
anime,legosecond2000,RT phnixhamsta Minecraft is now an anime,en,2022-04-15,大阪,[],neutral,0.0,356.0,0.0
anime,AsheAzure,RT SeinenVibes Anime Attack On Titan,en,2022-04-15,,[],neutral,0.0,957.0,0.0
anime,than_atos_sama,If were being honest Samurai Champloo is right up there with the rest of the GOATED anime,en,2022-04-15,,[],positive,0.0,0.0,0.4428571428571428
anime,Capi_Barbosa,RT leotsukjnaga Once every year the anime locals find out about egu and its so funny how its always like omg cant believe he is handsome,en,2022-04-15,,[],positive,0.0,134.0,0.25
anime,TheWaifuArmy,wake up girlsanime manga waifus,en,2022-04-15,,"['anime', 'manga', 'waifus']",neutral,0.0,0.0,0.0
anime,undeadrrabbit,RT sharanicolelynn 1 I am a person lmfao Black people will stay voicing in anime whether you like it or not 2 Yall can go and blo,en,2022-04-15,,[],negative,0.0,11573.0,-0.2083333333333333
anime,kazvutra,The25thBam I prefer Mikaela over the entire seraph of the end mangaanime,en,2022-04-15,,[],neutral,0.0,0.0,0.0
anime,AdventuresAnime,Happy NationalAnimeDay I love how our common love for anime has connected us in ways I could never have imagined What was the first show you watched that got you interested in anime,en,2022-04-15,,['NationalAnimeDay'],positive,0.0,0.0,0.3666666666666667
anime,mirukuopp,Hot takeSAO is trash The idea that 1 guy is gonna out level entire guilds in an MMO is the laziest self insert writing I have ever seen I have seen 12 episode harem anime that handle getting all the women better Its worst offense is him blocking an attack while in a COMA,en,2022-04-15,Eorzea doin your mom,[],negative,0.0,0.0,-0.0699999999999999
anime,myanimelist,News Isekai wa Smartphone to Tomo ni In Another World With My Smartphone TV anime gets Season 2,en,2022-04-15,"San Francisco, CA",['イセスマ'],neutral,0.0,0.0,0.0
anime,plumpCherryy,RT FlurETH Rare NFT Giveaway Cute Anime Utility Token launch tomorrow Kidzuki was a free mint and is growing fast with an,en,2022-04-15,,"['NFT', 'Anime', 'Kidzuki']",positive,0.0,531.0,0.4083333333333332
anime,saljutokyo,leggo kita main 1 like for 1 of my anime character kinnies and the reason why i kin them,en,2022-04-15,fyi : an enfp with he/they pro,[],positive,0.0,0.0,0.2083333333333333
anime,Vmin_Babies,RT AoTJewels Return to Shiganshina is one of the greatest arcs in anime history,en,2022-04-15,,[],positive,0.0,3071.0,1.0
anime,phmanhhungwt,Letmespeakorg anime,en,2022-04-15,,[],neutral,0.0,0.0,0.0
anime,T2PFlacko,Im tryna be laid up today and watch some anime,en,2022-04-15,"Trenton, NJ",[],neutral,0.0,0.0,0.0
anime,moolegx,RT catiescos do I look like an anime villain,en,2022-04-15,Neraka,[],neutral,0.0,854.0,0.0
anime,reoigari,RT sharanicolelynn 1 I am a person lmfao Black people will stay voicing in anime whether you like it or not 2 Yall can go and blo,en,2022-04-15,日本語勉強中,[],negative,0.0,11865.0,-0.2083333333333333
anime,GODLXST,izethetics vids remind me of karaoke anime dancers,en,2022-04-15,he/him,[],neutral,0.0,0.0,0.0
anime,Sheddy_IB,RT CloneX7100 WL GIVEAWAY 3x WLs for BoardGamersNFT courtesy of the team How to enter Follow BoardGamersNFT amp 0xFalcott,en,2022-04-15,"Lagos, Nigeria",[],neutral,0.0,386.0,0.0
anime,MovieManMadness,RT sharanicolelynn 1 I am a person lmfao Black people will stay voicing in anime whether you like it or not 2 Yall can go and blo,en,2022-04-15,Asgard,[],negative,0.0,11655.0,-0.2083333333333333
anime,slsfhh,RT AoTWiki 9 Years AgoArmored Titan Anime Debut,en,2022-04-15,She/they . 8teen,[],neutral,0.0,1361.0,0.0
anime,Raxens1,RT AoTWiki 9 Years AgoArmored Titan Anime Debut,en,2022-04-15,Paradis,[],neutral,0.0,1353.0,0.0
anime,Ellie_Miller_11,RT animesvisuaI Anime Spirited Away,en,2022-04-15,Jackson,[],positive,0.0,379.0,0.5
anime,lumiette_ffxiv,RT buncrimes yshtola has a magical girl summon sequence krile wears cat ears graha is a retrofuturisturianger larpsalphinaud takes,en,2022-04-15,crystal/brynhildr • EST,[],positive,0.0,255.0,0.5
anime,yumeyumeruhen,idol anime gives you a different type of pain cinderellazile,en,2022-04-15,22 she/her,['cinderellazile'],neutral,0.0,0.0,0.0
anime,floatingheadart,RT specialmamon Man 2022 has some good anime AlbanKnoxArt Briskart shikimorisan arttwt artph,en,2022-04-15,,"['AlbanKnoxArt', 'Briskart', 'shikimorisan', 'arttwt', 'artph']",positive,0.0,1726.0,0.7
anime,Neto_Linan,RT GuardianTalesEN Its national Anime Day We dont have our own anime series but we do have a cool intro and very cute characters a,en,2022-04-15,"Tamaulipas, México",[],positive,0.0,53.0,0.5333333333333333
anime,KAMUIRAIK4RU,RT HxHContents AnimeHunter x Hunter,en,2022-04-15,ψ ⎊⍟ ,[],neutral,0.0,765.0,0.0
anime,mccuddlezsv2,Wictor2501 Tsundere isnt bad as a concept but modern animemanga really ruin it,en,2022-04-15,,[],negative,0.0,0.0,-0.0999999999999999
anime,lalo_8000,RT JustSpicy Anime girls are not limited by laws of physics,en,2022-04-15,,[],positive,0.0,227.0,0.0357142857142857
anime,XxBlueCoffeexX,moistcr1tikal is by far the greatest youtuber on the planetgaminglife instagaming like gamerlife instagamer pcgamer funny gamingsetup k gameplay r nintendoswitch gamingmemes anime fortniteclips retrogaming instagram battleroyale warzone pubgmobile,en,2022-04-15,,"['gaminglife', 'instagaming', 'like', 'gamerlife', 'instagamer', 'pcgamer', 'funny', 'gamingsetup', 'k', 'gameplay', 'r', 'nintendoswitch', 'gamingmemes', 'anime', 'fortniteclips', 'retrogaming', 'instagram', 'battleroyale', 'warzone', 'pubgmobile']",positive,0.0,0.0,0.45
anime,andreaaldy21,RT TheAn1meMan There are two types of anime fans1 Those who keep up every week to all the new shows coming out per season2 Those wh,en,2022-04-15,Java,[],positive,0.0,1102.0,0.1363636363636363
anime,sebasviery,RT CloneX7100 Project Kurayami x SSSC WL Giveaway3x Whitelist for Project KurayamiRulesFollowProjectKurayamiireneyin2nftC,en,2022-04-15,,['Whitelist'],neutral,0.0,53.0,0.0
anime,top_pazinato,RT Animevizuals Anime Demon slayer,en,2022-04-15,,[],neutral,0.0,47.0,0.0
anime,sakamatalover,Looking at anime women in public,en,2022-04-15,19 they/them,[],neutral,0.0,0.0,0.0
anime,651bae,RT BrichibiTweets Anime is viewable to anyone whos interested so why is the big shock when Black people participateHere are the in,en,2022-04-15,,[],positive,0.0,964.0,0.0277777777777777
anime,franxxaes,RT sharanicolelynn 1 I am a person lmfao Black people will stay voicing in anime whether you like it or not 2 Yall can go and blo,en,2022-04-15,15 she/her || eng/fil,[],negative,0.0,15442.0,-0.2083333333333333
anime,KimHyoMi8,RT midnightenvy77 ayatohour The fact that AYATOS DAD HAS THE DEAD ANIME MOM HAIRSTYLE IS SO FUNNY TO ME,en,2022-04-15,"Buenos Aires, Argentina ",[],positive,0.0,25.0,0.0249999999999999
anime,bjtkmc,RT wildzo Pink Trio SAKURA sakuraharuno ItadoriYuuji AnyaForger anya SPYxFamily naruto jujutsukaisen fanart anime https,en,2022-04-15,she/they,"['SAKURA', 'sakuraharuno', 'ItadoriYuuji', 'AnyaForger', 'anya', 'SPYxFamily', 'naruto', 'jujutsukaisen', 'fanart', 'anime']",negative,0.0,701.0,-0.1953125
anime,benjanun_s,RT rahkan If you count manga anime and Japanese video games the average American 15 year old has consumed more Japanese narrative than,en,2022-04-15,"Lesbienne, tres bien",[],positive,0.0,1.0,0.075
anime,WeallNightcore,RT FallenNight1345 MetatronAnime The Seven Heavenly Virtues,en,2022-04-15,,[],neutral,0.0,2.0,0.0
anime,pepsitouille,RT HxHContents AnimeHunter x Hunter,en,2022-04-15,"bi, demi",[],neutral,0.0,765.0,0.0
anime,DnDSesame,May you have a Happy PassoverHappy Good FridayHappy Anime Day,en,2022-04-15,,[],positive,0.0,0.0,0.7749999999999999
anime,XaymaraRenteria,RT animesvisuaI Anime Spirited Away,en,2022-04-15,"San Diego, CA",[],positive,0.0,379.0,0.5
anime,Chinobu_TK,RT selectl4sa lisa as anime characters,en,2022-04-15,ประเทศไทย,[],neutral,0.0,17.0,0.0
anime,ImAkk0,RT Lokokabooster2 Anime SPY x FAMILY ep2 pv,en,2022-04-15,"Socorro, Colombia",[],neutral,0.0,505.0,0.0
anime,FakePenmug,RT specialmamon Man 2022 has some good anime AlbanKnoxArt Briskart shikimorisan arttwt artph,en,2022-04-15,ประเทศโลกที่สาม,"['AlbanKnoxArt', 'Briskart', 'shikimorisan', 'arttwt', 'artph']",positive,0.0,359.0,0.7
anime,jjohnjae,Because i will be sad if i see concert stuff on the tl i will be on priv watching and ranting about anime see yall when the con is over only speak to me about cix when its important please,en,2022-04-15,23 | she/her,[],negative,0.0,0.0,-0.0333333333333333
anime,cyberbana_b,RT PretxelArt NEW DROP ONLY 03 NEARWaifus With Helmet Futaba Waifu 036 PARASnft paras NFTs NFTCommunity pfpNFT NFTdrop NFT,en,2022-04-15,internet cafe,"['036', 'PARASnft', 'paras', 'NFTs', 'NFTCommunity', 'pfpNFT', 'NFTdrop', 'NFT']",positive,0.0,120.0,0.0681818181818181
anime,hilurins,RT TheAn1meMan There are two types of anime fans1 Those who keep up every week to all the new shows coming out per season2 Those wh,en,2022-04-15,Nopeville,[],positive,0.0,248.0,0.1363636363636363
anime,DontKnoNothin,NFTQuin Check out My account on OpenSea Full of 67 11 Anime Cartoon amp Paintings Once i Sell 20nfts There Will Be A 10 Nft Giveaway To 5 Holders Of My Nft Total Of 10 Random Nft Giveaway NFT NFTGiveaway digital opensea,en,2022-04-15,,"['NFT', 'NFTGiveaway', 'digital', 'opensea']",negative,0.0,0.0,-0.0375
anime,venakiira,RT ShonenDaily Anime Hunter x Hunter,en,2022-04-15,alt acc,[],neutral,0.0,635.0,0.0
anime,kshitizarora322,RT BerkleyBearNews Dragon Ball Super Makeover Gives Cabba A Dragon Ball Z Look DragonBallZ DragonBallSuper Ani,en,2022-04-15,"नई दिल्ली, भारत","['DragonBallZ', 'DragonBallSuper', 'Ani']",positive,0.0,1.0,0.3333333333333333
anime,jessa_maico,RT ckanki we made the hollow mask today from scratch on stream for LordKebun inspired by his favorite anime bleach for texturing and f,en,2022-04-15,somewhere on an island☀️🪸🐠🌴,[],positive,0.0,7.0,0.2625
anime,chellebelle731,RT AoTJewels Return to Shiganshina is one of the greatest arcs in anime history,en,2022-04-15,in the mothership,[],positive,0.0,3181.0,1.0
anime,airsoftkumasan1,NC Action Figures Attack On Titan Eren Jaeger Collectible Anime Toys Statue 26cm PVC Environmental Protection Materials Handmade Decorative Ornaments Gift for Adults and Children via amazon 446862816370,en,2022-04-15,Somewhere in the Pacific Ocean,[],negative,0.0,0.0,-0.2
anime,pamyindaeyo,RT AoTJewels Anime Attack on Titan,en,2022-04-15,EXO ♡ NCT,[],neutral,0.0,266.0,0.0
anime,jagggggy,RT namidaily Anime one piece,en,2022-04-15,,[],neutral,0.0,670.0,0.0
anime,anime__65,RT Rtima เราเลยไม่โอเคเหี้ย ๆ เลยว่ะที่คุณทำตัวกระจอกหดหัวอยู่ในรูขนาดที่ต้องเอาชื่อเราไปคุยในโม่ง ถามจริง ถ้าคิดว่าเราแย่ขนาดนั้นก็ม,th,2022-04-15,ออลทาเค/ไมค์ทาเค/ไฮทานิทาเค,[],negative,0.0,32.0,99.08
anime,CrispyboyTM,RT SeinenVibes Anime Attack On Titan,en,2022-04-15,Italy,[],neutral,0.0,1442.0,0.0
anime,AllGlassEmpty,Los1492 JJK anime is actually decent the rest are in between the idc category to fairy tail category,en,2022-04-15,Trial of The Fool,[],positive,0.0,0.0,0.1666666666666666
anime,AguilonJanrei,RT visuaIanimes Anime Given,en,2022-04-15,,[],neutral,0.0,4356.0,0.0
anime,raideneyy,I mightve appreciated the mcs confession if the anime showed how their relationship grew,en,2022-04-15,,[],positive,0.0,0.0,0.2
anime,iluvakaashii,RT AllAnimeVibe Anime Spy x Family,en,2022-04-15,"— filo
— she/they
— minor (14-16)
— tweets in fil/eng
— ic: @akinak0u",[],neutral,0.0,316.0,0.0
anime,ashvoier,in a way that the Manga was so good that it made the anime one look shit,en,2022-04-15,,[],positive,0.0,0.0,0.2499999999999999
anime,Mirakurunchan,fuck fuck fuck I never felt this many raw emotions from anime before Even I didnt feel this way when reading the source material a few times beforefuck am I getting old and emotional now,en,2022-04-15,,[],negative,0.0,0.0,-0.158974358974359
anime,Gris_l95,nbcanimemusic hstarmu I love you so much Starmyu,en,2022-04-15,Venezuela,[],positive,0.0,0.0,0.35
anime,KarenV05789028,RT NejireeKun Anime Demon Slayer,en,2022-04-15,,[],neutral,0.0,666.0,0.0
anime,liese_archives,RT CloneX7100 WL GIVEAWAY 3x WLs for BoardGamersNFT courtesy of the team How to enter Follow BoardGamersNFT amp 0xFalcott,en,2022-04-15,,[],neutral,0.0,996.0,0.0
anime,LallaBees,อยากวาดสาวๆใส่ชุดชั้นใน เพราะชั้นชอบBodyของผู้หญิงมาก ดังนั้นชั้นกะว่าจะสร้างงานสไตล์นี้ขึ้นมาอีกgirlillustration bikiny drawingillustration art watercolor procreate watercolorpainting ullzang lolitaillustration womanillustration animegirl girlanime anime,th,2022-04-15,,"['girlillustration', 'bikiny', 'drawing', 'illustration', 'art', 'watercolor', 'procreate', 'watercolorpainting', 'ullzang', 'lolitaillustration', 'womanillustration', 'animegirl', 'girlanime', 'anime']",neutral,0.0,0.0,0.0
anime,bizneth,SeekingHentai TheForeverWar Yeah its Hentai SweetSugarWaffle Anime Titties SpaceHoneyJoyWideOpenCockRocket,en,2022-04-15,wildn' in web3,[],positive,0.0,0.0,0.2624999999999999
anime,meltyryzu,RT catiescos do I look like an anime villain,en,2022-04-15,thank you,[],neutral,0.0,853.0,0.0
anime,dolgnsharon,RT SeinenVibes Anime Attack On Titan,en,2022-04-15,,[],neutral,0.0,1335.0,0.0
anime,LordNotnice,When will a new CAR themed anime appear,en,2022-04-15,"Goa, India",[],positive,0.0,0.0,0.1363636363636363
anime,imnotChris21,RT ShonensPicture Anime Spy x Family SpyFamily,en,2022-04-15,19,"['Spy_Family', 'スパイファミリー']",neutral,0.0,32.0,0.0
anime,SOLLenardo,RT BenjeeNFT GiveawayGoddesses of War unique anime NFTPresale 20th of April 3 PM UTCPrizes 10x WL Spots 20Rules,en,2022-04-15,,['Giveaway'],positive,0.0,63.0,0.1875
anime,itmyplace,RT VisuaIsAnimes Anime Ocean Waves,en,2022-04-15,🌻my free account🌷,[],neutral,0.0,275.0,0.0
anime,HarpiaPrateada,Vash the stampede TRiGUNI love this anime I highly recommend itanime fanart trigun arte Manga,en,2022-04-15,,"['anime', 'fanart', 'trigun', 'arte', 'Manga']",positive,0.0,0.0,0.33
anime,Juanlu_War,RT FunnyOnePiece Anime One Piece,en,2022-04-15,"Málaga, España",[],neutral,0.0,743.0,0.0
anime,ankur8792,MaxJmb Anime,en,2022-04-15,"London, United Kingdom",[],neutral,0.0,0.0,0.0
anime,Sim_FTN,RT justininimbx Making free headers for everyone Drop Ur name amp Anime Or Fortnite,en,2022-04-15,"Code Créateur ""simftn"" 🌴",[],positive,0.0,19.0,0.4
anime,jayjxg,MikahVavor I wish Galaxy Eyes was still metaI am one of those who build decks like that too but mainly the ones from anime like GalaxyEyes DDD i have some cards ill show a pic and cyber dragonGalaxy eyes are kinda underapreciated in the TCG with all the new cards i feel like,en,2022-04-15,,[],negative,0.0,0.0,-0.0656565656565656
anime,WeatheredWorm,RT YoseiSakura Character sheet Sakura no YseiCherry Fairy Meru Sakura Blossom FairyFan art YoseiSan Lewd Fan art YoseiAfterH,en,2022-04-15,Ur Anus UwU,"['YoseiSan', 'YoseiAfterH']",neutral,0.0,6.0,0.0
anime,liyuelawyermain,RT fae2002 Hi PortfolioDay I just turned 20 yesterday and I love illustrating animeinspired portraits,en,2022-04-15,,['PortfolioDay'],positive,0.0,3079.0,0.5
anime,pixxypic,RT HappyGh0s1 Introducing Happy Ghost 008 Dancing Ghost Hes practicing for something rarible ethere,en,2022-04-15,"กรุงเทพมหานคร, ประเทศไทย","['008', 'rarible', 'ethere']",positive,0.0,7.0,0.8
anime,HeribertoCasqu1,RT vickyyymatozah Which anime or pokmon character do I remind you of,en,2022-04-15,,[],neutral,0.0,1659.0,0.0
anime,monobyxm,RT bringthepain To 10 Anime Betrayals,en,2022-04-15,,[],neutral,0.0,25.0,0.0
anime,CurlyShinobi,RT AniimeTweets Anime Hunter X Hunter,en,2022-04-15,,[],neutral,0.0,713.0,0.0
anime,ikeaner_ebooks,wonder mixed with work in anime that New York and immediately started another cheat out for allowing music to fuck missed connection miracle,en,2022-04-15,The Woodlands,[],negative,0.0,0.0,-0.0878787878787878
anime,lTACHIASHES,RT wildzo Pink Trio SAKURA sakuraharuno ItadoriYuuji AnyaForger anya SPYxFamily naruto jujutsukaisen fanart anime https,en,2022-04-15,afrolatina / 20 / any pronouns,"['SAKURA', 'sakuraharuno', 'ItadoriYuuji', 'AnyaForger', 'anya', 'SPYxFamily', 'naruto', 'jujutsukaisen', 'fanart', 'anime']",negative,0.0,530.0,-0.1953125
anime,KingZachRenn,RT WaifuAnimeMan Sizilien amp Maria Anime Wise Mans Grandchild,en,2022-04-15,,[],positive,0.0,151.0,0.7
anime,papandau5566,Manbecause I was bored because of bleach I started read manga bleach but I drag me to read itI will return at bleach anime,en,2022-04-15,,[],negative,0.0,0.0,-0.3
anime,RafaelTomandao,RT GhibliAccount Anime Howls Moving Castle,en,2022-04-15,BGC Tondo,[],neutral,0.0,2410.0,0.0
anime,zalim_Kkowon,RT AoTJewels Return to Shiganshina is one of the greatest arcs in anime history,en,2022-04-15,"LOONA , TXT , AOT , Yaiba",[],positive,0.0,3232.0,1.0
anime,Peggy_0502,RT CloneX7100 WL GIVEAWAY 3x WLs for BoardGamersNFT courtesy of the team How to enter Follow BoardGamersNFT amp 0xFalcott,en,2022-04-15,"Selangor, Malaysia",[],neutral,0.0,374.0,0.0
anime,wilberino,RT Lokokabooster2 Bunny Girls Anime Date a Live IV,en,2022-04-15,,[],positive,0.0,2.0,0.1363636363636363
anime,FloretsF,RT harukocolorful OMG Top 1 Trending auctionsCrying Azuki,en,2022-04-15,,"['Crying', 'Azuki']",negative,0.0,14.0,-0.2
anime,kanpai_cast,sleep is important so yesop anime,en,2022-04-15,,['anime'],positive,0.0,0.0,0.4
anime,zoro_goated,blueapricott Its an anime themed store In cyprus,en,2022-04-15,Anywhere theres music 🎤,[],neutral,0.0,0.0,0.0
anime,amber_roseeey,Can you see meCosplay Mai San Bunny Girl from Rascal Does Not Dream Of Bunny Girl Senpai maisan bunnygirl rascaldoesnotdreamofbunnygirlsenpai anime cosplay,en,2022-04-15,18+,"['maisan', 'bunnygirl', 'rascaldoesnotdreamofbunnygirlsenpai', 'anime', 'cosplay']",neutral,0.0,0.0,0.0
anime,___UZI__,RT AllAnimeVibe Anime Spy x Family,en,2022-04-15,,[],neutral,0.0,539.0,0.0
anime,MechanimaO,RT Lokokabooster2 Anime SPY x FAMILY ep2 pv,en,2022-04-15,,[],neutral,0.0,264.0,0.0
anime,hobo0354,RT TortillaSenpai pulling up to the anime convention tomorrow like,en,2022-04-15,London,[],neutral,0.0,4.0,0.0
anime,fuyuu__________,RT animetvjp Official TeaserTo Your Eternity Season 2 Scheduled for this fallThe anime is listed for 20 episodesMore https,en,2022-04-15,,[],neutral,0.0,1206.0,0.0
anime,hatakezsashie,RT HxHVizuals Anime Hunter X Hunter,en,2022-04-15,RATE,[],neutral,0.0,722.0,0.0
anime,cellaissance,The owner is into KPOP especially to the yeojas group Shes a MeU but fx never comeback She dont know much about anime except GAKUEN BABYSITTERS OMG THEYRE CUTE Sheher is the pronounce Shes not a homophobic and not a minor,en,2022-04-15,"Cella, España.",[],positive,0.0,0.0,0.2125
anime,lovreste,RT Rm5aled Anime Spy x Family,en,2022-04-15,bed,[],neutral,0.0,808.0,0.0
anime,SenpaiDonald,Looks like China is creating Anime I know its going to be bad tough I can tell because of my superior anime insight,en,2022-04-15,Waifu Land,[],negative,0.0,0.0,-0.0712962962962962
anime,Bob_gamedev,RT sjfostersound Im Sam a freelance composer I am currently looking for new game and animation projects Check out my in The Rains,en,2022-04-15,,[],negative,0.0,3.0,-0.1212121212121212
anime,achilles_cart,RT seokjinbreadd wts lfb ph seokjinbreaddsellskny wafer cards akaza senjuro amp kyojurophp 289 set payoplease expect minor s,en,2022-04-15,,['seokjinbreadd_sells'],negative,0.0,5.0,-0.05
anime,KINGOFDABRONIES,RT namidaily Anime one piece,en,2022-04-15,"Bristol, England",[],neutral,0.0,515.0,0.0
anime,TapestryWhite,RT Animevizuals Anime Demon slayer,en,2022-04-15,,[],neutral,0.0,164.0,0.0
anime,kiweewiener,2014 was just anime characters and shading hair and leaving ALOT of shine,en,2022-04-15,Maryland!,[],neutral,0.0,0.0,0.0
anime,outcast_L1485,RT VisuaIsAnimes Anime Howls Moving Castle,en,2022-04-15,🐢,[],neutral,0.0,2752.0,0.0
anime,smollrawr,Give me the STRENGTH to watch this anime I just want my aroace icon lt3,en,2022-04-15,Simis tum tum,[],neutral,0.0,0.0,0.0
anime,NadaSpiderman,RT vickyyymatozah Looking for a girl that likes anime and Pokmon,en,2022-04-15,,[],neutral,0.0,1470.0,0.0
anime,goodheartkilla,Keeping this thread bec its the only time it shows the real me I was never a meme account or an anime take account or even anything,en,2022-04-15,he/him,[],positive,0.0,0.0,0.1
anime,V_Prodigy623,RT AniimeTweets Anime Hunter X Hunter,en,2022-04-15,"Silver Spring, MD",[],neutral,0.0,1347.0,0.0
anime,hikamisme,RT Lokokabooster2 Ai Anime Kaguyasama Love is War s3 Ultra Romantic,en,2022-04-15,六面世界,[],positive,0.0,19.0,0.25
anime,officerdorko,RT fae2002 Hi PortfolioDay I just turned 20 yesterday and I love illustrating animeinspired portraits,en,2022-04-15,She/They,['PortfolioDay'],positive,0.0,4605.0,0.5
anime,SiomaiShaman,RT yaisaeko CORRUPTED WL GIVEAWAYIm giving away 3 WL spots for the first shonen anime on the blockchain 1 Follow thecorruptednft,en,2022-04-15,,[],positive,0.0,140.0,0.3125
anime,mikmak_21,RT SageWeeb Anime Attack On Titan,en,2022-04-15,94 côté Chicago ,[],neutral,0.0,122.0,0.0
anime,CAPTSPCEBOY,jinxedrize pwnzore and of course YOU would say that with your fucking tohno pfpwe all know youre fantasising in ur little head about ciel doing things to youfucking freak i hate anime fans,en,2022-04-15,,[],negative,0.0,0.0,-0.546875
anime,FtblSir,mfs really be switching from anime to football and posting opinions,en,2022-04-15,,[],positive,0.0,0.0,0.2
anime,Inkka_tako,RT otakojpoficial Anime SPY x FAMILY,en,2022-04-15,"Bangkok,Thailand",[],neutral,0.0,226.0,0.0
anime,srhrnfkfmfn,The Fletcher Memorial Home For Incurable anime and Kings,en,2022-04-15,,[],negative,0.0,0.0,-0.5
