Keyword,User,Tweet,Language,Time,User Location,Hashtag,Polarity,Likes,Retweet,Sentiment
anime,chinatsu_bot,Im pretty close to my mom to but I wish my mom was into anime,en,2022-04-14,Amusement Club ,[],positive,0.0,0.0,0.25
anime,giriseung,iseyahb like anime not even out they are the weirdest weirdos out there so,en,2022-04-14,"22, she/her",[],neutral,0.0,0.0,0.0
anime,Anabel60454241,RT rondokitty I was rewatching the presscon hes a devil you ask him something he talks for 3 minutes in an anime character perspective,en,2022-04-14,,[],neutral,0.0,82.0,0.0
anime,bronnydotz,side characters of every anime my fav bc Im a side nigga irl,en,2022-04-14,FL,[],neutral,0.0,0.0,0.0
anime,busifess,ppp Haloo aku ada layout moodboard deco anime Anya Spy x Family amp Umaru cuma 8000 each get ava PNG onlyPayment via QRIS only yaaaa G,en,2022-04-14,handled by 🍞 🥛,[],neutral,1.0,0.0,0.0
anime,000j0nes,RT whatcler people will call anime weird then watch 27 year olds play highschoolers on netflix,en,2022-04-14,,[],negative,0.0,35322.0,-0.5
anime,joydboyig,RT ShonensPicture Anime Attack on Titan,en,2022-04-14,,[],neutral,0.0,677.0,0.0
anime,weirdhash,RT AnimesColorfuI Anime Violet Evergarden,en,2022-04-14,,[],neutral,0.0,559.0,0.0
anime,esunishi_shinjo,RT VisuaIsAnimes Anime Evangelion,en,2022-04-14,日本,[],neutral,0.0,5621.0,0.0
anime,sanzs101,RT zhashx i can feel myself getting hotter with every new anime i watch,en,2022-04-14,United States of America,[],positive,0.0,81.0,0.1363636363636363
anime,16ongee,RT LeekyNFT Minting now Only 007 ethAnime lovers come to Join The Discord NFT O,en,2022-04-14,she/her,"['NFT', 'O']",neutral,0.0,2159.0,0.0
anime,kookieeecharr,RT AllAnimeVibe Anime Spy x Family,en,2022-04-14,Old Town Road,[],neutral,0.0,1205.0,0.0
anime,animelizm,RT animeyoko Birdie Wing Golf Girls Story 02 anime,en,2022-04-14,,"['อน', 'ด', 'อน', 'อน', 'anime']",neutral,0.0,1.0,0.0
anime,22BI0S22,RT whatcler people will call anime weird then watch 27 year olds play highschoolers on netflix,en,2022-04-14,LHS-20,[],negative,0.0,34626.0,-0.5
anime,jay5ive92,RoyReadsManga Byakuya toshiro kenpachi killed this mf at least 34 times all together I liked this fight but I hope in the anime kubo amp the staff makes it to where all 3 take Gerald out together with a combination attack Thats never happened in Bleach amp this is the perfect opportunity,en,2022-04-14,"Michigan, USA",[],positive,0.0,0.0,0.275
anime,ReGamertron,RT NAmalgamated seehatos If you like nerd stuff Science and tech Gaming gamedev and game design All things popculture suc,en,2022-04-14,,"['nerd', 'Science', 'tech', 'Gaming', 'gamedev', 'popculture']",negative,0.0,1.0,-0.4
anime,bgruende,HTGANG1312 Guter anime,en,2022-04-14,weedbaden,[],neutral,0.0,0.0,0.0
anime,ArmandoCalleta,CEOofPyra I hear the movie was sad and everything but the anime probably is better due to having more time to flesh out the arc I havent actually watched either though,en,2022-04-14,,[],positive,0.0,0.0,0.075
anime,belowdenji,RT Crunchyroll NEWS Makoto Shinkais New Film Suzume no Tojimari Announces Its Release Date of November 11 2022MORE,en,2022-04-14,18 • she/her • eng fil ,[],positive,0.0,928.0,0.1363636363636363
anime,Genmayoung,RT whatcler people will call anime weird then watch 27 year olds play highschoolers on netflix,en,2022-04-14,,[],negative,0.0,34417.0,-0.5
anime,__Novaq__,RT PlayerIGN Calabiyau is an upcoming 3D animegunthemed UE4 competitive tactical 3rdperson hero shooter in Search amp Destroy mod,en,2022-04-14,,[],negative,0.0,11.0,-0.2
anime,ManniToastbrot,RT MystaRias favourite anime asking for a friend,en,2022-04-14,Midgar,[],neutral,0.0,555.0,0.0
anime,YasukoYzquierdo,คลิปหลุดแจกฟรี โอนลี่แฟน วัยรุ่นไทยขาวเนียนหีสวยไร้หมอย อาบน้ำเสร็จเงี่ยน,th,2022-04-14,,[],neutral,0.0,0.0,0.0
anime,animesvisuaI,RT GhibliAccount Anime Howls Moving Castle,en,2022-04-14, ☁️,[],neutral,0.0,45.0,0.0
anime,istrimassugaa,RT LeekyNFT Minting now Only 007 ethAnime lovers come to Join The Discord NFT O,en,2022-04-14,,"['NFT', 'O']",neutral,0.0,1010.0,0.0
anime,maimairants,waydropsbangers Anime fans,en,2022-04-14,,[],neutral,0.0,0.0,0.0
anime,victorhuff98,NinaKosaka I only watch anime and YouTube so I cant really offer suggestions,en,2022-04-14,"Clarksville, TN",[],positive,0.0,0.0,0.1
anime,MAYANKS58702813,singhpreeti4991 YONWORLD7 YouTube shunainuverse Hold More Stake More Earn MoreNext 1000xgem shunainuverse ShunaV2 shuna shunaarmy nft anime eth metaverse shunasynergy,en,2022-04-14,,"['1000xgem', 'shunainuverse', 'ShunaV2', 'shuna', 'shunaarmy', 'nft', 'anime', 'eth', 'metaverse', 'shunasynergy']",positive,0.0,0.0,0.375
anime,Lh_Norma47,LaunchNFTs 0x6Fdd2ba544B1BE39Dad2A9F453c9726063a11b2EHis expression reminds me of the animeDemon Slayer Looks like Kokushibo,en,2022-04-14,,[],neutral,0.0,0.0,0.0
anime,PABLINGSWIN30,RT LeekyNFT Minting now Only 007 ethAnime lovers come to Join The Discord NFT O,en,2022-04-14,"Manila City, National Capital ","['NFT', 'O']",neutral,0.0,1870.0,0.0
anime,AndresD43858209,ScorpX13 ForeverG9476 Tensura only the anime I wanted to give the LN a tried but I really dont have the motivation to do it however in mushoku tensei I did both incluiding the WN,en,2022-04-14,,[],positive,0.0,0.0,0.1
anime,ie6iri,puthsaemagic YEYYY lets hype jigo anime together soon lt3,en,2022-04-14,"she/her, proship dni",[],neutral,0.0,0.0,0.0
anime,xolovedowoon,RT 90sVisuaI Anime Sailor Moon,en,2022-04-14,military area,[],neutral,0.0,2007.0,0.0
anime,JosephJnr17,RT SonNoodles2 Dads in anime only got two choices,en,2022-04-14,"Federal Capital Territory, Nig",[],neutral,0.0,864.0,0.0
anime,QueeenMuuvaa,RT sharanicolelynn 1 I am a person lmfao Black people will stay voicing in anime whether you like it or not 2 Yall can go and blo,en,2022-04-14,,[],negative,0.0,557.0,-0.2083333333333333
anime,LukeDsouza16,RT web3sg We are giving out 10 WL spots TONIGHT courtesy of the Galverse team 1 LikeRTFollow web3sg galverseNFT milomonk 2 C,en,2022-04-14,,[],neutral,0.0,1268.0,0.0
anime,Lucky8Annie,RT LeekyNFT Minting now Only 007 ethAnime lovers come to Join The Discord NFT O,en,2022-04-14,,"['NFT', 'O']",neutral,0.0,1166.0,0.0
anime,ritsu66096706,RT AllAnimeVibe Anime Spy x Family,en,2022-04-14,,[],neutral,0.0,1699.0,0.0
anime,Noiir88,RT whatcler people will call anime weird then watch 27 year olds play highschoolers on netflix,en,2022-04-14,Lonesome Town,[],negative,0.0,34046.0,-0.5
anime,d3athcliff,RT ShonenFeeling Anime Hunter x Hunter,en,2022-04-14,,[],neutral,0.0,2409.0,0.0
anime,fatehoperI,RT visuaIanimes Anime Given,en,2022-04-14,,[],neutral,0.0,98.0,0.0
anime,sheraachoi,RT RUT0NIVERSE my favorite anime one piece the manga ive watched since episode one the scene where i cried was when my favorite cha,en,2022-04-14,ᵎ⌇ T R E A S U R E ◦ ☁⠀ ོ,[],positive,0.0,52.0,0.640625
anime,sim_ms__,RT AnimeColorful Anime Kids on the Sloop,en,2022-04-14,,[],neutral,0.0,182.0,0.0
anime,BrandonRTalks,YouDidGreatOk Autumnahhh AMintArt TylerTheJones gilga10 Bro this sort of thing is definitely not something that happens in mainstream anime I dont know what youve been watching but it clearly isnt normal,en,2022-04-14,,[],positive,0.0,0.0,0.075
anime,amanexx_,I LOVE SPORTS ANIME SM BRO,en,2022-04-14,they/she,[],positive,0.0,0.0,0.5
anime,woopdididoop_,RT RUT0NIVERSE my favorite anime one piece the manga ive watched since episode one the scene where i cried was when my favorite cha,en,2022-04-14,location unknown,[],positive,0.0,52.0,0.640625
anime,AS07Edits,RT whatcler people will call anime weird then watch 27 year olds play highschoolers on netflix,en,2022-04-14,,[],negative,0.0,34046.0,-0.5
anime,ex_tragada,RT VisuaIsAnimes Anime Evangelion,en,2022-04-14,,[],neutral,0.0,5684.0,0.0
anime,zaakokoro02,nohawsela Wait isnt that tanjiros dad Im quite impatient but the animation in the anime is so so good its the only reason why Im not going further w the manga ibr,en,2022-04-14,,[],positive,0.0,0.0,0.1249999999999999
anime,star_wass,RT 90sVisuaI Anime Bio Hunter,en,2022-04-14,Kingdom of Science ,[],neutral,0.0,970.0,0.0
anime,LiuLink,RT YtgmYshn113659 Anya ForgerAnime SPY X FAMILYArtist glycanSPYFAMILY SPYxFamily AnyaForger,en,2022-04-14,,"['SPY_FAMILY', 'SPYxFamily', 'スパイファミリー', 'AnyaForger']",neutral,0.0,237.0,0.0
anime,AyuTriwn,RT AnimesContents Anime Bunny Girl Senpai,en,2022-04-14,Cirebon Jawa Barat,[],neutral,0.0,2889.0,0.0
anime,LoreleiLoy,One of my favourite anime song for IsekaiMeta Hope you guys like it itsmeoniii jpegjohnNFT CyrisRigor notehhtan countryroad Ghibli,en,2022-04-14,Malaysia,"['countryroad', 'Ghibli']",neutral,0.0,0.0,0.0
anime,HavocJesta,RT ChipsnCookies 414nbrFrom left to right PLA Pokemas Spe anime amp BW Ingo,en,2022-04-14,,['4月14日はnbrを描こう'],positive,0.0,94.0,0.1785714285714285
anime,GreenishMio,MissGinaDarling White haired dudes in animegtgtgt,en,2022-04-14,Butterfly Mansion 🦋,[],neutral,0.0,0.0,0.0
anime,HoseoKhaleesi,Im not trying to be mean but why are people surprised when anime dudes are total creeps,en,2022-04-14,Moon kingdom,[],negative,0.0,0.0,-0.0708333333333333
anime,KingKemetic,RT EmbGemGfx I do not apologize for making heroes that look like me Short animation rant The message is in the music Some help from th,en,2022-04-14,Trinidad and Tobago,[],neutral,0.0,24.0,0.0
anime,nahhveen,RT VisualAnimes Anime Demon Slayer,en,2022-04-14,DMV,[],neutral,0.0,69.0,0.0
anime,Allysaluvie_,debolt1 idk ive never really liked anyone irl like game characters or anime characters maybe but,en,2022-04-14,2/4,[],negative,1.0,0.0,-0.35
anime,toutetsuyuuma,vinterp2 Much later into wano beyond the first act The anime does add a few sprinkles and crumbs of her before her introduction,en,2022-04-14,weed content warning,[],positive,0.0,0.0,0.0166666666666666
anime,moritaka_ishida,RT sharanicolelynn 1 I am a person lmfao Black people will stay voicing in anime whether you like it or not 2 Yall can go and blo,en,2022-04-14,He/Him,[],negative,0.0,1661.0,-0.2083333333333333
anime,nemusagii,RT shirahiko Sometimes I feel so off in the Vtuber community I dont want to be like corporate vtubers I dont want to play a char,en,2022-04-14,,[],neutral,0.0,38.0,0.0
anime,CropsHabsund,FLitz OP looks like a literal anime character and they still all gonna be racist towards him,en,2022-04-14,Antarctica,[],neutral,0.0,0.0,0.0
anime,AcrylicDawn,RT sharanicolelynn 1 I am a person lmfao Black people will stay voicing in anime whether you like it or not 2 Yall can go and blo,en,2022-04-14,New Jersey,[],negative,0.0,1661.0,-0.2083333333333333
anime,Suki22507250,RT SeinenVibes Anime Attack On Titan,en,2022-04-14,,[],neutral,0.0,55.0,0.0
anime,stocery,dznxya gwe anime,en,2022-04-14,,[],neutral,0.0,0.0,0.0
anime,Blazing32,ProjektMelody thanks for the wonderful anime music and good morning mel lt3,en,2022-04-14,United States,[],positive,0.0,0.0,0.6333333333333333
anime,xmnxuu,F1 anime edition,en,2022-04-14,she/her ,[],neutral,0.0,0.0,0.0
anime,AhadMia221,RT NazNftBox Special thanks to sologenic and its wonderful team and mostly mr reza bashash for the verified badge realSologenic rez,en,2022-04-14,,[],positive,0.0,240.0,0.5142857142857142
anime,kashwiddakay,RT TheComicFiend what if chainsawman had a 90s anime dub and they changed Denjis name to Dennis,en,2022-04-14,Buffalo buffalo buffalo ,[],neutral,0.0,11.0,0.0
anime,R1NTANI,RT reisakumqs hello promotwt anitwt im kia 18 i havent updated my carrd so its still 17 there any prns and im looking for moots,en,2022-04-14,"they them 19
eng/id! cbyf
ic: omanjumaturi3","['promotwt', 'anitwt']",neutral,0.0,1.0,0.0
anime,anonymesoul,YapapaMirage I always prefer the manga version in the 90 anime it looks like a minako clone it would have been fun to use minako instead of rei,en,2022-04-14,Inconnus dans les abysses les plus profonds,[],positive,0.0,0.0,0.3
anime,RevhSama,RT Crunchyroll NEWS Makoto Shinkais New Film Suzume no Tojimari Announces Its Release Date of November 11 2022MORE,en,2022-04-14,"Shiganshina, Wall Maria",[],positive,0.0,1430.0,0.1363636363636363
anime,_Eriico,RT WcSauce2 utdreportAcad Some anime shit right here,en,2022-04-14,PSYCHO WrLD,[],positive,0.0,4.0,0.0428571428571428
anime,jacklacies,goatzuku In anime its fine but in movies I HATE IT SO BAD,en,2022-04-14,desi. pan. minor. PROSHIP DNI,[],negative,0.0,0.0,-0.3611111111111111
anime,Suki22507250,RT visuaIanimes Anime Given,en,2022-04-14,,[],neutral,0.0,866.0,0.0
anime,ross2funny,Aye who I need talk to be a Anime voice actor frfr,en,2022-04-14,SC,['Anime'],neutral,0.0,0.0,0.0
anime,number7012,RT newworldartur Cover art for upcoming One Piece Log Collection anime releases for Wano,en,2022-04-14,,[],neutral,0.0,288.0,0.0
anime,SelfishFX,RT maniccarts Header ContestPrice 30 USDEURRulesgt Must include my logo 3d or 2d link in comments and also my behance Theme i,en,2022-04-14,🇵🇱,[],neutral,0.0,3.0,0.0
anime,GUXSTAMK,RT GhibliAccount Anime Howls Moving Castle,en,2022-04-14,home,[],neutral,0.0,532.0,0.0
anime,panpanic_,animeanxiety Im really not,en,2022-04-14,Australia,[],negative,0.0,0.0,-0.1
anime,hazelluvly,RT hazelluvly Anime amp Pokmon loverRihanna bodythis is what Wizkid and Beyonce was talking about in Brown skin girl,en,2022-04-14,,[],neutral,0.0,150.0,0.0
anime,bayleafxxx,RT sharanicolelynn 1 I am a person lmfao Black people will stay voicing in anime whether you like it or not 2 Yall can go and blo,en,2022-04-14,"Seattle, WA",[],negative,0.0,1661.0,-0.2083333333333333
anime,Coppelia57071,Got to love when a dubbed anime has an ark about the characters learning English The writers might as well leave a note saying what do we do now,en,2022-04-14,Clock Tower,[],positive,0.0,0.0,0.25
anime,headfallsoff,woodaba2 looking this up in detail i think this starts as teen kart racing but the obviously untranslated manga eventually gets to formula racing the anime which has been fansubbed doesnt but it is 50 episodes of racing at least this seems to be your best bet,en,2022-04-14,they/them,[],positive,0.0,0.0,0.175
anime,Loulanweu,RT Loulanweu Timelapse for your viewing pleasure wip Processing procreate procreateart anime indieanime,en,2022-04-14,fantasy obsessed,"['wip', 'Processing', 'procreate', 'procreateart', 'anime', 'indie_anime']",neutral,0.0,5.0,0.0
anime,bypetapan,RT HxHVizuals Anime Hunter X Hunter,en,2022-04-14,19 - they/them,[],neutral,0.0,109.0,0.0
anime,Alirezxab,RT Rm5aled Anime Spy x Family,en,2022-04-14,hamedan,[],neutral,0.0,100.0,0.0
anime,jcl4332,RT sharanicolelynn 1 I am a person lmfao Black people will stay voicing in anime whether you like it or not 2 Yall can go and blo,en,2022-04-14,"Madrid, Ciudad Infestada",[],negative,0.0,1661.0,-0.2083333333333333
anime,Silver_Coded,RT vickyyymatozah Which anime or pokmon character do I remind you of,en,2022-04-14,You're Amazing 🌸🍨🧁,[],neutral,0.0,441.0,0.0
anime,irsyadification,RT SaikoVibe Which 2 different anime characters were you surprised to find out shared the same voice actoractress I still cant believe,en,2022-04-14,,[],positive,0.0,454.0,0.0333333333333333
anime,kococohoi,RT HokeHustles Isekai WL Spots GiveawayVery bullish on Isekai massive anime project w great artYou dont want to miss this one,en,2022-04-14,GNK,[],positive,0.0,11853.0,0.3333333333333333
anime,Suki22507250,RT GhibliAccount Anime Howls Moving Castle,en,2022-04-14,,[],neutral,0.0,532.0,0.0
anime,So_Much_Fandoms,RT AnimesFeeIings Anime Spy x Family,en,2022-04-14,she/they,[],neutral,0.0,562.0,0.0
anime,deliriousfairy,RT sharanicolelynn 1 I am a person lmfao Black people will stay voicing in anime whether you like it or not 2 Yall can go and blo,en,2022-04-14,18+ !  she/her,[],negative,0.0,1661.0,-0.2083333333333333
anime,0wlMilk,RT sharanicolelynn 1 I am a person lmfao Black people will stay voicing in anime whether you like it or not 2 Yall can go and blo,en,2022-04-14,He/Them,[],negative,0.0,1661.0,-0.2083333333333333
anime,aniket_ghorai,RT AnimePraises Anyone with right skills and experience can voice any anime characters Thats the rule that all anime fans should respec,en,2022-04-14,,[],positive,0.0,1.0,0.2857142857142857
anime,AlFathiera,RT AniTrendz The many cute faces of ShutinaAnime Im Quitting Heroing,en,2022-04-14,,[],positive,0.0,65.0,0.5625
anime,virgob4byy,RT 90sVisuaI Anime Bio Hunter,en,2022-04-14,h i m ♡,[],neutral,0.0,969.0,0.0
anime,Miss_DeeMeaner,Introverted but willing to discuss BTS book anime and cats,en,2022-04-14,Purgatory,[],positive,0.0,0.0,0.25
anime,storiedshelves,RT myanimelist News Koukyuu no Karasu The Raven in the Inner Palace reveals main staff cast October 2022 premiere Chizuru Miyawaki,en,2022-04-14,"California, USA",[],positive,0.0,8.0,0.0833333333333333
anime,nisteexxx,would you rather be my anime bf or gaming chair 3,en,2022-04-14,,[],positive,0.0,0.0,0.5
anime,hotdteam,RT FabledDante Its not too late to give up on the idea of creating an official Dream SMP anime A bunch of us got together to create one,en,2022-04-14,any pronouns • 18 • cbyf ,[],negative,0.0,626.0,-0.3
anime,LeAsgardian,RT AnimesColorfuI Anime Your Name,en,2022-04-14,Hogwarts ☾ | TARDIS,[],neutral,0.0,230.0,0.0
anime,ReAnimetron,RT DinethEdirisin1 SPY X FAMILYanime shorts SPYxFamily,en,2022-04-14,Animeland,"['anime', 'shorts', 'SPYxFamily']",neutral,0.0,2.0,0.0
anime,saal_sol,RT sharanicolelynn 1 I am a person lmfao Black people will stay voicing in anime whether you like it or not 2 Yall can go and blo,en,2022-04-14,,[],negative,0.0,1661.0,-0.2083333333333333
anime,Suki22507250,RT 90sVisuaI Anime Bio Hunter,en,2022-04-14,,[],neutral,0.0,970.0,0.0
anime,HoodedProdigies,RT sharanicolelynn 1 I am a person lmfao Black people will stay voicing in anime whether you like it or not 2 Yall can go and blo,en,2022-04-14,,[],negative,0.0,1661.0,-0.2083333333333333
anime,KasimAkrBot,RT RdKennith drawing with only 4 hours of sleep is like having no clue wtf am I doing or saying anymoreanime talesrobloxart art di,en,2022-04-14,,"['robloxart', 'art', 'di']",negative,0.0,2.0,-0.25
anime,VitoPulitzer,S111 web3 anime support NFT collection of 10000 unique handdrawn Suzuki Story NFT to save the world surprise,en,2022-04-14,,"['S111', 'NFT']",positive,0.0,0.0,0.375
anime,Kacynichole101,RT AniimeTweets Anime Weathering with you,en,2022-04-14,,[],neutral,0.0,139.0,0.0
anime,asmijenner,RT SaikoVibe Which 2 different anime characters were you surprised to find out shared the same voice actoractress I still cant believe,en,2022-04-14,she/ her   lesbian🫴🏼,[],positive,0.0,454.0,0.0333333333333333
anime,LeAsgardian,RT AnimesContents Anime Bunny Girl Senpai,en,2022-04-14,Hogwarts ☾ | TARDIS,[],neutral,0.0,2889.0,0.0
anime,KilluaZ67720126,RT visuaIanimes Anime Given,en,2022-04-14,,[],neutral,0.0,865.0,0.0
anime,gothmik4sa,RT TodayJojo April 13 2019 JoJos Bizarre Adventure Golden Wind Anime Episode 26 A Little Story From the Past My Name Is Doppio,en,2022-04-14,,[],positive,0.0,132.0,0.0656249999999999
anime,MuertoCrypto,RT SaiyansNFT What do you all think of this rare apeCNFTart CNFTs anime ADA NFTs CNFTCommunity,en,2022-04-14,"Guadalajara, Jalisco","['CNFTart', 'CNFTs', 'anime', 'ADA', 'NFTs', 'CNFTCommunity']",positive,0.0,2.0,0.3
anime,nwsfy,RT VisuaIsAnimes Anime Howls Moving Castle,en,2022-04-14,,[],neutral,0.0,403.0,0.0
anime,Suki22507250,RT ColorfulWeeb Anime food details,en,2022-04-14,,[],neutral,0.0,441.0,0.0
anime,fayntasthicc,its not about whether theyre ficitional or real but the energy yall give when calling any female anime character lonte vs a male anime character cant even think a derogatory term for them lol,en,2022-04-14,UTC +8,[],positive,0.0,0.0,0.25
anime,SJ_2129,140422 SJ I just watched spyxfamily its a new anime SJ Sadly it only has one episode and I had to wait every week for a new one,en,2022-04-14,always hungry,[],positive,0.0,0.0,0.1022727272727272
anime,Trostz2,FlurETH Anime with boobas gt hehe,en,2022-04-14,,[],neutral,0.0,0.0,0.0
anime,ScorpioSamhain,RT GhibliAccount Anime Howls Moving Castle,en,2022-04-14,"MJ, she/her, 26",[],neutral,0.0,45.0,0.0
anime,Pinkxrr,RT SonNoodles2 Dads in anime only got two choices,en,2022-04-14,s/her,[],neutral,0.0,876.0,0.0
anime,notnisuu,RT AllAnimeVibe Anime Spy x Family,en,2022-04-14,"she/her, 16",[],neutral,0.0,1230.0,0.0
anime,TheColourOfFear,S4T4N1CK SkylightDreame agree but anime so cringe,en,2022-04-14,,[],neutral,0.0,0.0,0.0
anime,FILMSCOREMUSIC1,Anime ULTRAMAN Season 2 will be released worldwide soonMusic composed amp Produced by NobukoTodaKazumaJinnouchiThey composed wonderful music for Season 1 And again they composed NEW powerful music for the Ultra 6 BrothersOST Season 1,en,2022-04-14,✉️ office@filmscore.jp,"['ULTRAMAN', 'NobukoToda', 'KazumaJinnouchi']",positive,0.0,0.0,0.5350378787878788
anime,NitsujKeu,RT ShonenFeeling Anime Hunter x Hunter,en,2022-04-14,Cavite ,[],neutral,0.0,1506.0,0.0
anime,IncorrectWeeb,Started watching SPY x FAMILY animeplanet,en,2022-04-14,"Gaming, Oesterreich",['animeplanet'],neutral,0.0,0.0,0.0
anime,timroiTY,RT Postanimes Anime Dog Days,en,2022-04-14,,[],neutral,0.0,175.0,0.0
anime,BlackhatDebates,Joeytehwriter TheBasedJ DuperAspergers LemonZester If it looks like a real child which anime characters do not,en,2022-04-14,,[],positive,0.0,0.0,0.2
anime,bluecornmoon_n,RT MystaRias favourite anime asking for a friend,en,2022-04-14,,[],neutral,0.0,603.0,0.0
anime,LinKey47358403,RT Oodlenoodle08 Ayatolumi but Spy x family inspired MANN I really love the first episode of the anime They really chose the right voic,en,2022-04-14,"Lumine booba or thigh, choose",[],positive,0.0,26.0,0.3089285714285714
anime,BitcoinismyDear,RT Missfelder Giving Away 10 WL Spots Meet the ShurikenChiksIf youre looking for an anime project watch out To Enter,en,2022-04-14,Myanmar,[],neutral,0.0,123.0,0.0
anime,fated_weeb,areyyaarrr 17 Anime musicdance,en,2022-04-14,He/Him/Animesexual,[],neutral,0.0,0.0,0.0
anime,JJ70202118,RT onepiecedaiIys Anime One Piece,en,2022-04-14,,[],neutral,0.0,987.0,0.0
anime,insomniacfics,oLordyo Arkeus88 In an older episode of the anime there is sometimes mentions of her I cant remember what her team rocket story was but i remember Jessie mentioning she grew up without a lot and was forced to make snow food before she went to nursing school,en,2022-04-14,stuck,[],negative,0.0,0.0,-0.0666666666666667
anime,epaysuckit,RT animesvisuaI Anime Your Name,en,2022-04-14,"Cirebon, Jawa Barat ",[],neutral,0.0,8158.0,0.0
anime,misatospet,RT fruityjmsz Anime Hunter X Hunter,en,2022-04-14,,[],neutral,0.0,1375.0,0.0
anime,IanKong5,2 Aj beckles is a great voice actor who has started in 2018 Also he has voiced some of the white anime skin characters like Shiki tademaru from Kemono jihen and Takemichi from Tokyo revengers,en,2022-04-14,,[],positive,0.0,0.0,0.4
anime,Habieru_Reimaku,Enemy Spottedanime manga SPYxFAMILY,en,2022-04-14,Ningún Lugar,"['anime', 'manga', 'SPYxFAMILY']",neutral,0.0,0.0,0.0
anime,OzymandiasLvs,RT 38sr its PortfolioDay one again hello everyone my name is li and im a 2d animator and board artist over at marvel studios in my,en,2022-04-14,,['PortfolioDay'],neutral,0.0,304.0,0.0
anime,Rodrigo83817794,RT ShonenFeeling Anime Hunter x Hunter,en,2022-04-14,,[],neutral,0.0,2475.0,0.0
anime,LucaIsHere,RT sharanicolelynn 1 I am a person lmfao Black people will stay voicing in anime whether you like it or not 2 Yall can go and blo,en,2022-04-14,uranus,[],negative,0.0,884.0,-0.2083333333333333
anime,rAnimewallpaper,Hutao Genshin Impact 15002727 Post anime animewallpaper reddit wallpaper,en,2022-04-14,,"['anime', 'animewallpaper', 'reddit', 'wallpaper']",neutral,0.0,0.0,0.0
anime,i_Hstoys,Silence Studio Anya ForgerMeasurement Height 19cmanya anyaforger spyxfamily anime collectibles iHstoys,en,2022-04-14,新加坡,"['anya', 'anyaforger', 'アーニャフォージャー', 'spyxfamily', '间谍家家酒', 'anime', 'collectibles', 'i_Hstoys']",neutral,0.0,0.0,0.0
anime,Subaiitaaa,RT VisualAnimes One of the biggest anime glow ups,en,2022-04-14,she/her,[],neutral,0.0,1495.0,0.0
anime,sophiarivas_,RT AnimeColorful Anime Kids on the Sloop,en,2022-04-14,,[],neutral,0.0,247.0,0.0
anime,myosotiskills,RT funtomology truly the potential the black butler anime wouldve had if they hadnt picked it up so fucking early in the story,en,2022-04-14,20 she/her,[],negative,0.0,16.0,-0.0222222222222222
anime,Johnny2698,RT AnimesContents Anime Bunny Girl Senpai,en,2022-04-14,"Puerto Rico, USA",[],neutral,0.0,2063.0,0.0
anime,SpreeDev,RT SophiaCerin2 I just watched SPYxFAMILY Totally a recommended anime so I had to draw Anya This is also for Portfolio DayPortfolio,en,2022-04-14,,['Portfolio'],neutral,0.0,1.0,0.0
anime,connan__l,I MEAN I know Akemi is a common Japanese name and theyre not even written the same way yes I checked but tbh SG is so immersed in otaku culture it wouldnt be surprising if they put a reference to one of the most popular anime of the 2010s that also involve time loops lmao,en,2022-04-14,"Lille, France",[],positive,0.0,0.0,0.2234375
anime,Haute55470,raphtaliafanSH makiiavelli Eren is shit Mikey gtgtgtgtgtgtgtgtgtgtgtgtgtgt anime,en,2022-04-14,,[],negative,0.0,0.0,-0.2
anime,kimjunvidd,RT RUT0NIVERSE my favorite anime one piece the manga ive watched since episode one the scene where i cried was when my favorite cha,en,2022-04-14,she/her.,[],positive,0.0,104.0,0.640625
anime,DeceitfulOutcas,30 less fluffy 70 more anime Castlevania SomaCruz DawnOfSorrow animalifiedart,en,2022-04-14,aro/ace,"['Castlevania', 'SomaCruz', 'DawnOfSorrow', 'animalifiedart']",positive,0.0,0.0,0.0444444444444444
anime,cfn96,RT DailyOPMemes Anime One Piece Film RED,en,2022-04-14,,[],neutral,0.0,150.0,0.0
anime,chikafujimaraa,RT HxHVizuals Anime Hunter X Hunter 1999,en,2022-04-14,,[],neutral,0.0,610.0,0.0
