Keyword,User,Tweet,Language,Time,User Location,Hashtag,Polarity,Likes,Retweet,Sentiment
anime,Malhimself_,Been on Twitter so long Im seeing the return of parody accounts but with Anime avis sgg,en,2022-04-14,,[],negative,0.0,0.0,-0.05
anime,DanBarrios5,RT KimetsuVizuals Anime Demon Slayer,en,2022-04-14,,[],neutral,0.0,353.0,0.0
anime,SleeperOfTheBed,RT BrichibiTweets Them Why did you write about anime fans being mean to Black VAs back in February Why did you write about anime fans a,en,2022-04-14,He/Him,[],negative,0.0,36.0,-0.1597222222222222
anime,jormunglenndr,RT sharanicolelynn 1 I am a person lmfao Black people will stay voicing in anime whether you like it or not 2 Yall can go and blo,en,2022-04-14,"San Antonio, TX",[],negative,0.0,1085.0,-0.2083333333333333
anime,Urielsant_,One piece is my favorite series but Im not gonna lie it is better in the manga than the anime,en,2022-04-14,,[],positive,0.0,0.0,0.5
anime,GamebotIndie,RT KIPLIKED Forest Spiritpixelart anime painting pixeldailies forest gamedev pixelartist indiedev,en,2022-04-14,01110011 01100101 01100001 01110100 01110100 01101100 01100101,"['pixelart', 'anime', 'painting', 'pixel_dailies', 'forest', 'gamedev', 'pixelartist', 'indiedev']",neutral,0.0,102.0,0.0
anime,SlimeSenju,RT crymer9 Who is your favourite old man in animeManga,en,2022-04-14,,[],positive,0.0,39.0,0.1
anime,vHoodieJayy_,RT Sayngelic FinishedThe Misfit at Demon Academy810All hail AnosKing of the demonsMagestrate of making others fall in love with,en,2022-04-14,Mind ya Business,[],positive,0.0,1.0,0.5
anime,dcfirstwinwhen,RT LeekyNFT Minting now Only 007 ethAnime lovers come to Join The Discord NFT O,en,2022-04-14,"Central Luzon, Republic of the","['NFT', 'O']",neutral,0.0,1871.0,0.0
anime,RicardoPerez280,RT KimetsuVizuals Anime Demon Slayer,en,2022-04-14,"Mérida, Yucatán, Mexico",[],neutral,0.0,308.0,0.0
anime,just_lernx,RT LeekyNFT Minting now Only 007 ethAnime lovers come to Join The Discord NFT O,en,2022-04-14,🇵🇭❤️,"['NFT', 'O']",neutral,0.0,2027.0,0.0
anime,cangbacang,RT rocketboiART TOKUMASK ROACHSmall project Im undertaking in my spare time as part of my TOKUMASK OC A young man discovers he is a,en,2022-04-14,,[],negative,0.0,64.0,-0.075
anime,otakusenpai549,CEOofShin I read like 10 chs of manga after the anime 1st epAnd ppl are not ready for this shit,en,2022-04-14,India,[],negative,0.0,0.0,-0.15
anime,yesiibigwin,RT LeekyNFT Minting now Only 007 ethAnime lovers come to Join The Discord NFT O,en,2022-04-14,GA hunter📍,"['NFT', 'O']",neutral,0.0,3257.0,0.0
anime,WnDBpZa6hdUo1vb,RT Lokokabooster2 Marin Anime Sono Bisque Doll wa Koi wo Suru My DressUp Darling,en,2022-04-14,,[],neutral,0.0,108.0,0.0
anime,pareidolie1,MystaRias Its old now but it will always have a special place in my heart Hikaru no GoI cried reading the manga and I cried again watching the anime,en,2022-04-14,,[],positive,0.0,0.0,0.2285714285714286
anime,Raps_tweets,SpiderWasHere idk but i dont like anime,en,2022-04-14,🇵🇭,[],neutral,0.0,0.0,0.0
anime,lililoveokkotsu,RT Rm5aled Anime Spy x Family,en,2022-04-14,,[],neutral,0.0,1472.0,0.0
anime,anime_pretty,RT chaesuart sneakerhead tsundere,en,2022-04-14,,[],neutral,0.0,2680.0,0.0
anime,EeshaS628,RT HxHContents AnimeHunter x Hunter,en,2022-04-14,"Karachi, Pakistan",[],neutral,0.0,1753.0,0.0
anime,Shiinmen,RT AnimeColorful Anime Kids on the Sloop,en,2022-04-14,,[],neutral,0.0,229.0,0.0
anime,kirakult,what anime do yall watch that doesnt feel like this causw imstuck,en,2022-04-14,she 19 ar 57,[],neutral,0.0,0.0,0.0
anime,Piowjiwarud0,RT Piowjiwarud0 Fight Fight Fightrkgk indieanime fanart grimgar anime,en,2022-04-14,Shiganshina District,"['rkgk', 'indie_anime', '灰と幻想のグリムガル', 'fanart', 'grimgar', 'anime']",neutral,0.0,1.0,0.0
anime,mr_steveo01,RT KimetsuVizuals Anime Demon Slayer,en,2022-04-14,VA,[],neutral,0.0,27.0,0.0
anime,tintin110220,RT KimetsuVizuals Anime Demon Slayer,en,2022-04-14,Japan,[],neutral,0.0,108.0,0.0
anime,Abbot896,RT GalaxyHeroesGHC Galaxy Heroes could be the first film project on the blockchain producing liveaction pictures andor anime series,en,2022-04-14,,[],positive,0.0,98.0,0.25
anime,TDemised,RT Swirftyy Here it is Probably my current favorite video on the channel Brawlhalla Team Combo Anime Transitions 3,en,2022-04-14,Eu eww ,['3'],positive,0.0,3.0,0.3125
anime,sugawararlert,RT dailySpyFamily The official music video for the Spy Family anime opening song Mixed Nuts by Hige Dandism is out,en,2022-04-14,"she/her 20
eng/esp
snk jjk kny tr hq csm
NOT SPOILER FREE",[],neutral,0.0,1.0,0.0
anime,aiursunlights,RT kkyutiesdimple Haruto Top 3 cherished items from childhoodSnacks Churros Anime One pieceToys PlayStation Haruto said he so,en,2022-04-14,Treasure ,[],positive,0.0,76.0,0.5
anime,Chachou2Chachou,RT onepiecedaiIys Anime One Piece,en,2022-04-14,Royaume de la Science ,[],neutral,0.0,1571.0,0.0
anime,NERi_1123,RT LegacyWaifu Lilith Asami Anime Trinity Seven,en,2022-04-14,,[],neutral,0.0,196.0,0.0
anime,MessiMonza,RT KimetsuVizuals Anime Demon Slayer,en,2022-04-14,,[],neutral,0.0,308.0,0.0
anime,7sameDd3,RT ChibiizX Yooo house partynft NFTGiveaways NFTwhitelist 3dart nfts anime chibi,en,2022-04-14,Thailand,"['nft', 'NFTGiveaways', 'NFTwhitelist', '3dart', 'nfts', 'anime', 'chibi']",neutral,0.0,41.0,0.0
anime,cuteccumberr,RT sharanicolelynn 1 I am a person lmfao Black people will stay voicing in anime whether you like it or not 2 Yall can go and blo,en,2022-04-14,27,[],negative,0.0,709.0,-0.2083333333333333
anime,symzmidh,3 Sy and la is form my name and the zmi if form my fave anime character miyamura izumi,en,2022-04-14,She/her  (+63),[],neutral,0.0,0.0,0.0
anime,valkyminaa,artsyvii VII WAIT OHMYGOD THIS IS LITERALLY THE BEST EVERRRRRR the amount of times ive replayed ham ham heartbreak omfg and the anime intro literally ingrained into my brain THIS IS SO CUTE,en,2022-04-14,she/her | 23 | pdt ,[],positive,0.0,0.0,0.75
anime,rsniyg,RT HxHVizuals Anime Hunter X Hunter 1999,en,2022-04-14,,[],neutral,0.0,599.0,0.0
anime,thiseokjin92,RT elrsho Halo hai hayy Im looking for studytwt new moots Help rtlike thank you lt3about me call me el sheher 12th grade,en,2022-04-14,+62 | INFJ-A ,['studytwt'],positive,0.0,9.0,0.1363636363636363
anime,jingbigwins2022,RT nftasac ANTI SOCIAL ANIME CLUB x LEGENDS OF ATLANTIS 30 WL spots from nftasac 30 WL spots from LegendsAtlantis To Enter,en,2022-04-14,,[],positive,0.0,273.0,0.0333333333333333
anime,hoanglanhuy,RT HokeHustles Isekai WL Spots GiveawayVery bullish on Isekai massive anime project w great artYou dont want to miss this one,en,2022-04-14,,[],positive,0.0,11595.0,0.3333333333333333
anime,BloodyCheery,RT ChipsnCookies 414nbrFrom left to right PLA Pokemas Spe anime amp BW Ingo,en,2022-04-14,,['4月14日はnbrを描こう'],positive,0.0,18.0,0.1785714285714285
anime,SouravM78767279,RT Lokokabooster2 Marin Anime Sono Bisque Doll wa Koi wo Suru My DressUp Darling,en,2022-04-14,,[],neutral,0.0,91.0,0.0
anime,sabima_o7,RT FabledDante Its not too late to give up on the idea of creating an official Dream SMP anime A bunch of us got together to create one,en,2022-04-14,"they/she, minor",[],negative,0.0,494.0,-0.3
anime,benz_Ew_gazou,Pokemon Anime Teases Big Returning Battle for Ashs Infernape Verve Times,en,2022-04-14,,[],neutral,0.0,0.0,0.0
anime,NadesikoUmino,RT lilaichan art manga anime Im shipping trash,en,2022-04-14,,"['スレイヤーズ', 'リナガウ', 'アメゼル', 'art', 'manga', 'anime']",neutral,0.0,0.0,0.0
anime,1102001102CR,RT AnimesColorfuI Anime Violet Evergarden,en,2022-04-14,,[],neutral,0.0,663.0,0.0
anime,lordebear,RT Wictor2501 Is this the worst result in anime polling history,en,2022-04-14,,[],negative,0.0,75.0,-1.0
anime,ShinVTuber,RT ColorfulWeeb Anime food details,en,2022-04-14,,[],neutral,0.0,350.0,0.0
anime,yidou0601,RT leotsukjnaga Once every year the anime locals find out about egu and its so funny how its always like omg cant believe he is handsome,en,2022-04-14,?,[],positive,0.0,2.0,0.25
anime,monmondx99,RT TsuburayaGlobal Anime ULTRAMAN Season 2 global streaming begins on Netflix todayFor more information visit,en,2022-04-14,"Jakarta, Indonesia",[],positive,0.0,60.0,0.25
anime,prvtso,RT onepiecedaiIys Anime One Piece,en,2022-04-14,,[],neutral,0.0,1110.0,0.0
anime,LilibethPF10,RT HxHContents AnimeHunter x Hunter,en,2022-04-14,,[],neutral,0.0,743.0,0.0
anime,KonanTM,BrookHoHoo The only anime i watched in this list is Toradora it was greatTy,en,2022-04-14,"الرياض, المملكة العربية السعود",[],positive,0.0,0.0,0.5
anime,ctf_4fort,ive been noticing a rise in hate towards cute things especially with the breaking bad stuffits a good show its just all the memes im seeing is just anime bad with no punchline and its not funny lol,en,2022-04-14,,[],negative,0.0,0.0,-0.0406249999999999
anime,ianpewpewpew,RT ShonenFeeling Anime Hunter x Hunter,en,2022-04-14,"Michigan, USA",[],neutral,0.0,2297.0,0.0
anime,_ThisIsVals_,RT oceangorae just minhyuk sitting like an anime girl,en,2022-04-14,The upside down,[],neutral,0.0,1.0,0.0
anime,Raven_Anime_,RT AsterShock congrats,en,2022-04-14,France,[],neutral,0.0,13101.0,0.0
anime,srhrnfkfmfn,I have become anime,en,2022-04-14,,[],neutral,0.0,0.0,0.0
anime,afrah_rasya,RT ZoldyckSzn Anime fans can relate,en,2022-04-14,,[],neutral,0.0,202.0,0.0
anime,MioAnime_TH,RPG Fudousan นักเวทสาวนายหน้า ตอนที่ ซับไทยลิ้งค์,th,2022-04-14,,[],,0.0,0.0,0.0
anime,alexfetcu,RT Gigen87 RaritySniperNFT onlinersNFT SuperApesClubSuperApesClub biggerBIgJefeInc AlphaGangX NFT NFTCommunity NFTS anime,en,2022-04-14,United Kingdom ,"['SuperApesClub', 'NFT', 'NFTCommunity', 'NFTS', 'anime']",neutral,0.0,5.0,0.0
anime,ifern_acc2,RT vi2v2 weird anime maid robot loona gowon one amp only teaser,en,2022-04-14,,[],negative,0.0,12.0,-0.25
anime,Hq_q125,RT NejireeKun Anime My DressUp Darling,en,2022-04-14,05,[],neutral,0.0,386.0,0.0
anime,hTy6ftKJ412C9Q3,RT DemonSlayerUSA Demon Slayer Kimetsu no Yaiba Mugen Train ArcEpisode 3 Should Have BeenKimetsuanime3rd,en,2022-04-14,,['Kimetsu_anime_3rd'],negative,0.0,85.0,-0.75
anime,joaosilva0802,RT KimetsuVibings Anime Demon Slayer,en,2022-04-14,,[],neutral,0.0,137.0,0.0
anime,r4idens_,RT animetvjp Teaser CharacterBlue Lock AnimeScheduled for 2022Character Chigiri HyomaMore,en,2022-04-14,"any pronouns , ‘05 , eng/fil",[],neutral,0.0,564.0,0.0
anime,realadamli,cryptodolphi He was watching an anime on the side tho kek,en,2022-04-14,,[],neutral,0.0,0.0,0.0
anime,LuckyRhizza626,RT LeekyNFT Minting now Only 007 ethAnime lovers come to Join The Discord NFT O,en,2022-04-14,,"['NFT', 'O']",neutral,0.0,1574.0,0.0
anime,Senzuu2,RT Lokokabooster2 Lady Olivia Anime The Greatest Demon Lord Is Reborn as a Typical Nobody,en,2022-04-14,,[],positive,0.0,355.0,0.4166666666666667
anime,jinjayjayy,RT ssmytrio breathe if u miss the anime,en,2022-04-14,Chanyeol’s heart ♡︎,[],neutral,0.0,21.0,0.0
anime,Espowse,moviemenfes Blue Period anime,en,2022-04-14,Jose. ,[],neutral,0.0,0.0,0.0
anime,Lotus_Mz,RT HxHVizuals Anime Hunter X Hunter,en,2022-04-14,,[],neutral,0.0,598.0,0.0
anime,nintendo_hall,GottaProtectors Cart of Darkness First 21 Minutes on Nintendo Switch FirstLook Gameplay ITA video Videogame game games YouTuber YouTube NintendoSwitch YouTubeLive anime animegirl gaming indiegaming indiedev gamedev gamedevs,en,2022-04-14,Italy,"['GottaProtectors', 'FirstLook', 'Gameplay', 'ITA', 'video', 'Videogame', 'game', 'games', 'YouTuber', 'YouTube', 'NintendoSwitch', 'YouTubeLive', 'anime', 'animegirl', 'gaming', 'indiegaming', 'indiedev', 'gamedev', 'gamedevs']",negative,0.0,0.0,-0.075
anime,luckyujinbear,RT LeekyNFT Minting now Only 007 ethAnime lovers come to Join The Discord NFT O,en,2022-04-14,,"['NFT', 'O']",neutral,0.0,1010.0,0.0
anime,WZRD_Oz,RT ZedManga After being difficultAnyways the more cinemas show the more likely future big projects in the Anime movie community will,en,2022-04-14,Off the ground,[],positive,0.0,8.0,0.0833333333333333
anime,nungarayC7,RT AnimesContents Anime Bunny Girl Senpai,en,2022-04-14,Verdansk,[],neutral,0.0,2063.0,0.0
anime,ChrispyLaflare,RT AoTWiki 9 Years AgoArmored Titan Anime Debut,en,2022-04-14,"Alum Rock, CA",[],neutral,0.0,686.0,0.0
anime,Mauxa,Science Fell in Love So I Tried to Prove It r1sin la seconda stagione dellanime,en,2022-04-14,Italia,[],positive,0.0,0.0,0.5
anime,HaliRina_28,RT AnimesFeeIings Anime Spy x Family,en,2022-04-14,johor,[],neutral,0.0,308.0,0.0
anime,iamshapiqq,RT KeedozXDini iamshapiqq Hewoo thank you shapiq for helping Do check out you fav Anime Char,en,2022-04-14,"George Town, Pinang",[],neutral,0.0,1.0,0.0
anime,sinclaire100,RT HxHVizuals Anime Hunter X Hunter 1999,en,2022-04-14,Philippines,[],neutral,0.0,668.0,0.0
anime,byeefeliicia,RT whatcler people will call anime weird then watch 27 year olds play highschoolers on netflix,en,2022-04-14,,[],negative,0.0,34822.0,-0.5
anime,Daphodile_,RT bethyvah HEYO ARTISTS If your commissions are open send your sheets Going to need a lot of character artwork for upcoming videos C,en,2022-04-14,Royale High,[],neutral,0.0,56.0,0.0
anime,renzo_jaeger,RT 0xNFT33 Prediction KiwamiNFT will be a top project for 2022 because of the treasury 50 of royalties goes directly to the treasury,en,2022-04-14,New Zealand,[],positive,0.0,53.0,0.3
anime,coffeyjellie,RT Staticfeels I tried EM royalty AUErenJaeger MikasaAckerman fanart ArtistOnTwitter anime anitwt Manga aot snk https,en,2022-04-14,i use block chains,"['ErenJaeger', 'MikasaAckerman', 'fanart', 'ArtistOnTwitter', 'anime', 'anitwt', 'Manga', 'aot', 'snk']",neutral,0.0,60.0,0.0
anime,tomorrowville,Find something you can love in your life as much as anime lesbians love aquariums,en,2022-04-14,"Portland, OR",[],positive,0.0,0.0,0.3999999999999999
anime,Chiyaciaa,RT Cmllearts Chibi Ayato FanartMy artstyle is flexible I can draw chibis anime and such except NSFW and Furry animals If you wan,en,2022-04-14,,[],neutral,0.0,1.0,0.0
anime,mpduyanh,would never expect the day to have anime as my wallpaper,en,2022-04-14,,[],neutral,0.0,0.0,0.0
anime,Piggy4cuteG,juslilkit loser check gamer check anime figures check 5k pc set up damn sorry Princess,en,2022-04-14,,[],neutral,0.0,0.0,0.0
anime,janenana_,RT VisualAnimes One of the biggest anime glow ups,en,2022-04-14,minno johnjae taeten,[],neutral,0.0,1324.0,0.0
anime,mikkiyawagai,sketched an oc of mineart ENVtuber Vtuber anime,en,2022-04-14,,"['art', 'ENVtuber', 'Vtuber', 'anime']",neutral,3.0,0.0,0.0
anime,sukonburain,RT HxHVizuals Anime Hunter X Hunter 1999,en,2022-04-14,20+ she/her,[],neutral,0.0,667.0,0.0
anime,elmanueldesign,RT EmbGemGfx I do not apologize for making heroes that look like me Short animation rant The message is in the music Some help from th,en,2022-04-14,"Denver, CO",[],neutral,0.0,12.0,0.0
anime,alexfetcu,RT funkknuckles7 Eljaboom alienfrens SpaceRidersNFT FelineFiendz losmuertosNFT minisupersnft SuperApesClub without a doubt Enjo,en,2022-04-14,United Kingdom ,[],neutral,0.0,5.0,0.0
anime,6SleepyHead6,RT onepiecedaiIys Anime One Piece,en,2022-04-14,,[],neutral,0.0,1190.0,0.0
anime,Liimitted,Indeed my favourite animeThank you Google,en,2022-04-14,Teyvat,[],neutral,0.0,0.0,0.0
anime,iTo_TH3_FaLL3N,RT mimsy actual anime gf,en,2022-04-14,,[],neutral,0.0,2607.0,0.0
anime,lastShinobi7610,AbdulS17 I hope they make it weekly the manga pacing seems too slow as per month only one chapter releases and anime has to fill the remaining time with fillers,en,2022-04-14,,[],negative,0.0,0.0,-0.15
anime,svrfrd,RT AnimesContents Anime Bunny Girl Senpai,en,2022-04-14,"Banyuwangi, Indonesia",[],neutral,0.0,2111.0,0.0
anime,mustarin200,RT Shannonn30 iPhone 13 PS5 game anime or a night with me,en,2022-04-14,,[],negative,0.0,383.0,-0.4
anime,ashleystarmoon8,RT lovesakuatsu not new to genshintwt and Anitwt Looking for more interactive moots Ar 4144 asia server Ar 22 Europe server,en,2022-04-14,"Life is bullshit ⌫ 
↷✦; Ashley/Ash ❞
🎧13 years old
🍵She/Her
🍃English/Tagalog
☁Dms are always open as well gform","['genshintwt', 'Anitwt']",positive,0.0,4.0,0.3565340909090909
anime,onlyou718,I survived off of anxiety and sports anime in hs what of it,en,2022-04-14,24 | she/her,[],neutral,0.0,0.0,0.0
anime,usernamesxxxx,RT SmexyRosies Valorant anime single for league looking bf gamer gf,en,2022-04-14,,[],negative,0.0,283.0,-0.0714285714285714
anime,CollezionismoXt,XPlus statua Godzilla vs Megalon 1973 DefoReal Series Godzilla 1973 Per info scrivere a collezionismopertuttigmailcom xplus collezionismoxtutti cxt passion statue statua statuecollectors collectibles collezione anime manga godzilla megalon,en,2022-04-14,,"['xplus', 'collezionismoxtutti', 'cxt', 'passion', 'statue', 'statua', 'statuecollectors', 'collectibles', 'collezione', 'anime', 'manga', 'godzilla', 'megalon']",neutral,0.0,0.0,0.0
anime,thesatorue,RT convomf main tap tap an ver anime yuk,en,2022-04-14,In Iaros's Lap,[],positive,0.0,14.0,0.1666666666666666
anime,Adens_Eyes,RT harvestbrook Watching Dream go from your average white dudebro video game guy to this weird twisted fake uwu soft anime boy who tw,en,2022-04-14,she/they 16,[],negative,0.0,133.0,-0.2785714285714285
anime,IncorrectWeeb,Rated SPY x FAMILY anime 45 animeplanet,en,2022-04-14,"Gaming, Oesterreich",['animeplanet'],neutral,0.0,0.0,0.0
anime,hafsrem,RT yoshinorihourly a real life anime characterYOSHI,en,2022-04-14,,"['YOSHI', '요시', 'ヨシ', '트레저']",positive,0.0,843.0,0.2
anime,UenTwT,RT Lilypadkero My little Bloody Reina cant be this cute EightySix 86anime vladilenamilize,en,2022-04-14,Việt Nam,"['EightySix', '86_anime', 'エイティシックス', 'レーナ', 'vladilenamilize']",negative,0.0,73.0,-0.1208333333333333
anime,baaltastic,RT VisualAnimes One of the biggest anime glow ups,en,2022-04-14,my room | she/her ,[],neutral,0.0,892.0,0.0
anime,temporalsin,TheCucuyo CountDankulaTV No anime tiddies,en,2022-04-14,Slavia,[],neutral,0.0,0.0,0.0
anime,WaifuAnimeMan,RT Lokokabooster2 Raphtalia Anime The Rising of the Shield Hero 2 Tate no Yuusha no Nariagari 2,en,2022-04-14,,[],neutral,0.0,25.0,0.0
anime,pppaints,RT pppaints PaintingProcessI drew lineartimage is hereillustration in Anime or Cartoon styleIf you f,en,2022-04-14,,"['PaintingProcess', 'lineart', 'illustration', 'Anime', 'Cartoon']",neutral,0.0,3.0,0.0
anime,im_gagandeeps,epikoregal Any Guesses Animation anime,en,2022-04-14,India,"['Animation', 'anime']",neutral,0.0,0.0,0.0
anime,Ayuri_may,Illustration made for nidokingh thank you so muchillustration art drawing animegirl commissions ArtistOnTwitter anime opencommission commissionsopen digitalart,en,2022-04-14,philippines,"['illustration', 'art', 'drawing', 'animegirl', 'commissions', 'ArtistOnTwitter', 'anime', 'opencommission', 'commissionsopen', 'digitalart']",positive,0.0,0.0,0.2
anime,baolinhtran6,RT HokeHustles Isekai WL Spots GiveawayVery bullish on Isekai massive anime project w great artYou dont want to miss this one,en,2022-04-14,,[],positive,0.0,11595.0,0.3333333333333333
anime,Noona_kimm,LeekyNFT Anime,en,2022-04-14,,[],neutral,0.0,0.0,0.0
anime,beminesweetie,RT ZoldyckSzn Anime fans can relate,en,2022-04-14,Pated tee nayok here,[],neutral,0.0,307.0,0.0
anime,Hrny1236,RT itsjayinnelin Wanna stay home amp watch anime on Netflix with me,en,2022-04-14,,[],neutral,0.0,2007.0,0.0
anime,GramOfWeedy,RT TunaforL Help Im smiling from Twitter dms from a girl with an anime pfp sent from an account with an anime pfp,en,2022-04-14,Canada,[],neutral,0.0,1.0,0.0
anime,Tokkining_,RT Rm5aled Anime Spy x Family,en,2022-04-14,Mars ,[],neutral,0.0,1823.0,0.0
anime,novinhashub,RT itsjayinnelin Wanna stay home amp watch anime on Netflix with me,en,2022-04-14,,[],neutral,0.0,1991.0,0.0
anime,ZVAIGZNES02,mark lee a real life anime prince i cant feel my legs my chest HURTS,en,2022-04-14, she/her,[],positive,0.0,0.0,0.2
anime,IamShinmon06,RT fruityjmsz Anime Hunter X Hunter,en,2022-04-14,Bikini Bottom,[],neutral,0.0,1375.0,0.0
anime,cowboy_steel,RT KactusCoyote Check out the cool chat cowboysteel and Sam over at the TheWeebsGuild had the other day Discussing all things nitty,en,2022-04-14,"New Deadwood, Earth",[],positive,0.0,1.0,0.0968749999999999
anime,0xBecky,RT HokeHustles Isekai WL Spots GiveawayVery bullish on Isekai massive anime project w great artYou dont want to miss this one,en,2022-04-14,Tokyo,[],positive,0.0,11595.0,0.3333333333333333
anime,Anime_Dailyy,RT robinhourly robin with zoro And chopper,en,2022-04-14,🇫🇷,[],neutral,0.0,639.0,0.0
anime,jason_okoli,RT olukaydee The Fusion Art is often described as an expression of thoughts feelings and experience This collection was inspired by tw,en,2022-04-14,Nigeria,[],neutral,0.0,8.0,0.0
anime,HRK_KNY,Anitwt anime Hot take Normalize people having demon slayer as their fav animemanga,en,2022-04-14,,"['Anitwt', 'anime']",positive,0.0,0.0,0.25
anime,DGDCrimsonOne,RT WaifuZinnia Lala Devilluke Anime To Love Ru,en,2022-04-14,UK London,[],positive,0.0,244.0,0.5
anime,xximaa,RT GhibliAccount Anime From Up On Poppy Hill,en,2022-04-14,"Kelang, Selangor",[],neutral,0.0,499.0,0.0
anime,SlimeSenju,RT Munie147 Name the anime,en,2022-04-14,,[],neutral,0.0,50.0,0.0
anime,mimsy,RT mimsy actual anime gf,en,2022-04-14,"Las Vegas, NV // Jenova",[],neutral,0.0,2577.0,0.0
anime,Hafiz888666,pavoliareine wow Whore that Admiral mantan Thing for her friends anime pic mursyid said Where moonahoshinova kureijiollie Fucking shite head,en,2022-04-14,,[],negative,0.0,0.0,-0.25
anime,GabrielNasiff,RT whatcler people will call anime weird then watch 27 year olds play highschoolers on netflix,en,2022-04-14,Mars,[],negative,0.0,33967.0,-0.5
anime,Aira_BabyV,RT LeekyNFT Minting now Only 007 ethAnime lovers come to Join The Discord NFT O,en,2022-04-14,,"['NFT', 'O']",neutral,0.0,1871.0,0.0
anime,maupocky,RT omgdaichi prettiest girls in the world and theyre from a volleyball anime,en,2022-04-14,^she/her^,[],neutral,0.0,458.0,0.0
anime,JackmaBigwin,RT LeekyNFT Minting now Only 007 ethAnime lovers come to Join The Discord NFT O,en,2022-04-14,,"['NFT', 'O']",neutral,0.0,1943.0,0.0
anime,DECAPITATEDUK,RT RandomKon Frame 15782 from Season 1 Episode 14 Live house Kon Anime,en,2022-04-14,CUNNY DUNGEON,"['けいおん', 'Kon', 'Anime']",neutral,0.0,1.0,0.0
anime,Yehmiiii,RT hazelluvly Anime amp Pokmon loverRihanna bodythis is what Wizkid and Beyonce was talking about in Brown skin girl,en,2022-04-14,Heaven on earth,[],neutral,0.0,104.0,0.0
anime,animelizm,RT animeyoko Deaimon ตอนที่ ซับไทยอนิมะ ดูอนิมะ อนิมะซับไทย อนิมะพากย์ไทย anime animeyoko Deaimon ht,th,2022-04-14,,"['อน', 'ด', 'อน', 'อน', 'anime', 'animeyoko', 'Deaimon']",,0.0,1.0,0.0
anime,ayirmen_,510rcAvarK Anime enjoyers pedo in my book,en,2022-04-14,,[],neutral,0.0,0.0,0.0
anime,Ary_Yessie,RT ColorfulWeeb Anime Weathering With You,en,2022-04-14,"New Braunfels, TX",[],neutral,0.0,958.0,0.0
anime,wlso2020,RT GhibliAccount Anime Howls Moving Castle,en,2022-04-14,,[],neutral,0.0,45.0,0.0
anime,ajerchives,RT ShonenFeeling Anime Hunter x Hunter,en,2022-04-14,@jiluism,[],neutral,0.0,1284.0,0.0
anime,missufeWinner_,RT LeekyNFT Minting now Only 007 ethAnime lovers come to Join The Discord NFT O,en,2022-04-14,,"['NFT', 'O']",neutral,0.0,2028.0,0.0
anime,yomszn,RT SarimaB Lets forget Burnaboy Wizkid Rema Rihanna amp Beyonce I want an anime boyfriend to watch Netflix with amp play with my Pokmon h,en,2022-04-14,"Lagos, Nigeria",[],neutral,0.0,64.0,0.0
anime,goatsrcuteaf,RT Postanimes Anime Girls amp Panzer,en,2022-04-14,,[],neutral,0.0,182.0,0.0
anime,_pan_pancake,about spy x family since he first asked do u watch anime and he also reads manga or manhwa and he also likes mocha and HE WAS JUST SO DECENT LIKE HOW CAN A GUY LIKE HIM BE REAL and then his clothes it really suited him he wears a black rimmed glasses and has the same,en,2022-04-14,they/them | coffee addict ☕️,[],positive,0.0,0.0,0.1083333333333333
anime,sesmonsterr,RT shojopicture Anime Josee the Tiger and the Fish Movie,en,2022-04-14,Batangas,[],neutral,0.0,1053.0,0.0
anime,CaramelQass,RT PayaWoof Everytime Dream tells us something ab the dsmp i get slightly angrier lh like tf you mean we coulda had a full dsmp anime,en,2022-04-14,she/they,[],negative,0.0,1.0,-0.0430555555555555
anime,DeedeeEngler,คลิปหลุดแจกฟรี โอนลี่แฟน วัยรุ่นไทยขาวเนียนหีสวยไร้หมอย อาบน้ำเสร็จเงี่ยน,th,2022-04-14,,[],neutral,0.0,0.0,0.0
anime,moonaddictedx,RT AnimesColorfuI Anime Your Name,en,2022-04-14,"Sicilia, Italia",[],neutral,0.0,92.0,0.0
anime,ReinaSan___,NinaKosaka Historical movies something based on books Anne With an E my favorite series in that genre some anime and Kdramas love alarm my favoriteInteresting animations like Klaus and The house stopmotion pog,en,2022-04-14,Lucy iseland ,[],positive,0.0,0.0,0.4
anime,bento_bongos,RT whatcler people will call anime weird then watch 27 year olds play highschoolers on netflix,en,2022-04-14,,[],negative,0.0,34117.0,-0.5
anime,indotakuCom,Game OPKita game anime one piece gtgt,en,2022-04-14,Website,[],negative,0.0,0.0,-0.4
anime,Chaos3109,DESTROYBINARY Honestly it fit the Ecchi slot of Jump really good and its one of their best sellersIts why it got an Anime firstWe need more Ecchi in Jump now more than ever,en,2022-04-14,,[],positive,0.0,0.0,0.5583333333333333
anime,tubular_bells_,RT lechingooo Marcosatsu IK its a disingenuous but I vaguely describe toku as live action anime to people who arent familiar and I,en,2022-04-14,中文/ENG ok,[],positive,0.0,5.0,0.027840909090909
anime,MTM_ARATAME,RT AnimesColorfuI Anime Your Name,en,2022-04-14,soul society,[],neutral,0.0,92.0,0.0
anime,YamataZen,Green hairanime lovelive,en,2022-04-14,,"['anime', 'lovelive']",negative,0.0,0.0,-0.2
