Keyword,User,Tweet,Language,Time,User Location,Hashtag,Polarity,Likes,Retweet,Sentiment
anime,giabinhlyyi,RT HokeHustles Isekai WL Spots GiveawayVery bullish on Isekai massive anime project w great artYou dont want to miss this one,en,2022-04-14,,[],positive,0.0,11595.0,0.3333333333333333
anime,marcsterr,RT LeekyNFT Minting now Only 007 ethAnime lovers come to Join The Discord NFT O,en,2022-04-14,,"['NFT', 'O']",neutral,0.0,1311.0,0.0
anime,ihaveacupoftea,RT Rm5aled Anime Spy x Family,en,2022-04-14,,[],neutral,0.0,1585.0,0.0
anime,largimomola,RT LeekyNFT Minting now Only 007 ethAnime lovers come to Join The Discord NFT O,en,2022-04-14,,"['NFT', 'O']",neutral,0.0,3258.0,0.0
anime,KimMortonYep,RT sharanicolelynn 1 I am a person lmfao Black people will stay voicing in anime whether you like it or not 2 Yall can go and blo,en,2022-04-14,http://www.yepsound.com,[],negative,0.0,455.0,-0.2083333333333333
anime,polinkamalina1,RT TjisseNFT Free NFTGiveaways 1x Nft ZentoElfs To enter Follow ZentoElfs and TjisseNFT Rt amp Tag 3 Friends,en,2022-04-14,,"['Free', 'NFTGiveaways', 'Nft']",positive,0.0,350.0,0.4
anime,gae_anime,aicuriobot botprompt catgirl macron,en,2022-04-14,hell,[],neutral,0.0,0.0,0.0
anime,afriqteen,RT hazelluvly Anime amp Pokmon loverRihanna bodythis is what Wizkid and Beyonce was talking about in Brown skin girl,en,2022-04-14,10k ? 📍,[],neutral,0.0,104.0,0.0
anime,TurntoZero,I like anime about Vampires need to rewatch Seraph of the end and also have To watch more main stream Anime,en,2022-04-14,"Karnataka, India",[],positive,0.0,0.0,0.3333333333333333
anime,softikawa,RT ninimart NiNiMartGAs one winner each bts care package anime care package mbf rt reply chosen package amp proof a,en,2022-04-14,eng/fil | 20,['NiNiMartGAs'],neutral,0.0,73.0,0.0
anime,sunfIowerdaisy,RT SonNoodles2 Dads in anime only got two choices,en,2022-04-14,she/her • minor dnf,[],neutral,0.0,876.0,0.0
anime,itsbobo__,RT SaylupGG Which Anime character is capable of doing this to Goku,en,2022-04-14,"Louisiana, USA",[],positive,0.0,96.0,0.2
anime,u_d_r_c_r,RT whatcler people will call anime weird then watch 27 year olds play highschoolers on netflix,en,2022-04-14,,[],negative,0.0,33966.0,-0.5
anime,andrewAPPLE169,rycknft asne78222413 MindblowonNFT I like this painting style very much like my childhood anime godbin12345 supreme1111 Kazehayashinji,en,2022-04-14,,[],positive,0.0,0.0,0.26
anime,U55TDG25,RT herosultraman Anime ULTRAMAN Season 2 global streaming begins on Netflix todayStreaming Link ULTRAMAN,en,2022-04-14,北川町ツツジ台,['ULTRAMAN'],neutral,0.0,7.0,0.0
anime,luckyraolr26,raahulbhardwaj7 Its Japanese Anime,en,2022-04-14,Canada,[],neutral,0.0,0.0,0.0
anime,TheBetterNoona,RT shojopicture Anime Josee the Tiger and the Fish Movie,en,2022-04-14,"Perez, Calabarzon",[],neutral,0.0,927.0,0.0
anime,missglorya_,RT LeekyNFT Minting now Only 007 ethAnime lovers come to Join The Discord NFT O,en,2022-04-14,was @missgloryaa,"['NFT', 'O']",neutral,0.0,2028.0,0.0
anime,mrsboogeyman_,RT fairyysky i lt3 anime boys,en,2022-04-14,,[],neutral,0.0,8.0,0.0
anime,Vault1234567,ODFCxP EllieHola1 So it a 3D anime movie,en,2022-04-14,,[],neutral,0.0,0.0,0.0
anime,Johnsal30884513,RT lMLEXl2LEGIT Looking for a boyfriend that loves anime and Pokmon,en,2022-04-14,,[],neutral,0.0,1244.0,0.0
anime,eijeyyx_,RT LIDAWIDA Finally a Karen joke in anime SPYxFamily,en,2022-04-14,"
+63, she her 
stan, reading acc. 
tweets in eng / filo. 
",['SPYxFamily'],neutral,0.0,9884.0,0.0
anime,moses_kean,RT ShonenFeeling Anime Hunter x Hunter,en,2022-04-14,,[],neutral,0.0,2061.0,0.0
anime,Sleepykoya_7,RT whatcler people will call anime weird then watch 27 year olds play highschoolers on netflix,en,2022-04-14,My Animal Crossing Island ,[],negative,0.0,34572.0,-0.5
anime,0xnanocityx,RT LeekyNFT Minting now Only 007 ethAnime lovers come to Join The Discord NFT O,en,2022-04-14,,"['NFT', 'O']",neutral,0.0,2099.0,0.0
anime,piggywiggytime,Soraxjm I just re watched it recently Such a good anime,en,2022-04-14,"Denver, CO",[],positive,0.0,0.0,0.35
anime,FaithKuzunoha,the fact that drifter didnt specify which anime he was talking about is funny af everyone is figuring out which anime it is while I know because I was talking to him about it I literally hold the secret knowledge that no one knows but me till he wakes up,en,2022-04-14,she/her 18,[],negative,0.0,0.0,-0.075
anime,CossioHD,RT 90sVisuaI Anime Sailor Moon,en,2022-04-14,"Valparaiso, Zacatecas",[],neutral,0.0,2398.0,0.0
anime,Simply_Asa,WetbackWaffen MikazukiAugus Its just funny how hard people get baited over anime shitposts cracks me up every time,en,2022-04-14,United States,[],negative,0.0,0.0,-0.0208333333333333
anime,wanabiyorhani,RT 90sVisuaI Anime Sailor Moon,en,2022-04-14,,[],neutral,0.0,2198.0,0.0
anime,selflove1031,RT feliparchive A living anime character indeed SB19Official SB19KEN SB19at2022PPOPCON SB19,en,2022-04-14,,"['SB19_KEN', 'SB19at2022PPOPCON', 'SB19']",neutral,0.0,24.0,0.0
anime,flowylily,RT LeekyNFT Minting now Only 007 ethAnime lovers come to Join The Discord NFT O,en,2022-04-14,akun wangi 🍀,"['NFT', 'O']",neutral,0.0,1461.0,0.0
anime,pennywhispered,one day when i have nothing on my todo list im gonna compile screencaps of every single distinct outfit the characters i like the outfits of in every anime wearnothing on my todo list LMAO,en,2022-04-14,"Oregon, USA",[],positive,0.0,0.0,0.2761904761904761
anime,JennieAsi12,RT NFTGUYY Komorebi No Sekai x GiveawayNFTGiveway Collab20 Komorebi WL spots1 RT2 Follow KomorebiNoSekai3 Tag 3 fri,en,2022-04-14,,['NFTGiveway'],neutral,0.0,143.0,0.0
anime,Z0R0TETAS,RT ShonenFeeling Anime Hunter x Hunter,en,2022-04-14,Con Cavendish                 ,[],neutral,0.0,1675.0,0.0
anime,Vignesh04754585,RT VisualAnimes One of the biggest anime glow ups,en,2022-04-14,,[],neutral,0.0,843.0,0.0
anime,Elimeno,RT sharanicolelynn 1 I am a person lmfao Black people will stay voicing in anime whether you like it or not 2 Yall can go and blo,en,2022-04-14,"California, USA",[],negative,0.0,364.0,-0.2083333333333333
anime,baeluckywins,RT drunft If you know me you know I love anime so its no surprise kosekaiNFT stood out to me The resolution and attention to det,en,2022-04-14,bbh l 21,[],positive,0.0,1049.0,0.5
anime,redSubbySub,RT mimsy actual anime gf,en,2022-04-14,,[],neutral,0.0,2856.0,0.0
anime,JerZaaR,Watched RPG Fudousan Ep2,en,2022-04-14,Mi casa,[],neutral,0.0,0.0,0.0
anime,DiegoM_33,RT HxHPictures Anime Hunter x Hunter,en,2022-04-14,210,[],neutral,0.0,4264.0,0.0
anime,dei_araara,RT animexelite Anime Demon Slayer,en,2022-04-14,Look at those fool 👁👁,[],neutral,0.0,356.0,0.0
anime,AkumaTheDemon_,RT sharanicolelynn 1 I am a person lmfao Black people will stay voicing in anime whether you like it or not 2 Yall can go and blo,en,2022-04-14,Your mom’s house,[],negative,0.0,884.0,-0.2083333333333333
anime,femijidearemo,RT UkiyoPlayers Kami master of all elements of nature managed to save Metakai from the outrageous attack of Satsujin but needs our hel,en,2022-04-14," Lagos, Nigeria",[],negative,0.0,89.0,-1.0
anime,SuperDan1522,RT WaifuAnimeMan Sizilien amp Maria Anime Wise Mans Grandchild,en,2022-04-14,,[],positive,0.0,3.0,0.7
anime,ambrestn_,RT WaifuCulture Anime Attack on Titan,en,2022-04-14,she/her | 21,[],neutral,0.0,282.0,0.0
anime,JoseBedollaRam1,RT AvaBamby need an anime gf Ps whats the first thing you noticed about me,en,2022-04-14,,[],positive,0.0,217.0,0.25
anime,b1ccies,RT Rm5aled Anime Spy x Family,en,2022-04-14,,[],neutral,0.0,1622.0,0.0
anime,Javien282,RT onepiecexdaily Anime One Piece x Attack on Titan,en,2022-04-14,In Your Mom,[],neutral,0.0,1478.0,0.0
anime,iloveanime_Sa,RT fruityjmsz Anime Hunter X Hunter,en,2022-04-14,,[],neutral,0.0,1423.0,0.0
anime,SuminomAmonimus,RT UnusualImagery Anime is art,en,2022-04-14,"🇷🇺 Moscow, Russia. 24. Ace.",[],neutral,0.0,1.0,0.0
anime,anifty_jp,LAST 2 PIECES LEFTThank you activxgeth for your purchaseThe Forest Girl in the forestCreated by Kura 07koharu1807 sensei NFTdrop nftcollector anime ANIFTY AnimeNFT NFTJPN Purchase here,en,2022-04-14,The University of Tokyo,"['NFTdrop', 'nftcollector', 'anime', 'ANIFTY', 'AnimeNFT', 'NFTJPN']",neutral,0.0,0.0,0.0
anime,BluuRaeVT,TYSM for the tag Ashana lt3What you can expect on my channelAnimeweeb memes and referencesBad gameplay with a bubbly personalityChill vibesDeep conversationsEngaging communityFfriends LaDrohl PezTheKing DizzyDreamur djgukie BluuRae ENVtuber,en,2022-04-14,in your browser history,"['BluuRae', 'ENVtuber']",neutral,0.0,0.0,0.0
anime,YukyQwQ,RT SugoiLITE TV Anime Girls Frontline Dolls Frontline has 12 episodes,en,2022-04-14,💧🤲🏻💧,['ドールズフロントライン'],neutral,0.0,63.0,0.0
anime,Aprilwin03,RT LeekyNFT Minting now Only 007 ethAnime lovers come to Join The Discord NFT O,en,2022-04-14,,"['NFT', 'O']",neutral,0.0,1461.0,0.0
anime,go_anime,RT princesspromos 150 21 JT 24 HOURS RT amp Follow janoubiyanbu,en,2022-04-14,Philippines,[],neutral,0.0,7258.0,0.0
anime,MeluBigwin,RT LeekyNFT Minting now Only 007 ethAnime lovers come to Join The Discord NFT O,en,2022-04-14,Imdonesia,"['NFT', 'O']",neutral,0.0,1310.0,0.0
anime,eyaluxiem,KiraShizu MystaRias i know your fave anime is black butler hahaha,en,2022-04-14,Luxiem Dormitory,[],positive,0.0,0.0,0.0166666666666666
anime,sekIusyonn,RT GhibliAccount Anime From Up On Poppy Hill,en,2022-04-14,Gab. He/Him. Side lang. DNF!,[],neutral,0.0,529.0,0.0
anime,austinhinkle97,RT tedbob84 Got a new anime magazine haul and OH damn,en,2022-04-14,,[],positive,0.0,11.0,0.2130681818181818
anime,_S0NATA_,stonecoldnigcel I remember when the anime girls from my middle school did the Haruhi dance in the halls,en,2022-04-14,,[],neutral,0.0,0.0,0.0
anime,luckyyz7,RT mangakaua983 Im extremely grateful that our Anero fam has grown so much in short time weve been around Im honored that my art res,en,2022-04-14,Republic of the Philippines,['Anero'],negative,0.0,57.0,-0.0625
anime,_James_Wilson,RT whatcler people will call anime weird then watch 27 year olds play highschoolers on netflix,en,2022-04-14,Acton Ontario,[],negative,0.0,34775.0,-0.5
anime,OMZ_Yuki,RT WaifuVato Alice Anime Food Wars,en,2022-04-14,,[],neutral,0.0,60.0,0.0
anime,Niki_moon7,RT DemonSlayerUSA NEWS Demon Slayer Kimetsu no Yaiba Swordsmith Village Arc anime adaptation confirmed,en,2022-04-14,,['NEWS'],positive,0.0,17984.0,0.5
anime,shernorvabet,RT AoTWiki 9 Years AgoArmored Titan Anime Debut,en,2022-04-14,"₊˚⋆🧚🏻‍♀️ ma babies ⋆˚₊ 
@pledis_17🩰 / 트와이스 🍨 도경수 
✳︎ XH ✿ nmixx ⌇🐠 jeanboy & jypekids⛳
• °  +.❤︎ 𝖼𝗎𝗍𝗂𝖾 3oO % ❤︎ (ෆ`꒳´ෆ)◞︎ ̑̑
",[],neutral,0.0,44.0,0.0
anime,HungryMe133,yaisaeko AzumaAku yoongding CL33PY manhow712 kangsernft NFTLEARNER9 another anime,en,2022-04-14,Malaysia,[],neutral,0.0,0.0,0.0
anime,H4RUWEATHER,RT Rm5aled Anime Spy x Family,en,2022-04-14,ᕙ(⇀‸↼‶)ᕗ,[],neutral,0.0,1888.0,0.0
anime,anime_priya,evilxeme ArrowVibes OfficialRenzy Done,en,2022-04-14,,[],neutral,0.0,0.0,0.0
anime,Silver__Fox____,rienbsumsk Day 1 Childhood Trauma and SalvationDay 2 AU Battle Day 3 Crossover Road to Ninja Day 4 Genderbend Animals Day 5 Favorite Moments from Anime amp Novels Snow Festival Day 6 Timeskip The Sun and the Moon Day 7 Free,en,2022-04-14,.,[],positive,1.0,0.0,0.45
anime,itzybun,RT K1kka anime girl spawns on your timeline,en,2022-04-14,shay mel ,[],neutral,0.0,65.0,0.0
anime,Treyvon2018,RT sharanicolelynn 1 I am a person lmfao Black people will stay voicing in anime whether you like it or not 2 Yall can go and blo,en,2022-04-14,"Brampton, Ontario",[],negative,0.0,1320.0,-0.2083333333333333
anime,AWholeLottaLotl,RT sharanicolelynn 1 I am a person lmfao Black people will stay voicing in anime whether you like it or not 2 Yall can go and blo,en,2022-04-14,He/Him | White | Bi,[],negative,0.0,1320.0,-0.2083333333333333
anime,OkigboIkechukwu,Anime is wack,en,2022-04-14,,[],neutral,0.0,0.0,0.0
anime,Grymn_Kamui,RT Lokokabooster2 Asuna Anime Sword Art Online,en,2022-04-14,,[],neutral,0.0,149.0,0.0
anime,ZionSSBM,zyiirx ohhes going to forcebreedforcebreed the little 6 year old anime girl,en,2022-04-14,,[],negative,0.0,0.0,-0.04375
anime,Deicide99,RT DeathBattleBot DEATH BATTLE in Brussels Anime Peter Griffin VS Majin Buu,en,2022-04-14,Atomium,[],neutral,0.0,8.0,0.0
anime,MattMaxx16,RT Wictor2501 Theres plenty of anime with badass female MCs Theyre just overlooked,en,2022-04-14,"Georgia, USA",[],neutral,0.0,99.0,0.0
anime,smol_ffxiv,RT GhibliAccount Anime Howls Moving Castle,en,2022-04-14,Somewhere Vibing,[],neutral,0.0,479.0,0.0
anime,LoluvW,RT namelessmajin isaylottastuff UgandenX KarasunoTr8xs Im never gonna forget some anime nerd on TikTok said good genocide to justi,en,2022-04-14,,[],positive,0.0,1.0,0.7
anime,TwitchErodes,RT Lokokabooster2 Marin Anime Sono Bisque Doll wa Koi wo Suru My DressUp Darling,en,2022-04-14,Consistency is key 💸,[],neutral,0.0,331.0,0.0
anime,fatehoperI,RT shojopicture Anime Josee the Tiger and the Fish Movie,en,2022-04-14,,[],neutral,0.0,957.0,0.0
anime,wasuremasen_,RT whatcler people will call anime weird then watch 27 year olds play highschoolers on netflix,en,2022-04-14,she/her - ESP/ENG -,[],negative,0.0,34045.0,-0.5
anime,rezekinana2224,RT LeekyNFT Minting now Only 007 ethAnime lovers come to Join The Discord NFT O,en,2022-04-14,,"['NFT', 'O']",neutral,0.0,1786.0,0.0
anime,UtamiRiyanda,RT alonner01 saoanimeFriends,en,2022-04-14,,['sao_anime'],neutral,0.0,5.0,0.0
anime,ssinzzo,RT rocketboiART TOKUMASK ROACHSmall project Im undertaking in my spare time as part of my TOKUMASK OC A young man discovers he is a,en,2022-04-14,,[],negative,0.0,194.0,-0.075
anime,Ms_IUNA,RT whatcler people will call anime weird then watch 27 year olds play highschoolers on netflix,en,2022-04-14,,[],negative,0.0,34513.0,-0.5
anime,hwaiting,RT AnimesFeeIings Anime Spy x Family,en,2022-04-14,Jungneong,[],neutral,0.0,504.0,0.0
anime,SoftzAgain,mountainsatop ULTIMATE ANIME,en,2022-04-14,,[],neutral,0.0,0.0,0.0
anime,TheClashPlayer,RT thoughts0nanime Wait what did I saw Spy x Family anime adaptation was a mistake,en,2022-04-14,,[],neutral,0.0,2.0,0.0
anime,clmmchetluon,RT HokeHustles Isekai WL Spots GiveawayVery bullish on Isekai massive anime project w great artYou dont want to miss this one,en,2022-04-14,china,[],positive,0.0,11846.0,0.3333333333333333
anime,GeneraIAssEater,Nathandsomemore DaWorstMemes I have yet to see one funny anime meme But it becomes a form of dry humor when you replace the god awful joke with an angry face,en,2022-04-14,The Invisible Hand,[],negative,0.0,0.0,-0.3291666666666666
anime,numnuts_forever,RT sharanicolelynn 1 I am a person lmfao Black people will stay voicing in anime whether you like it or not 2 Yall can go and blo,en,2022-04-14,"North Tonawanda, NY",[],negative,0.0,1320.0,-0.2083333333333333
anime,Kendal_quack,RT sharanicolelynn 1 I am a person lmfao Black people will stay voicing in anime whether you like it or not 2 Yall can go and blo,en,2022-04-14,m/w: @funnymanoopsy | NSFW DNI,[],negative,0.0,1320.0,-0.2083333333333333
anime,beepbeepbitche3,teamgangfam ANIME And adventure time lt3,en,2022-04-14,They/she,[],neutral,0.0,0.0,0.0
anime,shadesonatnight,My mother who now exclusively watches anime,en,2022-04-14,Neo Tokyo,[],neutral,0.0,0.0,0.0
anime,Tomus95i,RT 90sVisuaI Anime Sailor Moon,en,2022-04-14,,[],neutral,0.0,2226.0,0.0
anime,oOacatalepsy,RT AnimesContents Anime Bunny Girl Senpai,en,2022-04-14,unknown,[],neutral,0.0,2063.0,0.0
anime,findingiyen,alfxmart anime,en,2022-04-14,she / her,[],neutral,0.0,0.0,0.0
anime,VictoryDraws,denicsua Thank you for this artshare on this ThursdayI am Victory a weird anime artist who draws her OCS fanart other stuff with tons of sparkle lighting My webcomic Jojos Record Raid is released on Webtoon Canvas my goal right now is reaching 10K followers by 2023,en,2022-04-14,LF Moots + Read my Webcomic!,[],negative,0.0,0.0,-0.0997023809523809
anime,OxdwiBigWin,RT LeekyNFT Minting now Only 007 ethAnime lovers come to Join The Discord NFT O,en,2022-04-14,,"['NFT', 'O']",neutral,0.0,3257.0,0.0
anime,Built_pkn,เธรดรวมทวิตที่ตัวเองพูดถึงanime springกลัวหาไม่เจอ,th,2022-04-14,,[],negative,0.0,0.0,80.0
anime,RealFireNSteel,SWORD ART ONLINE PEOPLE you know what were talking about fyp fyp foryou foryoupage anime tiktok viral animetiktok swordtiktok sword weapon weapons sao swordartonline kirito elucidator fireandsteel,en,2022-04-14,"Mississauga, Ontario","['fyp', 'fypシ', 'foryou', 'foryoupage', 'anime', 'tiktok', 'viral', 'animetiktok', 'swordtiktok', 'sword', 'weapon', 'weapons', 'sao', 'swordartonline', 'kirito', 'elucidator', 'fireandsteel']",positive,0.0,0.0,0.5
anime,dagliolio,animefess di anime given,en,2022-04-14,apa aje gue demen,[],neutral,0.0,0.0,0.0
anime,knkhkiew,RT Lilypadkero My little Bloody Reina cant be this cute EightySix 86anime vladilenamilize,en,2022-04-14,アニメ/漫画/만화/歌,"['EightySix', '86_anime', 'エイティシックス', 'レーナ', 'vladilenamilize']",negative,0.0,28.0,-0.1208333333333333
anime,Lary_Crazs,RT whatcler people will call anime weird then watch 27 year olds play highschoolers on netflix,en,2022-04-14,Ciudad Autónoma de Buenos Aire,[],negative,0.0,33966.0,-0.5
anime,littlevixlence,ed delivers nina and alexander where are they so softly bro HWY HES PISSED ANIME HAD HIM FURIOUS VIC WHY DIDNYOU CHANGE IT at least the fight hes more anger,en,2022-04-14,she/they - 22,[],positive,0.0,0.0,0.1
anime,NormallyEl,Check Out My Genshin Impact Anime Opening Playlist At Youtube Hope you enjoy and stay tuned for another updates Thanks for reading and happy watching genshinimpactanimeopeningopeninggenshinimpacteditgenshinimpactanimeopening,en,2022-04-14,,"['genshinimpact', 'animeopening', 'opening', 'genshinimpactedit', 'genshinimpactanimeopening']",positive,0.0,0.0,0.4666666666666667
anime,shonenfeeIs,RT AceRazeanime Anime Spy x Family Anya Forger,en,2022-04-14,,[],neutral,0.0,9.0,0.0
anime,gurttyj,RT onepiecedaiIys Anime One Piece,en,2022-04-14,,[],neutral,0.0,922.0,0.0
anime,vanquocpham3,RT HokeHustles Isekai WL Spots GiveawayVery bullish on Isekai massive anime project w great artYou dont want to miss this one,en,2022-04-14,,[],positive,0.0,11595.0,0.3333333333333333
anime,TleeEN_,RT HxHVizuals Anime Hunter X Hunter 1999,en,2022-04-14,,[],neutral,0.0,779.0,0.0
anime,BaeSyx,RT sharanicolelynn 1 I am a person lmfao Black people will stay voicing in anime whether you like it or not 2 Yall can go and blo,en,2022-04-14,Nowhere,[],negative,0.0,1320.0,-0.2083333333333333
anime,ItsTosin,RT AnimexVizuals Anime Tokyo Ghoul,en,2022-04-14,,[],neutral,0.0,35.0,0.0
anime,SEVKONPINKTEUME,RT harusbutterfly the anime i love is one piece i watched it from its first episode I have been rewatching it on YouTube with Asah,en,2022-04-14,🇵🇭,[],positive,0.0,90.0,0.375
anime,ja_mesnogales,RT AnimesColorfuI Anime Your Name,en,2022-04-14,,[],neutral,0.0,201.0,0.0
anime,njasnocha,RT sharanicolelynn 1 I am a person lmfao Black people will stay voicing in anime whether you like it or not 2 Yall can go and blo,en,2022-04-14,,[],negative,0.0,1320.0,-0.2083333333333333
anime,amam_snsn,RT OtakuAnimeInd RaphtaliaAnime Tate no Yuusha no Nariagari Season 2Genre Action Adventure Drama FantasyScore 763S,en,2022-04-14,"Kota Makassar, Sulawesi Selata",[],positive,0.0,2.0,0.1
anime,Diablo92079511,RT WaifuAnimeGuy Albedo Anime Overlord,en,2022-04-14,,[],neutral,0.0,72.0,0.0
anime,harruumine,RT teumeunion One pieceits the anime I love I saw it from EP 1 Ive been rewatching it with Asahi Hyung My favorite scene was wh,en,2022-04-14,04 she♡ treasure♥seventeen,[],positive,0.0,122.0,0.5
anime,Cryptoresource4,RT SmokezXBT Waaay too many Anime NFT projects popping up now Azuki amp Muri are the only 2 worth investing in still,en,2022-04-14,,[],positive,0.0,18.0,0.2666666666666666
anime,neybleecy_,RT LeekyNFT Minting now Only 007 ethAnime lovers come to Join The Discord NFT O,en,2022-04-14,🍭🍬,"['NFT', 'O']",neutral,0.0,1311.0,0.0
anime,joonsupremacist,RT kakashismain Something quick for Nanami working on Geto nanamikento jjk anime,en,2022-04-14,,"['nanamikento', 'jjk', 'anime']",positive,0.0,3138.0,0.3333333333333333
anime,shinigam124,RT kiyoesans cuckooanime Episode 1 preview screenshots,en,2022-04-14,"Barcelona, España",['cuckoo_anime'],neutral,0.0,3.0,0.0
anime,DarkFlame94,RT AoTWiki 9 Years AgoArmored Titan Anime Debut,en,2022-04-14,minnesota,[],neutral,0.0,202.0,0.0
anime,lithyenne,RT whatcler people will call anime weird then watch 27 year olds play highschoolers on netflix,en,2022-04-14,blm ,[],negative,0.0,34364.0,-0.5
anime,Jj42977016,RT YakuzaDaddy Time for Daddys NFTGiveaways 5 WL Spots for this dope Anime inspired project TokyoCloneNFT TO ENTER1 Follow Yak,en,2022-04-14,,['NFTGiveaways'],neutral,0.0,730.0,0.0
anime,nanchang000001,RT HokeHustles Isekai WL Spots GiveawayVery bullish on Isekai massive anime project w great artYou dont want to miss this one,en,2022-04-14,,[],positive,0.0,11589.0,0.3333333333333333
anime,teeterontweeter,ihrtei I heard spy x family is really good its everywhere right now but an anime movie I highly recommend if your in the I wanna watch anime romance anime thats really wholesome mood would be Josee the tiger and the fish,en,2022-04-14,,[],positive,0.0,0.0,0.3489285714285714
anime,rileyscott64,Listening to anime ops while making spreadsheets so I feel like the protagonist of my engineering firm,en,2022-04-14,,[],negative,0.0,0.0,-0.2
anime,umarfaroukosu,RT VisualAnimes One of the biggest anime glow ups,en,2022-04-14,Mermaid aqua,[],neutral,0.0,744.0,0.0
anime,moenchii,JackaryDraws If I compare your art to others who draw in a similar style it is definitely the faces Yours look more anime like bigger eyes etc compared to othersI really like that,en,2022-04-14,Deutschland,[],positive,0.0,0.0,0.1399999999999999
anime,dazzle_aria,RT novabrush Fam I did it I have finished my Vtuber Live2DModel Now I just gotta figure out this rigging and animating stuff in Li,en,2022-04-14,The Human World,"['Vtuber', 'Live2DModel', 'rigging', 'animating', 'Li']",neutral,0.0,54.0,0.0
anime,llinglinggz,RT whatcler people will call anime weird then watch 27 year olds play highschoolers on netflix,en,2022-04-14,"Otara, Auckland",[],negative,0.0,34626.0,-0.5
anime,emerazu,Sweeter than vanilla nekopara vanilla anime art,en,2022-04-14,,"['nekopara', 'vanilla', 'anime', 'art']",neutral,0.0,0.0,0.0
anime,Libiomienano,EinsteinYipie THINGnft zyclw yutiancoin I like this painting style very much like my childhood anime godbin12345 supreme1111Kazehayashinji,en,2022-04-14,Pucallpa,[],positive,0.0,0.0,0.26
anime,mactakamii,RT lilangrygirll the constant battle between wanting to play video games watch anime amp read manga all at the same time is slowly killing,en,2022-04-14,18 she/they,[],negative,0.0,14.0,-0.1
anime,KyoraBolena,RT ulinagia Here casually thinking how the ONLY time InuYasha says his own name is in episode 147 of the anime,en,2022-04-14,,[],positive,0.0,44.0,0.0333333333333332
anime,ShinRaMusou,RT ShonenFeeling Anime Hunter x Hunter,en,2022-04-14,,[],neutral,0.0,1079.0,0.0
anime,officialpakoo,RT tripleacshion Hi please this may not be anime related but take time to watch this video and read the article check replies I just,en,2022-04-14,genderfluid. fil / jp.,[],neutral,0.0,9.0,0.0
anime,thaynolung,RT HokeHustles Isekai WL Spots GiveawayVery bullish on Isekai massive anime project w great artYou dont want to miss this one,en,2022-04-14,NY,[],positive,0.0,11595.0,0.3333333333333333
anime,bronto_biru,RT NoriShips Early mornings jeankasa anime AttackOnTitan,en,2022-04-14,Earth,"['jeankasa', 'anime', '進撃の巨人', 'AttackOnTitan']",positive,0.0,287.0,0.1
anime,CUMSlPPER,jaemorphic cardcaptor sakuradnangelfull moon wo sagashitetsubasa reservoir chronicle xxxholicyumeiro patissiere shugo charasuper galsprincess tututhis is all just shit i watch i have a super specific taste in anime,en,2022-04-14,19 • she/zee • 🇵🇸 • autistic,[],positive,0.0,0.0,0.1633333333333333
anime,pristina_astera,RT fae2002 Hi PortfolioDay I just turned 20 yesterday and I love illustrating animeinspired portraits,en,2022-04-14, 🇪🇺 | she/her | 🏳️‍🌈 | 25↑,['PortfolioDay'],positive,0.0,2.0,0.5
anime,Jhazzhands,RT Pattiethecake Anime boobs or anime thighs Which pillow do you want,en,2022-04-14,Styx,[],neutral,0.0,200.0,0.0
anime,LostScarf,RT whatcler people will call anime weird then watch 27 year olds play highschoolers on netflix,en,2022-04-14,www.twitch.tv/LostScarf,[],negative,0.0,35874.0,-0.5
anime,JohnSanchess,RT SeinenVibes Anime Tokyo Ghoul,en,2022-04-14,,[],neutral,0.0,171.0,0.0
anime,jeonjjkjeykey,RT Rm5aled Anime Spy x Family,en,2022-04-14,"Cikarang, Indonesia",[],neutral,0.0,79.0,0.0
anime,GreedYaoTTV,RT sharanicolelynn 1 I am a person lmfao Black people will stay voicing in anime whether you like it or not 2 Yall can go and blo,en,2022-04-14,South East London,[],negative,0.0,1320.0,-0.2083333333333333
anime,notPotatoe_,RT MishaaBear I was blessed with drawing this cutie for a commission hope you will like her too mumei hololive fanart anime an,en,2022-04-14,Poland,"['mumei', 'hololive', 'fanart', 'anime', 'an']",neutral,0.0,12.0,0.0
anime,HoinRikka,RT AnyTube21 Special illustrations that will be given as purchase benefits of the BlurayDVD volumes of the anime Kunoichi Tsubaki no M,en,2022-04-14,,[],positive,0.0,17.0,0.3571428571428571
anime,miguel730302,RT AnimesFeeIings Anime Spy x Family,en,2022-04-14,"Monterrey, Nuevo León",[],neutral,0.0,556.0,0.0
anime,alXtrathicc,RT HardDriveMag Anime Fan Can Speak Fluent Japanese as Long as Conversation Exclusively Involves the Lyrics to the Hunter x Hunter Them,en,2022-04-14,Virginia somewhere ,[],negative,0.0,206.0,-0.025
