Keyword,User,Tweet,Language,Time,User Location,Hashtag,Polarity,Likes,Retweet,Sentiment
anime,_Glanzx,RT JPPorunarefuu Yay Finally finished it RTs are much appreciated JoJosBizarreAdventure jojoanime jojo,en,2022-04-14,,"['JoJosBizarreAdventure', 'jojo_anime', 'jojo']",positive,0.0,5.0,0.1
anime,Panzery25,CJAYCEART Very Good anime dogs,en,2022-04-14,Indonesialand,[],positive,0.0,0.0,0.91
anime,hahahanubayan,RT drunft If you know me you know I love anime so its no surprise kosekaiNFT stood out to me The resolution and attention to det,en,2022-04-14,,[],positive,0.0,1130.0,0.5
anime,Lile1_,RT mimsy actual anime gf,en,2022-04-14,,[],neutral,0.0,2837.0,0.0
anime,aureasmortem,RT fruityjmsz Anime Hunter X Hunter,en,2022-04-14,Night City,[],neutral,0.0,1509.0,0.0
anime,Animemes_san,Gender equality fanservicePost animemes animememes memes anime,en,2022-04-14,,"['animemes', 'animememes', 'memes', 'anime']",neutral,0.0,0.0,0.0
anime,MRiderKenneth,RT RiceDigital Yarrgh anime,en,2022-04-14,,['anime'],neutral,0.0,6.0,0.0
anime,twentyjune_____,RT yoshinorihourly a real life anime characterYOSHI,en,2022-04-14,,"['YOSHI', '요시', 'ヨシ', '트레저']",positive,0.0,865.0,0.2
anime,nerdgasm24,Forever my anime bae ItsCherryBanks MyFreeCams sublife,en,2022-04-14,"Springfield, MA",['sublife'],neutral,0.0,0.0,0.0
anime,seleniasollan,RT VisualAnimes One of the biggest anime glow ups,en,2022-04-14,,[],neutral,0.0,1297.0,0.0
anime,PorgySalema2,RT samonata Everyones fav trio ngl souleater anime,en,2022-04-14,,"['souleater', 'anime']",neutral,0.0,8.0,0.0
anime,sugardaddy6912,w3sbians zyiirx Why would they exactly Just because you like anime people that look similar to a child doesnt mean you instantly like children,en,2022-04-14,,[],negative,0.0,0.0,-0.015625
anime,Z38Daniel,RT WaifuVato Alice Anime Food Wars,en,2022-04-14,,[],neutral,0.0,78.0,0.0
anime,nrwd24,RT whatcler people will call anime weird then watch 27 year olds play highschoolers on netflix,en,2022-04-14,,[],negative,0.0,34117.0,-0.5
anime,AnimatorsPal,RT Habibie2019 Coinwexchange My answer GalaxyHeroesGHCGalaxy Heroes could be the first film project on the blockchain producing live,en,2022-04-14,Berlin,['film'],positive,0.0,1.0,0.25
anime,im_ursa_major,RogueHimself omgRainMan verified top 10 anime crossovers,en,2022-04-14,New Hampshire,[],positive,0.0,0.0,0.5
anime,46610B,RT GhibliAccount Anime Howls Moving Castle,en,2022-04-14,,[],neutral,0.0,45.0,0.0
anime,floorthefloor,Why does every revale mv make me wish there were an actual anime for this,en,2022-04-14,interests: ur mom,[],neutral,0.0,0.0,0.0
anime,yuhboiJC,AnimeMemeNFT WHAAAAAAAA I love this style I cant wait to see the pfp project also that sounds like so much fun working in anime studio,en,2022-04-14,Blockchain,[],positive,0.0,0.0,0.4625
anime,floorthefloor,id choose anime adaption based on by no doubt over Idolish7 the anime any time of the day no cap Im just being real here come on now,en,2022-04-14,interests: ur mom,[],positive,0.0,0.0,0.2
anime,abstractnilah,Anime dad of the year,en,2022-04-14,kwangya,[],neutral,0.0,0.0,0.0
anime,Astro_Cyclops,RT Crunchyroll FEATURE 8 Of The Best Funimation Fantasy Anime Now On CrunchyrollMORE,en,2022-04-14,Simpville,[],positive,0.0,4.0,1.0
anime,bigwin1_0xchita,RT LeekyNFT Minting now Only 007 ethAnime lovers come to Join The Discord NFT O,en,2022-04-14,"Jawa Tengah, Indonesia","['NFT', 'O']",neutral,0.0,1787.0,0.0
anime,24iX4,RT Nicchiban Reminder that Interspecies Reviewers anime has no business being as good as it isGo watch it now thank,en,2022-04-14,,[],positive,0.0,36.0,0.7
anime,KawaiiMangakaXD,Look Beelzebub is a funny action anime but im not crying this time sobs I JUST GOT A FLU,en,2022-04-14,,[],positive,0.0,0.0,0.1687499999999999
anime,ss_121204,RT animesvisuaI Anime Your Name,en,2022-04-14,,[],neutral,0.0,8267.0,0.0
anime,who_s_candice,RT visuaIanimes Anime Given,en,2022-04-14,"Amadora, Portugal",[],neutral,0.0,334.0,0.0
anime,princesstiyya,RT visuaIanimes Anime Given,en,2022-04-14,"Johor Bahru, Johor",[],neutral,0.0,334.0,0.0
anime,PRINCEMASE1,RT whatcler people will call anime weird then watch 27 year olds play highschoolers on netflix,en,2022-04-14,Planet Earth,[],negative,0.0,35752.0,-0.5
anime,Yejispigtails1x,RT EGIRLYUN4 yuna looks like a living anime character,en,2022-04-14,,[],neutral,0.0,291.0,0.0
anime,bakanekofr,Light Fairytale Episode 1 is now available to preorder on NintendoSwitch in EuropeLink Coming to the US in just a few hoursJRPG Anime indiegame madewithunity gaming,en,2022-04-14,France,"['NintendoSwitch', 'JRPG', 'Anime', 'indiegame', 'madewithunity', 'gaming']",positive,0.0,0.0,0.2166666666666666
anime,grungroses,RT VisuaIsAnimes Anime Howls Moving Castle,en,2022-04-14,📍letras - uff ,[],neutral,0.0,13.0,0.0
anime,anime_gabriela,RT mbmpostcom MBMPOST X Lonely Legends WL x 31Follow lonelylegendnftMBMPOSTCOM2Like amp RT3Tag your friends Join Disco,en,2022-04-14,,[],negative,0.0,34131.0,-0.0999999999999999
anime,Rockyyy_178,RT Missfelder Giving Away 10 WL Spots Meet the ShurikenChiksIf youre looking for an anime project watch out To Enter,en,2022-04-14,"Usa-shi, Oita",[],neutral,0.0,123.0,0.0
anime,IsnAkira,Obviously there are unpredictable anime plots or stories in general though,en,2022-04-14,Trovotopia,[],negative,0.0,0.0,-0.0388888888888888
anime,jisho_oji,RT yoshinorihourly a real life anime characterYOSHI,en,2022-04-14,𝙱𝙱 𝚌𝚘𝚖𝚎𝚋𝚊𝚌𝚔💎,"['YOSHI', '요시', 'ヨシ', '트레저']",positive,0.0,744.0,0.2
anime,ArtLeftist,Thomaserail DylanBurns1776 saying someone looks stupid is not a dunk especially when u have an anime PFP jesuschrist at least post face if ur gonna mock others appearances,en,2022-04-14,"Washington, USA",[],negative,0.0,0.0,-0.3666666666666666
anime,lilmalim,RT HxHPictures Anime Hunter x Hunter,en,2022-04-14,,[],neutral,0.0,40.0,0.0
anime,MohsinHadish,RT AllVibeAnime One of the biggest anime glow ups,en,2022-04-14,,[],neutral,0.0,24956.0,0.0
anime,dmplngxz,RT waydropsbangers while i must admit the build up for it was painstaking the chimera ant arc is still one of the most well executed arc,en,2022-04-14,bellissima ^ 19,[],positive,0.0,38.0,0.5
anime,biahssss,RT VisuaIsAnimes Anime Howls Moving Castle,en,2022-04-14,"Marabá, Brasil",[],neutral,0.0,181.0,0.0
anime,yuinae_,relionwastaken am i anime girl im asian,en,2022-04-14,spam : @yuinae_lol,[],neutral,0.0,0.0,0.0
anime,Shizukuvale,RT AoTWiki 9 Years AgoArmored Titan Anime Debut,en,2022-04-14,no #'s,[],neutral,0.0,610.0,0.0
anime,ireene_mv,RT animesvisuaI Anime Your Name,en,2022-04-14,,[],neutral,0.0,8169.0,0.0
anime,Shiburito,RT Nicchiban Reminder that Interspecies Reviewers anime has no business being as good as it isGo watch it now thank,en,2022-04-14,Poland,[],positive,0.0,35.0,0.7
anime,0nim3lali,RT AnimesColorfuI Anime Your Name,en,2022-04-14,,[],neutral,0.0,113.0,0.0
anime,3161127_bp,RT ShonensPicture Anime Attack on Titan,en,2022-04-14,"Manila, AR",[],neutral,0.0,593.0,0.0
anime,1kimchii,rymexin hi po my commissions are open for semirealism anime chibis and emotes feel free to dm me if youre interested lt33,en,2022-04-14,🇵🇭,[],positive,0.0,0.0,0.2166666666666666
anime,ThatFlareon,RT ChipsnCookies 414nbrFrom left to right PLA Pokemas Spe anime amp BW Ingo,en,2022-04-14,it/they/eve/void,['4月14日はnbrを描こう'],positive,0.0,55.0,0.1785714285714285
anime,maris2ndwife,RT VisualAnimes One of the biggest anime glow ups,en,2022-04-14,he/her🏳️‍🌈,[],neutral,0.0,1296.0,0.0
anime,xuanphuner,RT HokeHustles Isekai WL Spots GiveawayVery bullish on Isekai massive anime project w great artYou dont want to miss this one,en,2022-04-14,,[],positive,0.0,11595.0,0.3333333333333333
anime,Raven_Lou_Demon,RT SakuraRoiyaru Hello everyone Im a dreamy german artist who loves to create colorful drawings of her OCs and favorite characters,en,2022-04-14,,[],positive,0.0,5.0,0.2666666666666666
anime,RomualdCedr,RT SeinenVibes Anime Tokyo Ghoul,en,2022-04-14,Côte d'Ivoire et le monde ,[],neutral,0.0,130.0,0.0
anime,jialmjghty,RT drunft If you know me you know I love anime so its no surprise kosekaiNFT stood out to me The resolution and attention to det,en,2022-04-14,sjy & kmg,[],positive,0.0,1049.0,0.5
anime,guillen95_J,RT GhibliAccount Anime Howls Moving Castle,en,2022-04-14,"Barcelona, España",[],neutral,0.0,283.0,0.0
anime,A_MAN_IN_YELL0W,RT EvanPlatinum Reminder all of this blather is because they dont want anime avatars hurling slurs at them on the bird app without gett,en,2022-04-14,,[],neutral,0.0,4.0,0.0
anime,seesyra,im gonna lose my shit an anime Im watching just updated Im gonna be out for awhile,en,2022-04-14,she/her. 17. fil/en. ,[],negative,0.0,0.0,-0.2
anime,PPixelfun,tachibana923613 Gift for you pixelfun bleach Only made with Bleach anime charactersRT is cool a follow is appreciated If u dont like this gt tell me gt i delete,en,2022-04-14,,"['pixelfun', 'bleach']",positive,0.0,0.0,0.40323486328125
anime,melinac_30,RT visuaIanimes Anime Given,en,2022-04-14,"she/her, esp/eng/fr",[],neutral,0.0,570.0,0.0
anime,sleepy_fluf,RT L0VEY0UH3ART Anime techno when technofanart technobladefanart,en,2022-04-14,tell your mom i said hi,"['technofanart', 'technobladefanart']",neutral,0.0,16.0,0.0
anime,cnetoin,RT Anime Hmm Spy x Family,en,2022-04-14,Colombo/PR - Brasil,[],neutral,0.0,4.0,0.0
anime,meiliondream,RT VisuaIsAnimes Anime Howls Moving Castle,en,2022-04-14,19 | she/her,[],neutral,0.0,344.0,0.0
anime,CureJikan,RT sharanicolelynn 1 I am a person lmfao Black people will stay voicing in anime whether you like it or not 2 Yall can go and blo,en,2022-04-14,Daia's World ,[],negative,0.0,884.0,-0.2083333333333333
anime,panstapatsa,kingjinwoo One of the few anime collabs i saw that look clean as hellbesides gojo but who cares about that dude,en,2022-04-14,,[],positive,0.0,0.0,0.0833333333333333
anime,Dewschu2,jjk 0 is easily one of the best anime adaptations ever made,en,2022-04-14,Harrisburg,[],positive,0.0,0.0,0.7166666666666667
anime,daybysunlight,RT teumeunion One pieceits the anime I love I saw it from EP 1 Ive been rewatching it with Asahi Hyung My favorite scene was wh,en,2022-04-14,🤍,[],positive,0.0,122.0,0.5
anime,Yeridoublel,LUNAA444 This is your anime training arc,en,2022-04-14,,[],neutral,0.0,0.0,0.0
anime,cheep_hardware,RT maxcapacity Check out my buddy neonphomes new work on objktcom Pats also one of The TV People You may remember our animethem,en,2022-04-14,Northern California,[],positive,0.0,3.0,0.1704545454545454
anime,A_L_I_E_N_xdxd,RT TodayJojo April 13 2019 JoJos Bizarre Adventure Golden Wind Anime Episode 26 A Little Story From the Past My Name Is Doppio,en,2022-04-14,Argentina,[],positive,0.0,116.0,0.0656249999999999
anime,itspacarjunkyu,RT teumeunion One pieceits the anime I love I saw it from EP 1 Ive been rewatching it with Asahi Hyung My favorite scene was wh,en,2022-04-14,acc only hype trejo,[],positive,0.0,122.0,0.5
anime,ZMalholtral,RT lMLEXl2LEGIT Looking for a boyfriend that loves anime and Pokmon,en,2022-04-14,"Dallas, TX",[],neutral,0.0,1665.0,0.0
anime,airymonettt,RT HxHContents AnimeHunter x Hunter,en,2022-04-14,ur heart,[],neutral,0.0,1749.0,0.0
anime,theobservant1my,RT nichosheen Shikimoris Not Just a Cutie episode 1 was pretty wholesome The animation on the eyes are so good If you want to watch a,en,2022-04-14,,[],positive,0.0,13.0,0.475
anime,IanKong5,1 Zeno Robinson is one of my favorite black VA who voice bunch of animes video games and animation Zeno has voiced some white skin anime characters just name a few like Hawks from My hero academiaGenya from Demon slayer and Vanitas from the case study of vanitas,en,2022-04-14,,[],positive,0.0,0.0,0.0333333333333333
anime,teaofeelea,RT 90sVisuaI Anime Bio Hunter,en,2022-04-14,,[],neutral,0.0,60.0,0.0
anime,Marlonqb16,anime kdrama aaaaa the vibe,en,2022-04-14,,[],neutral,0.0,0.0,0.0
anime,datboy_isiah,RT AoTJewels Anime Attack on Titan,en,2022-04-14,,[],neutral,0.0,3123.0,0.0
anime,Animosus69,RT ShonenFeeling Anime Hunter x Hunter,en,2022-04-14,"New York, NY",[],neutral,0.0,2297.0,0.0
anime,RadioTria,RT onepiecedaiIys Anime One Piece,en,2022-04-14,"Tampere, Finland",[],neutral,0.0,1016.0,0.0
anime,sainttillwoledo,RT phnixhamsta Minecraft is now an anime,en,2022-04-14,IM IN YOUR AREA,[],neutral,0.0,72.0,0.0
anime,03d0l3nZQcar2L5,RT GrIdolArchivist America I won the warJapan I will have my sweet revenge YOU WILL SUBMIT TO US WE WILL GIVE YOU ANIME AND GRAVURE I,en,2022-04-14,,[],positive,0.0,4.0,0.35
anime,Thedeerlesbian,RT moonsuki Im only getting started izuku deku izukumidoriya dekufanart bnha bnhafanart myart anime,en,2022-04-14,She / He / Fawn / Love,"['izuku', 'deku', 'izukumidoriya', 'dekufanart', 'bnha', 'bnhafanart', 'myart', 'anime']",neutral,0.0,9.0,0.0
anime,zoed2705,If you dont care about shounen you just dont get to participate in anime discussionIs Naruto or one piece better Idk i dont fucking care Im too busy with romcoms and villainess manga,en,2022-04-14,Jamaica/Hot Homophobic Hell,[],positive,0.0,0.0,9.251858538542969e-18
anime,KaylaWayla20,Anyway its her favorite anime now,en,2022-04-14,United States,[],positive,0.0,0.0,0.5
anime,terezana95,RT ulinagia Here casually thinking how the ONLY time InuYasha says his own name is in episode 147 of the anime,en,2022-04-14,,[],positive,0.0,50.0,0.0333333333333332
anime,airymonettt,RT HxHContents AnimeHunter x Hunter,en,2022-04-14,ur heart,[],neutral,0.0,33.0,0.0
anime,_bigwinseb,RT LeekyNFT Minting now Only 007 ethAnime lovers come to Join The Discord NFT O,en,2022-04-14,"young, dumb, and broke ","['NFT', 'O']",neutral,0.0,2207.0,0.0
anime,vKiIIzone,RT visuaIanimes Anime Given,en,2022-04-14,Asia,[],neutral,0.0,98.0,0.0
anime,reignchoi0405,RT teumeunion One pieceits the anime I love I saw it from EP 1 Ive been rewatching it with Asahi Hyung My favorite scene was wh,en,2022-04-14,"Teuland, South Korea",[],positive,0.0,180.0,0.5
anime,JoseBedollaRam1,RT AvaBambyTV Do you like girls who like anime and gaming,en,2022-04-14,,[],neutral,0.0,380.0,0.0
anime,tale_of_arcane,RT 90sVisuaI Anime Bio Hunter,en,2022-04-14,,[],neutral,0.0,60.0,0.0
anime,a_f_uk,RT whichteamapp What NFT PFP manga art you like better AzukiOfficial divineanarchy MuriNFT projectPXNOther comment down,en,2022-04-14,,['NFT'],positive,0.0,16.0,0.0731481481481481
anime,serialsimper,RT MetaComiClub New Sneakpeek amp tag friends if you enjoy it Can you recognize these charactersDont forget to send itweetproo,en,2022-04-14,she/her ,[],positive,0.0,752.0,0.4
anime,JyuuHachi_18_,RT Wictor2501 Gm anime twt,en,2022-04-14,,[],neutral,0.0,18.0,0.0
anime,mikeysavge,RT AoTWiki 9 Years AgoArmored Titan Anime Debut,en,2022-04-14,"Seattle, WA",[],neutral,0.0,43.0,0.0
anime,DhavernasM,RT mimsy actual anime gf,en,2022-04-14,🔺,[],neutral,0.0,2577.0,0.0
anime,aZixy42T7SZvl7f,RT WaifuAnimeMan Ako Anime And You Thought There Is Never a Girl Online,en,2022-04-14,,[],neutral,0.0,66.0,0.0
anime,sakureis,hyakuraii feels bad when theyve only seen badly produced live action anime films 25d saikouuuu,en,2022-04-14,pls read carrd byf! :),[],negative,0.0,0.0,-0.2327272727272726
anime,tanyingzhan,RT KimetsuVibings Anime Demon Slayer,en,2022-04-14,,[],neutral,0.0,5.0,0.0
anime,bleakvalue4,RT cidrawdes1 Luffy 5th gear coming at you hope you like it gear5 luffygear5 ONEPIECE1046 luffy ONEPIECESPOILERS anime fanart,en,2022-04-14,Frankfort,"['gear5', 'luffygear5', 'ONEPIECE1046', 'luffy', 'ONEPIECESPOILERS', 'anime', 'fanart']",positive,0.0,1746.0,0.5
anime,Cxiaoamore,RT JJBAVD New Stone Ocean Anime Art Collab with EnskyArtist Unknown,en,2022-04-14,สติมาปัญญาอ่อน,[],positive,0.0,164.0,0.0181818181818181
anime,3_bro0,RT layma555 Hello guys I just brought you one of the best projectJoin thesushicatsnft today and get your whitelist to access the FREE,en,2022-04-14,,[],positive,0.0,1.0,1.0
anime,yeagahsan,RT Staticfeels I tried EM royalty AUErenJaeger MikasaAckerman fanart ArtistOnTwitter anime anitwt Manga aot snk https,en,2022-04-14,He/Him,"['ErenJaeger', 'MikasaAckerman', 'fanart', 'ArtistOnTwitter', 'anime', 'anitwt', 'Manga', 'aot', 'snk']",neutral,0.0,19.0,0.0
anime,_dutchzz,what your favourite anime and why,en,2022-04-14,+60,[],neutral,0.0,0.0,0.0
anime,animelizm,RT animeyoko RPG Fudousan นักเวทสาวนายหน้าอสังหาริมทรัพย์ ตอนที่ ซับไทยอนิมะ ดูอนิมะ อนิมะซับไทย อนิมะพ,th,2022-04-14,,"['อน', 'ด', 'อน', 'อน']",,0.0,1.0,0.0
anime,Noktifer,Please Elon buy the fuck out of Twitter Make the anime avatars seethe,en,2022-04-14,,[],negative,0.0,0.0,-0.4
anime,OkekeCy39252391,RT KarumaPalace Karuma is an anime NFT Community that supports GameFi Developers Artists amp FilmTV MusiciansThe Karuma NFTs are Yiel,en,2022-04-14,,[],neutral,0.0,3.0,0.0
anime,ko_Gatsheni,RT MaryAnnNkoana Enjoy some of your favourite anime soundtracks,en,2022-04-14,"Durban, South Africa",[],positive,0.0,10.0,0.4
anime,Deserve2022_,RT LeekyNFT Minting now Only 007 ethAnime lovers come to Join The Discord NFT O,en,2022-04-14,Republic of the Philippines,"['NFT', 'O']",neutral,0.0,2028.0,0.0
anime,Dracopein,RT whatcler people will call anime weird then watch 27 year olds play highschoolers on netflix,en,2022-04-14,Olympus,[],negative,0.0,34626.0,-0.5
anime,ICYYTOGOATED,RT HxHPictures Anime Hunter x Hunter,en,2022-04-14,,[],neutral,0.0,182.0,0.0
anime,MajinCecelia,RT asimplesugar When a girl says she watches anime theres a 90 chance this is what she means,en,2022-04-14,"Custom, Free Cities | She/Her",[],neutral,0.0,1.0,0.0
anime,ReAnimetron,RT ArefNiazi 6 BIDsBid placed by dear sharafieth thank you very much anime animegirl nft nftcol,en,2022-04-14,Animeland,"['anime', 'animegirl', 'nft', 'nftcol']",positive,0.0,7.0,0.26
anime,cnl_png02,RT FabledDante Its not too late to give up on the idea of creating an official Dream SMP anime A bunch of us got together to create one,en,2022-04-14,,[],negative,0.0,380.0,-0.3
anime,peecum_allergy,RT windbrnexo That whore from dogs anime HIS NAME IS DAZAI,en,2022-04-14,she/her,[],neutral,0.0,1.0,0.0
anime,Chew_Watt,RT TheNewSign Marcosatsu I swear its just like Live Action anime,en,2022-04-14,Earth,[],positive,0.0,7.0,0.1181818181818181
anime,AprilBigWin26,RT LeekyNFT Minting now Only 007 ethAnime lovers come to Join The Discord NFT O,en,2022-04-14,,"['NFT', 'O']",neutral,0.0,1166.0,0.0
anime,kohanatwt,tweetberry4 I honestly feel like were in a highstakes countdown in an anime trying to avoid the Bad Future Its not exciting its just scary,en,2022-04-14,mikrokosmos,[],negative,0.0,0.0,-0.1499999999999999
anime,portia_bartel,RT PixieInktvis Hey PortfolioDay Im Bene most here call me Pixie and lately Ive been drawing a lot of FF14 FFXIV 90s inspired a,en,2022-04-14,"Austin, TX","['PortfolioDay', 'FF14', 'FFXIV']",positive,0.0,97.0,0.1
anime,Wadaa2x,RT HxHContents AnimeHunter x Hunter,en,2022-04-14,inBEBEmouth 👅☁️🌈,[],neutral,0.0,66.0,0.0
anime,yournamebyname,RT shonensources Anime Demon Slayer,en,2022-04-14,,[],neutral,0.0,52.0,0.0
anime,Chriz_000,TheSliceofAnime Ayo Slice of anime replied to me its such an honor,en,2022-04-14,𝐶𝑊: 𝑆𝑒𝑎𝑠𝑜𝑛𝑎𝑙𝑠,[],neutral,0.0,0.0,0.0
anime,tamaharuchan,SajedeL1485 Haikyuu is one of my sports anime Diamond No Ace is the other one,en,2022-04-14,malayxiah home sweet home,[],negative,0.0,0.0,-0.125
anime,ss_121204,RT GhibliAccount Anime Spirited Away,en,2022-04-14,,[],positive,0.0,2675.0,0.5
anime,FedRiz1997,People wouldnt complain about localisation if the people in charge of it wouldnt use it to push their political agendaSure some Anime revolve around political related themes but one thing is if its those are part of the story its something else SHOVING it just to be WOKE,en,2022-04-14,Italy,[],positive,0.0,0.0,0.125
anime,SUPERIORAFA,RT HxHPictures Anime Hunter x Hunter,en,2022-04-14,mental hospital,[],neutral,0.0,4193.0,0.0
anime,_machima,slutforrevy Aaaaa this was my fave romance anime for a long time I miss ao haru ride,en,2022-04-14,20↑ • ar55 • childe main,[],negative,0.0,0.0,-0.078125
anime,mochigf,RT visuaIanimes Anime Given,en,2022-04-14,i love you mostest 🕯,[],neutral,0.0,98.0,0.0
anime,CPU_Saiyan,RT wasabiilemon Words cannot express how heartwarming this anime makes me feel,en,2022-04-14,Big Gammer moment bro,[],neutral,0.0,1.0,0.0
anime,snmx_i,RT thegoatedshonen Chainsaw Man is the anime that Im most looking forward to,en,2022-04-14,,[],positive,0.0,180.0,0.5
anime,HotSoupyMiku,RT MystiaCeleste I just found out about PortfolioDay Im Mystia I like to draw cute anime girls,en,2022-04-14,Soup,['PortfolioDay'],positive,0.0,12.0,0.5
anime,Sophilautia,I love this anime,en,2022-04-14,"Victoria, Australia",[],positive,0.0,0.0,0.5
anime,JKDesignsStore,RT ddckaylee Anime inspired jewelry for your favorite otakuTake 20 off your entire purchase thru 430 no coupon code needed 22 sa,en,2022-04-14,,[],positive,0.0,13.0,0.3125
anime,HandsHimbo,RT TheNewSign Marcosatsu I swear its just like Live Action anime,en,2022-04-14,,[],positive,0.0,6.0,0.1181818181818181
anime,iam_DlANAH,RT SarimaB Lets forget Burnaboy Wizkid Rema Rihanna amp Beyonce I want an anime boyfriend to watch Netflix with amp play with my Pokmon h,en,2022-04-14,,[],neutral,0.0,64.0,0.0
anime,woonbigwiin,no I mean I feel like I heard that before kinda like dejavu but Im 100 sure it was my first time watching the anime,en,2022-04-14,she/her ,[],positive,0.0,0.0,0.3020833333333333
anime,SpiderMashi,RT teumeunion One pieceits the anime I love I saw it from EP 1 Ive been rewatching it with Asahi Hyung My favorite scene was wh,en,2022-04-14,she/they! ‹𝟹 ( rcbyf ),[],positive,0.0,122.0,0.5
anime,PRODVISAHI,RT SOULMATESJlKYU Harutos Top 3 cherished items from his childhood1 Play station2 Anime One Piece3 Snack churros treasure,en,2022-04-14,she/her (slow) busy 📚 ,[],positive,0.0,22.0,0.5
anime,missufetestixy,RT LeekyNFT Minting now Only 007 ethAnime lovers come to Join The Discord NFT O,en,2022-04-14,,"['NFT', 'O']",neutral,0.0,1310.0,0.0
anime,Q4YAZS,hihimytulip movie or anime,en,2022-04-14,,[],neutral,0.0,0.0,0.0
anime,MigueLino88,RT dragonballsuper NEWS Dragon Ball Symphonic Adventure Concert Makes US Debut This MayRead more,en,2022-04-14,Mexico DF,[],positive,0.0,88.0,0.5
anime,ndzhfnzri,RT VisualAnimes One of the biggest anime glow ups,en,2022-04-14,putra heights ,[],neutral,0.0,766.0,0.0
anime,MxntStudio,RT wnd55 Say Cheese Collection5 girls leftSold out 106111Price 00375 ETH Polygon Available now on opensea https,en,2022-04-14,Thailand,[],positive,0.0,32.0,0.4
anime,twtmonii29,RT teumeunion One pieceits the anime I love I saw it from EP 1 Ive been rewatching it with Asahi Hyung My favorite scene was wh,en,2022-04-14,Treasure Planet 🌟💎,[],positive,0.0,122.0,0.5
anime,AksharJain,The love for OP1 has decreased for me now dunno why it was my top 1 anime openingDoesnt hit the same way it did during my first watchBut stillGuren no YumiyaThe RumblingShinzou wo SasageyoRed SwanMy WarJiyuu no TsubasaShoukei to Shikabane no Michi,en,2022-04-14,"Delhi, India",[],positive,0.0,0.0,0.1416666666666666
anime,artemsxiyue,RT Based5656 Spy x Family getting an anime adaptation was a mistake i hate anime fans,en,2022-04-14,she/they | 18+,[],negative,0.0,1808.0,-0.8
anime,Spooderman6996,RT calicaeth A thread on metakages and why I think its a sleeper among recent animerelated NFT mints The following will cover the art,en,2022-04-14,,[],neutral,0.0,196.0,0.0
anime,artmospherc,RT anihusband Anime Number 24,en,2022-04-14,he / him • (eng/spa)  +21 ,[],neutral,0.0,19.0,0.0
anime,KumarNinya,RT 4ul0sR4ZR 2nd Goood Anime Meme and for the 2nd time the punchline aint pornLook at the sushi shoesNo improvements needed,en,2022-04-14,"Noida, India",[],neutral,0.0,2.0,0.0
anime,Pie31105109,henokcrypto shunainuverse 100x 5 Eth reflections shunainuverse ShunaV2 shunaarmy nft anime eth metaverse animenfts shunainuverse,en,2022-04-14,,"['Eth', 'shunainuverse', 'ShunaV2', 'shunaarmy', 'nft', 'anime', 'eth', 'metaverse', 'animenfts']",neutral,0.0,0.0,0.0
anime,BerkleyBearNews,Dragon Ball Super Super Hero Film Rescheduled to June 11 After Toei Animation Hack Anime,en,2022-04-14,Doghouse,['Anime'],positive,0.0,0.0,0.3333333333333333
anime,WaifuAnimeMan,RT Lokokabooster2 Ireeny Anime The Greatest Demon Lord Is Reborn as a Typical Nobody,en,2022-04-14,,[],positive,0.0,69.0,0.4166666666666667
anime,hoanghautran,RT HokeHustles Isekai WL Spots GiveawayVery bullish on Isekai massive anime project w great artYou dont want to miss this one,en,2022-04-14,,[],positive,0.0,11595.0,0.3333333333333333
anime,yibo_w0805,RT onepiecedaiIys Anime One Piece,en,2022-04-14,,[],neutral,0.0,1382.0,0.0
anime,dwibigwins,RT LeekyNFT Minting now Only 007 ethAnime lovers come to Join The Discord NFT O,en,2022-04-14,,"['NFT', 'O']",neutral,0.0,2207.0,0.0
anime,Bonsay_NFT,RT web3sg We are giving out 10 WL spots TONIGHT courtesy of the Galverse team 1 LikeRTFollow web3sg galverseNFT milomonk 2 C,en,2022-04-14,"Abu Dhabi, United Arab Emirate",[],neutral,0.0,1228.0,0.0
anime,hawkshoticus,what anime pfp makes me the most better at rocket league,en,2022-04-14,"Austin, TX",[],positive,0.0,0.0,0.5
anime,WaifuAnimeMan,RT Lokokabooster2 Ireenachan Anime The Greatest Demon Lord Is Reborn as a Typical Nobody,en,2022-04-14,,[],positive,0.0,132.0,0.4166666666666667
anime,Camtamvetren,RT HokeHustles Isekai WL Spots GiveawayVery bullish on Isekai massive anime project w great artYou dont want to miss this one,en,2022-04-14,LA,[],positive,0.0,11528.0,0.3333333333333333
anime,eua_99s,RT JujutsuTwts There are 2 types of anime dads,en,2022-04-14,,[],neutral,0.0,4367.0,0.0
anime,srinesnm,RT VisualAnimes One of the biggest anime glow ups,en,2022-04-14,,[],neutral,0.0,1324.0,0.0
