Keyword,User,Tweet,Language,Time,User Location,Hashtag,Polarity,Likes,Retweet,Sentiment
animation,TalLyeOb,RT celestiictown i had an idea and i had to go through with itwhat if animation magic made a sonic game for the cdi,en,2022-04-21,Some Haunted Closet,[],positive,0.0,1041.0,0.0499999999999999
animation,nitin221203,RT AwanishSharan Make Time For Your Children Before Its Too LateBrilliant animation And a very deep and powerful message,en,2022-04-21,"New Delhi, India",[],positive,0.0,1071.0,0.225
animation,GrayGray871,RT ArknightsEN Arknights Animation PV Near LightThe time has come to remember what justice and honor truly stand forNew Side Sto,en,2022-04-21,,[],positive,0.0,316.0,0.2121212121212121
animation,IronShadowChaos,RT b0tster Made a little animation and integrated them into the start of the race albeit with some missing sound effects,en,2022-04-21,no,[],positive,0.0,61.0,0.0375
animation,CYM_K25,RT sketchshark A lot of important things are being discussed right now and I hope that people still support and watch the shows being put,en,2022-04-21,In HELL,[],positive,0.0,13.0,0.3428571428571428
animation,sagarveer48,RT AwanishSharan Make Time For Your Children Before Its Too LateBrilliant animation And a very deep and powerful message,en,2022-04-21,,[],positive,0.0,533.0,0.225
animation,jakeandhispain,RT CrimsonMayhem Netflix We strive animation to be inspired by The Boss Baby cartoonThe Boss Baby cartoon,en,2022-04-21,your mom,[],neutral,0.0,100.0,0.0
animation,StarConfessor,RT RiseFallNickBck Netflix in the span of like a week went from beloved to public enemy number one in animationIts genuinely impressiv,en,2022-04-21,Invented my own in Tacoma,[],positive,0.0,166.0,0.3666666666666667
animation,n_syohei_3,CoyoteKEMOV Cute Animation,en,2022-04-21,,[],positive,0.0,0.0,0.5
animation,julia_y13,RT RiseFallNickBck Netflix in the span of like a week went from beloved to public enemy number one in animationIts genuinely impressiv,en,2022-04-21,United States,[],positive,0.0,86.0,0.3666666666666667
animation,inti_joshua,RT CNschedules Today in unrelated news Phil Rynda Netflixs Director of Creative Leadership and Development for Original Animation has,en,2022-04-21,España,[],positive,0.0,915.0,0.4375
animation,jmanxxda,fizzbhau YeenieMcbeenie Liveaction skit shows in the 90s were probably easier to finance compared to animation in 2020Manu shows could afford to be on air for so long just to fill in airtime most likely accdg to some,en,2022-04-21,,[],positive,0.0,0.0,0.15
animation,dyn_shii,RT dailymouche scaramouche bird idle animation feels so real to me ill actually cry if it doesnt happen,en,2022-04-21,scara waiting room,[],neutral,0.0,265.0,0.0
animation,Thomas_Astruc,IryPixar Sadly confirms what we were talking about few days ago Animation remains a niche Only projects aiming at kids gather enough audience to be economically interesting Sad sad sad,en,2022-04-21,"Paris, France",[],negative,0.0,0.0,-0.2125
animation,HerrySis,RT catsuka Several Netflix animated projects have been canceled including Jeff Smiths Bone series,en,2022-04-21,Neverland,[],neutral,0.0,18.0,0.0
animation,nonbinary_bf,RT genegoldstein The animation industry in America is in an absolute free fall and I would suggest anybody looking to get their ideas ma,en,2022-04-21,he/they/it + neos,[],positive,0.0,312.0,0.3
animation,zaneasherlycan,The plot of An Earth Immortal Reborn is like a roller coaster of emotion Its riveting and full of surprises sakuga VoxAkuma manhwa animation,en,2022-04-21,,"['sakuga', 'VoxAkuma', 'manhwa', 'animation']",positive,0.0,1.0,0.46875
animation,gvmstix,RT genegoldstein The animation industry in America is in an absolute free fall and I would suggest anybody looking to get their ideas ma,en,2022-04-21,"Dallas, TX",[],positive,0.0,54.0,0.3
animation,By_Colomina,MrFungible I was working on an nft for days and couldnt find something that worked The design was great but animation just didnt make it for me I dropped a smoke video at the wrong place and then I realised the smoke was revealing the design I loved it,en,2022-04-21,"uK, France",[],positive,0.0,0.0,0.3333333333333333
animation,eye_of_m3ss,RT 80Level One more awesome animation by kse332official Other works animation art design,en,2022-04-21,,"['animation', 'art', 'design']",positive,0.0,17.0,0.4583333333333333
animation,kishanreddybjp,On the occasion of 400th Parkash Parv of Guru Tegh Bahadur ji PM Shri narendramodi ji will release a postage stamp amp commemorative coin todayA comic amp animation film for children besides other cultural programmes will be showcased at The Red Fort New Delhi400yearsGuruParv,en,2022-04-21,"Hyderabad, Telangana.",['400yearsGuruParv'],positive,3.0,0.0,0.0722727272727272
animation,akimillustrates,RT celinekim218 As there are very disappointing news about the studio there are still some really great animated series and movies that,en,2022-04-21,"Glendale, CA",[],positive,0.0,14.0,0.01
animation,ThakarTapan,RT AwanishSharan Make Time For Your Children Before Its Too LateBrilliant animation And a very deep and powerful message,en,2022-04-21,"Ahmadabad City, India",[],positive,0.0,811.0,0.225
animation,XlAOCORE,RT dailymouche scaramouche bird idle animation feels so real to me ill actually cry if it doesnt happen,en,2022-04-21,"♡ - 夏彦 ！luke loml
      she/they , asia ar57
      ifb^^ / sb to unf",[],neutral,0.0,95.0,0.0
animation,porn_animation,RT itsdigitaljerry Pay attention Im going to expose the secrets of UI Design The stuff that no one talks about because theyre too sca,en,2022-04-21,,[],neutral,0.0,185.0,0.0
animation,SLAMDUNKASAUR,RT LSMark The nicest character in animation history,en,2022-04-21,"El Paso, TX",[],neutral,0.0,22309.0,0.0
animation,moonandsunfeel,RT TailsAustin9922 Tyson Hesse helped fix the original Sonic Movie Sonic design and has made such great art and animation for the Sonic,en,2022-04-21,Tierra de la libertad,[],positive,0.0,179.0,0.3916666666666666
animation,quirkyweebkun,RT SaveNimona Feeling for everyone over at Netflix Animation right now Yall deserve better than this,en,2022-04-21,In ur mum | 23,[],positive,0.0,528.0,0.3928571428571428
animation,bbabylittlep,RT yzko1130 animation version with new songOUTNOWLaysJoyExchangeppkritt bbillkinbkppfanart,en,2022-04-21,#GOT7FOREVER | 💗 @ppkritt,"['แลกเลยปะOUTNOW', 'LaysJoyExchange', 'ppkritt', 'bbillkin', 'bkppfanart']",positive,0.0,63.0,0.1363636363636363
animation,HussarKapitan,RT RiseFallNickBck Netflix in the span of like a week went from beloved to public enemy number one in animationIts genuinely impressiv,en,2022-04-21,A damp cave,[],positive,0.0,230.0,0.3666666666666667
animation,Black_Mage_Oro,RT thecartooncrave Netflixs upcoming BONE series has been canceled along with other original animated projects,en,2022-04-21,Spice City,[],positive,0.0,1049.0,0.125
animation,kjykjn,RT Rauhlsfictions Yb look gorgeous in animation form too,en,2022-04-21,"BIGBANG, BLACKPINK, SHINee",[],positive,0.0,1.0,0.7
animation,Mereiconoclast,RT BlenderNation Earlier todayChanging directions between multiple Mixamo animation clips in Blender NLA b3d ht,en,2022-04-21,Numeric Trip ,['b3d'],neutral,0.0,7.0,0.0
animation,AestuoM,RT sketchshark A lot of important things are being discussed right now and I hope that people still support and watch the shows being put,en,2022-04-21,"Houston, TX",[],positive,0.0,163.0,0.3428571428571428
animation,polchurgyst,RT Kiecaburn ELDENRING Maliketh The Black Blade Vs Tarnished Animation,en,2022-04-21,California,"['ELDENRING', 'Animation']",negative,0.0,30951.0,-0.1666666666666666
animation,charlieahayes,RT hikariviny Ejem Yeah 3D animation is cool and all butSEGA CAN WE PLEASE HAVE A 2D ANIMATED SERIESI mean just look how good,en,2022-04-21,Australia,[],positive,0.0,309.0,0.0625
animation,Cinesite,E V E N T Join us for an evening of animation networking at our new London Head Office next Friday 29th Apr 58pm amp connect with our teams online Details amp registration here,en,2022-04-21,London | Montreal | Vancouver,[],positive,0.0,0.0,0.0681818181818181
animation,DaisyBarajasVA,RT OnlyShawnReimer Hey Hey Take a listen to my Animation Demo It was a blast to make Ive got a broadcast quality home studio so l,en,2022-04-21,,[],neutral,0.0,10.0,0.0
animation,wardious,RT Kiecaburn ELDENRING Maliketh The Black Blade Vs Tarnished Animation,en,2022-04-21,,"['ELDENRING', 'Animation']",negative,0.0,30929.0,-0.1666666666666666
animation,Emojiboy16,RT thecartooncrave Sony Animations SPIDERMAN ACROSS THE SPIDERVERSE has been delayed to June 2 2023,en,2022-04-21,,[],neutral,0.0,747.0,0.0
animation,jxhnnyleka,RT JaredMorgan I know were all talking about Netflix right now but what I really want to know is when does shudder start its animation,en,2022-04-21,Toronto🇨🇦//22//he/him,[],positive,0.0,3.0,0.2428571428571428
animation,PaulDRamone,RT teeapostrophee Serious question no shade is meant How secure is the animation job industry when I see all my favorite artists cons,en,2022-04-21,United States,[],positive,0.0,248.0,0.1888888888888888
animation,8_bit_satan,RT AwestruckVox netflix after realizing animation costs money,en,2022-04-21,"Jeffersonville, IN",[],neutral,0.0,1313.0,0.0
animation,ArtistRTweeters,RT healymusic New Video Release Short is an animated music video with clay figures moving about the screen while carrying Lincoln Log,en,2022-04-21,USA,[],positive,0.0,2.0,0.0681818181818181
animation,SuperBakedBeans,Its outrageous and perfect for animation,en,2022-04-21,,[],neutral,0.0,0.0,0.0
animation,sailormpqx,RT noeyJ ไม่รู้จะมีประโยชน์ไหม แต่ช่องยูทูปสอนวาดรูปที่เราดูมีประมาณนี้ แล้วเราดูฝึกมาเอง ไม่เคยไปหาที่ติวที่ไหนเลย คือmarco buccii,th,2022-04-21,,[],positive,0.0,3637.0,66.67
animation,jewlry4justice,RT AusElectoralCom JulianHillMP SugaredCriminal Hi Julian that video is indeed more geared towards the House of Representatives than,en,2022-04-21,,[],positive,0.0,1.0,0.5
animation,sournote566,Made a small short of Sour Note OC MLPFiM art animation,en,2022-04-21,"San Antonio, TX","['OC', 'MLPFiM', 'art', 'animation']",negative,0.0,1.0,-0.1458333333333333
animation,MelisaOngMiQin0,RT randomsakuga Animation Movie Atlantis The Lost Empire 2001,en,2022-04-21,,[],neutral,0.0,26.0,0.0
animation,sok_riza,RT ScratchyDerose I find it funny how many are now saying that Disney Seth McFarlane Boss Baby or Cocomelon have ruined Animation forev,en,2022-04-21,,[],positive,0.0,262.0,0.375
animation,gatonecio_,can animation studio execs like shut up for 5 seconds,en,2022-04-21,ur mom,[],neutral,0.0,0.0,0.0
animation,SolomonMuhamm4d,RT thecartooncrave Sony Animations SPIDERMAN ACROSS THE SPIDERVERSE has been delayed to June 2 2023,en,2022-04-21,"Michigan, USA",[],neutral,0.0,574.0,0.0
animation,Tanukitsune,RT RiseFallNickBck Not many more tragic and unlucky stories out there like Jeff Smiths BoneHe has literally been trying since 1990 f,en,2022-04-21,"Madrid, Spain",[],negative,0.0,175.0,-0.1666666666666666
animation,lwolfie20,RT Katnay3 VibingAnimation,en,2022-04-21,,['Animation'],neutral,0.0,673.0,0.0
animation,Miss_Farenheit,Gonna do some comic reading drawMEI jojo animation idwsonic,en,2022-04-21,México,"['drawMEI', 'jojo', 'animation', 'idwsonic']",positive,0.0,0.0,0.25
animation,Arowa32k,CryptoTrustCMM NoftGames Torekkos is a whole new Ecosystem aiming to Decentralize the World of Japanese Animation amp Mangas As a Japanese animationmanga project do you have your own manga label for issue your own manga series Can you tell us more about your own label and its contents,en,2022-04-21,,[],positive,0.0,0.0,0.3295454545454545
animation,souleaterddc05,RT AwestruckVox netflix after realizing animation costs money,en,2022-04-21,Somewhere in the city idk,[],neutral,0.0,1313.0,0.0
animation,Amardee53810811,RT AwanishSharan Make Time For Your Children Before Its Too LateBrilliant animation And a very deep and powerful message,en,2022-04-21,,[],positive,0.0,533.0,0.225
animation,Rafikisland,RT CNschedules Today in unrelated news Phil Rynda Netflixs Director of Creative Leadership and Development for Original Animation has,en,2022-04-21,Madrid,[],positive,0.0,891.0,0.4375
animation,Wheresdamachine,RT KevinAstrokev Evolution of active regions 2993 4 amp 5 over the last 2 daysId like to try and do an animation of a large sunspot,en,2022-04-21,,['sunspot'],positive,0.0,8.0,0.0269841269841269
animation,TylerJa26282324,RT Roux36Prod I find it kinda funny that a Bendy animation got me here,en,2022-04-21,WHERECREATIONSLINE,[],positive,0.0,2.0,0.25
animation,malxinfluencia,RT diegovl2609 Kiecaburn Now thats what i call impact incredible animation also sfx and music cause why not,en,2022-04-21,Laugh Tale,[],positive,0.0,42.0,0.9
animation,Wanjiru_ke_,RT ChunkYbn Animation series to watchThread,en,2022-04-21,Compton ,[],neutral,0.0,95.0,0.0
animation,ifollowghosts,RT IsaacOrloff A sad reality of modern animation pipelines is that most production work does little to grow your skill set beyond basic f,en,2022-04-21,"Puerto Rico, USA",[],positive,0.0,98.0,0.0025
animation,Jen_Benben,RT sketchshark A lot of important things are being discussed right now and I hope that people still support and watch the shows being put,en,2022-04-21,Los Angeles,[],positive,0.0,55.0,0.3428571428571428
animation,aquarimsx,RT noeyJ ไม่รู้จะมีประโยชน์ไหม แต่ช่องยูทูปสอนวาดรูปที่เราดูมีประมาณนี้ แล้วเราดูฝึกมาเอง ไม่เคยไปหาที่ติวที่ไหนเลย คือmarco buccii,th,2022-04-21,on bed,[],positive,0.0,3984.0,66.67
animation,TheFntsyNtwrk,RT TheFntsyNtwrk Winner of Outstanding Animation and Best Fantasy at the 2021 New Jersey Web Fest Brian Badgettes Lucidity traces,en,2022-04-21,The internet,[],positive,0.0,8.0,0.5454545454545454
animation,buttermoonx,RT noeyJ ไม่รู้จะมีประโยชน์ไหม แต่ช่องยูทูปสอนวาดรูปที่เราดูมีประมาณนี้ แล้วเราดูฝึกมาเอง ไม่เคยไปหาที่ติวที่ไหนเลย คือmarco buccii,th,2022-04-21,mamamoo ♡ ,[],positive,0.0,3190.0,66.67
animation,Dapshine0,The manhua has been feeding us so well ThorLoveAndThunder SPYFAMILY animation drawMEI,en,2022-04-21,,"['ThorLoveAndThunder', 'SPY_FAMILY', 'animation', 'drawMEI']",neutral,0.0,1.0,0.0
animation,sweetlysymphon1,RT SaveNimona Feeling for everyone over at Netflix Animation right now Yall deserve better than this,en,2022-04-21,,[],positive,0.0,354.0,0.3928571428571428
animation,DwixoDoodles,RT genegoldstein The animation industry in America is in an absolute free fall and I would suggest anybody looking to get their ideas ma,en,2022-04-21,Somewhere,[],positive,0.0,91.0,0.3
animation,NetashaLautner,RT QueenVIPam The animation is greatThe singing YGGlobalVIP BIGBANG BIGBANGStillLife,en,2022-04-21,,"['BIGBANG', 'BIGBANG_StillLife']",positive,0.0,257.0,0.8
animation,carstenseller,I like turtles 2d animation made in unity3d 2d animation package The flash effect uses a sprite library and can be triggered interactivly Illustration by MaVersiani Dnyanesh Sawant animation gamedev,en,2022-04-21,"Hamburg, Deutschland","['unity3d', 'animation', 'gamedev']",neutral,0.0,0.0,0.0
animation,luvbkppmak,RT noeyJ ไม่รู้จะมีประโยชน์ไหม แต่ช่องยูทูปสอนวาดรูปที่เราดูมีประมาณนี้ แล้วเราดูฝึกมาเอง ไม่เคยไปหาที่ติวที่ไหนเลย คือmarco buccii,th,2022-04-21,,[],positive,0.0,3376.0,66.67
animation,StaySee75033538,RT Alberto9Herrera Whats been happening at Netflix Animation is very upsetting At the beginning it was seen as a great place for the,en,2022-04-21,,[],positive,0.0,684.0,0.5
animation,heyhey_nft,Only 55 minutes away Lets go NFTCommunity Youre invited to the premiere NFT NFTs Animation Comic Metaverse,en,2022-04-21,,"['NFTCommunity', 'NFT', 'NFTs', 'Animation', 'Comic', 'Metaverse']",positive,1.0,1.0,0.125
animation,kaemYCheek,RT noeyJ ไม่รู้จะมีประโยชน์ไหม แต่ช่องยูทูปสอนวาดรูปที่เราดูมีประมาณนี้ แล้วเราดูฝึกมาเอง ไม่เคยไปหาที่ติวที่ไหนเลย คือmarco buccii,th,2022-04-21,,[],positive,0.0,4445.0,66.67
animation,KurtLaffreuxped,RT CNschedules Today in unrelated news Phil Rynda Netflixs Director of Creative Leadership and Development for Original Animation has,en,2022-04-21,,[],positive,0.0,891.0,0.4375
animation,_BullShxt__,RT noeyJ ไม่รู้จะมีประโยชน์ไหม แต่ช่องยูทูปสอนวาดรูปที่เราดูมีประมาณนี้ แล้วเราดูฝึกมาเอง ไม่เคยไปหาที่ติวที่ไหนเลย คือmarco buccii,th,2022-04-21,nct wayv rvv aespa,[],positive,0.0,3313.0,66.67
animation,Vanessa33629428,RT yourlocalenth Aam I wierd for not wanting to work in the animation industry anymoreLike I want to work in animation I just don,en,2022-04-21,,[],neutral,0.0,1.0,0.0
animation,wan97565774,RT breanimator Netflix Animation bubble bursting Right wing weirdos continue to smear Disney colleagues for their weird homophobic agend,en,2022-04-21,,[],negative,0.0,255.0,-0.1071428571428571
animation,Redd_Zaraki19,RT Kiecaburn Dropping Luffy God of Thunder animation later today get readyy,en,2022-04-21,,[],neutral,0.0,111.0,0.0
animation,yaguurt,RT ScratchyDerose I find it funny how many are now saying that Disney Seth McFarlane Boss Baby or Cocomelon have ruined Animation forev,en,2022-04-21,she/they,[],positive,0.0,412.0,0.375
animation,ButterWentDark,RT dailymouche scaramouche bird idle animation feels so real to me ill actually cry if it doesnt happen,en,2022-04-21,He/Him || Gay🏳️‍🌈,[],neutral,0.0,165.0,0.0
animation,sfhadavin,RT noeyJ ไม่รู้จะมีประโยชน์ไหม แต่ช่องยูทูปสอนวาดรูปที่เราดูมีประมาณนี้ แล้วเราดูฝึกมาเอง ไม่เคยไปหาที่ติวที่ไหนเลย คือmarco buccii,th,2022-04-21,she / her,[],positive,0.0,3797.0,66.67
animation,IprotectBigbang,RT QueenVIPam The animation is greatThe singing YGGlobalVIP BIGBANG BIGBANGStillLife,en,2022-04-21,"Mizoram, India","['BIGBANG', 'BIGBANG_StillLife']",positive,0.0,282.0,0.8
animation,CriminTPK,RT PetraGurin CAF The AnimationSatoshi has always dreamed of reopening his late grandfathers caf One day he is suddenly invite,en,2022-04-21,🔞 Sometimes NSFW 🔞,[],negative,0.0,79.0,-0.15
animation,srothbell,RT BonnieBranson Studios arent the heart n soul of the animation industry we are,en,2022-04-21,"Los Angeles, CA",[],neutral,0.0,98.0,0.0
animation,ScrimFinder,RT GfxKiara Hey fam If you guys looking for a dope animated twitch overlays Consider me Ill surely make dope screens panels and aler,en,2022-04-21,International,[],positive,0.0,8.0,0.5
animation,MilindDongardiv,RT AwanishSharan Make Time For Your Children Before Its Too LateBrilliant animation And a very deep and powerful message,en,2022-04-21,Tumse matlab,[],positive,0.0,249.0,0.225
animation,ken2158,RT RiseFallNickBck Per the Yahoo article on the Netflix layoffs Netflix cited The Boss Baby Animated series as The series all animat,en,2022-04-21,,[],neutral,0.0,171.0,0.0
animation,3113201260,Sean Price STFU Part 2 Mic Tyson Cover Animation Video via YouTube,en,2022-04-21,McKoy's Tavern Jukebox,[],neutral,0.0,0.0,0.0
animation,MrDazAnimation,RT 3DRdNeves GM Take a look at some making off and behind the scenes of some of the steps for Diamond Hand Currently owned by C,en,2022-04-21,,[],negative,0.0,1.0,-0.2
animation,Jpanboy,RT RiseFallNickBck Not many more tragic and unlucky stories out there like Jeff Smiths BoneHe has literally been trying since 1990 f,en,2022-04-21,"Montpellier, France",[],negative,0.0,175.0,-0.1666666666666666
animation,MagnusForce2,But great designs need to be backed up with great animation and the show was GORGEOUS which should be no surprise given Mercury Filmworks It was even nominated for two Annies and the National Cartoonist Societys award for TV Animation with The Loud House and THE SIMPSONS,en,2022-04-21,Canada,[],positive,0.0,0.0,0.6
animation,NerdAqua,RT somebadideas In here is exactly what I was talking about Netflixs severe problems with marketing and creating amp sustaining audiences,en,2022-04-21,,[],positive,0.0,90.0,0.25
animation,KyraKupetsky,RT sketchshark A lot of important things are being discussed right now and I hope that people still support and watch the shows being put,en,2022-04-21,"Burbank, CA",[],positive,0.0,28.0,0.3428571428571428
animation,lilbisadguy,RT CNschedules Today in unrelated news Phil Rynda Netflixs Director of Creative Leadership and Development for Original Animation has,en,2022-04-21,United States,[],positive,0.0,924.0,0.4375
animation,MrJakob,dreilu Metropius are unreal Their animation screening was jaw dropping,en,2022-04-21,melbourne Australia,[],neutral,0.0,0.0,0.0
animation,LoayKamel5,RT Benny69314170 hello kiba kiba community Im a fresh holder and wanted to say hello to everyone I created an animation to support,en,2022-04-21,,['kiba'],positive,0.0,7.0,0.3
animation,OmenPilot,tvnkth You saw that fan animation with the lightning bolt,en,2022-04-21,Mordor Simply Walking,[],neutral,0.0,0.0,0.0
animation,invbotfunko,1299Funko POP Animation Naruto Shippuden Kakashi Raikiri GlowgamestopExclusive funko funkopop narutoSource Gamestop SearchReason Available0605521340 AM EDT Ad,en,2022-04-21,,"['gamestopExclusive', 'funko', 'funkopop', 'naruto', 'Ad']",positive,0.0,0.0,0.4
animation,MrRetrogon,RT Katnay3 VibingAnimation,en,2022-04-21,France,['Animation'],neutral,0.0,826.0,0.0
animation,h6TbxjKBaFgx3jU,RT mekameeart shake shake catanimation cat funny dance shake,en,2022-04-21,포자행성,"['animation', 'cat', 'funny', 'dance', 'shake']",positive,0.0,1360.0,0.25
animation,thepixeldevs,RT CCWVIBI Rebel Pistol Animation Set Primary Use Burst FireSecondary Use Full Auto Reference G19unity3d madewithunity gam,en,2022-04-21,Raspberry Pi,"['unity3d', 'madewithunity', 'gam']",positive,0.0,18.0,0.15
animation,princesseva43,RT Alberto9Herrera Whats been happening at Netflix Animation is very upsetting At the beginning it was seen as a great place for the,en,2022-04-21,The Isle of Lesb(ian)os,[],positive,0.0,637.0,0.5
animation,Critoons,RT AGuyWhoDraws Im also curious on how this negative word of mouth about Netflix and how their animation sector was treated will affect,en,2022-04-21,,[],negative,0.0,52.0,-0.2
animation,HenryNFT2,RT PepeCloverNFT Last chance for animation ep 4You can watch the animation ep 1 at,en,2022-04-21,,[],neutral,0.0,8.0,0.0
animation,Rohit_rawal14,RT AwanishSharan Make Time For Your Children Before Its Too LateBrilliant animation And a very deep and powerful message,en,2022-04-21,,[],positive,0.0,353.0,0.225
animation,Aimi1Morita,RT Frankie20911 My opinion on SummertimeRender anime maybe I will read the manga the first episode was wild animation wise and I hope,en,2022-04-21,,['SummertimeRender'],positive,0.0,1.0,0.3499999999999999
animation,TeaffanPancakes,RT sub0ru while im on my music break im gonna finally finish this god damn animationsonicexe SonicTheHedgehog fnfmod,en,2022-04-21,,"['sonicexe', 'SonicTheHedgehog', 'fnfmod']",neutral,0.0,5.0,0.0
animation,goldfreddyexe,NissanetteFunny FredGoneFazey Have you considered to make a FNAF roblox game with that sick animation and those models,en,2022-04-21,España,[],negative,0.0,0.0,-0.5571428571428572
animation,SaziSkylion,RT AniMat505 Remember how people say that Nickelodeon is poorly run because their business model is if its not as big as SpongeBob the,en,2022-04-21,over the hills and far away,[],negative,0.0,92.0,-0.2
animation,DonieDarko3,RT lafoung Guras Understudies SP Hololive Animation via YouTube,en,2022-04-21,Youtube,[],neutral,0.0,1.0,0.0
animation,berozgar_bharat,RT AwanishSharan Make Time For Your Children Before Its Too LateBrilliant animation And a very deep and powerful message,en,2022-04-21,,[],positive,0.0,649.0,0.225
animation,WeirdPG,RT RiseFallNickBck Not many more tragic and unlucky stories out there like Jeff Smiths BoneHe has literally been trying since 1990 f,en,2022-04-21,"Winnipeg, Manitoba",[],negative,0.0,24.0,-0.1666666666666666
animation,That_FitFatKid,RT AwanishSharan Make Time For Your Children Before Its Too LateBrilliant animation And a very deep and powerful message,en,2022-04-21,"Pune, India",[],positive,0.0,622.0,0.225
animation,TmoneyGames,RT 80Level Lets have a look at stunning works and animations by Seung Eun Kim kse332official Heres a video from Arcane storyboards,en,2022-04-21,,[],positive,0.0,6.0,0.5
animation,Marksmen16,RT AnimatedAntic Reading the stuff about Netflix Animation becoming corporate is seriously frustrating and worrisome The fact theyre o,en,2022-04-21,St.Louis,[],positive,0.0,385.0,0.0166666666666666
animation,ti_vision_,RT gozabraham This 11 NFT is an Afrowestern blend of 4 unique patterned styles in 1 3D ghost animationAuction is live on OpenSeahtt,en,2022-04-21,,[],positive,0.0,4.0,0.2556818181818182
