Keyword,User,Tweet,Language,Time,User Location,Hashtag,Polarity,Likes,Retweet,Sentiment
animation,LLBroadwell,RT FBBMB ICYMI The visuals in this are an absolute knockout SpiderVerse might be the best thing to have ever happened to American an,en,2022-04-24,"Amsterdam, NL",[],positive,0.0,4.0,0.3999999999999999
animation,b4ernd,RT pleasingnesss Needle Felt Stop Motion Animation,en,2022-04-24,Bayreuth,[],neutral,0.0,340.0,0.0
animation,AnimatorsPal,RT thatshellad0pe Kosmic Dragon a planetary protector hypnoticly dances across the night sky The interstellar hydrangea armors the heav,en,2022-04-24,Berlin,[],neutral,0.0,1.0,0.0
animation,PlusUltraQueen,RT toonsite Next animation soon,en,2022-04-24,,[],neutral,0.0,76.0,0.0
animation,aliusmani,RT kashthefuturist An amazing animation on an LCD display on a building in Japan,en,2022-04-24,Delhi Ghetto,[],positive,0.0,62.0,0.6000000000000001
animation,AHitofValium,RT awwlba using izzy for animation tests cononeilluk OurFlagMeansDeath,en,2022-04-24,,['OurFlagMeansDeath'],neutral,0.0,576.0,0.0
animation,minghongakihiro,RT fuIgars fulgur rushing to uki so he can see his cute heart animation when he jumps UkiVioleta Ukilipse PsyBorg,en,2022-04-24,,"['UkiVioleta', 'Ukilipse', 'PsyBorg']",positive,0.0,49.0,0.5
animation,2Coop3,RT KaiZenKDP Netflix heavily increases subscription priceUsers unsubscribeNetflix Ah I see it was animation that was the pro,en,2022-04-24,"Miami, FL",[],negative,0.0,36292.0,-0.2
animation,yxss4L,RT LusakaIFF Are You passionate about writing amp wish to tell your story to the world through filmmaking or animation we would love to s,en,2022-04-24,the hills,"['filmmaking', 'animation']",positive,0.0,36.0,0.225
animation,QyubeySan,RT MAgho Taking a shot in the dark butIm opening character animation commissionsltltDM for additional detailsgtgt,en,2022-04-24,,[],negative,0.0,1697.0,-0.1875
animation,PascalDufourd,RT KaiZenKDP Netflix heavily increases subscription priceUsers unsubscribeNetflix Ah I see it was animation that was the pro,en,2022-04-24,,[],negative,0.0,35480.0,-0.2
animation,VictorLysakov,Inconsistent Landscape 00110 110 animation NFT 00952 We all need reference points in life but the landscape is so unreliable at times Turn up the sound to examine the surroundings OpenSea OpenSea OpenSeaNFT art NFTCommunity,en,2022-04-24,Pebble Beach/Carmel/LV/Moscow,"['animation', 'NFT', 'OpenSea', 'OpenSeaNFT', 'art', 'NFTCommunity']",positive,2.0,1.0,0.4
animation,Bambisverse,RT LKlemmbaustein The looped version of my EmetSelch in Amaurot Animation is finally upon us Added some music and stuff Sadly twitt,en,2022-04-24,she/her,[],negative,0.0,256.0,-0.25
animation,TirednSleepy_,RT awwlba using izzy for animation tests cononeilluk OurFlagMeansDeath,en,2022-04-24,🇨🇴,['OurFlagMeansDeath'],neutral,0.0,550.0,0.0
animation,kidcoziboi,RT KaiZenKDP Netflix heavily increases subscription priceUsers unsubscribeNetflix Ah I see it was animation that was the pro,en,2022-04-24,{ t-crew } / she/her/ 20,[],negative,0.0,35815.0,-0.2
animation,ntcolour,RT KaiZenKDP Netflix heavily increases subscription priceUsers unsubscribeNetflix Ah I see it was animation that was the pro,en,2022-04-24,United Kingdom,[],negative,0.0,36688.0,-0.2
animation,Barb_sheesh,RT MAgho Taking a shot in the dark butIm opening character animation commissionsltltDM for additional detailsgtgt,en,2022-04-24,,[],negative,0.0,1428.0,-0.1875
animation,Dnngblck,RT KaiZenKDP Netflix heavily increases subscription priceUsers unsubscribeNetflix Ah I see it was animation that was the pro,en,2022-04-24,,[],negative,0.0,36292.0,-0.2
animation,Elysis_,RT ArknightsEN Arknights TV Animation PRELUDE TO DAWN Official TrailerSilent we shall be should conflict be avoidablebut fight too,en,2022-04-24,,[],neutral,0.0,2528.0,0.0
animation,castielsgranger,RT KaiZenKDP Netflix heavily increases subscription priceUsers unsubscribeNetflix Ah I see it was animation that was the pro,en,2022-04-24,,[],negative,0.0,36140.0,-0.2
animation,Teddytheclown,RT KaiZenKDP Netflix heavily increases subscription priceUsers unsubscribeNetflix Ah I see it was animation that was the pro,en,2022-04-24,,[],negative,0.0,36973.0,-0.2
animation,nanudoggu,RT Blueisderg More Than Nightmaresfunny model AND scenebuilding I thought about making fnaf4 hallway but like weird or smthin I like,en,2022-04-24,16 they/she,[],positive,0.0,502.0,0.0833333333333333
animation,Narukami_85,RT NitroSpidey Styalised CGI animation that is a hybrid of 3D and 2D gtgtgtgtgtgtgtgtgtgtgtgtgtgtgtgtgtgtgtgtgtgtgtgtgtgt CGI being used for realism,en,2022-04-24,Just Existing,[],neutral,0.0,1256.0,0.0
animation,Orugaitsuka81,RT MantisX2 Takagis Gym Fun Animation 4,en,2022-04-24,,['4'],positive,0.0,328.0,0.375
animation,Forgotten353134,Ju600an82 I started watching while sadist first manhunt animation but i got interested in dsmp lore whille first lmanburg war just after erets betrail,en,2022-04-24,somewhere in poland ,[],positive,0.0,0.0,0.3125
animation,xXBLEACHED_SOUL,RT PokemanZ0N6 The best animation of ace ever,en,2022-04-24,Jigoku,[],positive,0.0,6.0,1.0
animation,NofunFantasma,RT NitroSpidey Styalised CGI animation that is a hybrid of 3D and 2D gtgtgtgtgtgtgtgtgtgtgtgtgtgtgtgtgtgtgtgtgtgtgtgtgtgt CGI being used for realism,en,2022-04-24,"Beauclair, Toussaint",[],neutral,0.0,1088.0,0.0
animation,AnimatorsPal,RT AaronAsherArt Sooo Im working on a fairly chunky animation right now and Im almost done with the storyboarding portion of just bloc,en,2022-04-24,Berlin,[],positive,0.0,1.0,0.4928571428571428
animation,PacmanAli,RT philipcdavis It can be difficult to know what values to use for the Interpolated Spring animationI made a little SwiftUI playground,en,2022-04-24,"Hamburg, Germany",[],negative,0.0,12.0,-0.34375
animation,HaopengWu,After Effect was a great beginning of creating animation video and this 3D software can give you a brief review of how 3D modeling works with video and animation After Effect may be good for an every animator and it can be a quick way for an every animator,en,2022-04-24,,[],positive,0.0,0.0,0.4583333333333333
animation,sadkimbap,RT IGN Netflix is cancelling animation projects after a highlypublicized drop in users,en,2022-04-24,Earth,[],neutral,0.0,1999.0,0.0
animation,IntrinsicWorld,RT pagurusart king of thorns transformationanimation indiedevhour gamedev indiegame indiegamedev bioidGame indiedev indie https,en,2022-04-24,Dressrosa,"['animation', 'indiedevhour', 'gamedev', 'indiegame', 'indiegamedev', 'bioidGame', 'indiedev', 'indie']",neutral,0.0,434.0,0.0
animation,ChipperBoat7,RT SuperFoxcade One Pieces animation for Wano continues to go aggressively hard in making scenes come to life to the point that Im lea,en,2022-04-24,on a boat,[],negative,0.0,6.0,-0.2916666666666667
animation,dammaway,RT AyuRythm Fun time Click it to stop amp follow the suggestion Sometimes its all about doing basic things and following a basic routine,en,2022-04-24,,[],positive,0.0,6.0,0.09375
animation,AnimatorsPal,RT designtatum SightingOutpost Jetty animation abstractart generativeart artistsoninstagram AIart opensea visualart NFTab,en,2022-04-24,Berlin,"['animation', 'abstractart', 'generativeart', 'artistsoninstagram', 'AIart', 'opensea', 'visualart', 'NFTab']",neutral,0.0,1.0,0.0
animation,akeru_0003,RT DillonGoo AHHHHHH Demon Slayer CATS 2 is finally done We started this video before the movie was released So we set out to tell the,en,2022-04-24,,[],neutral,0.0,154.0,0.0
animation,ShuiXian17,RT MAgho Taking a shot in the dark butIm opening character animation commissionsltltDM for additional detailsgtgt,en,2022-04-24,,[],negative,0.0,1805.0,-0.1875
animation,_ahamedOfficial,RT KaiZenKDP Netflix heavily increases subscription priceUsers unsubscribeNetflix Ah I see it was animation that was the pro,en,2022-04-24,Twitter Hall of Shame,[],negative,0.0,38235.0,-0.2
animation,KartProwler,Like shit like this is the stuff i adore when the music and the animation are together with such perfect cohesion Elements of the visuals being informed by the instrumentation major elements of the shot timed to beats and lyrics,en,2022-04-24,England,[],positive,0.0,0.0,0.215625
animation,CityofHopeGames,RT TheMirrorKnight Ive been learning some game animation tips and how to use Unreal I did this very quick and rough walk cycle to test,en,2022-04-24,MF world,[],negative,0.0,1.0,-0.0222222222222222
animation,LaurenC43552972,RT AvatarJah Danny failed math class dannyphantom dannyfenton cartoon cartoontwt animation anime Nickelodeon,en,2022-04-24,"Cumberland, Rhode Island","['dannyphantom', 'dannyfenton', 'cartoon', 'cartoontwt', 'animation', 'anime', 'Nickelodeon']",negative,0.0,4.0,-0.5
animation,bohito4,RT NikolinaPetolas One of my first Nfts The tree house animation collected last year by the amazing bittm Forever grateful How time,en,2022-04-24,root@localhost,[],positive,0.0,21.0,0.3958333333333333
animation,ska_on_air,RT G0YAM0N On that sunaosa Friends edit I cant make an animation but I can draw fake movie stills,en,2022-04-24,Probably on ao3,[],negative,0.0,364.0,-0.5
animation,Bansenkon,RT MAgho Taking a shot in the dark butIm opening character animation commissionsltltDM for additional detailsgtgt,en,2022-04-24,Teyvat,[],negative,0.0,1776.0,-0.1875
animation,whitney_beryl,RT KaiZenKDP Netflix heavily increases subscription priceUsers unsubscribeNetflix Ah I see it was animation that was the pro,en,2022-04-24,city within a city,[],negative,0.0,36140.0,-0.2
animation,justasoapbar,RT MAgho Taking a shot in the dark butIm opening character animation commissionsltltDM for additional detailsgtgt,en,2022-04-24,"Manila City, National Capital ",[],negative,0.0,1564.0,-0.1875
animation,nyxchroniclez,RT CuteC3 The Adventures of Klee and IttoSound ON importantAnimation CuteC3 Happy New YearGenshinImpact Itto klee ani,en,2022-04-24,,"['GenshinImpact', 'Itto', 'klee', 'ani']",positive,0.0,2509.0,0.4676136363636364
animation,cheesypoffs,cdtxufre THIS IS SO CUTE I really love the animation in this,en,2022-04-24,I keep it SFW,[],positive,1.0,1.0,0.73828125
animation,KyleKozmikDLuxO,Heres a fun animation trivia questionNo googling when was the last time no new animated feature opened in US theaters in an entire calendar year,en,2022-04-24,New England,[],positive,1.0,0.0,0.0579545454545454
animation,wilbdhm_,RT KaiZenKDP Netflix heavily increases subscription priceUsers unsubscribeNetflix Ah I see it was animation that was the pro,en,2022-04-24,she/her,[],negative,0.0,36022.0,-0.2
animation,snoozedsneeze,RT CryptOblomov Can we recruit MileyCyrus to tinydinosnft Ty for adding the audio to my animation nomamesgwei ily,en,2022-04-24,"Mumbai, India",[],neutral,0.0,6.0,0.0
animation,Majdnotmajed,Ive said this before butnothing will make me angrier than my uni opening up a film and animation degree when Im a year away from graduating,en,2022-04-24,(he/him),[],neutral,0.0,0.0,0.0
animation,MmelsZuma,ApP3te Seen better animation in Shield Hero Sesso 2,en,2022-04-24,"Durban, South Africa",[],positive,0.0,0.0,0.5
animation,SirensAVtuber,RT vuyprvakr LoFi ironmouse I have long wanted to make such an animation I hope you like it ironmouseart bubiart,en,2022-04-24,,"['ironmouseart', 'bubiart']",negative,0.0,153.0,-0.025
animation,tony23581,Azuki is a series of pictures with the theme of Japanese animation style NFT Japanese cartoon style starting 10000Each NFT is unique with differences in hair style eyes mouth and neck clothing accessories and background types It has high aesthetic appreciation,en,2022-04-24,,[],positive,0.0,0.0,0.107
animation,Santiago_Alves_,RT KaiZenKDP Netflix heavily increases subscription priceUsers unsubscribeNetflix Ah I see it was animation that was the pro,en,2022-04-24,Uberlandia MG,[],negative,0.0,36893.0,-0.2
animation,AmerEzatXV,Msilby2 luffysmayie It take so much time to finish this art of animation and weekly release doesnt help that way theyre taking time for each crazy animation release unlike seasonal that have their time until they actually release it,en,2022-04-24,,[],negative,0.0,0.0,-0.1333333333333333
animation,1CryptoTiger,RT PontesNFT GM NFTCommunity NEW DREAM objktcom Psyco DREAMS 2 10 Editions 1 XTZ Feel the DREAM NFT NFTartist n,en,2022-04-24,Metaverse,"['NFTCommunity', '2', 'NFT', 'NFTartist', 'n']",positive,0.0,4.0,0.1704545454545454
animation,Caldarone_ALan,RT MAgho Taking a shot in the dark butIm opening character animation commissionsltltDM for additional detailsgtgt,en,2022-04-24,,[],negative,0.0,1564.0,-0.1875
animation,ArtistRTweeters,RT karlyyallop Hey If You Want High Quality animation For Your gaming Then Feel Free To HMU stream twitchtv twitchgamer streame,en,2022-04-24,USA,"['animation', 'gaming', 'stream', 'twitchtv', 'twitchgamer', 'streame']",positive,0.0,5.0,0.28
animation,antibrendy,HbcuAnime Its animation adds to the actual story It feels more in ur face and real I love the 3D idc,en,2022-04-24,,[],positive,0.0,0.0,0.4166666666666667
animation,Sarah95ux,RT Harry55817971 the m47animation 3Danimation Blender3d,en,2022-04-24,,"['animation', '3Danimation', 'Blender3d']",neutral,0.0,2.0,0.0
animation,Krzysztof_Syruc,Thanks hansup for minting Wide Curved Alternation iteration 39 for your collectionHeres some stills I saved from this live generating animation,en,2022-04-24,"Gdańsk, Polska",['39'],positive,0.0,0.0,0.0787878787878787
animation,ThaddeusArjuna,RT Car01am RTNOW AVAILABLE on Audible GOOD SISTER BAD SISTER Book 1of THE HEART OF THE STAFF Narration by SkyWildmist Cover Anim,en,2022-04-24,Tiny Blue Dot in Milky Way.,['RT'],positive,0.0,131.0,0.1333333333333334
animation,gradeA1_vic,RT KaiZenKDP Netflix heavily increases subscription priceUsers unsubscribeNetflix Ah I see it was animation that was the pro,en,2022-04-24,,[],negative,0.0,35481.0,-0.2
animation,earthroon,RT dnf0328 To Dreamworks Animation and All Fanart creatorThank you for such wonderful works I got to believe in LOVE again shera ca,en,2022-04-24,마계,"['shera', 'ca']",positive,0.0,66.0,0.5
animation,SoaresGirolamy,RT kingdavidsimien DRAGON BALL SUPER SUPER HERO FAN ANIMATION TRAILER BlueAnimation1 DragonBallSuper DragonBallSuperSuperHero http,en,2022-04-24,,"['DragonBallSuper', 'DragonBallSuperSuperHero']",positive,0.0,5.0,0.4921874999999999
animation,SinaDino1,RT pleasingnesss Needle Felt Stop Motion Animation,en,2022-04-24,Is schön in Plön,[],neutral,0.0,280.0,0.0
animation,Bltmovies,46350pmTHE BIG COUNTRY5Action1958PeckWestern4350FATHER OFTHE BRIDEChnl51991MartinKeaton35430THE LEGO MOVIESkyShowcase2014Animation45430MY BEST FRIENDS WEDDINGFilm41997RobertsComedy4535 JURASSICWORLD FALLEN KINGDOMITV22018PrattDinoAdventure35,en,2022-04-24,,[],positive,0.0,0.0,0.5
animation,SwooshyCueb,RT Tytofi Daddy Rex Cookin PrehistoricPlanet animation,en,2022-04-24,"Durham, NC","['PrehistoricPlanet', 'animation']",neutral,0.0,2312.0,0.0
animation,sw0x_,RT RAlNEYDAY THIS IS NOT A DISS ON THE OWL HOUSE hollow mind made me realize how bad we need more animationcontent aimed at youn,en,2022-04-24,,[],negative,0.0,935.0,-0.0999999999999999
animation,warmtalent1,RT jellowpaws Hello from jellowpaws NFTCommunity and NFT world Jellowpaws makes a short animation of cuties that they have,en,2022-04-24,,"['NFTCommunity', 'NFT']",neutral,0.0,13.0,0.0
animation,AbysswalkerRaul,thegameawards A really high budget Pokemon with voice acting and great animation for most moves,en,2022-04-24,,[],positive,0.0,0.0,0.365
animation,langatoon,RT ArtRMe A work in progress of a timebomb animation based on one of my previous drawings arcane jinxandekko,en,2022-04-24,18 | any pronouns,"['timebomb', 'arcane', 'jinxandekko']",negative,0.0,104.0,-0.1666666666666666
animation,Yeezy707,RT EldenDarkinWolf ONEPIECE1015 Its extremely hard to describe with words how peak this episode was Had tears in my eyes from start,en,2022-04-24,"Le Mans, France",['ONEPIECE1015'],negative,0.0,93.0,-0.2916666666666667
animation,_zenora_,zedcull AliasArtworks JamiUwUs obviously didnt mean to redo all of it in this dramatic tone just meant the higher quality animation and direction for all of it,en,2022-04-24,18 | Guy,[],negative,0.0,0.0,-0.1239583333333333
animation,bluetigerart,At risk of breaking into tears at any HEARTSTOPPER scene with the goddam animation leaves,en,2022-04-24,They/them,[],neutral,0.0,0.0,0.0
animation,O_otaeil,FUCKizone WHAT ANIMATION,en,2022-04-24,they/them,[],neutral,0.0,0.0,0.0
animation,rriizzaannsia,RT KaiZenKDP Netflix heavily increases subscription priceUsers unsubscribeNetflix Ah I see it was animation that was the pro,en,2022-04-24,,[],negative,0.0,36893.0,-0.2
animation,juicy_even,AyyTeeThreeDee whens the next animation,en,2022-04-24,,[],neutral,0.0,0.0,0.0
animation,fhe_niniah,RT gomanga THE SCUM VILLAINS SELFSAVING SYSTEM REN ZHA FANPAI ZIJIU XITONG NOVEL Vol 2Read what happens next in the series by NYT,en,2022-04-24,Brasil,[],negative,0.0,860.0,-0.15
animation,Loune__e,New animation animation oc originalcharacter 2danimation,en,2022-04-24,,"['animation', 'oc', 'originalcharacter', '2danimation']",positive,0.0,0.0,0.5852272727272727
animation,Em_Iodine,RT SamuelDeats Netflix Animation didnt close down they sadly canceled some projects Theyre still making a bunch of stuffOutside st,en,2022-04-24,,[],negative,0.0,813.0,-0.2185185185185185
animation,Emmanuel_k047,RT KaiZenKDP Netflix heavily increases subscription priceUsers unsubscribeNetflix Ah I see it was animation that was the pro,en,2022-04-24,"Iowa City, IA",[],negative,0.0,36782.0,-0.2
animation,MiraBiggestSimp,Ok one problem thoughFor the project so far weve got people that wanna voice act write stories and Im sure weve got editors tooBuuut we aint got no animators And considering the fact that animation takes FOREVER to actually look good itll be hard to find,en,2022-04-24,"She/her, or really any! 💞",[],positive,0.0,0.0,0.2722222222222222
animation,XZYBEXO851005,RT kldIaw This whole scene had me screaming shaking and crying The animation RogerLuffy parallels the music literally everything was,en,2022-04-24,,[],neutral,0.0,854.0,0.0
animation,gingkoginkgo,RT LKlemmbaustein The looped version of my EmetSelch in Amaurot Animation is finally upon us Added some music and stuff Sadly twitt,en,2022-04-24,,[],negative,0.0,256.0,-0.25
animation,Dollop_draws,RT MrReks4 Trashpaladinsgame SFM animation,en,2022-04-24,,"['paladinsgame', 'SFM', 'animation']",neutral,0.0,4.0,0.0
animation,kyutilla,RT SakugaLad And to bring Ishitanis wonderful ideas to life beautifully you leave it up to the character acting and overall animation e,en,2022-04-24,Laugh Tale,[],positive,0.0,8.0,0.4625
animation,uchimouchi,RT CHECHE98711466 Intro outro animationBirthday gift for Milord Link AkumassetsAkThumbA Akurylic V,en,2022-04-24,,"['Akumassets', 'AkThumbA', 'Akurylic', 'V']",neutral,0.0,183.0,0.0
animation,Sad_Demon_lol,RT leomiller10 yessss very cocky idle animation gtMoonAnimator RobloxDev Roblox RobloxAnimation,en,2022-04-24,i forgor,"['MoonAnimator', 'RobloxDev', 'Roblox', 'RobloxAnimation']",negative,0.0,6.0,-0.505
animation,Ian_AGES,McLeodGarning The worst part is that the reached peak Sonic animation on Brawl but in Ultimate his mouth is literally just a texture HE HAS NO MOUTH,en,2022-04-24,,[],negative,0.0,0.0,-0.5
animation,kopibrian,RT MAgho Taking a shot in the dark butIm opening character animation commissionsltltDM for additional detailsgtgt,en,2022-04-24,Malaysia,[],negative,0.0,1805.0,-0.1875
animation,juanjo_belic,RT LuxArume quick lil fluttershy animation i made in like 2 hours,en,2022-04-24,,[],positive,0.0,55.0,0.3333333333333333
animation,Loo__kii,RT KaiZenKDP Netflix heavily increases subscription priceUsers unsubscribeNetflix Ah I see it was animation that was the pro,en,2022-04-24,,[],negative,0.0,38031.0,-0.2
animation,BorutoOriginals,Npmleo I totally agree with youthis Episode was made by the main studio and this animation is a disgracesuch a important Episode,en,2022-04-24,,[],positive,0.0,0.0,0.1888888888888888
animation,TergoLiv,Happy Noblegarden Here is the animation of the Noble Gardeners Hearthstone Warcraft WorldOfWarcraft,en,2022-04-24,"Denver, CO",['WorldOfWarcraft'],positive,0.0,0.0,0.875
animation,AndreaMcKid,ima1966 YouTube A sequel to Star Fox Zero for Switch would probably be better Accompanied by a new episode of the animation sure,en,2022-04-24,Italy,[],positive,0.0,0.0,0.3787878787878787
animation,farez_san,RT kashthefuturist An amazing animation on an LCD display on a building in Japan,en,2022-04-24,"Petaling Jaya, Selangor",[],positive,0.0,124.0,0.6000000000000001
animation,ayepixelart,RT bleachboybeats Pay to disconnectArtworkanimation ayepixelart Music by me,en,2022-04-24,,[],neutral,0.0,2.0,0.0
animation,beruangjingga,RT catsuka Earth Day 2022 animation by Lorenzo FrestaEarthDay EarthDay2022,en,2022-04-24,any pronouns,"['EarthDay', 'EarthDay2022']",neutral,0.0,983.0,0.0
animation,viciousvill,been a while since my last animation huh,en,2022-04-24,dormant h: matsuda_toki,[],neutral,1.0,0.0,0.0
animation,lavalightfury,RT codaanim ROXANNE WOLFsong by ArizonaZervasanimatronic rextures by GsstudiosY animation by me FNAF fnafsecuritybreach,en,2022-04-24,Classified,"['FNAF', 'fnafsecuritybreach']",positive,0.0,261.0,0.5
animation,AnimatorsPal,RT essentialwa Testimonials Carouselhtml css testimonial sliderCSS3 HTML5 FrontEnd FrontEndDevelopment,en,2022-04-24,Berlin,"['CSS3', 'HTML5', 'FrontEnd', 'FrontEndDevelopment']",neutral,0.0,2.0,0.0
animation,takamiojo,RT Brogrammist A lot of stuff is being worked on behind the scenes for RED Shadow Maggots one of the more visible additions is the firs,en,2022-04-24,,[],positive,0.0,33.0,0.0333333333333333
animation,Uxian_,RT LKlemmbaustein The looped version of my EmetSelch in Amaurot Animation is finally upon us Added some music and stuff Sadly twitt,en,2022-04-24,Spain,[],negative,0.0,933.0,-0.25
animation,AnimatorsPal,RT hustlenomics916 Senki Zesshou Symphogear Character Song Complete Box Limited Edition King Records Senki,en,2022-04-24,Berlin,['Senki'],positive,0.0,1.0,0.0142857142857142
animation,PixSkullPoster,RT professaurkeen Think theres something in the boxes Captainpixelart animation,en,2022-04-24,,"['pixelart', 'animation']",neutral,0.0,2.0,0.0
animation,ill_fckyourwife,I wonder if Vegas has the odds for Toei animation spoiling Gear 5 on the opener,en,2022-04-24,,[],neutral,0.0,0.0,0.0
animation,cupacawfee,ButtJavis wow that animation is really good 0,en,2022-04-24,,[],positive,0.0,0.0,0.3999999999999999
animation,ocvt__,this has gotta be the worst animation ive seen since 7DS,en,2022-04-24,nowhere,[],negative,0.0,0.0,-1.0
animation,Red_No_00,Ju600an82 JanuaryFebruary 2021 I saw an animation of a game of among us by rae and corpse where dream came out then I found several videos of dnf moments and I started following them,en,2022-04-24,All pronouns/ bi/ gender fluid,[],negative,0.0,0.0,-0.1333333333333333
animation,AridLemming,Simple things like this are a huge inspiration for me getting into 3D animation you dont always need something complex to convey a strong emotion,en,2022-04-24,"Ultros, Primal DC",[],positive,0.0,0.0,0.1333333333333333
animation,Pixcelerator,RT professaurkeen Think theres something in the boxes Captainpixelart animation,en,2022-04-24,The Internet,"['pixelart', 'animation']",neutral,0.0,2.0,0.0
animation,bhunnox666,imichilton SlythanX I agree with you the animation for RE Vendetta was pretty amazing Claire Leon would be great partners for Jill Valentine,en,2022-04-24,"Raccoon City, USA",[],positive,0.0,0.0,0.55
animation,nikkochola,RT KW7MD8FEWT7lMXx Baby ChainsawFull Animation drawingMEI galaxillust gawrt,en,2022-04-24,"Manila, Philippines","['drawingMEI', 'galaxillust', 'gawrt']",positive,0.0,222.0,0.35
animation,JohnLew51077488,RT Cartoonbrains Still thinking about Porsha Shes got REALLY nice legs The animation gives a lot of emphasis on her hips too which i,en,2022-04-24,,[],positive,0.0,7.0,0.6
animation,mysticwonder48,RT KaiZenKDP Netflix heavily increases subscription priceUsers unsubscribeNetflix Ah I see it was animation that was the pro,en,2022-04-24,he/him autism/adhd hispanic,[],negative,0.0,39687.0,-0.2
animation,Spooky1Fish,RT KaiZenKDP Netflix heavily increases subscription priceUsers unsubscribeNetflix Ah I see it was animation that was the pro,en,2022-04-24,,[],negative,0.0,39687.0,-0.2
animation,Hotfox_the_Cop,RT codaanim ROXANNE WOLFsong by ArizonaZervasanimatronic rextures by GsstudiosY animation by me FNAF fnafsecuritybreach,en,2022-04-24,"Brooklyn, NY","['FNAF', 'fnafsecuritybreach']",positive,0.0,260.0,0.5
animation,Alexmercerst,RT TheCelticTampon we need your supportWelcome to 2022 BotbCartoonCreator TheCelticTampon CoSR parkerrsimmons EPs Game,en,2022-04-24,"California, USA",[],positive,0.0,833.0,1.0
animation,EvanGrayM,ewg118 BillCorbett I also wonder how the arts would have developed in Miami if Fleischer animation hadnt gone out of business,en,2022-04-24,Next to the stuffing,[],positive,0.0,0.0,0.1
animation,costixDxD,Frecklychan I didnt know about Ghibli Animationbut i did some research and yes thats true It was so damn good they decided to add it,en,2022-04-24,România - Râmnicu Vâlcea 🇷🇴,[],positive,0.0,0.0,0.6234375
animation,kenny_jpg13,RT NitroSpidey Styalised CGI animation that is a hybrid of 3D and 2D gtgtgtgtgtgtgtgtgtgtgtgtgtgtgtgtgtgtgtgtgtgtgtgtgtgt CGI being used for realism,en,2022-04-24,any prns :),[],neutral,0.0,2134.0,0.0
animation,yovillustar,RT NippoisAlien Unmute pleaseThis is an another old animation i animated along with some voice files in the game this time featur,en,2022-04-24,The Spaceship💫✨,[],negative,0.0,2.0,-0.4666666666666666
animation,AnimatorsPal,RT KCookieBrooke harvestbrook detectiverj Im biased Bc I work on HB and have a lot of future plot context but I agree that its not,en,2022-04-24,Berlin,[],neutral,0.0,1.0,0.0
animation,SonejeeNikhil,ADuocrypto My Pixel Venom Animation available on opensea,en,2022-04-24,India,[],positive,0.0,0.0,0.4
