Keyword,User,Tweet,Language,Time,User Location,Hashtag,Polarity,Likes,Retweet,Sentiment
animation,WvrldFamous,RT ltrllivi The LiveHigh Ganjaverse Episode 1 The MeetingStory by kxrlymiyagi x LiveHighArt and animation by kxrlymiyagi Epis,en,2022-04-21,Jamaica,[],neutral,0.0,2.0,0.0
animation,mnlghtdestiny_,RT RiseFallNickBck Across the Spiderverse Part 1 has been delayed until June of 2023Not really surprised as the October 2022 date se,en,2022-04-21,,[],negative,0.0,44.0,-0.05
animation,champstice,Honestly between this cracking down on password sharing losing A Lot of stuff they had like a decade ago to other services And the shit going on with animation behind the scenes Very interesting seeing a company just absolutely torpedo their money and image away,en,2022-04-21,Ireland ,[],positive,0.0,0.0,0.0813492063492063
animation,tiednote,RT TheCelticTampon we need your supportWelcome to 2022 BotbCartoonCreator TheCelticTampon CoSR parkerrsimmons EPs Game,en,2022-04-21,United States,[],positive,0.0,308.0,1.0
animation,EyelessIris,RT sheeprilyn wow a certain studio does not know what to do with its animation department and it shows So many people were upended,en,2022-04-21,behind you,[],positive,0.0,50.0,0.2714285714285714
animation,DunyMarc,RT RiseFallNickBck Netflix in the span of like a week went from beloved to public enemy number one in animationIts genuinely impressiv,en,2022-04-21,,[],positive,0.0,764.0,0.3666666666666667
animation,_ludenyo_,RT ChunkYbn Animation series to watchThread,en,2022-04-21,,[],neutral,0.0,108.0,0.0
animation,ILOVEPHOTO50,RT dailymouche scaramouche bird idle animation feels so real to me ill actually cry if it doesnt happen,en,2022-04-21,대한민국,[],neutral,0.0,554.0,0.0
animation,Crip2DaX,ideartisteth GM mate i dont have any animation always open to some hot stuff D,en,2022-04-21,"Mtl, Canada",[],positive,1.0,0.0,0.4166666666666667
animation,ohmygauss77,RT RiseFallNickBck Not many more tragic and unlucky stories out there like Jeff Smiths BoneHe has literally been trying since 1990 f,en,2022-04-21,,[],negative,0.0,920.0,-0.1666666666666666
animation,gradunza,RT RessencourtA blood cell wrapped by shimmer 2d handmade animation for arcane episode 7 ForticheProd arcaneshow arcane arcanes,en,2022-04-21,"Boston, MA","['arcane', 'arcanes']",neutral,0.0,11.0,0.0
animation,LukePolito,RT javadoodlestv recent animation news has been very discouraging so I encourage everyone to pour yourselves a cup of coffee and also dra,en,2022-04-21,,[],positive,0.0,2.0,0.1
animation,gwidion,RT AnimatoHQ Looking for a gig at animation studios using Blender There are over 100 job openings You can now filter jobs by softwa,en,2022-04-21,campinas-sp-brazil,[],neutral,0.0,6.0,0.0
animation,officialkorede2,RT NewAgeArt2 Need someone to do product photography product videography stopmotion animation eventsGeneral adverts and Musical vide,en,2022-04-21,Everywhere,[],positive,0.0,35.0,0.025
animation,dannormski,RT PozNote Off to the Eastgate Theatre in Peebles today for the Scotland International Festival of Cinema where On Wenlock Edge is nomin,en,2022-04-21,"Oxford, England",[],neutral,0.0,1.0,0.0
animation,CSVACTION,Freewheelers work in Music Drama Dance and Media working with disabled and nondisabled artists using theatre dance film and animation We are looking for Lunch Support Volunteer to assist the artists and make sure they have everything they need,en,2022-04-21,Mole Valley. Epsom & Elmbridge,[],positive,0.0,0.0,0.15
animation,tweety_talk,RT AwanishSharan Make Time For Your Children Before Its Too LateBrilliant animation And a very deep and powerful message,en,2022-04-21,,[],positive,0.0,564.0,0.225
animation,TFB5Spike,RT breanimator No other studio pays Production Animation workers as much as Netflix Animation does and its just i,en,2022-04-21,,[],positive,0.0,330.0,0.13125
animation,MattWolfstein94,RT Alberto9Herrera Tomorrow The Bad Guys will officially release in theaters It will be the first widerelease movie of 2022 that was m,en,2022-04-21,"Tijeras, New Mexico",[],negative,0.0,15.0,-0.2249999999999999
animation,PoisonedElite,RT DrewTailored For those asking heres a nonpaywalled version of my Netflix Animation story thanks russfischer And yes Bone is,en,2022-04-21,Robot Witch,[],positive,0.0,95.0,0.25
animation,fleischshake,RT HillfortGames Phffahaha I had too much fun with puzzle failstates last night LongGoneGame IndieGameDev indiedev GameDev Pix,en,2022-04-21,Hamburg,"['LongGoneGame', 'IndieGameDev', 'indiedev', 'GameDev', 'Pix']",positive,0.0,97.0,0.15
animation,Ftw_Katherine,RT CNschedules Today in unrelated news Phil Rynda Netflixs Director of Creative Leadership and Development for Original Animation has,en,2022-04-21,The Internet,[],positive,0.0,1052.0,0.4375
animation,mydearheidi_,RT Chevistian1 The Wrap just put up an article about everything going down at Netflix Animation all those hint tweets from me showcase t,en,2022-04-21,Alderaan,[],negative,0.0,38.0,-0.1555555555555555
animation,chalewarinxq,RT noeyJ ไม่รู้จะมีประโยชน์ไหม แต่ช่องยูทูปสอนวาดรูปที่เราดูมีประมาณนี้ แล้วเราดูฝึกมาเอง ไม่เคยไปหาที่ติวที่ไหนเลย คือmarco buccii,th,2022-04-21,"◌ *late reply | pd 
/รี+เฟบโป๊🔞 , multi fandom*
(toman etc.) (YEONJUN , HARUTO etc.)

🪦 @Eleanor @quan6ix @1̶8̶0̶6̶1̶2̶",[],positive,0.0,3509.0,66.67
animation,T3dotcom,Netflix just cancelled another show but bigger problems loom,en,2022-04-21,"Bath, England",[],neutral,0.0,0.0,0.0
animation,TahjSales,Lyle2K colethemanyt I give it 1018 Technology is improving faster than it ever has Its at a point where weve reached exponential growth because AI can now teach and learn on its own Not saying itll be for NBA 2k within that time but animation and programming are on the rise within gaming,en,2022-04-21,,[],positive,0.0,0.0,0.6
animation,Bluesea75462488,RT CNschedules Today in unrelated news Phil Rynda Netflixs Director of Creative Leadership and Development for Original Animation has,en,2022-04-21,,[],positive,0.0,1077.0,0.4375
animation,ShinyRexxie,RT b0tster Working on the little messenger trio for todays BloodborneKart I threw them into the kart pawn after making the rig and idle,en,2022-04-21,i was Gwen first owo,['BloodborneKart'],negative,0.0,39.0,-0.234375
animation,notshounenprot,RT sketchshark A lot of important things are being discussed right now and I hope that people still support and watch the shows being put,en,2022-04-21,nowe cresthill,[],positive,0.0,181.0,0.3428571428571428
animation,ZeroC50,Echidnuh Man All that wait for some cheap animation It is what it is,en,2022-04-21,"Panabo, Davao Region",[],positive,0.0,0.0,0.4
animation,xiao_ngelem,RT dailymouche scaramouche bird idle animation feels so real to me ill actually cry if it doesnt happen,en,2022-04-21,,[],neutral,0.0,276.0,0.0
animation,BelbelSyah,RT Ratuart168 UPANLmao Messy short animation BoBoiBoy boboiboytaufan animation,en,2022-04-21,,"['BoBoiBoy', 'boboiboytaufan', 'animation']",positive,0.0,50.0,0.1333333333333333
animation,beetlefella101,RT tonygoldmark SO YEAH SOMEONE MADE REALLY AWESOME ANIMATION TO WORDS THAT CAME OUT OF MY FACE HOLE GAAAAAA SO COOL,en,2022-04-21,,[],positive,0.0,8.0,0.675
animation,FireheartForces,RiseFallNickBck Fuckin ALL THREE Thats bullshit dawg like the minute I saw Bone trending I thought it was good news about the show Its such a good story and I dont get why no one wants to make itWarner Animation should definitely be ashamed of themselves like thats some ass,en,2022-04-21,,[],positive,0.0,0.0,0.3199999999999999
animation,fahpiieew,RT noeyJ ไม่รู้จะมีประโยชน์ไหม แต่ช่องยูทูปสอนวาดรูปที่เราดูมีประมาณนี้ แล้วเราดูฝึกมาเอง ไม่เคยไปหาที่ติวที่ไหนเลย คือmarco buccii,th,2022-04-21,,[],positive,0.0,3981.0,66.67
animation,konglish45,justmaiko hsbstock5037 IsekaiMeta ShluvPals hsbstock5037 yooho2500 mama28sj Everything about IsekaiMeta makes me curious so I am looking forward to seeing my favorite animation works,en,2022-04-21,,['IsekaiMeta'],positive,0.0,0.0,0.2
animation,fantasystar541,Why do certain Studio Ghibli movies make me cry I just finished Spirited Away and it made me well in tearsFunny Enough The Secret World of Arriety made me do the same thing years agoMaybe its the asthenic of the old animation that makes me cryor the music at the end,en,2022-04-21,"Spring, TX",[],positive,0.0,0.0,0.069047619047619
animation,Tori_San01,RT ArknightsEN Arknights Animation PV Near LightThe time has come to remember what justice and honor truly stand forNew Side Sto,en,2022-04-21,Tori San#7225,[],positive,0.0,316.0,0.2121212121212121
animation,beef17235679,RT sketchshark A lot of important things are being discussed right now and I hope that people still support and watch the shows being put,en,2022-04-21,,[],positive,0.0,273.0,0.3428571428571428
animation,nidirect,RT ConsumerCouncil The price of 500L of home heating oil will cost 42028 on average this week Go to to view th,en,2022-04-21,"Belfast, Northern Ireland",[],negative,0.0,1.0,-0.15
animation,Vol4Bourbon,RT RiseFallNickBck Not many more tragic and unlucky stories out there like Jeff Smiths BoneHe has literally been trying since 1990 f,en,2022-04-21,"Knoxville, TN",[],negative,0.0,920.0,-0.1666666666666666
animation,LargeLizardLad,RT RiseFallNickBck Not many more tragic and unlucky stories out there like Jeff Smiths BoneHe has literally been trying since 1990 f,en,2022-04-21,Corn,[],negative,0.0,920.0,-0.1666666666666666
animation,ridermatsu,RT RiseFallNickBck Netflix in the span of like a week went from beloved to public enemy number one in animationIts genuinely impressiv,en,2022-04-21,"Nova Scotia, Canada",[],positive,0.0,765.0,0.3666666666666667
animation,Punkypine,RT ScratchyDerose I find it funny how many are now saying that Disney Seth McFarlane Boss Baby or Cocomelon have ruined Animation forev,en,2022-04-21,,[],positive,0.0,439.0,0.375
animation,kiaraxkiri,False friendship like the ivy decays and ruins the walls it embraces but true friendship gives new life and animation to the object it supports BECHARI POSTER OUT,en,2022-04-21,,[],negative,0.0,0.0,-0.0159090909090909
animation,Rivet_ArtGoblin,RT b0tster Been working on a bunch of UI related code for my day job over at WitchJRPG now that the finalized art is coming in I made a,en,2022-04-21,,[],neutral,0.0,81.0,0.0
animation,MeechBrooks,RT gostephgo Netflix Animation burned hot and bright at the start and its upsetting to watch in real time so many talented creatives t,en,2022-04-21,New York City,[],positive,0.0,384.0,0.47
animation,binguahjussi,RT QueenVIPam The animation is greatThe singing YGGlobalVIP BIGBANG BIGBANGStillLife,en,2022-04-21,,"['BIGBANG', 'BIGBANG_StillLife']",positive,0.0,495.0,0.8
animation,farda_az,RT QueenVIPam The animation is greatThe singing YGGlobalVIP BIGBANG BIGBANGStillLife,en,2022-04-21,Indonesia,"['BIGBANG', 'BIGBANG_StillLife']",positive,0.0,257.0,0.8
animation,MunnaBh07003654,RT AwanishSharan Make Time For Your Children Before Its Too LateBrilliant animation And a very deep and powerful message,en,2022-04-21,,[],positive,0.0,649.0,0.225
animation,stellamydog,JShooke I actually like it but I can I can understand why some dont The constant breaking of the fourth wall the onscreen text the cutesy animation Just tell the story,en,2022-04-21,"Harrisburg, PA",[],neutral,0.0,0.0,0.0
animation,m134dragon,RT BombowyL Dont miss the premiere of my new animationYou can watch it tomorrow at 1700 CEST on YouTube,en,2022-04-21,Europe,[],positive,0.0,8.0,0.1363636363636363
animation,MrRacotero,RT breanimator Netflix Animation bubble bursting Right wing weirdos continue to smear Disney colleagues for their weird homophobic agend,en,2022-04-21,en tu tl,[],negative,0.0,324.0,-0.1071428571428571
animation,mireillemarso,For EarthDay2022 Mowglis familyNobel Laureate Rudyard Kiplings fictional story The Jungle Book animation 1967 ecosystems Animation wildlife,en,2022-04-21,,"['EarthDay2022', 'ecosystems', 'Animation', 'wildlife']",neutral,0.0,0.0,0.0
animation,MeechBrooks,RT breanimator No other studio pays Production Animation workers as much as Netflix Animation does and its just i,en,2022-04-21,New York City,[],positive,0.0,330.0,0.13125
animation,steffy_sa,RT VirallySocial Do want to an ad like thatDo you also need the following servicesphotography product videography stopmotion anima,en,2022-04-21,Multiuniverse ,[],neutral,0.0,39.0,0.0
animation,Pabloblanc01,Denizzm48524303 FLOOR 03DougTenNapel the creator of the video game EARTHWORM JIM and THE NEVERHOOD has worked in comics and animation for over 30 years Hes worked on shows such as Nickelodeons Cat Scratch amp VeggieTales to name a few The set is called EternalKlay,en,2022-04-21,,[],negative,0.0,0.0,-0.2166666666666666
animation,PSunkawpun,RT noeyJ ไม่รู้จะมีประโยชน์ไหม แต่ช่องยูทูปสอนวาดรูปที่เราดูมีประมาณนี้ แล้วเราดูฝึกมาเอง ไม่เคยไปหาที่ติวที่ไหนเลย คือmarco buccii,th,2022-04-21,,[],positive,0.0,4567.0,66.67
animation,LenKusov,RT RiseFallNickBck Not many more tragic and unlucky stories out there like Jeff Smiths BoneHe has literally been trying since 1990 f,en,2022-04-21,"Lexington, KY",[],negative,0.0,815.0,-0.1666666666666666
animation,TIDRPodshow,RT TSFTMpod MOVIE OR SONG ToyStory 3OR We Belong Together by RandyNewmanVote belowOur full ToyStory3 deep dive,en,2022-04-21,"Southampton, England","['ToyStory', 'RandyNewman', 'ToyStory3']",positive,0.0,2.0,0.175
animation,AngelOmar12998,The Rugrats and They All Grown Up ArleneKlasky GaborCsupo amp PaulGermain AllGrownUp RuGRatSAllGrownUp on Nickelodeon and YTV en Nickelodeon Animation,en,2022-04-21,Dominican Republic,"['ArleneKlasky', 'GaborCsupo', 'PaulGermain', 'AllGrownUp', 'RuGRatSAllGrownUp', 'Nickelodeon', 'YTV']",neutral,0.0,0.0,0.0
animation,realgwentastic,RT AnimatedAntic The sooner that executives learn how to appreciate the art of animation and not treat it so badly and also let it thriv,en,2022-04-21,,[],negative,0.0,189.0,-0.6999999999999998
animation,PulseJhoon,RT DahjaCat THIS SET IS SO GOOD AND THE GLIDER ANIMATION,en,2022-04-21,,[],positive,0.0,4.0,0.7
animation,rpggamebot,RT hhh89569658 Pro Squid Game Players be like in MINECRAFTminecraft anime animation game gamer 3D yout,en,2022-04-21,MF world,"['minecraft', 'anime', 'animation', 'game', 'gamer', '3D', 'yout']",negative,0.0,1.0,-0.4
animation,Lance_Charleson,RT SarahJSketches AMPTP may think dragging out Animation Guild Contract negotiations will wear us down Theyre wrong Dont studios real,en,2022-04-21,DO NOT repost my art!!!,[],negative,0.0,44.0,-0.3277777777777778
animation,azullvz,RT TheCelticTampon we need your supportWelcome to 2022 BotbCartoonCreator TheCelticTampon CoSR parkerrsimmons EPs Game,en,2022-04-21,,[],positive,0.0,325.0,1.0
animation,Aminionn,RT genegoldstein The animation industry in America is in an absolute free fall and I would suggest anybody looking to get their ideas ma,en,2022-04-21,Interweb,[],positive,0.0,784.0,0.3
animation,Toddmoistfantan,Western animation is so garbage lmao,en,2022-04-21,Kevin james hot,[],positive,1.0,0.0,0.3
animation,woofmans0412,RT breanimator Netflix Animation bubble bursting Right wing weirdos continue to smear Disney colleagues for their weird homophobic agend,en,2022-04-21,,[],negative,0.0,350.0,-0.1071428571428571
animation,MathisSea,LilliahCampagna after the amazing work theyve been doing for the last few years Animation is keeping the industry alive That is super depressing,en,2022-04-21,United States,[],positive,0.0,0.0,0.0360243055555555
animation,VolatileElk,SaziSkylion What did Dreamworks do I know about Netflix screwing over a lot of animation people but what did Dreamworks do,en,2022-04-21,,[],neutral,0.0,0.0,0.0
animation,KesariYadav14,RT kishanreddybjp On the occasion of 400th Parkash Parv of Guru Tegh Bahadur ji PM Shri narendramodi ji will release a postage stamp amp c,en,2022-04-21,,[],neutral,0.0,132.0,0.0
animation,VictorLysakov,There are moments when youre not living existing Youre gasping for air numb and floating The saga of The Falling Angel concludes with such a moment in an epilogue OpenSea OpenSeaNFT 11 NFT animation 025 NFTCommunity lysakov art,en,2022-04-21,Pebble Beach/Carmel/LV/Moscow,"['OpenSeaNFT', 'NFT', 'animation', 'NFTCommunity', 'lysakov', 'art']",negative,2.0,0.0,-0.3
animation,Retro_RiffRaff,RT BonnieBranson Studios arent the heart n soul of the animation industry we are,en,2022-04-21,,[],neutral,0.0,236.0,0.0
animation,_LOHI_,RT TheWrap Rita Moreno Whoopi Goldberg Jacob Tremblay and more are among the voice cast for the next film from the animation studio beh,en,2022-04-21,"Port Harcourt, Nigeria",[],positive,0.0,4.0,0.25
animation,lady_vinyl,RT matthewlayzell A little behind the scenes glimpse at all the silly videos I made for Plastic Wax the animation studio we partnered wi,en,2022-04-21,twin peaks🦉(she/her),[],negative,0.0,40.0,-0.3625
animation,random29408192,RT dailymouche scaramouche bird idle animation feels so real to me ill actually cry if it doesnt happen,en,2022-04-21,Behind You,[],neutral,0.0,147.0,0.0
animation,troll_lock,Netflix while filled with great people can be a wonderful place But when you are being driven purely by algorithms and numbers sometimes the math doesnt add up,en,2022-04-21,he/him,[],positive,0.0,0.0,0.6035714285714286
animation,Sherlock_971,RT diegovl2609 Kiecaburn Now thats what i call impact incredible animation also sfx and music cause why not,en,2022-04-21,A côté de la voisine.,[],positive,0.0,75.0,0.9
animation,minmisery,RT ArknightsEN Arknights Animation PV Near LightThe time has come to remember what justice and honor truly stand forNew Side Sto,en,2022-04-21,,[],positive,0.0,645.0,0.2121212121212121
animation,XPussyXSlayer,RT genegoldstein The animation industry in America is in an absolute free fall and I would suggest anybody looking to get their ideas ma,en,2022-04-21,He/they | Nya/nyan | 16 |,[],positive,0.0,784.0,0.3
animation,DiHuang,RT AshGMonstrology While I still got into animation eventually seeing Disney shut down their 2D animation studios as I got out of high s,en,2022-04-21,Los Angeles,[],positive,0.0,82.0,0.0022222222222222
animation,DJMurphy_05,RT RiseFallNickBck Not many more tragic and unlucky stories out there like Jeff Smiths BoneHe has literally been trying since 1990 f,en,2022-04-21,nowhere and everywhere,[],negative,0.0,1025.0,-0.1666666666666666
animation,Animation_vibes,Thanks to everyone who is updating stories on Instagram sharing this video tagging us on different social sites to support this huge change in Indian Animation industry and Community AnimeIsComingbackInIndia,en,2022-04-21,India,['AnimeIsComingbackInIndia'],positive,1.0,0.0,0.1833333333333333
animation,zambianperson,RT tabproductionsc Half Caste volume 12 is on the way Have you read the first half of the volume yet CLICK HERE TO DOWNLOAD https,en,2022-04-21,Hangzhou,[],negative,0.0,3.0,-0.0277777777777777
animation,ghostkidarioch,RT genegoldstein The animation industry in America is in an absolute free fall and I would suggest anybody looking to get their ideas ma,en,2022-04-21,,[],positive,0.0,292.0,0.3
animation,Animal_Fort,Uriel2911 Not enough sleep for me but I am close to getting enough mental rest to finish an animation class from AaronBlaiseArt Hes in Europe right now teaching but Im taking his online advance class he basically gifted out to everyone What are you eating today Via JhonenV,en,2022-04-21,Somewhere Between Heaven &Hell,[],positive,0.0,0.0,0.1371428571428571
animation,DaniNC96,RT Alberto9Herrera Whats been happening at Netflix Animation is very upsetting At the beginning it was seen as a great place for the,en,2022-04-21,,[],positive,0.0,1131.0,0.5
animation,GioSatan11,RT RiseFallNickBck Netflix in the span of like a week went from beloved to public enemy number one in animationIts genuinely impressiv,en,2022-04-21,18,[],positive,0.0,816.0,0.3666666666666667
animation,scifiguy202,RT RiseFallNickBck Not many more tragic and unlucky stories out there like Jeff Smiths BoneHe has literally been trying since 1990 f,en,2022-04-21,"Michigan, USA",[],negative,0.0,1025.0,-0.1666666666666666
animation,AsrielRetweets,RT BellaStudio7 YEETfnf fridaynightfunkin fnfmod mod fridaynightfunkinmod fnfindiecross indiecross indiecrossmod wip underta,en,2022-04-21,Undertale Fandom in link:,"['fnf', 'fridaynightfunkin', 'fnfmod', 'mod', 'fridaynightfunkinmod', 'fnfindiecross', 'indiecross', 'indiecrossmod', 'wip', 'underta']",positive,0.0,3.0,0.2
animation,toomanybirdy,RT dearestdoremi Quick lil bun animation I did on todays stream,en,2022-04-21,they/he + xero/xeros,[],positive,0.0,13.0,0.3333333333333333
animation,MannysMyName,RT BonnieBranson Studios arent the heart n soul of the animation industry we are,en,2022-04-21,Illinois,[],neutral,0.0,236.0,0.0
animation,StephenAfamO,RT cassiecodes This weeks codesandbox challenge is the Flip animation techniqueFlip is kinda like magic it allows you to animate,en,2022-04-21,"Hamburg, Germany",[],positive,0.0,24.0,0.5
animation,Sergal_Paws,RT RiseFallNickBck Not many more tragic and unlucky stories out there like Jeff Smiths BoneHe has literally been trying since 1990 f,en,2022-04-21,,[],negative,0.0,1025.0,-0.1666666666666666
animation,alekascious,RT MonolithNews Animation,en,2022-04-21,He/him,[],neutral,0.0,21.0,0.0
animation,kellygoround,oh heres some Context for you perverts who can still enjoy that sort of thing,en,2022-04-21,Baltimore or less,[],positive,0.0,0.0,0.4
animation,lawrencebrenner,RT breanimator Netflix Animation bubble bursting Right wing weirdos continue to smear Disney colleagues for their weird homophobic agend,en,2022-04-21,"New York, NY",[],negative,0.0,43.0,-0.1071428571428571
animation,jidrgn__,RT QueenVIPam The animation is greatThe singing YGGlobalVIP BIGBANG BIGBANGStillLife,en,2022-04-21,,"['BIGBANG', 'BIGBANG_StillLife']",positive,0.0,115.0,0.8
animation,jasonnguyen648,RT spongieupdates This whole animation mess as well as the ad supported service the price hikes and all this other mess things are not,en,2022-04-21,"Hanoi, Vietnam",[],negative,0.0,2.0,-0.0687499999999999
animation,1front10back,thecartooncrave they can take an extra 5 years and i honestly would not care as long as they do not compromise on the quality spiderverse was a great work of animation,en,2022-04-21,,[],positive,0.0,0.0,0.3375
animation,IanFPS_,AsuraiGaming Itlll just make Jett mains play smarter Hahaha its not really a nerf a nerf is like slowing down the dash animation,en,2022-04-21,,[],negative,0.0,0.0,-0.0185185185185185
animation,Ryanm7288,GlamrockBud Thats because he is a Animation Paragon not a GFX Paragon,en,2022-04-21,Robux,[],neutral,0.0,0.0,0.0
animation,0rea0s,RT MannLightfoot Netflix really looked at their animation department and said,en,2022-04-21,,[],positive,0.0,10.0,0.2
animation,tacochronicles,RT MayoJarz well im glad its finally public knowledge,en,2022-04-21,Tacoland,[],positive,0.0,19.0,0.25
animation,Leonandian,RT FlugingoFlimbo cartonofshi TFW an animation budget that couldve gone into a Second Season of Seis Manos is instead used on a wuheheh,en,2022-04-21,Multifandom/Multiversal,[],neutral,0.0,11.0,0.0
animation,amatobennyy,xthedawnz I say TG or even stuff like Berserk HxHs animation is great and should end on the same animation as it started with,en,2022-04-21,,[],positive,0.0,0.0,0.4
animation,b3anz1e,RT fufuromoe In this paper GetInTheMecha talks about different ways of animating morphing sequences and how it tells more about the st,en,2022-04-21,,[],positive,0.0,85.0,0.25
animation,wanat_wanatt,RT noeyJ ไม่รู้จะมีประโยชน์ไหม แต่ช่องยูทูปสอนวาดรูปที่เราดูมีประมาณนี้ แล้วเราดูฝึกมาเอง ไม่เคยไปหาที่ติวที่ไหนเลย คือmarco buccii,th,2022-04-21,,[],positive,0.0,3637.0,66.67
animation,shak_weather,RT ASKMeteo Our weather in Europe today This animation for today 06 UTC shows the ground analysis of DWD over the ICON clouds for 21,en,2022-04-21,Minnesota/US/Cambodia/Asia,"['weather', 'Europe', 'DWD', 'ICON']",neutral,0.0,1.0,0.0
animation,adesyndicate,RT genegoldstein The animation industry in America is in an absolute free fall and I would suggest anybody looking to get their ideas ma,en,2022-04-21,"York, PA",[],positive,0.0,352.0,0.3
animation,hugsarchival,RT mannyoe Damn I really thought Netflix was gonna shake up the animation industry back in 2019 Nvm,en,2022-04-21,,[],positive,0.0,120.0,0.1
animation,scriberian,RT OxfordStats This animation featured the work of Prof Christl Donnelly and emmandankwa You can watch the video,en,2022-04-21,"London, UK",[],neutral,0.0,1.0,0.0
animation,Pseyechlops,RT FloopDoop6 Saltman animationSaltyDKArtRT pixelart aseprite pixelartist animation,en,2022-04-21,The bottom of a trash bin,"['pixelart', 'aseprite', 'pixelartist', 'animation']",neutral,0.0,33.0,0.0
animation,HAIRDO2DT,RT kse332official Boxing rough animation,en,2022-04-21,LAS VEGAS NV / CHICAGO ILL.,[],negative,0.0,22386.0,-0.1
animation,ManiacsAction,RT thecartooncrave Netflixs upcoming BONE series has been canceled along with other original animated projects,en,2022-04-21,Pakistan,[],positive,0.0,846.0,0.125
