Keyword,User,Tweet,Language,Time,User Location,Hashtag,Polarity,Likes,Retweet,Sentiment
animation,Tatted_Cat13x,Gotta love me some Max the Murder Cat animation murdercat,en,2022-05-03,"Rochester, New York","['animation', 'murdercat']",positive,0.0,0.0,0.5
animation,Kinesomania,Limitless creativity Truly original work 33 3d animation visualisation ue5 unrealengine,en,2022-05-03,"Southend-on-Sea, Essex","['3d', 'animation', 'visualisation', 'ue5', 'unrealengine']",positive,0.0,1.0,0.46875
animation,BSKELETONFT,RT brobotnfts TheMagicSeven PASTE ETH ADDRESS FREE NFT GIVEAWAY LIKEBUY FOLLOW,en,2022-05-03,,"['ETH', 'NFT']",positive,0.0,1.0,0.625
animation,FilmsDoghouse,We are very happy to announce the selection of BLIND WILLOW SLEEPING WOMAN the new animated feature film by director Pierre Foldes in the Official Selection in competition of the Festival International du film danimation dAnnecy,en,2022-05-03,Luxembourg,[],positive,0.0,0.0,0.1590909090909091
animation,HoD_arbitrary,RT 80Level Have a look at this adorable procedurally animated isopod made by rileypneville in Unreal Engine,en,2022-05-03,Land of Magic and Ants,[],positive,0.0,57.0,0.5
animation,REIN65658623,RT Ahmedmedhat000 How the Hunter x Hunter 99 adapted kurapikas chain fighting style into animationis one of the most creative,en,2022-05-03,,[],positive,0.0,2163.0,0.5
animation,Seve_rin69,RT haiyan331 kaelucHappy birthday to DilucGenshin Impact MV KaeLuc fan animation Night KnightArtAnimation HaiyanCompo,en,2022-05-03,,"['ガイディル', 'kaeluc']",positive,0.0,59.0,0.8
animation,lunatwink,RT Miryuu1004 FulGallery FulgurOvidHere Died at this part when I was watching the Zelda stream its going 2 be my new ringtone now,en,2022-05-03,"any pronouns, dont perceive me","['FulGallery', 'FulgurOvidHere']",positive,0.0,519.0,0.1363636363636363
animation,HHololive,RT DailyMangas Gun Animation,en,2022-05-03,🍃🌸🚑,[],neutral,0.0,10815.0,0.0
animation,unethicalcupid,RT dragonforgenft Twitter Spaces Event NFTvJoin dragonforgenft and frens for a great talk about Lore in NFT Film,en,2022-05-03,Ancient Rome,"['NFT', 'Film']",positive,0.0,12.0,0.8
animation,invisibleindra1,RT stufflistings There should be an Alwayson charging animation option for all the devices flaunting crazy charging speeds IMO,en,2022-05-03,"Kolkata, India",[],negative,0.0,70.0,-0.6
animation,arthurmadrid,RT offshoot3D Laser Eyes Animation for nftcrypto3,en,2022-05-03,,[],neutral,0.0,12.0,0.0
animation,rufus_tangen,RT sqrcreations It has been a long time since posting and that is because we did some changes to our profile and migrated to RMRK 20,en,2022-05-03,norway,[],negative,0.0,1.0,-0.05
animation,wisag0d,RT tuyoki more progress on this animation,en,2022-05-03,Taiwan,[],positive,0.0,2352.0,0.5
animation,ArchAngel_NFTs,RT ALISALEHI1997 thetitanborn 2D Abstract animation Number 1 of 11113 TezOne of One,en,2022-05-03,Unapologetic Ape City,[],neutral,0.0,1.0,0.0
animation,ZackZanic,RT TheMarkyDragon Quick Animation Very wacky and menacing 3,en,2022-05-03,Pakistan ,[],positive,0.0,7.0,0.1208333333333333
animation,ALI_SALEHI_1997,thetitanborn 2D Abstract animation Number 1 of 11113 TezOne of One,en,2022-05-03,Metaverse,[],neutral,1.0,1.0,0.0
animation,takanasi2816,RT DailyMangas Gun Animation,en,2022-05-03,niwatori村鶏園,[],neutral,0.0,10902.0,0.0
animation,angelking144,Watch OPAL in Paris on May 8th Our new feature film OPAL is an Official Selection in the nollywoodweek in france filmfestival fantasy caribbean blackgirlmagic animation anime Africa award awardwinningMartiniqueMagnifiqueAlizLaViechristianruart,en,2022-05-03,Martinique,"['france', 'filmfestival', 'fantasy', 'caribbean', 'blackgirlmagic', 'animation', 'anime', 'Africa', 'award', 'awardwinning', 'MartiniqueMagnifique']",positive,0.0,1.0,0.2663352272727272
animation,Chaos_Alfa,RT Ahmedmedhat000 How the Hunter x Hunter 99 adapted kurapikas chain fighting style into animationis one of the most creative,en,2022-05-03,,[],positive,0.0,1786.0,0.5
animation,LoveableDragon,RT Ahmedmedhat000 How the Hunter x Hunter 99 adapted kurapikas chain fighting style into animationis one of the most creative,en,2022-05-03,A Quiet Den with Video Games ,[],positive,0.0,1840.0,0.5
animation,Takasimaten,RT DailyMangas Gun Animation,en,2022-05-03,,[],neutral,0.0,10815.0,0.0
animation,AngahSyakir,RT DailyMangas Gun Animation,en,2022-05-03,"Johor Darul Takzim,Malay",[],neutral,0.0,10902.0,0.0
animation,E1ena_C0meha,RT TbTrash Did a Lil animation of Angel the other night for his big reveal Might finish it eventually someday heh Love his design,en,2022-05-03,ツイフィよんでね,[],positive,0.0,1916.0,0.125
animation,pavs_eth,RT daydreamersgif gm followersWere DAYDREAMERS a 10k collection focussed on animation and games Minting around end of May ht,en,2022-05-03,,[],neutral,0.0,125.0,0.0
animation,jellyjam23,davpope AdeleKThomas Mate you would kill it in animation just quietly Your style would lend itself most admirably to almost any production whispers looking for storyboard work,en,2022-05-03,"Sydney, New South Wales",[],positive,0.0,0.0,0.25
animation,Elpeocross,LilDrawingboy SpongeBob Thats it bro we gotta fix the western animation sceneGet the heelies and my Richard Williams Animation Survival Guide,en,2022-05-03,a comfy yatai,[],neutral,0.0,0.0,0.0
animation,emitsukino,RT madakrn 3D Animation breakdown from my solo 3DMV project i used Miyutans live performance from the 4th live watch the full 3DMV he,en,2022-05-03,Indonesia,[],positive,0.0,1.0,0.2075757575757575
animation,IMissPark3r,this weak ass animation off my tl man,en,2022-05-03,bisexual he/him . 19,[],negative,0.0,0.0,-0.375
animation,Reesh10th,RT abasu0819 Director Yabuta amp Yakimura Sensei have confirmed MAPPA is animating Vinland Saga S2 Animation teams from S1 Pla,en,2022-05-03,,[],positive,0.0,35.0,0.4
animation,Alphasta9,RT springflowerjay Jays favorite color green Fav animal dog also cat wolf Fav food curry also pasta Fav tea wedding imp,en,2022-05-03,,[],positive,0.0,549.0,0.15
animation,iTIKLHIcLdxbBa3,RT JDPhoenix5 Wraith Finisher Animation remastered Roblox RobloxDev,en,2022-05-03,,"['Roblox', 'RobloxDev']",neutral,0.0,337.0,0.0
animation,MythicLegends_,trophydad The animation is truly insane Have a great time playing the whole game,en,2022-05-03,,[],positive,0.0,0.0,0.02
animation,tarirompofu_iv,RT ThatsElijahB NoSwayze Blew your mind when he threw off the other oneBlew your mind again when the entire animation changed when he,en,2022-05-03,"Harare, Zimbabwe",[],negative,0.0,1.0,-0.0625
animation,yV7ROh6VLF298fD,RT DailyMangas Gun Animation,en,2022-05-03,,[],neutral,0.0,10815.0,0.0
animation,MarkMograph,Should I start minting my PFP animations Would allow holders to sell the animation I made if they want to part with their PFPThanks for the idea alek1eth,en,2022-05-03,Location Independent 🧳,[],positive,0.0,0.0,0.25
animation,PhysicsQehs,Another great animation from the Y12 physics students,en,2022-05-03,Gainsborough,[],positive,0.0,0.0,0.8
animation,Banshe_617,RT jomigalvssart smol derg oc animation,en,2022-05-03,,[],neutral,0.0,80.0,0.0
animation,BetaGun03,RT 80Level Have a look at incredible Portalinspired animations made by 3D Artist Laser Casserole in Blender EeveeMore animations here,en,2022-05-03,"Jerez de la Frontera, España",[],positive,0.0,24.0,0.7
animation,hhh89569658,HAPPY NEW YEAR 2022 minecraft amp POKEMON dirty countdown partyminecraft anime animation game pikachu pokemon 2022 happynewyear DJ EDM monsterenergy,en,2022-05-03,,"['minecraft', 'anime', 'animation', 'game', 'pikachu', 'pokemon', '2022', 'happynewyear', 'DJ', 'EDM', 'monsterenergy']",positive,0.0,1.0,0.0165838068181818
animation,GalarianM,RT Jonathan699 No matter how many times I watch this battle Ill never get bored of it The stakes the music the animation the story,en,2022-05-03,United Kingdom,[],neutral,0.0,17.0,0.0
animation,ZaneWhittingham,RT FettleAnimation Can you believe that on the 8th May Fettle Animation will be 10yrs oldTo celebrate well be sharing exclusive ne,en,2022-05-03,,[],positive,0.0,3.0,0.125
animation,coolphroggy,RT Ahmedmedhat000 How the Hunter x Hunter 99 adapted kurapikas chain fighting style into animationis one of the most creative,en,2022-05-03,,[],positive,0.0,1289.0,0.5
animation,tirorupannda,RT DailyMangas Gun Animation,en,2022-05-03,,[],neutral,0.0,10397.0,0.0
animation,eyeoutfits,RT EliotTheRaccoon Finished commission ArtistOnTwitter procreate animation digitalart,en,2022-05-03,"Montréal, Québec","['ArtistOnTwitter', 'procreate', 'animation', 'digitalart']",neutral,0.0,1.0,0.0
animation,44444Drake,RT ApeReunion This is not a test I repeat this is not a test We are here to rewrite the past and make historyAnimation pipeline,en,2022-05-03,,[],negative,0.0,135.0,-0.25
animation,kimukimu045,RT DailyMangas Gun Animation,en,2022-05-03,北海道 訓子府町,[],neutral,0.0,10815.0,0.0
animation,BCytochrome,RT kevincodes Trying to create a Collapsing Toolbar XML experience in this jetpack compose projectAt the moment I have created the s,en,2022-05-03,,[],neutral,0.0,13.0,0.0
animation,Nima_Mobin,RT NimaMobin Old streetAnimation Voxel Art11002 ETHNFT NFTCommunity NFTs 3D animation voxel v,en,2022-05-03,,"['NFT', 'NFTCommunity', 'NFTs', '3D', 'animation', 'voxel', 'v']",positive,0.0,1.0,0.1
animation,Greenknight40,RT tuyoki more progress on this animation,en,2022-05-03,Singapore,[],positive,0.0,2331.0,0.5
animation,WeExplain2,Inusen666 Mate I gotta say the last update did not have much content Half of the main scene were reused art and animation from the previous update I get that you want to provide hidden content and what not but it feels like the normal content is getting affected by it,en,2022-05-03,,[],positive,0.0,0.0,0.0023809523809523
animation,ishutmayah,RT shansyney Rate me in my animation AviLets follow each other,en,2022-05-03,,[],negative,0.0,8.0,-0.125
animation,ka_kris_ko,RT shansyney Rate me in my animation AviLets follow each other,en,2022-05-03,"Kampala, Uganda",[],negative,0.0,60.0,-0.125
animation,DHinskey,hardeljohn 3GoldBalls People talk about how smooth the animation on the Babysitter Bandit was for that shot while beauties like this get overlooked,en,2022-05-03,,[],positive,0.0,0.0,0.4
animation,500burgers,RT Ahmedmedhat000 How the Hunter x Hunter 99 adapted kurapikas chain fighting style into animationis one of the most creative,en,2022-05-03,,[],positive,0.0,1652.0,0.5
animation,Meme_Gunner,RT Kitani Sans and Papyrus I did for codaanim for his animation Very swag Very cool Love these little men,en,2022-05-03,"Snowdin Town, Underground",[],positive,0.0,30.0,0.2828125
animation,MrDazAnimation,RT 3angrymen We collaborated with the wonderful talents at beginners animation studio to bring our film about disclosure for NSPCC to l,en,2022-05-03,,[],positive,0.0,1.0,1.0
animation,atyqahdattebane,RT Ahmedmedhat000 How the Hunter x Hunter 99 adapted kurapikas chain fighting style into animationis one of the most creative,en,2022-05-03,Konohagakure,[],positive,0.0,1289.0,0.5
animation,jluke12_12,RT ValorantRed Found a new Yoru animation cancel,en,2022-05-03,,[],positive,0.0,27.0,0.1363636363636363
animation,topdindjarin,RT basicbarbz survivors when they get downed and do that backflip animation,en,2022-05-03,mandalore,[],neutral,0.0,16.0,0.0
animation,ksmika,RT DailyMangas Gun Animation,en,2022-05-03,いつも心にヴァギナデンタタ,[],neutral,0.0,10815.0,0.0
animation,yoryi_cm,RT Ahmedmedhat000 How the Hunter x Hunter 99 adapted kurapikas chain fighting style into animationis one of the most creative,en,2022-05-03,,[],positive,0.0,1731.0,0.5
animation,fedora_hart,RT shansyney Rate me in my animation AviLets follow each other,en,2022-05-03,,[],negative,0.0,56.0,-0.125
animation,Askila_Deamon,RT fuhai8000 Hello hello spooky looping C0mmissions and more are open again All information and ToS in pinned tweetAnimation slots,en,2022-05-03,,[],positive,0.0,14.0,0.25
animation,E2174085017,RT gilangak92 i drew Skadi the Corrupting Heart skin Sublimation go check the sd animation too,en,2022-05-03,,[],neutral,0.0,3153.0,0.0
animation,ako_jimmie_rsa,RT vtownanimation Welcome to V Town animation humans,en,2022-05-03,"Tembisa, South Africa",[],positive,0.0,2.0,0.8
animation,Coyba_,Hey guys I actually did an animation for this video make sure you check it out bc theres a lot of amazing talent in it like voice acting and art And if you just want to see a nice shuakeshu wedding story,en,2022-05-03,"Canada, Ontario  |  she/her",[],positive,0.0,0.0,0.34
animation,bimotrianda,RT Wolfsmokestudio Segment2 of Batman of Shanghai we made for DC Nation projects Catwoman is our favorite character on this project and,en,2022-05-03,"DKI Jakarta, Indonesia",[],positive,0.0,82.0,0.5
animation,Sunnykumar62010,RT stufflistings There should be an Alwayson charging animation option for all the devices flaunting crazy charging speeds IMO,en,2022-05-03,Bihar Patna city 800008,[],negative,0.0,56.0,-0.6
animation,abgamer46,RT ValorantRed Found a new Yoru animation cancel,en,2022-05-03,,[],positive,0.0,42.0,0.1363636363636363
animation,chaosliterature,RT CGAStudioGames Happy TrailerTuesday Since weve shared Virtual Driving Schools trailer before today were sharing something bran,en,2022-05-03,United Kingdom,['TrailerTuesday'],positive,0.0,7.0,0.8
animation,FloCNFTs,RT enosaby OllieAnimation by Leo Delisle illustration digitalpainting animation,en,2022-05-03,,"['illustration', 'digitalpainting', 'animation']",neutral,0.0,2.0,0.0
animation,JoJo_LiFi,RT Ahmedmedhat000 How the Hunter x Hunter 99 adapted kurapikas chain fighting style into animationis one of the most creative,en,2022-05-03,United States,[],positive,0.0,1731.0,0.5
animation,CcPrakay,RT sfera314 How does the relativistic Doppler effect redshift compare with the classical effectIn the animation c is the speed of lig,en,2022-05-03,"กรุงเทพมหานคร, ประเทศไทย",[],neutral,0.0,8.0,0.0
animation,dilemins,lasttofulite yeah true the animation was sick too but personally preferred the drama ending much more,en,2022-05-03,王一博 💌  | gifs; don't repost,[],positive,0.0,0.0,0.0339285714285714
animation,maeuiieu,RT Ahmedmedhat000 How the Hunter x Hunter 99 adapted kurapikas chain fighting style into animationis one of the most creative,en,2022-05-03,random spazzes,[],positive,0.0,1652.0,0.5
animation,Magdaraya559,RT Egocider and heres my new sub animation I just recreated the old one but now with 2x the speen,en,2022-05-03,,[],positive,0.0,783.0,0.1477272727272727
animation,HARKA4696,RT DailyMangas Gun Animation,en,2022-05-03,,[],neutral,0.0,10815.0,0.0
animation,RanginekomanC,RT 3dwonders 80Level Have a look at this adorable procedurally animated isopod made by rileypneville in Unreal Engine,en,2022-05-03,"St Petersburg, FL",[],positive,0.0,4.0,0.5
animation,LaloNotLalo,RT KREEPTURE1 I forgot to share this one here but our student short film we had to make for our final year of animation school won an awa,en,2022-05-03,"Milano, Lombardia",[],neutral,0.0,2.0,0.0
animation,HermitPossibly,StuckInTheSound LetsGo AnimationFlatbush Zombies Palm Trees Music Video Prod By The Architect PALMTREESMEMEWARS GUERRA TURNTHEREFROGSGAY NUKETHEMWITHGAYBOMBS FREECHINA FREERUSSIA FUCKCHINAINTHEASS FUCKCHINAINTHEASSSREDDIT REDDIT,en,2022-05-03,,"['StuckInTheSound', 'LetsGo', 'Animation', 'PALMTREES', 'MEMEWARS', 'GUERRA', 'TURNTHEREFROGSGAY', 'NUKETHEMWITHGAYBOMBS', 'FREECHINA', 'FREERUSSIA', 'FUCKCHINAINTHEASS', 'FUCKCHINAINTHEASSS', 'REDDIT']",neutral,0.0,0.0,0.0
animation,stevenfraserart,My short Prosopagnosia is now available to watch online on OpDocs from nytimes opdocs animation documentary newyorktimes animateddocumentary,en,2022-05-03,"Glasgow, Scotland","['opdocs', 'animation', 'documentary', 'newyorktimes', 'animateddocumentary']",positive,0.0,1.0,0.1333333333333333
animation,zombie_frankie,RT CanYouPetTheDog Ruined King has six playable characters and each of them has a unique animation for petting Professor Gilly This spe,en,2022-05-03,"brussels, Belgium",[],positive,0.0,247.0,0.375
animation,BlurNFTs,RT planet iandees Motion blur is entirely artificial to keep people from getting a headache watching the animation,en,2022-05-03,BlurSea 🦐🦀🐙🐟🐬🦈🐳🐋,[],negative,0.0,1.0,-0.75
animation,sainttapok,RT haiyan331 kaelucHappy birthday to DilucGenshin Impact MV KaeLuc fan animation Night KnightArtAnimation HaiyanCompo,en,2022-05-03,,"['ガイディル', 'kaeluc']",positive,0.0,60.0,0.8
animation,momo_dayoVT,RT RubieMoonie Hiya This is Rubie the tiny CatTuber I do cutesy and bouncie art UwU are HIGHLY appreciated,en,2022-05-03,your mom ,[],positive,0.0,3.0,0.125
animation,Mandalorian473,RT DPMonksFinance AVAsAutomated Virtuel AnimationNFTsRDX AVA 001 picRDX AVA ArtisanXDX AVA 001XDX AVA Blaze COMI,en,2022-05-03,UK,"['NFTs', 'RDX', 'RDX', 'XDX', 'XDX']",neutral,0.0,66.0,0.0
animation,Rosesare367,RT stufflistings There should be an Alwayson charging animation option for all the devices flaunting crazy charging speeds IMO,en,2022-05-03,India ,[],negative,0.0,70.0,-0.6
animation,kyokill_,GLOWA foundation Cheers man Huge coming from a soundanimation master like yourself,en,2022-05-03,"Perth, Western Australia",[],positive,0.0,0.0,0.4000000000000001
animation,Ann__1002,RT Ahmedmedhat000 How the Hunter x Hunter 99 adapted kurapikas chain fighting style into animationis one of the most creative,en,2022-05-03,,[],positive,0.0,1840.0,0.5
animation,AnimationVFXJob,Multiple job openings at Videogyan Studios india modelingtexturing maya animation fulltime lighting 2d blender 3dcgi photoshop,en,2022-05-03,,"['india', 'modelingtexturing', 'maya', 'animation', 'fulltime', 'lighting', '2d', 'blender', '3dcgi', 'photoshop']",neutral,0.0,0.0,0.0
animation,unheil_,RT Wolfsmokestudio Segment2 of Batman of Shanghai we made for DC Nation projects Catwoman is our favorite character on this project and,en,2022-05-03,,[],positive,0.0,80.0,0.5
animation,Bekingwang,RT offshoot3D Reference vs final animation bayc 1208,en,2022-05-03,,['bayc'],neutral,0.0,538.0,0.0
animation,PaniniFucker,RT Ahmedmedhat000 How the Hunter x Hunter 99 adapted kurapikas chain fighting style into animationis one of the most creative,en,2022-05-03,"Portland, OR",[],positive,0.0,1626.0,0.5
animation,kaisar085,RT DailyMangas Gun Animation,en,2022-05-03,,[],neutral,0.0,10667.0,0.0
animation,urnotspcl,RT springflowerjay Jays favorite color green Fav animal dog also cat wolf Fav food curry also pasta Fav tea wedding imp,en,2022-05-03,poca enjoyer,[],positive,0.0,212.0,0.15
animation,Theegyptianguy,RT Ahmedmedhat000 How the Hunter x Hunter 99 adapted kurapikas chain fighting style into animationis one of the most creative,en,2022-05-03,Rosaria,[],positive,0.0,1731.0,0.5
animation,calestiial,RT onifess Kny Still amaze how real this fire animation was,en,2022-05-03,she/her,[],positive,0.0,59.0,0.2
animation,il_lustfoul,RT DailyMangas Gun Animation,en,2022-05-03,HINOMOTO,[],neutral,0.0,10735.0,0.0
animation,ONLY_DHFM,RT stufflistings There should be an Alwayson charging animation option for all the devices flaunting crazy charging speeds IMO,en,2022-05-03,tiruvuru,[],negative,0.0,56.0,-0.6
animation,GLS_001,RT PencilWorkshop justiceforspongebob We all worked on this project for 2 years and poured in original animation art voice acting mus,en,2022-05-03,,['justiceforspongebob'],positive,0.0,11080.0,0.1875
animation,supgoopi______,RT DailyMangas Gun Animation,en,2022-05-03,,[],neutral,0.0,10902.0,0.0
animation,marielightful,RT NewsIdentity5 COA Arnold and Puppets 1010The Puppet show in the mansion has begun A short Animation of the Fifth Personali,en,2022-05-03, 🇸🇻🇲🇽 🇺🇲| eng/esp OK!,[],negative,0.0,1.0,-0.46875
animation,brobotnfts,1PrecentclubNFT PASTE ETH ADDRESS FREE NFT GIVEAWAY LIKEBUY FOLLOW brobotnfts JOIN NFTs NFTCommunity brobots NFTGiveaway BTC Solana nftcollectors NFTAirdrop animation web3,en,2022-05-03,,"['ETH', 'NFT', 'NFTs', 'NFTCommunity', 'brobots', 'NFTGiveaway', 'BTC', 'Solana', 'nftcollectors', 'NFTAirdrop', 'animation', 'web3']",positive,0.0,0.0,0.625
animation,LolzersNFT,RT ThePossessedNFT Say hello to the latest ThePossessedNFT X shamanzs creative collaboration Watch out for this beauty making an,en,2022-05-03,jakarta / metav3rse,[],positive,0.0,1850.0,0.5
animation,SissyVonHissy,RT OfficialOdoTV Odos Tuesday morning reminder to stay hydrated happytuesday tuesdaymotivation tuesdayvibes odo tvforkids odot,en,2022-05-03,merry old england,"['happytuesday', 'tuesdaymotivation', 'tuesdayvibes', 'odo', 'tvforkids', 'odot']",neutral,0.0,2.0,0.0
animation,Jarnny9098721,RT ProjectMili NEW SONGGIVE ME RICEanimated music videopremiering MAY 6Animation by SEWINGBUG,en,2022-05-03,Taiwan,[],neutral,0.0,201.0,0.0
animation,moeinshekarchi,RT themiladrahimi HI NFTfam my latest NFTs drop foundationits Crimson Tide Rivers of absurdity will flow from withinCrimson tide,en,2022-05-03,,"['NFTfam', 'NFTs']",positive,0.0,32.0,0.5
animation,saliegor,RevivalOfPotara DaTruthDT Gohan ssj2 with as entry animation the bye guys from goku maybe,en,2022-05-03,,[],neutral,0.0,0.0,0.0
animation,angel_water72,RT Saberspark For the last 2 years this dedicated team of passionate fans recreated the SpongeBob movie brick by brick with unique anima,en,2022-05-03,,[],positive,0.0,12633.0,0.1083333333333333
animation,ocalyps_,RT ocalyps the rologue as Ike saysI made a short animation of the Luxiem Horror AU based from Mystas Luxiem Tierlist streamL,en,2022-05-03,,['L'],neutral,0.0,500.0,0.0
animation,kujstar,RT GrandGuerrilla Sandman jojo jojoanime SBRanimation,en,2022-05-03,     𝗷𝗼𝗷𝗼 (n.) ! ★,"['jojo', 'jojo_anime', 'SBR_animation']",neutral,0.0,370.0,0.0
animation,StreaterGeorge,RT PencilWorkshop justiceforspongebob We all worked on this project for 2 years and poured in original animation art voice acting mus,en,2022-05-03,,['justiceforspongebob'],positive,0.0,11345.0,0.1875
animation,sqarkledog,RT g5mlp The French retail chain King Jouet has posted pics of their Sunny Starscout mascot on Linkedin The post says the mascot toured,en,2022-05-03,"Florida, USA",[],neutral,0.0,44.0,0.0
animation,Usamimimodoki,RT BlazyNeko The thubnail used for the videopicoday2022 Picoday FNF fridaynightfunkin animation fanart bf gf pico drawing di,en,2022-05-03,🍄キノコ🍄,"['picoday2022', 'Picoday', 'FNF', 'fridaynightfunkin', 'animation', 'fanart', 'bf', 'gf', 'pico', 'drawing', 'di']",neutral,0.0,34.0,0.0
animation,NFTSTARMAKER11,RT Noapistudio RT if you are cuterNFT NFTGiveaway nftcollector NFTCommmunity NFTartist nftlover nftart NFTWhitelist cute An,en,2022-05-03,,"['NFT', 'NFTGiveaway', 'nftcollector', 'NFTCommmunity', 'NFTartist', 'nftlover', 'nftart', 'NFTWhitelist', 'cute', 'An']",positive,0.0,4.0,0.5
animation,GassanAqel,RT megacubeio NEW Artists confirmed in Megacube KratoArt Collector amp NFT Creator GassanAqel Visual artist amp NFT Creato,en,2022-05-03,,['Megacube'],positive,0.0,1.0,0.2121212121212121
animation,dyonisian_,RT Ahmedmedhat000 How the Hunter x Hunter 99 adapted kurapikas chain fighting style into animationis one of the most creative,en,2022-05-03,Brasil,[],positive,0.0,2163.0,0.5
animation,GoldenGuard17,RT hightobias Can Roblox please stop doing unneeded updatesThe Animation Plugin update is atrocious it randomly sets the X and Z to 1,en,2022-05-03,Your walls,[],negative,0.0,1.0,-0.6
animation,RaphaelSoma,RT AIRNews01 Kamen Rider anime FUUTO PI begins streaming weekly in Japan on August 1 Animation Studio KAITheyve also unveiled a,en,2022-05-03,Porto Alegre - RS,[],neutral,0.0,19.0,0.0
animation,misfortune133,RT DailyMangas Gun Animation,en,2022-05-03,書庫が俺のサンクチュアリ,[],neutral,0.0,10902.0,0.0
animation,designsakura,RT Kotatsufestival Save the dates for 2022 KotatsufestivalWe are happy to be back again at the venues this year chaptertweets Sat,en,2022-05-03,,[],positive,0.0,8.0,0.4
animation,vcollectss,Hunter x Hunter is the only anime I have nothing but praise and absolute admiration for From the animation plot characters Japanese dubbing soundtrack Everything is topnotch,en,2022-05-03,云深不知处,[],positive,0.0,0.0,0.3
animation,TeoYunXuan1,AAAAAA I havent post in a while cause I quit twitter yea soooooooooooooo go check out my YT channel CrispyFriesAvon I maek cool animation memes,en,2022-05-03,"North-East Region, Singapore",[],positive,1.0,0.0,0.35
animation,ust0223,RT seanhahm The teaser video of Derby Stars official trailer has been releasedWe applied the famous LOL animation Arcane style of,en,2022-05-03,,[],positive,0.0,2.0,0.65
animation,CapVgr,RT FNBRSnipex Fortnite Klombo have gotten a new Dance Animation in this Update,en,2022-05-03,The Sanctuary,['Fortnite'],positive,0.0,3.0,0.1704545454545454
animation,Coffeebeans42,RT PencilWorkshop justiceforspongebob We all worked on this project for 2 years and poured in original animation art voice acting mus,en,2022-05-03,,['justiceforspongebob'],positive,0.0,11230.0,0.1875
animation,frederickcheung,RT ThePossessedNFT Say hello to the latest ThePossessedNFT X shamanzs creative collaboration Watch out for this beauty making an,en,2022-05-03,"ÜT: -6.156573,106.822392",[],positive,0.0,1840.0,0.5
animation,ziehaxt,RT G0ld3niris quick InvaderZim animation,en,2022-05-03,,"['InvaderZim', 'animation']",positive,0.0,3.0,0.3333333333333333
animation,bluwolfblitz,3 issues for now with it1 No proper color scrolling using a botched RGB anim2 The rate is too quick Ill have to reduce it3 For some reason it doesnt read every section of my texture so its only using 2 parts of the animation,en,2022-05-03,,[],positive,2.0,0.0,0.1111111111111111
animation,06bjMm,WillthewieG Animation,en,2022-05-03,Canada,[],neutral,0.0,0.0,0.0
