Keyword,User,Tweet,Language,Time,User Location,Hashtag,Polarity,Likes,Retweet,Sentiment
animation,Luna_kitties,RT CanYouPetTheDog Ruined King has six playable characters and each of them has a unique animation for petting Professor Gilly This spe,en,2022-05-03,USA,[],positive,0.0,231.0,0.375
animation,ComradeVT,Id like to see Christopher Nolan make a romcom David Fincher try anything in animation and Michael Bay do a period piece,en,2022-05-03,help,[],neutral,1.0,0.0,0.0
animation,AmarHamtig,RT pielosul Giveawaytime 3 NFTSTo enter Follow pielosul Like amp RT Tag 3 friends 24hElrond ElrondNFTs ElrondC,en,2022-05-03,"Olongapo City, Central Luzon","['Giveawaytime', 'Elrond', 'ElrondNFTs', 'ElrondC']",neutral,0.0,12.0,0.0
animation,brobotnfts,Wandler14 PASTE ETH ADDRESS FREE NFT GIVEAWAY LIKEBUY FOLLOW brobotnfts JOIN NFTs NFTCommunity brobots NFTGiveaway BTC Solana nftcollectors NFTAirdrop animation web3,en,2022-05-03,,"['ETH', 'NFT', 'NFTs', 'NFTCommunity', 'brobots', 'NFTGiveaway', 'BTC', 'Solana', 'nftcollectors', 'NFTAirdrop', 'animation', 'web3']",positive,0.0,0.0,0.625
animation,haitanrachman,CreateStudio Animation Made Easy InosiTools,en,2022-05-03,Indonesia,['InosiTools'],positive,0.0,0.0,0.4333333333333333
animation,MinervaWallet,SpaghettEth in full swing The team just minted their conference POAPs with the poapxyz app using a Minerva Wallet address on gnosischainNice animation guys Awesome,en,2022-05-03,Gnosis Chain Polygon Ethereum,['POAPs'],positive,0.0,0.0,0.7000000000000001
animation,JoeIorio24,CocoaFox023 Haha best child romance in animation history go brrrrrr,en,2022-05-03,Location: Getting Closer,[],positive,1.0,0.0,0.6
animation,dsdrawanims,RT FrozieArtz animationSefrain aztechhy welp i am animating i guess P,en,2022-05-03,,['animation'],positive,0.0,11.0,0.75
animation,antonioberetini,In terms of the animation itself Mica focus should also switch to the active window automatically while shuffling,en,2022-05-03,"Austin, TX",[],negative,0.0,0.0,-0.1333333333333333
animation,takakinch,RT ProjectMili NEW SONGGIVE ME RICEanimated music videopremiering MAY 6Animation by SEWINGBUG,en,2022-05-03,28/fub free,[],neutral,0.0,245.0,0.0
animation,pinyaapples,RT AIRNews01 Kamen Rider anime FUUTO PI begins streaming weekly in Japan on August 1 Animation Studio KAITheyve also unveiled a,en,2022-05-03,,[],neutral,0.0,25.0,0.0
animation,Mad_AkaKabut,RT ProjectMili NEW SONGGIVE ME RICEanimated music videopremiering MAY 6Animation by SEWINGBUG,en,2022-05-03,,[],neutral,0.0,284.0,0.0
animation,_vinudes_,RT Ahmedmedhat000 How the Hunter x Hunter 99 adapted kurapikas chain fighting style into animationis one of the most creative,en,2022-05-03,ele/dele/he/him,[],positive,0.0,2224.0,0.5
animation,JennsterJay,RT DallienceRNG Little bit of a speechexpression animation practiceMight come back to make it look all nice voice act it but for no,en,2022-05-03,United States,[],positive,0.0,1923.0,0.1374999999999999
animation,SoupPablo,my crummy animation,en,2022-05-03,man,[],neutral,0.0,0.0,0.0
animation,PirateChests,The World Ends with You The Animation The Complete Season Bluray preorder is 4999 on Amazon 23 off ad,en,2022-05-03,United States,['ad'],positive,0.0,0.0,0.1
animation,slyulchak,Scream 1 15 editions left 10 editions sold 1 XTZ our current collab with soundwavesphotn animation and sound by soundwaves oil pastels by me we used limb00 real scream for this work Link and WIP below,en,2022-05-03,Almaty,[],positive,0.0,0.0,0.15
animation,WzardOfOzi,RT haiyan331 kaelucHappy birthday to DilucGenshin Impact MV KaeLuc fan animation Night KnightArtAnimation HaiyanCompo,en,2022-05-03,,"['ガイディル', 'kaeluc']",positive,0.0,160.0,0.8
animation,whim_dream,CoyoteKEMOV Oh You watch the animationIm looking forward to it too,en,2022-05-03,,[],neutral,0.0,0.0,0.0
animation,kodavell,RT PencilWorkshop justiceforspongebob We all worked on this project for 2 years and poured in original animation art voice acting mus,en,2022-05-03,Stuck in Executive Dysfunction,['justiceforspongebob'],positive,0.0,11358.0,0.1875
animation,ivorymalice,RT Ahmedmedhat000 How the Hunter x Hunter 99 adapted kurapikas chain fighting style into animationis one of the most creative,en,2022-05-03,,[],positive,0.0,2224.0,0.5
animation,ngt62135230,RT chiknnuggit Oddly impractical tiktok animation,en,2022-05-03,,"['tiktok', 'animation']",negative,0.0,1644.0,-0.1666666666666666
animation,NoodleStorm2,RT Saberspark For the last 2 years this dedicated team of passionate fans recreated the SpongeBob movie brick by brick with unique anima,en,2022-05-03,,[],positive,0.0,12653.0,0.1083333333333333
animation,kinoharahinata,RT ProjectMili NEW SONGGIVE ME RICEanimated music videopremiering MAY 6Animation by SEWINGBUG,en,2022-05-03,フレコ系はツイフィに載せてる(更新サボり中),[],neutral,0.0,284.0,0.0
animation,kwazie_harry,RT rapidodraws Havent done any animation sketches or glow art in a whileboy do i miss itDo you have a favourite,en,2022-05-03,,[],neutral,0.0,21.0,0.0
animation,JaffaArchfiend,RT Ahmedmedhat000 How the Hunter x Hunter 99 adapted kurapikas chain fighting style into animationis one of the most creative,en,2022-05-03,,[],positive,0.0,2224.0,0.5
animation,CavalairVT,RT shoyukia BADGE UPDATE Star Guardian Set 2 Badges Heard theyre doing star guardian skins again this year I dont think anything w,en,2022-05-03,,[],negative,0.0,18.0,-0.9375
animation,DragonKnightGX,RT g5mlp The French retail chain King Jouet has posted pics of their Sunny Starscout mascot on Linkedin The post says the mascot toured,en,2022-05-03,Little Fairilu,[],neutral,0.0,6.0,0.0
animation,NAGAIwww,RT DailyMangas Gun Animation,en,2022-05-03,,[],neutral,0.0,10773.0,0.0
animation,udadabi,RT DailyMangas Gun Animation,en,2022-05-03,해피 미니 버거,[],neutral,0.0,10618.0,0.0
animation,__memori__,RT haiyan331 kaelucHappy birthday to DilucGenshin Impact MV KaeLuc fan animation Night KnightArtAnimation HaiyanCompo,en,2022-05-03,"🔁🚫, All🔥","['ガイディル', 'kaeluc']",positive,0.0,160.0,0.8
animation,toya_kiryu,RT DailyMangas Gun Animation,en,2022-05-03,,[],neutral,0.0,10957.0,0.0
animation,Rysta_Mias,RT haiyan331 kaelucHappy birthday to DilucGenshin Impact MV KaeLuc fan animation Night KnightArtAnimation HaiyanCompo,en,2022-05-03,,"['ガイディル', 'kaeluc']",positive,0.0,161.0,0.8
animation,KitStarry,RT TheCelticTampon Rough Animation BotbCartoon music video Roomer by thehawkinsband Creator TheCelticTamponCoSR parkerrsi,en,2022-05-03,,[],neutral,0.0,259.0,0.0
animation,oreoscar01,RT ThePossessedNFT Say hello to the latest ThePossessedNFT X shamanzs creative collaboration Watch out for this beauty making an,en,2022-05-03,Metaverse,[],positive,0.0,1945.0,0.5
animation,EmikoAnno,RT Saberspark For the last 2 years this dedicated team of passionate fans recreated the SpongeBob movie brick by brick with unique anima,en,2022-05-03,,[],positive,0.0,12653.0,0.1083333333333333
animation,xxa0031,PotsNFT shit the animation was awesome,en,2022-05-03,,[],positive,0.0,0.0,0.4
animation,FNFAnimReview,Alright from now on people that get over a 85 rating on their animation will get a free follower by me,en,2022-05-03,100 Pleasant View Bloomfield,[],positive,0.0,0.0,0.4
animation,Ugho_o_,RT beeverOne Animation stitch test Ive really been enjoying playing with animation Im liking it much more than I thought I would htt,en,2022-05-03,Canada,[],positive,0.0,13.0,0.3999999999999999
animation,pawel_developer,RT d954mas Add win animation Also add level changing logicIf changing or restart level it exploded If changing too fast no explosio,en,2022-05-03,,[],positive,0.0,4.0,0.5
animation,VideoScribeApp,Whiteboard animation is ranked as the most effective type of animation just one of the juicy facts highlighted in Sparkols 2022 State of Animation report Have you started your free trial to create your own whiteboard animations yet,en,2022-05-03,"England, United Kingdom",[],positive,0.0,0.0,0.525
animation,SuperCarralite,RT LostValerie New Video up Pride month is soon and maybe this will get you in the mood a bit Remember it could always be gayer Th,en,2022-05-03,,[],neutral,0.0,17.0,0.0
animation,rahul05ranjan,RT David72102212 Just finished a flutter course it was cool flutterwave animation StarInMyMind programming techwithsam,en,2022-05-03,"Chandigarh, India","['flutterwave', 'animation', 'StarInMyMind', 'programming', 'techwithsam']",positive,0.0,1.0,0.35
animation,LunaLong123,RT mocakosmos93 kkukstudio about animation lmao hahaha theyre both clips about him so im not sure which twt it was referring lol,en,2022-05-03,,[],positive,0.0,1.0,0.1833333333333333
animation,S1lver_Zero,krjie13 Emotionally my favorite was Gil CasterHype wise probably Quetz or IskandarAnimation goes to either Salter in HF or EA In Zero,en,2022-05-03,horny (Omni-Present),[],positive,0.0,0.0,0.6
animation,mizukichiurara,RT ProjectMili NEW SONGGIVE ME RICEanimated music videopremiering MAY 6Animation by SEWINGBUG,en,2022-05-03,,[],neutral,0.0,245.0,0.0
animation,Celestazugh,RT haiyan331 kaelucHappy birthday to DilucGenshin Impact MV KaeLuc fan animation Night KnightArtAnimation HaiyanCompo,en,2022-05-03,💧🔶 | 🍅 | ❄🔥 : all🔁🆗!!,"['ガイディル', 'kaeluc']",positive,0.0,101.0,0.8
animation,SalmonFormosa,RT Egocider and heres my new sub animation I just recreated the old one but now with 2x the speen,en,2022-05-03,Taiwan,[],positive,0.0,868.0,0.1477272727272727
animation,yujagame,RT haiyan331 kaelucHappy birthday to DilucGenshin Impact MV KaeLuc fan animation Night KnightArtAnimation HaiyanCompo,en,2022-05-03,,"['ガイディル', 'kaeluc']",positive,0.0,101.0,0.8
animation,awawa_715,RT ProjectMili NEW SONGGIVE ME RICEanimated music videopremiering MAY 6Animation by SEWINGBUG,en,2022-05-03,ブリュンヒルデがいる世界線,[],neutral,0.0,245.0,0.0
animation,Huli_furrybutt,RT LKlemmbaustein The looped version of my EmetSelch in Amaurot Animation is finally upon us Added some music and stuff Sadly twitt,en,2022-05-03,,[],negative,0.0,3265.0,-0.25
animation,Parthalonian,1 an animation on Russian news talking about Russia invading Europe,en,2022-05-03,The Pale Blue Dot,"['РОССИЯ1', 'Russia', 'Europe']",neutral,0.0,0.0,0.0
animation,748__9951314,RT ProjectMili NEW SONGGIVE ME RICEanimated music videopremiering MAY 6Animation by SEWINGBUG,en,2022-05-03,do NOT send DMs ++ id.en.jp.cn,[],neutral,0.0,245.0,0.0
animation,Leo_norushka,RT busharty Guys I want to remind you that I have 4 amazing paintings on foundation All paintings are unique The starting pri,en,2022-05-03,,[],positive,0.0,7.0,0.325
animation,miguelcinzento,RT Ahmedmedhat000 How the Hunter x Hunter 99 adapted kurapikas chain fighting style into animationis one of the most creative,en,2022-05-03,,[],positive,0.0,2185.0,0.5
animation,saggingarts,Dont worry the fluffs still there HazbinHotel HazbinHotelAngelDust AngelDust animation,en,2022-05-03,,"['HazbinHotel', 'HazbinHotelAngelDust', 'AngelDust', 'animation']",negative,0.0,0.0,-0.1
animation,HighRiskOculus,RT EDMeadArt OK SO on that subject What are some things that YOU want to see out of an indie animation community discord What should I,en,2022-05-03,,[],positive,0.0,7.0,0.25
animation,Skapokon,RT thetomska The next day April 30th 2006 I made this as a bio for my asdfman SheezyArt account Not a terrible thrust animation if,en,2022-05-03,"Ciudad Real, España",[],positive,0.0,15.0,0.25
animation,NathanGatr,RT chiknnuggit Oddly impractical tiktok animation,en,2022-05-03,,"['tiktok', 'animation']",negative,0.0,1644.0,-0.1666666666666666
animation,misael_casanova,RT PokemanZ0N6 Water animation,en,2022-05-03,aqui,[],neutral,0.0,243.0,0.0
animation,Coolartist1110,RT thetomska Not sure Ive ever shown this before but this 12yearold clip from 2006 is actually the first asdf animation ever It was m,en,2022-05-03,The Starboard Bow,[],neutral,0.0,110.0,0.0
animation,jag2kn,RT WebFestLondon WINNER BEST DOCUMENTARYMATARIFE The Butcher DANIEL MENDOZA CESAR ANDRADEshortfilm,en,2022-05-03,,['shortfilm'],positive,0.0,64.0,0.5
animation,fr3q_m33k,Ganja White Night Trinity Single Music Video Animation Dark Wobble 2021 via YouTube,en,2022-05-03,⛛,[],negative,0.0,0.0,-0.0738095238095238
animation,Nima_Mobin,RT NimaMobin Work in process of Green Valley available on foundation NFT NFTCommunity NFTs 3D animat,en,2022-05-03,,"['NFT', 'NFTCommunity', 'NFTs', '3D', 'animat']",positive,0.0,1.0,0.1
animation,DamnatoDolls,RT SakisImport Time to Ape into the 90sApeClub Taking you back to the 90s Amazing team DoxxedAwesome CommunityMetaverse Games,en,2022-05-03,,[],positive,0.0,6.0,0.5333333333333333
animation,Txe1Nd,RT tuyoki more progress on this animation,en,2022-05-03,,[],positive,0.0,2244.0,0.5
animation,Lokius4Ever,RT coaxol0tl Lil bruno animation Encanto brunomadrigal,en,2022-05-03,,"['Encanto', 'brunomadrigal']",neutral,0.0,2.0,0.0
animation,AuraZWaves,RT jomigalvssart smol derg oc animation,en,2022-05-03,,[],neutral,0.0,115.0,0.0
animation,TheYeet0ne,RT FNAssist New Klombo files updated in Fortnite v2030AddedFootstep effectsDance animationSpawn overlay maps,en,2022-05-03,YMCA,['Fortnite'],positive,0.0,15.0,0.1704545454545454
animation,NkaniYabathathu,RT VirallySocial Do you like this adWell get in touch with VirallySocial and will hook you upOh and we also do Product photogr,en,2022-05-03,"Harrismith, South Africa",[],neutral,0.0,65.0,0.0
animation,nathalivia19_04,RT springflowerjay Jays favorite color green Fav animal dog also cat wolf Fav food curry also pasta Fav tea wedding imp,en,2022-05-03,"Jakarta Capital Region, Indonesia",[],positive,0.0,244.0,0.15
animation,Reesh10th,RT abasu0819 Director Yabuta amp Yakimura Sensei have confirmed MAPPA is animating Vinland Saga S2 Animation teams from S1 Pla,en,2022-05-03,,[],positive,0.0,34.0,0.4
animation,DUMDUMCYA1,RT Ahmedmedhat000 How the Hunter x Hunter 99 adapted kurapikas chain fighting style into animationis one of the most creative,en,2022-05-03,에린,[],positive,0.0,1289.0,0.5
animation,kickedbylanze,RT Jao1702542 Look how detailed and how HD the animation is This movie deserve a recognitionBubble Bubbleanime,en,2022-05-03,SZA,"['Bubble', 'Bubbleanime']",positive,0.0,1.0,0.5
animation,ArtPetio,RT ArtPetio Sometimes we just get stuck in gravity Orbit is my new animated piece available at SuperRare,en,2022-05-03,,[],positive,0.0,116.0,0.2681818181818182
animation,SepiaSandCreate,RT DailyMangas Gun Animation,en,2022-05-03,,[],neutral,0.0,10397.0,0.0
animation,RealSkynut,RT PencilWorkshop justiceforspongebob We all worked on this project for 2 years and poured in original animation art voice acting mus,en,2022-05-03,,['justiceforspongebob'],positive,0.0,11100.0,0.1875
animation,User_Prot0type_,RT 80Level Check out a cute singing app made by animator eranhill and ioramastudioanimation app AppStore,en,2022-05-03,Twitter,"['animation', 'app', 'AppStore']",positive,0.0,13.0,0.5
animation,gujingujin1,RT Ahmedmedhat000 How the Hunter x Hunter 99 adapted kurapikas chain fighting style into animationis one of the most creative,en,2022-05-03,;),[],positive,0.0,1811.0,0.5
animation,SidnerdArt,RT Saberspark For the last 2 years this dedicated team of passionate fans recreated the SpongeBob movie brick by brick with unique anima,en,2022-05-03,,[],positive,0.0,12524.0,0.1083333333333333
animation,HwangOnlyneen__,RT springflowerjay Jays favorite color green Fav animal dog also cat wolf Fav food curry also pasta Fav tea wedding imp,en,2022-05-03,Galaxy,[],positive,0.0,157.0,0.15
animation,leonmont22,HajPucciHaghgo MercerTheOne AlecNobody1994 NannerNeff that is so unbelievably shit it puts animation back decades lmao,en,2022-05-03,United Kingdom,[],positive,0.0,0.0,0.1333333333333333
animation,YoArjash,Bary0nyx Anime supremacy novel adaption live action x animation Pretty great novel I would say its more an advanced and mature take on Shirobako btw have only read one part of the novel which features a female anime producer,en,2022-05-03,北,[],positive,0.0,0.0,0.254040404040404
animation,DyllanTheDrawer,Based5656 Ive still yet to see a real OP purist bro Ive seen a gross amount of DBZ Naruto and even bleach but OP still gettin slandered But yet the animation and stories been speaking for themselves as of the past couple years idk bro Think the love is definitely earned,en,2022-05-03,"Garden City Park, NY",[],positive,0.0,0.0,0.09
animation,Luna_Wolffe,RT Saberspark For the last 2 years this dedicated team of passionate fans recreated the SpongeBob movie brick by brick with unique anima,en,2022-05-03,she/her,[],positive,0.0,12433.0,0.1083333333333333
animation,localghostbabe,Someone needs to make an animation of Shake it Sheamus where Sheamus is dancing in some way Like that twerking Gaston gif WWESheamus WWE shakeitsheamus,en,2022-05-03,Ohio,['shakeitsheamus'],neutral,0.0,0.0,0.0
animation,KazuoSanVT,RT KazuoSanVT Retweets are Appreciated Helping out a friend with finding new clients for 2D Animation Commissions Starting at 80,en,2022-05-03,kazcomms.weebly.com,[],negative,0.0,8.0,-0.1034090909090909
animation,BuffGoob,RT tuyoki more progress on this animation,en,2022-05-03,,[],positive,0.0,2159.0,0.5
animation,OMGitZuma_,RT VirallySocial Do you like this adWell get in touch with VirallySocial and will hook you upOh and we also do Product photogr,en,2022-05-03,Straight Outta Durban(NUZ),[],neutral,0.0,80.0,0.0
animation,beautifuI_pain,Ooooh makes sense lol the animation style does not look very good,en,2022-05-03,ᴍᴇ ᴀɴᴅ ʏᴏᴜ @ɪғᴢᴇᴄᴏ,[],positive,0.0,1.0,0.855
animation,138_Pedro,RT pantsmode SpongeBob gtdoesnt credit the animatorgttakes down a full fan recreation of the original moviegtmilks the franchise with sp,en,2022-05-03,,[],positive,0.0,55.0,0.1898148148148148
animation,MaddnessRhino,RT Saberspark For the last 2 years this dedicated team of passionate fans recreated the SpongeBob movie brick by brick with unique anima,en,2022-05-03,bed,[],positive,0.0,12475.0,0.1083333333333333
animation,Neetle_Teets,RT tenmiyakiyo Im looking forward to the animation of Temtuyoki,en,2022-05-03,,[],neutral,0.0,12.0,0.0
animation,deltaVexator,RT PencilWorkshop justiceforspongebob We all worked on this project for 2 years and poured in original animation art voice acting mus,en,2022-05-03,contact through dms,['justiceforspongebob'],positive,0.0,11209.0,0.1875
animation,ent_con,RT Kidzcoolit TUESDAY on Kidzcoolit Part 15 or AND Interviews,en,2022-05-03,"England, United Kingdom",['Interviews'],neutral,0.0,3.0,0.0
animation,adriansalter315,RT SteveGames Theres DoctorStrange then theresDoctor StrangegamesHollywood graphic animation gamedev IndieGameDev amreadi,en,2022-05-03,"Charmouth, Dorset, England, UK","['DoctorStrange', 'Hollywood', 'graphic', 'animation', 'gamedev', 'IndieGameDev', 'amreadi']",neutral,0.0,6.0,0.0
animation,mufic_mateo,RT offshoot3D Reference vs final animation bayc 1208,en,2022-05-03,,['bayc'],neutral,0.0,561.0,0.0
animation,annivy_D,Experiment with animation what do you think about it nftsale NFTfamily NFTCommunity nftcollector NFT,en,2022-05-03,metaverse,"['nftsale', 'NFTfamily', 'NFTCommunity', 'nftcollector', 'NFT']",neutral,5.0,0.0,0.0
animation,dragao_shotgun,RT DailyMangas Gun Animation,en,2022-05-03,,[],neutral,0.0,10735.0,0.0
animation,ideas_sharon,RT offshoot3D Reference vs final animation bayc 1208,en,2022-05-03,,['bayc'],neutral,0.0,510.0,0.0
animation,BadCattos,RT DailyMangas Gun Animation,en,2022-05-03,,[],neutral,0.0,10667.0,0.0
animation,chromat1cfire,Completed Fate StayNight Unlimited Blade WorksWhat else can I say This series is a masterpiece Starting from well written characters story fights to the animation direction of Ufotable everything was so goodIts one of those series which provided me EVERYTHING1010,en,2022-05-03,"Sylhet, Bangladesh",[],positive,4.0,0.0,0.4375
animation,dameonkingX,RT DallienceRNG Little bit of a speechexpression animation practiceMight come back to make it look all nice voice act it but for no,en,2022-05-03,,[],positive,0.0,1775.0,0.1374999999999999
animation,theducationshop,NEW Filmmaking amp Animation online courses available from The Education Shop Make a One Minute Movie on Your Mobile Stop Motion Make a Lego Character Walk Using BrickflicksLesson 1 is FREE,en,2022-05-03,Melbourne,[],positive,0.0,0.0,0.3454545454545454
animation,opalaristo,RT Ahmedmedhat000 How the Hunter x Hunter 99 adapted kurapikas chain fighting style into animationis one of the most creative,en,2022-05-03,somewhere,[],positive,0.0,1378.0,0.5
animation,Batkiller_34,RT animetvjp Only 2 week left until Vampire in the Garden premieres worldwide on Netflix Are you Excited Animation Production WI,en,2022-05-03,"Kissimmee, FL",[],positive,0.0,597.0,0.125
animation,SpareTimeVA,RT charquipvee Character Demo Reel If its a badass bitch yandere stalker emotional antihero or even a seductive temptress I ca,en,2022-05-03,The Booth🎙,[],neutral,0.0,5.0,0.0
animation,meowkaeIa,minhexmoon AGREED only the animation though i already love the music and voice actors of the show,en,2022-05-03,プロのミカ優擁護者 • she/her • lisa ♡,[],negative,0.0,0.0,-0.0833333333333333
animation,GDAutoArt,RT AerMartin0423 The girl in the subway stationdigitalart art Illustration oc procreate Animation,en,2022-05-03,a computer server somewhere,"['digitalart', 'art', 'Illustration', 'oc', 'procreate', 'Animation']",neutral,0.0,2.0,0.0
animation,M3taGirl,RT SkullsPrime We are beginning the stage of full fledge outreach to games and environments to attempt to get our characters into their g,en,2022-05-03,Spaceport,[],positive,0.0,66.0,0.35
animation,RyanSignGuy,RT KJOEE88 Animated artwork Character background effect Lets Gooo Yocci Animation Commissio,en,2022-05-03,my own little world,[],neutral,0.0,311.0,0.0
animation,bookfindsgifts,Looking for movies or audio CDs visit today movies film animation cartoon anime music dance musica gift giftideas,en,2022-05-03,United States,"['movies', 'film', 'animation', 'cartoon', 'anime', 'music', 'dance', 'musica', 'gift', 'giftideas']",neutral,0.0,0.0,0.0
animation,MurojoRuby,RT furihataai Kimitachi KIWIPAPAYAMANGO da ne Animation MV Over 600000 viewsThe number of Official YouTube channel subscribers,en,2022-05-03,Recording 静かな夢町,[],neutral,0.0,95.0,0.0
animation,sylnyexne,Another background concept art for my animation assignment A somewhat mystical forest if you will Character by badutberkuda artidn zonakaryaid conceptart,en,2022-05-03,Indonesia,"['artidn', 'zonakaryaid', 'conceptart']",neutral,3.0,1.0,0.0
animation,VTuberTweeter,RT TaVsora me i dont have time ive got so many stuff to do im so tiredalso meNEED TO PAT THE MANGO GIVE MANGO DA PAT j33vii anima,en,2022-05-03,In Your Heart❤️,['anima'],positive,0.0,2.0,0.0499999999999999
animation,MyAxieWorld,RT peeps026 my AxieOrigin animation for ArticOriginContest Axie44 AxieInfinity,en,2022-05-03,Lunacia,['ArticOriginContest'],neutral,0.0,54.0,0.0
animation,Heeyoung__95,RT sylnyexne Another background concept art for my animation assignment A somewhat mystical forest if you will Character by badutberk,en,2022-05-03,8 Years With BTS,[],neutral,0.0,1.0,0.0
animation,Shirakiin0,RT DailyMangas Gun Animation,en,2022-05-03,,[],neutral,0.0,10296.0,0.0
animation,Laabidi0001,RT brobotnfts PASTE ETH ADDRESS FREE NFT GIVEAWAY LIKEBUY FOLLOW brobotnfts,en,2022-05-03,,"['ETH', 'NFT']",positive,0.0,35.0,0.625
animation,Sweetgi10361331,RT springflowerjay Jays favorite color green Fav animal dog also cat wolf Fav food curry also pasta Fav tea wedding imp,en,2022-05-03,,[],positive,0.0,129.0,0.15
animation,Franciskfosu3,RT SeptembaDegree Gob3 is not only for Ghanaians and its chemically approved Animation by Me,en,2022-05-03,"Tema, Ghana",[],neutral,0.0,45.0,0.0
animation,he_is_animation,RT Aluminemsiren what does it mean,en,2022-05-03,,[],neutral,0.0,276.0,0.0
animation,bustahwoalf,RT Ahmedmedhat000 How the Hunter x Hunter 99 adapted kurapikas chain fighting style into animationis one of the most creative,en,2022-05-03,finger pistols,[],positive,0.0,1378.0,0.5
animation,creamcaramello,RT Ahmedmedhat000 How the Hunter x Hunter 99 adapted kurapikas chain fighting style into animationis one of the most creative,en,2022-05-03,"Petaling Jaya, Malaysia",[],positive,0.0,1378.0,0.5
animation,dianagenius_,RT shansyney Rate me in my animation AviLets follow each other,en,2022-05-03,Uganda,[],negative,0.0,56.0,-0.125
animation,Z0MB3LOL,RT chatonagrestee i absolutely loathe the animation in qilinbut marinette looks so good with gray eyes,en,2022-05-03,L'Manberg,[],positive,0.0,29.0,0.4499999999999999
animation,bersekovich,RT Ahmedmedhat000 How the Hunter x Hunter 99 adapted kurapikas chain fighting style into animationis one of the most creative,en,2022-05-03,,[],positive,0.0,1459.0,0.5
animation,Lafkareine,RT DailyMangas Gun Animation,en,2022-05-03,,[],neutral,0.0,10296.0,0.0
animation,FlanAmaterasu,RT DallienceRNG Little bit of a speechexpression animation practiceMight come back to make it look all nice voice act it but for no,en,2022-05-03,,[],positive,0.0,1784.0,0.1374999999999999
animation,Rramahlajana,RT VirallySocial Do you like this adWell get in touch with VirallySocial and will hook you upOh and we also do Product photogr,en,2022-05-03,"Unit D, Temba",[],neutral,0.0,95.0,0.0
animation,Pesky_Dust_520,RT DallienceRNG Little bit of a speechexpression animation practiceMight come back to make it look all nice voice act it but for no,en,2022-05-03,,[],positive,0.0,1785.0,0.1374999999999999
animation,lorebanti,RT SkullsPrime ANIMATIONS UPDATEWith our skeletons easily rigged to major engine skeletons like the Epic Skeleton unreal engine it,en,2022-05-03,,[],positive,0.0,120.0,0.1986111111111111
animation,kleestrang,RT Ahmedmedhat000 How the Hunter x Hunter 99 adapted kurapikas chain fighting style into animationis one of the most creative,en,2022-05-03,1313 Mockingbird Lane,[],positive,0.0,1378.0,0.5
