Keyword,User,Tweet,Language,Time,User Location,Hashtag,Polarity,Likes,Retweet,Sentiment
animation,AgentAccel,RT DailyMangas Gun Animation,en,2022-05-03,The Agency,[],neutral,0.0,10735.0,0.0
animation,ToonSoraAD,RT Ahmedmedhat000 How the Hunter x Hunter 99 adapted kurapikas chain fighting style into animationis one of the most creative,en,2022-05-03,She/Her | Bi  | 20,[],positive,0.0,1378.0,0.5
animation,AuroraArts18,RT sblarts Breathe Lil Procreate animation art drawing illustration Procreate,en,2022-05-03,Probably still in bed,"['art', 'drawing', 'illustration', 'Procreate']",neutral,0.0,19.0,0.0
animation,MetroidvaniaBot,RT OnixGames6 Another enemy that is new in Janosik 1 A bird attacking with eggs gamedev indiegame indiegames pixelart animation,en,2022-05-03,,"['gamedev', 'indiegame', 'indiegames', 'pixelart', 'animation']",positive,0.0,5.0,0.1363636363636363
animation,HagTeenzcoolit,RT Kidzcoolit Disney Avatar review by Con AvatarTheWayOfWater Avatar2 Avatar JamesCameron DisneyPlus A,en,2022-05-03,,"['AvatarTheWayOfWater', 'Avatar2', 'Avatar', 'JamesCameron', 'DisneyPlus', 'A']",neutral,0.0,3.0,0.0
animation,Luck4ger,RT Rainmaker1973 This animation shows how thermal convection currents in the viscous mantle drive plate tectonics movement of rigid lith,en,2022-05-03,,[],neutral,0.0,181.0,0.0
animation,ent_con,RT Kidzcoolit TUESDAY on Kidzcoolit Part 17 or AND Interviews,en,2022-05-03,"England, United Kingdom",['Interviews'],neutral,0.0,4.0,0.0
animation,Patroni20,RT Ahmedmedhat000 How the Hunter x Hunter 99 adapted kurapikas chain fighting style into animationis one of the most creative,en,2022-05-03,France,[],positive,0.0,1652.0,0.5
animation,VolumeOnePod,RT Ahmedmedhat000 How the Hunter x Hunter 99 adapted kurapikas chain fighting style into animationis one of the most creative,en,2022-05-03,,[],positive,0.0,1840.0,0.5
animation,3angrymen,We collaborated with the wonderful talents at beginners animation studio to bring our film about disclosure for NSPCC to life Here are some bright and bold frames from itNSPCC charity charityfilm,en,2022-05-03,London E2,"['NSPCC', 'charity', 'charityfilm']",positive,0.0,1.0,0.6777777777777779
animation,NFTGod0007,TokenHunter Coinwexchange MiloInu do you have any plans to release an milo animation series on Netflix etc,en,2022-05-03,,[],neutral,0.0,0.0,0.0
animation,Inhumanity_arts,Loool Pops just indirectly asked Is He referring to my humble selfgoing to work todayI run 2 parttime jobs run animation commissions and a 3 PC xmr mining rig off Renewable Solar energy My moneys working for me nowGet on my level BvtchThats the tweet,en,2022-05-03,africa,[],negative,1.0,0.0,-0.48828125
animation,TVPaint_Anim,RT javadoodlestv One year ago I posted this animation about muscles and it changed everything kevinjthornton TVPaintAnim,en,2022-05-03,Metz (France),[],neutral,0.0,3.0,0.0
animation,hailtxthethief,EDMeadArt oh man im still new at animation but id love to be a part of this i feel like it would have a lot of opportunities to foster a lot of really fun creative ideas,en,2022-05-03,"20, IN",[],positive,0.0,0.0,0.4122727272727273
animation,Gunnerstars,RT studiotendril NEW WORK with Aize EchoicAudio Case study at design animation digitaltwin techno,en,2022-05-03,Earth,"['design', 'animation', 'digitaltwin', 'techno']",positive,0.0,68.0,0.1363636363636363
animation,Andesastro,RT tuyoki more progress on this animation,en,2022-05-03,,[],positive,0.0,2263.0,0.5
animation,morpor_kikkak,RT LieDoesArt EVERYONE MOVE IM GAY Uki VioletaAnimation practiceVioletAtelier NIJISANJIEN,en,2022-05-03,"ระยอง, ประเทศไทย","['VioletAtelier', 'NIJISANJI_EN']",positive,0.0,476.0,0.4166666666666667
animation,ricky_jedai,RT ThePossessedNFT Say hello to the latest ThePossessedNFT X shamanzs creative collaboration Watch out for this beauty making an,en,2022-05-03,"Bali, Indonesia",[],positive,0.0,1840.0,0.5
animation,likesbooba,RT ishigyunyu Please do not send One Piece Reply to my sisters account My sister has nothing to do with Toei Animation,en,2022-05-03,Bohol,[],neutral,0.0,9.0,0.0
animation,I_CO_NIC,RT stufflistings There should be an Alwayson charging animation option for all the devices flaunting crazy charging speeds IMO,en,2022-05-03,,[],negative,0.0,56.0,-0.6
animation,quoZtouqpeVABzN,RT DailyMangas Gun Animation,en,2022-05-03,,[],neutral,0.0,10401.0,0.0
animation,NekoMeowgician,RT tuyoki more progress on this animation,en,2022-05-03,,[],positive,0.0,2244.0,0.5
animation,astronomy_u_y_r,RT Ahmedmedhat000 How the Hunter x Hunter 99 adapted kurapikas chain fighting style into animationis one of the most creative,en,2022-05-03,お好み焼き,[],positive,0.0,1378.0,0.5
animation,Cryptorian69,RT DPMonksFinance AVAsAutomated Virtuel AnimationNFTsRDX AVA 001 picRDX AVA ArtisanXDX AVA 001XDX AVA Blaze COMI,en,2022-05-03,,"['NFTs', 'RDX', 'RDX', 'XDX', 'XDX']",neutral,0.0,61.0,0.0
animation,YourMomsAccoun6,Check my animation made with FlipaClipDownload Free,en,2022-05-03,,['FlipaClip'],positive,0.0,0.0,0.4
animation,JeffCantCry,RT PencilWorkshop justiceforspongebob We all worked on this project for 2 years and poured in original animation art voice acting mus,en,2022-05-03,"Ohio, USA",['justiceforspongebob'],positive,0.0,11162.0,0.1875
animation,ShatteredWaters,animation for Core War 5 is actually goin wellkinda speedrunning the episode rn but I think you guys will really like what I got in storenot showing the chart because most scenes are considered unfinished because I didnt lip sync them yet lol,en,2022-05-03,Discord: Shattered Waters#9609,[],positive,0.0,0.0,0.375
animation,MeghanAlt,concertnext Good Kanye killed him on screen gleefully with animation He can take a couple of shots expect Ye is a puy,en,2022-05-03,,[],positive,0.0,0.0,0.2499999999999999
animation,TobascoH,RT TimmCosplay Hornet is the Bad GuyThanks to ArtistNcs for permission to copy your animation but with cosplay HollowKnight ht,en,2022-05-03,Olympus mons,['HollowKnight'],negative,0.0,19.0,-0.2499999999999999
animation,KuruChuuVT,RT HeavenMozaic VTuberMyskoRoseLive2D ShowcaseMyskoRoseLive2D commissions animation anime VTubeStudio,en,2022-05-03,Netherlands,"['Live2D', 'commissions', 'animation', 'anime', 'VTubeStudio']",neutral,0.0,18.0,0.0
animation,Kazooples,RT satuwn PLUTO IM PLUTO PLUTO THATS ME my first ever 3D animation check out the full thing here,en,2022-05-03,Australia,[],positive,0.0,60.0,0.3
animation,Razaruku,RT janicechun Registration is now open for my Storyboard for Animation class at CGMasterAcademy If you sign up within the next 2 w,en,2022-05-03,,[],neutral,0.0,34.0,0.0
animation,DnlsmmS,RT DnlsmmS PIXEL ORCHARD is live on fxhash Interactive generative animation Lots of textures Especially in full screen Check it,en,2022-05-03,"Amsterdam, Nederland",[],positive,0.0,3.0,0.4352272727272727
animation,XenoSpiider,RT FNAssist New Klombo files updated in Fortnite v2030AddedFootstep effectsDance animationSpawn overlay maps,en,2022-05-03,Resistance,['Fortnite'],positive,0.0,15.0,0.1704545454545454
animation,kazuhwaa,RT LieDoesArt EVERYONE MOVE IM GAY Uki VioletaAnimation practiceVioletAtelier NIJISANJIEN,en,2022-05-03,"any prns, 16 | ic: matchach","['VioletAtelier', 'NIJISANJI_EN']",positive,0.0,476.0,0.4166666666666667
animation,DeaAdhaRizki1,RT geppei5959 CloudshyWolf Thanks again for watchingIt takes more than two full weeks to make this animation but I find it rewarding,en,2022-05-03,,[],positive,0.0,1.0,0.4
animation,Kakarot_AU,I have no idea what I got maybe guaranteed cell maybe guaranteed featured maybe no animation at all idfk but I got cell so W,en,2022-05-03,She/her they/them pan 15,[],neutral,0.0,0.0,0.0
animation,RanginekomanC,RT CemBuyukpilavci Gm with a rough digital mockup of my upcoming work in which I will try to tell a story regarding psychological r,en,2022-05-03,"St Petersburg, FL",[],negative,0.0,1.0,-0.0333333333333333
animation,PostiveJo,RT IGN ICYMI Netflix is cancelling animation projects after a highlypublicized drop in users,en,2022-05-03,"Moreno Valley, CA",[],neutral,0.0,191.0,0.0
animation,IGorodencev,RT SsbBurrito Yall get one sneak peek of an animation meme Im working on cuz I got inspired by another animation meme like this yay,en,2022-05-03,"Москва, Россия",[],neutral,0.0,2.0,0.0
animation,ilbee_tk,RT haiyan331 kaelucHappy birthday to DilucGenshin Impact MV KaeLuc fan animation Night KnightArtAnimation HaiyanCompo,en,2022-05-03,please do not repost my art,"['ガイディル', 'kaeluc']",positive,0.0,60.0,0.8
animation,cherryrouges,RT haiyan331 kaelucHappy birthday to DilucGenshin Impact MV KaeLuc fan animation Night KnightArtAnimation HaiyanCompo,en,2022-05-03, ,"['ガイディル', 'kaeluc']",positive,0.0,60.0,0.8
animation,scarletmonahan,Vintage found footage Dont go Alan animation animated Animatedvideos QuarantineLifeCalm endlockdown shortfilm stopmotion art movie video lonely sadmovies 39,en,2022-05-03,United Kingdom,"['animation', 'animated', 'Animatedvideos', 'QuarantineLifeCalm', 'endlockdown', 'shortfilm', 'stopmotion', 'art', 'movie', 'video', 'lonely', 'sadmovies']",negative,0.0,0.0,-0.0999999999999999
animation,uweplus,RT williamgarratt Hornsound on animation old,en,2022-05-03,The Länd. ,"['animation', 'old']",positive,0.0,6.0,0.25
animation,posingdedede,RT EvilRedYoshis THANK YOU FOR 500 FOLLOWERS OMG YALL R AMAZING I wanna share this animation I made its been a while since Ive fi,en,2022-05-03,a random trashcan i found. ,[],positive,0.0,22.0,0.6000000000000001
animation,tanyingzhan,RT cremmeart TGCF The Princess Who Slit Her ThroatA super short animation of our favorite Rain Master lt3I loved her ascension story,en,2022-05-03,,[],positive,0.0,2318.0,0.3833333333333333
animation,TheGayestDay,RT WryCritic Seriously recommending Chinese fantasy epic Jing Zy 2020 Its actually great Chinese animation has really evolv,en,2022-05-03,,[],positive,0.0,136.0,0.1277777777777778
animation,ChapeauCaribou,RT hongga17 Working on Attack Animation,en,2022-05-03,,[],neutral,0.0,51.0,0.0
animation,yourethehoon,RT springflowerjay Jays favorite color green Fav animal dog also cat wolf Fav food curry also pasta Fav tea wedding imp,en,2022-05-03, she/her,[],positive,0.0,263.0,0.15
animation,yuyu_withlove,RT springflowerjay Jays favorite color green Fav animal dog also cat wolf Fav food curry also pasta Fav tea wedding imp,en,2022-05-03,,[],positive,0.0,263.0,0.15
animation,syouyuhaoisi,RT DailyMangas Gun Animation,en,2022-05-03,,[],neutral,0.0,10902.0,0.0
animation,jewjewcat,RT Saberspark For the last 2 years this dedicated team of passionate fans recreated the SpongeBob movie brick by brick with unique anima,en,2022-05-03,your mom's elbow skin,[],positive,0.0,12406.0,0.1083333333333333
animation,spoiledchestnut,RT Ahmedmedhat000 How the Hunter x Hunter 99 adapted kurapikas chain fighting style into animationis one of the most creative,en,2022-05-03,,[],positive,0.0,1172.0,0.5
animation,Nanana546,RT ProjectMili NEW SONGGIVE ME RICEanimated music videopremiering MAY 6Animation by SEWINGBUG,en,2022-05-03,,[],neutral,0.0,315.0,0.0
animation,dark_rozen,RT Ahmedmedhat000 How the Hunter x Hunter 99 adapted kurapikas chain fighting style into animationis one of the most creative,en,2022-05-03,,[],positive,0.0,2265.0,0.5
animation,nicky_t1468,RT ThePossessedNFT Say hello to the latest ThePossessedNFT X shamanzs creative collaboration Watch out for this beauty making an,en,2022-05-03,,[],positive,0.0,1786.0,0.5
animation,HeadBones2,RT DailyMangas Gun Animation,en,2022-05-03,,[],neutral,0.0,10450.0,0.0
animation,MrDazAnimation,RT AerMartin0423 The girl in the subway stationdigitalart art Illustration oc procreate Animation,en,2022-05-03,,"['digitalart', 'art', 'Illustration', 'oc', 'procreate', 'Animation']",neutral,0.0,2.0,0.0
animation,biblical_boi,RT Saberspark For the last 2 years this dedicated team of passionate fans recreated the SpongeBob movie brick by brick with unique anima,en,2022-05-03,ligma,[],positive,0.0,12665.0,0.1083333333333333
animation,JohnDMontague,RT PencilWorkshop justiceforspongebob We all worked on this project for 2 years and poured in original animation art voice acting mus,en,2022-05-03,Raleigh,['justiceforspongebob'],positive,0.0,11382.0,0.1875
animation,Lynkhnk,RT Ahmedmedhat000 How the Hunter x Hunter 99 adapted kurapikas chain fighting style into animationis one of the most creative,en,2022-05-03,,[],positive,0.0,2265.0,0.5
animation,WillieWillikers,RT redblueen Into the gloomb3d npr animation noir,en,2022-05-03,Gaming,"['b3d', 'npr', 'animation', 'noir']",negative,0.0,154.0,-0.1333333333333333
animation,spdern_,RT thetomska Not sure Ive ever shown this before but this 12yearold clip from 2006 is actually the first asdf animation ever It was m,en,2022-05-03,He/They/It/Void/Ve,[],neutral,0.0,118.0,0.0
animation,isamaru95,RT KJOEE88 Animated artwork Character Background Visual effect Lets Gooo Vei Animation Com,en,2022-05-03,España,[],neutral,0.0,215.0,0.0
animation,monzturo,RT bokammandala The journey of life processes781 XTZLink for buy,en,2022-05-03,,[],neutral,0.0,9.0,0.0
animation,OneDePrata,sakugabrasil Minha lista1 Ufotable 2 Kyoto Animation KyoAni 3 Bones 4 WIT Studio5 Clover Works6 Trigger7 MAPPA8 A1 PICTURES9 TOEI 10 Madhouse,en,2022-05-03,"Rio de Janeiro, Brasil",[],neutral,0.0,0.0,0.0
animation,m1kan20,RT PencilWorkshop justiceforspongebob We all worked on this project for 2 years and poured in original animation art voice acting mus,en,2022-05-03,,['justiceforspongebob'],positive,0.0,11382.0,0.1875
animation,reyemy1,RT brobotnfts PASTE ETH ADDRESS FREE NFT GIVEAWAY LIKEBUY FOLLOW brobotnfts,en,2022-05-03,🇳🇬🇬🇶,"['ETH', 'NFT']",positive,0.0,53.0,0.625
animation,LeaderBunni,RT Jonathan699 No matter how many times I watch this battle Ill never get bored of it The stakes the music the animation the story,en,2022-05-03,,[],neutral,0.0,36.0,0.0
animation,Recursi0n_1imit,RT ProjectMili NEW SONGGIVE ME RICEanimated music videopremiering MAY 6Animation by SEWINGBUG,en,2022-05-03,不是在吃饭就是在睡觉,[],neutral,0.0,315.0,0.0
animation,BettingFella,RT peeps026 my AxieOrigin animation for ArticOriginContest Axie44 AxieInfinity,en,2022-05-03,,['ArticOriginContest'],neutral,0.0,70.0,0.0
animation,Criswastaken,RT Ahmedmedhat000 How the Hunter x Hunter 99 adapted kurapikas chain fighting style into animationis one of the most creative,en,2022-05-03,,[],positive,0.0,1385.0,0.5
animation,Itsroodji022,RT Noapistudio RT if you are cuterNFT NFTGiveaway nftcollector NFTCommmunity NFTartist nftlover nftart NFTWhitelist cute An,en,2022-05-03,,"['NFT', 'NFTGiveaway', 'nftcollector', 'NFTCommmunity', 'NFTartist', 'nftlover', 'nftart', 'NFTWhitelist', 'cute', 'An']",positive,0.0,9.0,0.5
animation,_Teobaldo_,Dragon Ball Super Entire Saga in 3 Minutes ArcadeCloud Animation via YouTube,en,2022-05-03,93,[],positive,0.0,0.0,0.1666666666666666
animation,AngelRu16434135,RT OppaiHobby Well its time to continue with the commissions xDGenshinImapct genshinimpact yelan animation Edit,en,2022-05-03,,"['GenshinImapct', 'genshinimpact', 'yelan', 'animation', '原神', '夜兰', '夜蘭', 'イェラン']",neutral,0.0,11.0,0.0
animation,olabode_dev,RT Inhumanityarts Loool Pops just indirectly asked Is He referring to my humble selfgoing to work todayI run 2 parttime job,en,2022-05-03,"Lagos, Nigeria",[],negative,0.0,1.0,-0.2
animation,Empress_Phy,RT leoraokponwa This is my 5th art for the community AswangTribe This is a 3d animation of me praying in the ogassi shrinesurrounded,en,2022-05-03,🇳🇬🇨🇦,[],neutral,0.0,54.0,0.0
animation,mattjooe,Finally I watched Onward 2020 Another dope animation MoviesMattjoe,en,2022-05-03,Somewhere in Africa/Nigeria,"['Movies', 'Mattjoe']",neutral,0.0,0.0,0.0
animation,Excalibur493,gamesasylum If a zombie had an animation like that Id shit my fuckin pants,en,2022-05-03,"Myrtle Beach, SC",[],negative,0.0,0.0,-0.2
animation,the_miladrahimi,Crimson TideRivers of absurdity will flow from withinCrimson tide upon warp and weft of washed cleansaturates out up till There is no one left who has not seenMUSIC3D sculpting animation by me017 THNFTs NFTCommunity nftart,en,2022-05-03,,"['NFTs', 'NFTCommunity', 'nftart']",positive,3.0,1.0,0.1833333333333333
animation,johnsimiso,RT shansyney Rate me in my animation AviLets follow each other,en,2022-05-03,,[],negative,0.0,93.0,-0.125
animation,KurtCunningha16,RT Wolfsmokestudio Segment1 of Doomfist character short film from Overwatch Thanks to Blizzard and everyone on the team for giving us th,en,2022-05-03,,[],positive,0.0,3.0,0.1
animation,ZokuNeel,RT chromat1cfire Completed Fate StayNight Unlimited Blade WorksWhat else can I say This series is a masterpiece Starting from well,en,2022-05-03,,[],neutral,0.0,3.0,0.0
animation,Prism_Grubs,RT Ahmedmedhat000 How the Hunter x Hunter 99 adapted kurapikas chain fighting style into animationis one of the most creative,en,2022-05-03,I retweet too much,[],positive,0.0,2265.0,0.5
animation,SawitComingTbh,RT Ahmedmedhat000 How the Hunter x Hunter 99 adapted kurapikas chain fighting style into animationis one of the most creative,en,2022-05-03,,[],positive,0.0,2265.0,0.5
animation,ROMsenyou_103,RT haiyan331 kaelucHappy birthday to DilucGenshin Impact MV KaeLuc fan animation Night KnightArtAnimation HaiyanCompo,en,2022-05-03,,"['ガイディル', 'kaeluc']",positive,0.0,204.0,0.8
animation,YunUsagichan,RT haiyan331 kaelucHappy birthday to DilucGenshin Impact MV KaeLuc fan animation Night KnightArtAnimation HaiyanCompo,en,2022-05-03,,"['ガイディル', 'kaeluc']",positive,0.0,60.0,0.8
animation,s0da0n,RT ProjectMili NEW SONGGIVE ME RICEanimated music videopremiering MAY 6Animation by SEWINGBUG,en,2022-05-03,,[],neutral,0.0,201.0,0.0
animation,MrDazAnimation,RT NoteRyButBook Animation emote commission from Pastelzen,en,2022-05-03,,[],neutral,0.0,1.0,0.0
animation,Tsubaki74001743,RT gilangak92 i drew Skadi the Corrupting Heart skin Sublimation go check the sd animation too,en,2022-05-03,,[],neutral,0.0,3160.0,0.0
animation,Mydaybacon,RT springflowerjay Jays favorite color green Fav animal dog also cat wolf Fav food curry also pasta Fav tea wedding imp,en,2022-05-03,Thailand,[],positive,0.0,588.0,0.15
animation,Kanlaya83074466,RT planbmediapcl ญาญ่า อุรัสยา ชวนทุกคนมาดื่มสิ่งดี ๆ จากธรรมชาติในแบบทะลุจอใจกลางเมืองในโฆษณา มิเนเร่ น้ำแร่ธรรมชาติ โดยโฆษณา,th,2022-05-03,"อ.เมืองขอนแก่น, จ.ขอนแก่น",[],positive,0.0,8.0,75.0
animation,Jay97006362,RT JayLender1 I drew this bit and added the followon dialog when Split Personality was in animatic Animation gets better and better a,en,2022-05-03,,[],positive,0.0,51.0,0.5
animation,OblexObleckobla,RT McCardArt New animationFeaturing hylics 2 composer chucksalamone I did my best to make this reality Thanks to annachloemo,en,2022-05-03,,['hylics'],positive,0.0,338.0,0.6
animation,Mamochi,RT tuyoki more progress on this animation,en,2022-05-03,inarizaki,[],positive,0.0,2523.0,0.5
animation,WakibiZ,RT lcreationz Spice up your video projects with the next level 3D animation and motion graphics using one of our topnotch 3D animators,en,2022-05-03,Uganda,[],positive,0.0,3.0,0.5
animation,Kynsofficial,1 CSS animations and effect Every designer dream is to create great design with formidable UI and user experience Animation gives one the sweetest feelings and I know a guy that could helpThat guy is,en,2022-05-03,ceo@aptlearn.io,[],positive,0.0,0.0,0.8
animation,ToonTroops,RT CGAStudioGames Happy TrailerTuesday Since weve shared Virtual Driving Schools trailer before today were sharing something bran,en,2022-05-03,,['TrailerTuesday'],positive,0.0,7.0,0.8
animation,dosei_no_kozika,RT ProjectMili NEW SONGGIVE ME RICEanimated music videopremiering MAY 6Animation by SEWINGBUG,en,2022-05-03,イベリアも頼れるようになったロドス,[],neutral,0.0,201.0,0.0
animation,Diegax__,RT DailyMangas Gun Animation,en,2022-05-03,zone 51,[],neutral,0.0,10902.0,0.0
animation,izukatsudon,i therefore conclude wit studio made this movie to flex their superior animation angles,en,2022-05-03,21 ☁️ she/they ☁️ asian,[],positive,0.0,0.0,0.7
animation,MiyataAoi1,RT yayamiOfficial animaechan This seasons very goodlooking suspense animation with the feeling of Steins Gate and Re Zero I recommen,en,2022-05-03,,[],positive,0.0,3.0,0.2
animation,rinnie0718,RT PencilWorkshop justiceforspongebob We all worked on this project for 2 years and poured in original animation art voice acting mus,en,2022-05-03,,['justiceforspongebob'],positive,0.0,11230.0,0.1875
animation,medicinehelp,Orm and Cheep Five Enchanting Tales Cartoon Animation Grown Ups KidsToys,en,2022-05-03,"Atlanta,GA",[],neutral,0.0,0.0,0.0
animation,sm_graym,RT michaelCuevas27 For beginner animators I recommend the following short amp simple drill to train your eye sensitivity for timing and sp,en,2022-05-03,Ukraine,[],neutral,0.0,599.0,0.0
animation,ytissyblaize,RT Saberspark For the last 2 years this dedicated team of passionate fans recreated the SpongeBob movie brick by brick with unique anima,en,2022-05-03,,[],positive,0.0,12529.0,0.1083333333333333
animation,spaceribbon,RT CGAStudioGames Happy TrailerTuesday Since weve shared Virtual Driving Schools trailer before today were sharing something bran,en,2022-05-03,"Liverpool, England",['TrailerTuesday'],positive,0.0,7.0,0.8
animation,s0f1kka,RT WTHDIDT Happy birthday to the legend himself Eric Goldberg Responsible for bringing the Genie to life directing the animation in Lo,en,2022-05-03,at home,[],positive,0.0,191.0,0.6
animation,ripice_,RT DivineStudi0s SAYF The GreatswordIt was discovered in an Arabian desert posted as a conquerors trophy in the ancient sandsmore,en,2022-05-03,Puerto Rico,[],neutral,0.0,124.0,0.0
animation,AndrewDunn10,RT royalsociety Suspended animation is a common device in science fiction But just how efficient would hibernation be for an animal th,en,2022-05-03,London,[],negative,0.0,2.0,-0.3
animation,NoodlesBotRemy,RT thetomska Not sure Ive ever shown this before but this 12yearold clip from 2006 is actually the first asdf animation ever It was m,en,2022-05-03,any pronouns,[],neutral,0.0,108.0,0.0
animation,techjunkiejh,Netflixsponsored anime school trains new generation of animators amid genres soaring demand education Career CareersTj MoviesTvTj TechJunkieInvest MoviesTvTj animation,en,2022-05-03,,"['Netflix', 'anime', 'education', 'Career', 'CareersTj', 'MoviesTvTj', 'TechJunkieInvest', 'MoviesTvTj', 'animation']",positive,0.0,1.0,0.1363636363636363
animation,kolomania4,CRAMEScopeDog wow really good animationyou really good animator,en,2022-05-03,,[],positive,1.0,0.0,0.7000000000000001
animation,Timtamdzns,RT SpoonzyEdits May the 4th be with you A short star wars animation StarWarsDay,en,2022-05-03,"Perth, Western Australia",['StarWarsDay'],neutral,0.0,4.0,0.0
animation,akira_5052505,RT ProjectMili NEW SONGGIVE ME RICEanimated music videopremiering MAY 6Animation by SEWINGBUG,en,2022-05-03,テレクシエ・ペイア号とキングオブヘリングスを行ったり来たり,[],neutral,0.0,282.0,0.0
animation,mooniary,RT afrogxnya seeing a lot of talk on the tl about how antiblackness is very much present in animation and I just wanna bring up how often,en,2022-05-03,stress,[],neutral,0.0,542.0,0.0
animation,NorusArtBook,RT tuyoki more progress on this animation,en,2022-05-03,,[],positive,0.0,2523.0,0.5
animation,twicemawed,Updated my donation alert Cant wait to work on my other alerts Its a fun exercise in my animating skills as wellVtubers VTuberEN Vtuber VTuberUprising VTU animation CLIPSTUDIOPAINT Hermitcrab Crab streamers,en,2022-05-03,,"['Vtubers', 'VTuberEN', 'Vtuber', 'VTuberUprising', 'VTU', 'animation', 'CLIPSTUDIOPAINT', 'Hermitcrab', 'Crab', 'streamers']",positive,0.0,0.0,0.071875
animation,wgsgrama,RT gaw1ik One of my favorites from last week I made quite a few tweaks towards the end of the week that have given a lot more life to th,en,2022-05-03,,[],positive,0.0,6.0,0.0999999999999999
animation,YAMAMETOSAIKOU,RT ProjectMili NEW SONGGIVE ME RICEanimated music videopremiering MAY 6Animation by SEWINGBUG,en,2022-05-03,,[],neutral,0.0,315.0,0.0
animation,halfmoonriri,RT ProjectMili NEW SONGGIVE ME RICEanimated music videopremiering MAY 6Animation by SEWINGBUG,en,2022-05-03,ヒント:ヤンキーピラフ,[],neutral,0.0,315.0,0.0
animation,xoByza,We all have that one green animation that we cant miss with whats your,en,2022-05-03,Australia,[],negative,0.0,0.0,-0.2
animation,NeguchiMaroyama,RT iterorg At ITER preparations for a remarkable lift are ongoing the transfer into the Tokamak Pit of the first section of the vacu,en,2022-05-03,,"['ITER', 'Tokamak', 'vacu']",positive,0.0,3.0,0.5
animation,LucasIllustrate,RT KoRyAbeebee Pinky sneezing REMAKEanimation wilfordwarfstache,en,2022-05-03,,"['animation', 'wilfordwarfstache']",neutral,0.0,1027.0,0.0
animation,sayz_simone,RT NikiLeSunshine1 Such moving artwork from ResetNft from the LITWTF Artist List Check it out LITsupportLIT,en,2022-05-03,,['LITsupportLIT'],neutral,0.0,2.0,0.0
animation,Scrubben_,RT thetomska Not sure Ive ever shown this before but this 12yearold clip from 2006 is actually the first asdf animation ever It was m,en,2022-05-03,p:azzles h:_alextwt,[],neutral,0.0,88.0,0.0
animation,de_squirrel7,RT WTHDIDT Happy birthday to the legend himself Eric Goldberg Responsible for bringing the Genie to life directing the animation in Lo,en,2022-05-03,"Sacramento, CA",[],positive,0.0,101.0,0.6
animation,soyokaze93,RT Ahmedmedhat000 How the Hunter x Hunter 99 adapted kurapikas chain fighting style into animationis one of the most creative,en,2022-05-03,United States,[],positive,0.0,1698.0,0.5
