Keyword,User,Tweet,Language,Time,User Location,Hashtag,Polarity,Likes,Retweet,Sentiment
animation,DepressedMoonch,RT redblueen Trying a different light setup on this one I like the color contrast but shadows in the previous clip made the image to lo,en,2022-04-21,ı don't know where ı belong,[],positive,0.0,86.0,0.0777777777777777
animation,samtendo09,RT ScratchyDerose I find it funny how many are now saying that Disney Seth McFarlane Boss Baby or Cocomelon have ruined Animation forev,en,2022-04-21,,[],positive,0.0,474.0,0.375
animation,Valarjar,RT BombowyL Dont miss the premiere of my new animationYou can watch it tomorrow at 1700 CEST on YouTube,en,2022-04-21,Fólkvangr,[],positive,0.0,11.0,0.1363636363636363
animation,sadch55se,อยากเห็นมิลลิได้พากย์ animation สักเรื่องอ่า ทำให้กันได้มึ้ยยย,th,2022-04-21,in the fridge forever,[],,0.0,0.0,0.0
animation,DJMurphy_05,RT genegoldstein The animation industry in America is in an absolute free fall and I would suggest anybody looking to get their ideas ma,en,2022-04-21,nowhere and everywhere,[],positive,0.0,31.0,0.3
animation,16bitjeff,RT genegoldstein I dont want people to see this as fearmongering or me being dramatic though maybe a little but what I DO want is fo,en,2022-04-21,"Springfield, MA",[],negative,0.0,12.0,-0.3104166666666667
animation,orbluoil,RT hikariviny Ejem Yeah 3D animation is cool and all butSEGA CAN WE PLEASE HAVE A 2D ANIMATED SERIESI mean just look how good,en,2022-04-21,PROSHIP DNI,[],positive,0.0,303.0,0.0625
animation,PelleCreepy,SantorioG POTUSThump The plot and animation quality gets kinda lost in season 3 but some of the best episodes are in that next batch I cant recall if youre using it or not but I tweaked my viewing order up through season 3 to restore some of the intended story arcs,en,2022-04-21,,[],positive,0.0,0.0,0.5
animation,tinyxkkuno,RT GEiRU SYKKUNO MERCH SOONI did a little something for Sykkunos merch dropsyktwt sykkunomerch Sykkuno SykkunoFanart hoo,en,2022-04-21,any pronouns 🇵🇭 22,"['syktwt', 'sykkunomerch', 'Sykkuno', 'SykkunoFanart', 'hoo']",negative,0.0,206.0,-0.234375
animation,deyztro,RT Kiecaburn YOOOOO i cant believe how much love you guys are giving to my animation i cant thank you enough,en,2022-04-21,i love my fucking girlfriend,[],positive,0.0,159.0,0.5
animation,Aephetetg,RT noeyJ ไม่รู้จะมีประโยชน์ไหม แต่ช่องยูทูปสอนวาดรูปที่เราดูมีประมาณนี้ แล้วเราดูฝึกมาเอง ไม่เคยไปหาที่ติวที่ไหนเลย คือmarco buccii,th,2022-04-21,โพนีแลนด์แดนพิงกี้พาย,[],positive,0.0,3774.0,66.67
animation,Cailex_z,In or Out is an absolutely perfect comic Its living rent free in my head Manga manhwa amphibia animation,en,2022-04-21,,"['Manga', 'manhwa', 'amphibia', 'animation']",positive,0.0,0.0,0.6041666666666666
animation,penguincaster,RT noeyJ ไม่รู้จะมีประโยชน์ไหม แต่ช่องยูทูปสอนวาดรูปที่เราดูมีประมาณนี้ แล้วเราดูฝึกมาเอง ไม่เคยไปหาที่ติวที่ไหนเลย คือmarco buccii,th,2022-04-21,,[],positive,0.0,4108.0,66.67
animation,antloks,RT OriginalFunko Coming soon POP Animation The Simpsons Homer in Hedges Preorder for your collection today,en,2022-04-21,"Fresno, CA",[],neutral,0.0,460.0,0.0
animation,Freezebit22,Gonna do some comic reading manhua animationdev gamedev animation,en,2022-04-21,,"['manhua', 'animationdev', 'gamedev', 'animation']",positive,0.0,0.0,0.25
animation,xbaizhux,RT whotaoist This burst animation,en,2022-04-21,,[],neutral,0.0,2004.0,0.0
animation,rodent_pawz,RT Salterin0 i did a quick thing for friendsanimationanimationan,en,2022-04-21,somewhere in canada ,[],positive,0.0,36.0,0.3333333333333333
animation,garciagerard320,RT genegoldstein The animation industry in America is in an absolute free fall and I would suggest anybody looking to get their ideas ma,en,2022-04-21,,[],positive,0.0,31.0,0.3
animation,inspiredrawAW,RT DrewTailored For those asking heres a nonpaywalled version of my Netflix Animation story thanks russfischer And yes Bone is,en,2022-04-21,Commissions are open!,[],positive,0.0,95.0,0.25
animation,tripnipalex,RT genegoldstein The animation industry in America is in an absolute free fall and I would suggest anybody looking to get their ideas ma,en,2022-04-21,"Greenville, South Carolina",[],positive,0.0,31.0,0.3
animation,z_overpowered,RT RiseFallNickBck Per the Yahoo article on the Netflix layoffs Netflix cited The Boss Baby Animated series as The series all animat,en,2022-04-21,"Iowa, USA",[],neutral,0.0,206.0,0.0
animation,Fang65851912,man when will people take animation seriously,en,2022-04-21,Tennessee,[],negative,0.0,0.0,-0.3333333333333333
animation,mvbrat91,It seems Pixar has noticed the Netflix animation layoffs as if it were the Bat signal At least those people care,en,2022-04-21,West Virginia ,[],negative,0.0,0.0,-0.3
animation,baeyuni,RT mekameeart shake shake catanimation cat funny dance shake,en,2022-04-21,,"['animation', 'cat', 'funny', 'dance', 'shake']",positive,0.0,1391.0,0.25
animation,smileyzard,Looking for 3D Animation NFT at a low priceHere it is NFT NFTCommunity NFTGiveaway NFTartist NFTartist NFTshill NFTProject 3Danimation 3DNFT 3dmodeling Blender3d artwork illustration Etherum OpenSeaNFT Etherum lizard,en,2022-04-21,Southeast Sulawesi,"['NFT', 'NFTCommunity', 'NFTGiveaway', 'NFTartist', 'NFTartist', 'NFTshill', 'NFTProject', '3Danimation', '3DNFT', '3dmodeling', 'Blender3d', 'artwork', 'illustration', 'Etherum', 'OpenSeaNFT', 'Etherum', 'lizard']",neutral,0.0,1.0,0.0
animation,mairinriybe,Netflix Animation Erased Executives Fired Shows Canceled and Accusations of Staged Data Exclusive via Yahoo,en,2022-04-21,,[],neutral,0.0,0.0,0.0
animation,choudhary9772,RT AwanishSharan Make Time For Your Children Before Its Too LateBrilliant animation And a very deep and powerful message,en,2022-04-21,"Jaipur, India",[],positive,0.0,622.0,0.225
animation,MESIAS_ROCKET,RT b0tster Made a little animation and integrated them into the start of the race albeit with some missing sound effects,en,2022-04-21,La Mesianica,[],positive,0.0,30.0,0.0375
animation,S71396811Alyssa,RT RiseFallNickBck Not many more tragic and unlucky stories out there like Jeff Smiths BoneHe has literally been trying since 1990 f,en,2022-04-21,canterlot,[],negative,0.0,24.0,-0.1666666666666666
animation,ZWB009,RT diegovl2609 Kiecaburn Now thats what i call impact incredible animation also sfx and music cause why not,en,2022-04-21,South Carolina,[],positive,0.0,42.0,0.9
animation,godzillaisb,RT ScratchyDerose I find it funny how many are now saying that Disney Seth McFarlane Boss Baby or Cocomelon have ruined Animation forev,en,2022-04-21,,[],positive,0.0,306.0,0.375
animation,youshiyt,PenguinOp6 HalfEyedGhoul Phoenixoofss1 Animation carry Look at my hero thats popular to but its also 010 story its bland and over used,en,2022-04-21,,[],positive,0.0,0.0,0.2166666666666666
animation,StephenLuque,RT BixelsWixels With the news of cancellationsfirings from Netflix Animation I gotta remind everyone to support indie animation as its,en,2022-04-21,"San Diego, CA",[],neutral,0.0,39.0,0.0
animation,Cha_ongong,RT noeyJ ไม่รู้จะมีประโยชน์ไหม แต่ช่องยูทูปสอนวาดรูปที่เราดูมีประมาณนี้ แล้วเราดูฝึกมาเอง ไม่เคยไปหาที่ติวที่ไหนเลย คือmarco buccii,th,2022-04-21,,[],positive,0.0,3557.0,66.67
animation,Nocturne_dragon,RT zakeno A little animation I did a little bit ago of my two pet mantids at the time Cryptid and Scully Cryptid was trying https,en,2022-04-21,"Santa Monica, CA",[],negative,0.0,102.0,-0.2109375
animation,PanzerThiefZer0,RT RiseFallNickBck Not many more tragic and unlucky stories out there like Jeff Smiths BoneHe has literally been trying since 1990 f,en,2022-04-21,Australia (trans rights),[],negative,0.0,161.0,-0.1666666666666666
animation,moonycarrot,RT Peace0fMind Congrats to all the new test subjects I finished up my first ever animation yesterday Whats the posse think pssssd,en,2022-04-21,"Ho Chi Minh, Vietnam","['posse', 'pssssd']",positive,0.0,18.0,0.2102272727272727
animation,ida7007,RT QueenVIPam The animation is greatThe singing YGGlobalVIP BIGBANG BIGBANGStillLife,en,2022-04-21,,"['BIGBANG', 'BIGBANG_StillLife']",positive,0.0,243.0,0.8
animation,MegaJaguarKipo,RT averydmerrick SheRa is trending right My response watch SheRa and the Princesses of Power 2018 if you didnt yet Its a great,en,2022-04-21,,[],positive,0.0,62.0,0.2857142857142857
animation,larukenciel,RT noeyJ ไม่รู้จะมีประโยชน์ไหม แต่ช่องยูทูปสอนวาดรูปที่เราดูมีประมาณนี้ แล้วเราดูฝึกมาเอง ไม่เคยไปหาที่ติวที่ไหนเลย คือmarco buccii,th,2022-04-21,strawberry field,[],positive,0.0,3469.0,66.67
animation,AllSystemsWrite,Manifesting riches thatll help me build an animation studio and pay sweet wages,en,2022-04-21,"Los Angeles, CA",[],positive,0.0,0.0,0.35
animation,lowpoly_tweeter,RT CCWVIBI Rebel Pistol Animation Set Primary Use Burst FireSecondary Use Full Auto Reference G19unity3d madewithunity gam,en,2022-04-21,The Cloud,"['unity3d', 'madewithunity', 'gam']",positive,0.0,18.0,0.15
animation,maxfolkmax,Incredibly disappointing The brief time Nick and I had to work with Netflix Animation on We Lost Our Human was among our best work experiences No clashing personalities and the atmosphere was the perfect conduit for creativity,en,2022-04-21,Los Angeles,[],positive,0.0,0.0,0.2799999999999999
animation,nguyenhimself,Netflix currently touts Boss Baby as the ideal of what an animated series on the platform should be and what kind of numbers those animated series should be bringing inWhoa,en,2022-04-21,"Ho Chi Minh City, Vietnam",[],positive,0.0,0.0,0.5
animation,Jehinite,RT TheOneAzrai well rescuing crappy screencaps of botw moments I enjoyed by making them into faux ghiblilike animation cells is a stres,en,2022-04-21,Cardiff,[],positive,0.0,39.0,0.5
animation,BaezSamaris,RT breanimator Netflix Animation bubble bursting Right wing weirdos continue to smear Disney colleagues for their weird homophobic agend,en,2022-04-21,Puerto Rico 🇵🇷,[],negative,0.0,361.0,-0.1071428571428571
animation,EssexON_Fire,RT HFSCorg Dont get fooled by myths Home fire sprinklers are activated by the high heat of a fire not smoke Learn all the facts on o,en,2022-04-21,"Essex, Ontario, Canada",[],positive,0.0,14.0,0.16
animation,bmyfirstletter,thirsty4souls Literally having to memorize an animation loop should not be a good indication because most player wont know or have time for it especially for how niche it is,en,2022-04-21,Myers house,[],positive,0.0,0.0,0.3999999999999999
animation,tama_thatsme,RT Alberto9Herrera Whats been happening at Netflix Animation is very upsetting At the beginning it was seen as a great place for the,en,2022-04-21,"England, United Kingdom",[],positive,0.0,684.0,0.5
animation,7GaP76rlqAAvT4X,RT noeyJ ไม่รู้จะมีประโยชน์ไหม แต่ช่องยูทูปสอนวาดรูปที่เราดูมีประมาณนี้ แล้วเราดูฝึกมาเอง ไม่เคยไปหาที่ติวที่ไหนเลย คือmarco buccii,th,2022-04-21,,[],positive,0.0,3257.0,66.67
animation,decemberdesire,RT noeyJ ไม่รู้จะมีประโยชน์ไหม แต่ช่องยูทูปสอนวาดรูปที่เราดูมีประมาณนี้ แล้วเราดูฝึกมาเอง ไม่เคยไปหาที่ติวที่ไหนเลย คือmarco buccii,th,2022-04-21,They/Them,[],positive,0.0,3257.0,66.67
animation,Priyamkkk341,RT mrscoop Sony Animations SpiderMan Across the SpiderVerse has been delayed to June 2 2023,en,2022-04-21,,[],neutral,0.0,3.0,0.0
animation,W0817_S0525,RT CloverSakuga Spoiler warningSource Black Clover 093Key Animation GemSakugabooru BlackClover,en,2022-04-21,She/Her Bisexual🖤🤍,"['093', 'BlackClover']",negative,0.0,34.0,-0.0833333333333333
animation,pxrkhdjh,RT LSMark The nicest character in animation history,en,2022-04-21,,[],neutral,0.0,22307.0,0.0
animation,Maruti552,RT kishanreddybjp On the occasion of 400th Parkash Parv of Guru Tegh Bahadur ji PM Shri narendramodi ji will release a postage stamp amp c,en,2022-04-21,,[],neutral,0.0,103.0,0.0
animation,ZocaLight,RT StuartsPixels Ive added animation and sound to my developerlogo I miss the old Nintendo and Gameboy logos and the little sounds th,en,2022-04-21,👇👇👇❤,['developerlogo'],positive,0.0,8.0,0.1041666666666666
animation,digital_hamid,RT vincentschwenk And here is the animation for the new S26 start screen This is really a huge honor Every time I open C4D now it make,en,2022-04-21,NFT community,[],positive,0.0,38.0,0.1787878787878788
animation,Deepanshu566605,RT TataCrucible Any Shrek fans in the house This one is for you Dreamworks Animation is a subsidiary of which major Hollywood company,en,2022-04-21,"Sonipat, India",[],positive,0.0,26.0,0.0625
animation,ArchivesJuicey,RT kse332official Boxing rough animation,en,2022-04-21,,[],negative,0.0,22362.0,-0.1
animation,XpSrEKEvjZ,RT GalaxyHeroesGHC Work hard in silence regardless of what naysayers thinkGHC GHC GalaxyHeroes GHX BSC BSCGem GameFi PlayToEar,en,2022-04-21,,"['GHC', 'GalaxyHeroes', 'GHX', 'BSC', 'BSCGem', 'GameFi', 'PlayToEar']",negative,0.0,270.0,-0.2916666666666667
animation,TanseemHaider,RT AwanishSharan Make Time For Your Children Before Its Too LateBrilliant animation And a very deep and powerful message,en,2022-04-21,India,[],positive,0.0,249.0,0.225
animation,WizardLimon,RT ScratchyDerose I find it funny how many are now saying that Disney Seth McFarlane Boss Baby or Cocomelon have ruined Animation forev,en,2022-04-21,they/them 𖧷 AroAce ,[],positive,0.0,315.0,0.375
animation,CleverMonkey12,Morning NFT famNo sale but still up and working hardSmooth wavy shiny sexy cool animationWishing everyone an amazing and peaceful day,en,2022-04-21,,[],positive,0.0,0.0,0.3013888888888889
animation,callie_wei,RT mochokofilm Im thinking to master these basic animation below is first step to be an animator in JapanWalking RunningTurnRota,en,2022-04-21,"Los Angeles, CA",[],positive,0.0,739.0,0.125
animation,Duffel_555,RT Treyvon One piece fans are crazily insanely talented just LOOK AT THIS This guy name Jazy made a fan animation of gear 5th alread,en,2022-04-21,,[],positive,0.0,1387.0,0.7
animation,cynthiaaldaba2,RT GinaCastro Beautiful Animation SONIC SonicTheHedgehog,en,2022-04-21,"Phoenix, AZ","['SONIC', 'SonicTheHedgehog']",positive,0.0,3.0,1.0
animation,RearwardDrake18,RT gostephgo Netflix Animation burned hot and bright at the start and its upsetting to watch in real time so many talented creatives t,en,2022-04-21,"Houston, TX",[],positive,0.0,380.0,0.47
animation,wabayyera,RT dailymouche scaramouche bird idle animation feels so real to me ill actually cry if it doesnt happen,en,2022-04-21,icon : kayachan__ ,[],neutral,0.0,95.0,0.0
animation,shyamashishyad2,RT AwanishSharan Make Time For Your Children Before Its Too LateBrilliant animation And a very deep and powerful message,en,2022-04-21,,[],positive,0.0,458.0,0.225
animation,wasaab_i,Check out much more on Bilibili Comics search Nations Hunk is Hooked on Me and favorite Manga conceptart animation NFTGiveaway,en,2022-04-21,,"['Manga', 'conceptart', 'animation', 'NFTGiveaway']",positive,0.0,1.0,0.5625
animation,Vnend,RT DrewTailored Here it is my big piece on the current state of Netflix Animation specifically Kids amp Family series Thank you to ever,en,2022-04-21,"Sol 3, until further notice.",[],neutral,0.0,537.0,0.0
animation,_lalaying,RT noeyJ ไม่รู้จะมีประโยชน์ไหม แต่ช่องยูทูปสอนวาดรูปที่เราดูมีประมาณนี้ แล้วเราดูฝึกมาเอง ไม่เคยไปหาที่ติวที่ไหนเลย คือmarco buccii,th,2022-04-21,รอน้องซองชานเสมอ,[],positive,0.0,4026.0,66.67
animation,SxlflessHeart,OMG THIS ANIMATION IS SO FOOKING CUTE,en,2022-04-21,Pfp/Header - @1L9l2Aa8UCL0IGJ,[],positive,0.0,0.0,0.78125
animation,Dominique_Zoey,RT LBMMTheMovie The wait is finally over Nigerias first cinematic feature length animation movie Ladybuckit amp the Motley Mopsters is,en,2022-04-21,,[],positive,0.0,1668.0,0.2125
animation,LordSpamBot,RT Kiecaburn Tarnished vs Godskin Duo Animation ELDENRING,en,2022-04-21,,"['Animation', 'ELDENRING']",neutral,0.0,3652.0,0.0
animation,physalus_,RT meganglenna Morning Commute pixelart animation,en,2022-04-21,cyber / @jiuyeonl,"['pixelart', 'ドット絵', 'animation']",neutral,0.0,1126.0,0.0
animation,little_chibs,RT jarofjamm NSFW text audio animation wip idk if i wanna do clean up on this so here lolakiyama has something to sayht,en,2022-04-21,Under My Blanket,[],positive,0.0,3.0,0.1388888888888889
animation,callmedaddy204,RT RiseFallNickBck Netflix in the span of like a week went from beloved to public enemy number one in animationIts genuinely impressiv,en,2022-04-21,USA ,[],positive,0.0,212.0,0.3666666666666667
animation,MemphisR56,RT MarcusLarry627 Im just gonna say itA sonic cartoon with this artstyle and flying bark handling the animation would be the fucking D,en,2022-04-21,Liverpool - COMMISSIONS OPEN,[],negative,0.0,1049.0,-0.6
animation,kyospotatoes,RT SaveNimona Feeling for everyone over at Netflix Animation right now Yall deserve better than this,en,2022-04-21,khami/kyo he/she,[],positive,0.0,362.0,0.3928571428571428
animation,ruhi_mukherjee,RT AwanishSharan Make Time For Your Children Before Its Too LateBrilliant animation And a very deep and powerful message,en,2022-04-21,"Mumbai, India",[],positive,0.0,1194.0,0.225
animation,iTz_xKarim,RT JoeMiller101 Animation Director SonySantaMonica reaffirmsGodofWarRagnarok is coming this year,en,2022-04-21,"Pandora,Shear,Typhoon,Rupture",['GodofWarRagnarok'],neutral,0.0,73.0,0.0
animation,niccinft,RT seerlight M a p l e w a v ei wonder if they remember me like how I remember them me to my old maple friends who stopped logging,en,2022-04-21,Philippines,[],positive,0.0,83.0,0.1
animation,fatherperiodic,RT enderu First Person Shooter Animationindieanime animation,en,2022-04-21,,"['indie_anime', 'animation']",positive,0.0,1001.0,0.25
animation,vexusdylan,RT genegoldstein The animation industry in America is in an absolute free fall and I would suggest anybody looking to get their ideas ma,en,2022-04-21,Indiana,[],positive,0.0,870.0,0.3
animation,Tasarii2,RT RiseFallNickBck Not many more tragic and unlucky stories out there like Jeff Smiths BoneHe has literally been trying since 1990 f,en,2022-04-21,Birmingham ,[],negative,0.0,1195.0,-0.1666666666666666
animation,Guns205,RT lordsoftheseth disney plus please add option to view The Clone Wars in reverse production order so I can watch the animation slowly de,en,2022-04-21,United States,[],negative,0.0,12.0,-0.3
animation,link_kata,RT OdexEnix Kiecaburn Small Volume WarningI tried putting Sfx W Animation,en,2022-04-21,,[],negative,0.0,88.0,-0.25
animation,Science_Pack,RT MarcusLarry627 Im just gonna say itA sonic cartoon with this artstyle and flying bark handling the animation would be the fucking D,en,2022-04-21,UUHHH.,[],negative,0.0,1139.0,-0.6
animation,bakarai120,RT KJOEE88 Animated artwork Character background effect Lets Gooo Finana Ryugu Animation C,en,2022-04-21,idk,[],neutral,0.0,251.0,0.0
animation,vanitlee,RT DendeIsMe Demon slayer might have the BEST animation NGL,en,2022-04-21,"Kansas City, MO",[],positive,0.0,7.0,1.0
animation,RetroUpgrade,RT RiseFallNickBck Not many more tragic and unlucky stories out there like Jeff Smiths BoneHe has literally been trying since 1990 f,en,2022-04-21,"Indiana, USA",[],negative,0.0,1195.0,-0.1666666666666666
animation,sornshinexx,RT dailymouche scaramouche bird idle animation feels so real to me ill actually cry if it doesnt happen,en,2022-04-21,she/he/they,[],neutral,0.0,598.0,0.0
animation,poke_pumpkin,RT starteas Weve reached our goal but hey why not continue to support Lumi and the Great Big Galaxy Indie animation is in a state,en,2022-04-21,In a tragic comedy,[],positive,0.0,17.0,0.2666666666666666
animation,LJParent,RT RiseFallNickBck Not many more tragic and unlucky stories out there like Jeff Smiths BoneHe has literally been trying since 1990 f,en,2022-04-21,Lives on Earth,[],negative,0.0,1195.0,-0.1666666666666666
animation,vinconsummer,RT noeyJ ไม่รู้จะมีประโยชน์ไหม แต่ช่องยูทูปสอนวาดรูปที่เราดูมีประมาณนี้ แล้วเราดูฝึกมาเอง ไม่เคยไปหาที่ติวที่ไหนเลย คือmarco buccii,th,2022-04-21,mha tr jjk hk ,[],positive,0.0,4652.0,66.67
animation,DhaniRaam5,The plot of My Sassy Wife is like a roller coaster of emotion Its riveting and full of surprises comic animation milkmochabear Manga,en,2022-04-21,,"['comic', 'animation', 'milkmochabear', 'Manga']",positive,0.0,0.0,0.3958333333333333
animation,CardelEnt,RT animationirel Congratulations to the 17 producers selected for this yearss Animation Special Delighted for our members Alan Holly,en,2022-04-21,Ireland,"['producers', 'Animation']",positive,0.0,4.0,0.5732142857142857
animation,HaqueDipty,I wanna try out this comic book style comic animation milkmochabear Manga,en,2022-04-21,,"['comic', 'animation', 'milkmochabear', 'Manga']",positive,0.0,0.0,0.25
animation,lonercollector,SCDS05 Kyteau Both shows are pretty cool though eventually you do get sick of TTG after all the spamAlso its not even made by CN they license it out from WB Animation but they do decide when to renew it iirc,en,2022-04-21,"California, USA",[],negative,0.0,0.0,-0.0380952380952381
animation,AnimacionSmith,RT BonnieBranson Studios arent the heart n soul of the animation industry we are,en,2022-04-21,,[],neutral,0.0,260.0,0.0
animation,bakarai120,RT KJOEE88 Animated artwork Character background effect Lets Gooo Emiru Animation Commissio,en,2022-04-21,idk,[],neutral,0.0,227.0,0.0
animation,Peavolov,RT teeapostrophee Serious question no shade is meant How secure is the animation job industry when I see all my favorite artists cons,en,2022-04-21,Dublin,[],positive,0.0,232.0,0.1888888888888888
animation,LaurenFoxWrites,RT TheCelticTampon we need your supportWelcome to 2022 BotbCartoonCreator TheCelticTampon CoSR parkerrsimmons EPs Game,en,2022-04-21,Australia,[],positive,0.0,353.0,1.0
animation,AliKhan43886443,Gonna do some comic reading SPYFAMILY bilibilicomics holoCouncil animation,en,2022-04-21,,"['SPY_FAMILY', 'bilibilicomics', 'holoCouncil', 'animation']",positive,0.0,0.0,0.25
animation,aa_maker_eilan,RT SakimichanA Tifa animation work in progress 3,en,2022-04-21,이불 속,[],positive,0.0,163.0,0.5
animation,IncubatedGeekCC,A refactored version of its prototype Built with clientside JavaScriptjavascript GIF Animation webdev Video coding fps,en,2022-04-21,Singapore,"['javascript', 'GIF', 'Animation', 'webdev', 'Video', 'coding', 'fps']",neutral,0.0,0.0,0.0
animation,DynatropePress,RT TheCelticTampon we need your supportWelcome to 2022 BotbCartoonCreator TheCelticTampon CoSR parkerrsimmons EPs Game,en,2022-04-21,,[],positive,0.0,353.0,1.0
animation,MrJiavo,ZooLSmith You should look at the galil inspect animation now,en,2022-04-21,,[],neutral,0.0,0.0,0.0
animation,HeyJude19writes,RT teaandmalfoy i promise one day ill animate him speaking properly but for now this is for all you dhr lovelies who make me cry with,en,2022-04-21,,[],neutral,0.0,7.0,0.0
animation,gdesaaa,RT QueenVIPam The animation is greatThe singing YGGlobalVIP BIGBANG BIGBANGStillLife,en,2022-04-21,+66,"['BIGBANG', 'BIGBANG_StillLife']",positive,0.0,515.0,0.8
animation,JSchoonmakerArt,RT AniMat505 Remember how people say that Nickelodeon is poorly run because their business model is if its not as big as SpongeBob the,en,2022-04-21,,[],negative,0.0,265.0,-0.2
animation,selaicoklatkcg,theramalmedia I mean let alone animation Android is still filled with graphical issues such as solid background color that is different from the app color on both navigation bar and status bar,en,2022-04-21,,[],positive,0.0,0.0,0.0175
animation,RealDINNERman,RT CNschedules Today in unrelated news Phil Rynda Netflixs Director of Creative Leadership and Development for Original Animation has,en,2022-04-21,"CWCville, VA",[],positive,0.0,1142.0,0.4375
animation,CardelEnt,RT ScreenIreland Delighted to be supporting this workshop for animation producers and congrats to Alan Holly from andmapsandplans and Ca,en,2022-04-21,Ireland,[],positive,0.0,3.0,0.475
animation,ShrimpHaze,FlywheelKnot feelsbadmanbut i get what they mean by lacking the actual new animation that isnt recycled from other attacks isnt as smooth as the rest of the attack,en,2022-04-21,behind you (hi),[],positive,0.0,0.0,0.0197727272727272
