Keyword,User,Tweet,Language,Time,User Location,Hashtag,Polarity,Likes,Retweet,Sentiment
animation,Lzybird,RT bokammandala The journey of life processes781 XTZLink for buy,en,2022-05-03,Somewhere ,[],neutral,0.0,9.0,0.0
animation,PakR_,RT kuniimitsu Yoru animation cancel on newest patch,en,2022-05-03,,[],neutral,0.0,8.0,0.0
animation,KateSullivan01,Almost The WholeHog Analog35mm Letraset ReeltoReel and bit of digital editingdaw ingSoundtracks made using manipulated recordings by the late great TonyPritchettMovingImage ExperimentalFilm Animation Wigglegram stereoscopic WeirdWalk stereoscopicsoc,en,2022-05-03,Shoeburyness,"['WholeHog', 'Analog', '35mm', 'Letraset', 'ReeltoReel', 'daw', 'TonyPritchett', 'MovingImage', 'ExperimentalFilm', 'Animation', 'Wigglegram', 'stereoscopic', 'WeirdWalk']",positive,0.0,0.0,0.1666666666666666
animation,pedram_jamadi,RT erphanmalek My first mint on formfunction Listed for 058 Solana What are you talking about,en,2022-05-03,,['Solana'],positive,0.0,1.0,0.25
animation,pillow_flite,RT piipstachio cookierun wip Finished the first rough draft of the vampire cookie animation now I gotta do a second draft,en,2022-05-03,"Alexandria, Egypt",['cookierun'],negative,0.0,3.0,-0.15
animation,iEatAsbestos4dr,RT Saberspark For the last 2 years this dedicated team of passionate fans recreated the SpongeBob movie brick by brick with unique anima,en,2022-05-03,,[],positive,0.0,12651.0,0.1083333333333333
animation,maggieemage,RT JamesRowley21 Happy Birthday to the amazing Eric Goldberg The animator behind Genie Louis the Alligator and Rabbit and the animation,en,2022-05-03,"Laguna Niguel, CA",[],positive,0.0,185.0,0.3333333333333333
animation,Coolartist1110,RT charquipvee Character Demo Reel If its a badass bitch yandere stalker emotional antihero or even a seductive temptress I ca,en,2022-05-03,The Starboard Bow,[],neutral,0.0,16.0,0.0
animation,ribz_rb,RT Matema Everything to keep you entertained is up on this telegram channelBoth newly released movies old time classic movies adult,en,2022-05-03,,[],positive,0.0,19.0,0.1343434343434343
animation,rinya_kat,RT haiyan331 kaelucHappy birthday to DilucGenshin Impact MV KaeLuc fan animation Night KnightArtAnimation HaiyanCompo,en,2022-05-03,,"['ガイディル', 'kaeluc']",positive,0.0,154.0,0.8
animation,RevivedSin,RT AIRNews01 Kamen Rider anime FUUTO PI begins streaming weekly in Japan on August 1 Animation Studio KAITheyve also unveiled a,en,2022-05-03,"Bae Area, CA",[],neutral,0.0,19.0,0.0
animation,kithingu,RT haiyan331 kaelucHappy birthday to DilucGenshin Impact MV KaeLuc fan animation Night KnightArtAnimation HaiyanCompo,en,2022-05-03,19 | they/them,"['ガイディル', 'kaeluc']",positive,0.0,154.0,0.8
animation,_vinudes_,RT Ahmedmedhat000 How the Hunter x Hunter 99 adapted kurapikas chain fighting style into animationis one of the most creative,en,2022-05-03,ele/dele/he/him,[],positive,0.0,2217.0,0.5
animation,IntrinsicWorld,RT 80Level Have a look at this adorable procedurally animated isopod made by rileypneville in Unreal Engine,en,2022-05-03,Dressrosa,[],positive,0.0,31.0,0.5
animation,MKbutHorny,RT BaygulPortlek OMG ARE YOU GUYS CRAZYWE ARE All MOST 30 AAAAAAAI fucked my own computer so I cant make rr34 I fucked the animat,en,2022-05-03,"Cumming, GA",[],negative,0.0,0.0,-0.195
animation,Mad_AkaKabut,RT ProjectMili NEW SONGGIVE ME RICEanimated music videopremiering MAY 6Animation by SEWINGBUG,en,2022-05-03,,[],neutral,0.0,282.0,0.0
animation,pinyaapples,RT AIRNews01 Kamen Rider anime FUUTO PI begins streaming weekly in Japan on August 1 Animation Studio KAITheyve also unveiled a,en,2022-05-03,,[],neutral,0.0,19.0,0.0
animation,sancho_villa93,i love everything about this little bit of continuitybuildup to the film no one in animation works harder than the bobsburgers crew,en,2022-05-03,"Austin, TX",['bobsburgers'],positive,0.0,0.0,0.0708333333333333
animation,xzit1142,RT haiyan331 kaelucHappy birthday to DilucGenshin Impact MV KaeLuc fan animation Night KnightArtAnimation HaiyanCompo,en,2022-05-03,,"['ガイディル', 'kaeluc']",positive,0.0,154.0,0.8
animation,dk_designerkart,RT ThePossessedNFT Say hello to the latest ThePossessedNFT X shamanzs creative collaboration Watch out for this beauty making an,en,2022-05-03,Metaverse,[],positive,0.0,1951.0,0.5
animation,lazycat3427,RT Ahmedmedhat000 How the Hunter x Hunter 99 adapted kurapikas chain fighting style into animationis one of the most creative,en,2022-05-03,,[],positive,0.0,2217.0,0.5
animation,PC_Animation,loueratna เราจะตุยกันหมดดดดดดดดดดดดด,th,2022-05-03,,[],,0.0,0.0,0.0
animation,Pandalalalameer,RT PencilWorkshop justiceforspongebob We all worked on this project for 2 years and poured in original animation art voice acting mus,en,2022-05-03,,['justiceforspongebob'],positive,0.0,11186.0,0.1875
animation,thestrider007,RT qbonevt Good morningWe are at 530 and the animation isnt done yetI will be drawing and animating most of today Would you all lik,en,2022-05-03,roasting your nuts ,[],positive,0.0,4.0,0.6875
animation,layladadoggo,RT springflowerjay Jays favorite color green Fav animal dog also cat wolf Fav food curry also pasta Fav tea wedding imp,en,2022-05-03,"Brisbane, Queensland",[],positive,0.0,588.0,0.15
animation,meadamillion,RT tuyoki more progress on this animation,en,2022-05-03,somewhere,[],positive,0.0,2523.0,0.5
animation,OpulentMyzery,RT tuyoki more progress on this animation,en,2022-05-03,,[],positive,0.0,2523.0,0.5
animation,FTFTheToonist,RT InCorrectZak Hmmmgt The Bad Guysgt Lupin The Thirdgt Spy x Familygt Cat BurglarIm noticing a specific pattern with 2022 animatio,en,2022-05-03,France,[],negative,0.0,6.0,-0.2333333333333332
animation,Shaylaina,FoEmpires I dont know about a fav building but I like the buildings that have lights flashes pretty colours or bats flying out of them I love the animation that brings life to the city,en,2022-05-03,"Ontario, Canada",[],positive,0.0,0.0,0.375
animation,reubeam,WhicheverComa What a lovely project That screenshake and animation when bonking the walls is so satisfying Great job,en,2022-05-03,Way of Nor,[],positive,0.0,0.0,0.7083333333333334
animation,029_counter,RT ProjectMili NEW SONGGIVE ME RICEanimated music videopremiering MAY 6Animation by SEWINGBUG,en,2022-05-03,幸せでなければならないリセマラ管理人室,[],neutral,0.0,201.0,0.0
animation,MrDazAnimation,RT hothusband69420 All Animation twitter watches is Owl House Amphibia Gravity Falls and Adventure time,en,2022-05-03,,[],neutral,0.0,1.0,0.0
animation,miikubinder,RT g5mlp The French retail chain King Jouet has posted pics of their Sunny Starscout mascot on Linkedin The post says the mascot toured,en,2022-05-03,tumblr,[],neutral,0.0,44.0,0.0
animation,RuudVdHeuvel1,RT EthanHuntCT Just bought my first NFT on Opensea Hyped cause i did with this TinyFacesNFT real lovers of illustration and animation w,en,2022-05-03,,[],positive,0.0,8.0,0.225
animation,NoteRyButBook,Animation emote commission from Pastelzen,en,2022-05-03,,[],neutral,0.0,1.0,0.0
animation,icylives,RT Ahmedmedhat000 How the Hunter x Hunter 99 adapted kurapikas chain fighting style into animationis one of the most creative,en,2022-05-03,"Georgia, USA",[],positive,0.0,2217.0,0.5
animation,LiltConstanze,RT PencilWorkshop justiceforspongebob We all worked on this project for 2 years and poured in original animation art voice acting mus,en,2022-05-03,West Coast of Pandora,['justiceforspongebob'],positive,0.0,11345.0,0.1875
animation,mantafae,RT AulaniSummerz ProcessI had him smiling originally but it looked weird with the animation so I changed it,en,2022-05-03,,[],negative,0.0,1.0,-0.0625
animation,nya_suke21,RT haiyan331 kaelucHappy birthday to DilucGenshin Impact MV KaeLuc fan animation Night KnightArtAnimation HaiyanCompo,en,2022-05-03,推しのいないテイ㍗,"['ガイディル', 'kaeluc']",positive,0.0,60.0,0.8
animation,cucabarascream,RT Ahmedmedhat000 How the Hunter x Hunter 99 adapted kurapikas chain fighting style into animationis one of the most creative,en,2022-05-03,,[],positive,0.0,1840.0,0.5
animation,dannce_20,RT PokemanZ0N6 Water animation,en,2022-05-03,ciudad de lepes,[],neutral,0.0,191.0,0.0
animation,Beautiful_Frame,RT jametc I walked past him once at the Disney animation building cafeteria and thats my immortalityI did not say anything as he had,en,2022-05-03,Loughborough University UK,[],negative,0.0,16.0,-0.25
animation,kuurizutaru,RT haiyan331 kaelucHappy birthday to DilucGenshin Impact MV KaeLuc fan animation Night KnightArtAnimation HaiyanCompo,en,2022-05-03,,"['ガイディル', 'kaeluc']",positive,0.0,60.0,0.8
animation,giusepp10514741,RT ThePossessedNFT Say hello to the latest ThePossessedNFT X shamanzs creative collaboration Watch out for this beauty making an,en,2022-05-03,TRAP HOUSE,[],positive,0.0,1951.0,0.5
animation,arkadeeee,RT pielosul Giveawaytime 3 NFTSTo enter Follow pielosul Like amp RT Tag 3 friends 24hElrond ElrondNFTs ElrondC,en,2022-05-03,România,"['Giveawaytime', 'Elrond', 'ElrondNFTs', 'ElrondC']",neutral,0.0,11.0,0.0
animation,JennyMe25484989,RT helix3ds The Unicorn Flakes IncidentJust something I put together pretty quickly that I may or may not expand upon in the future,en,2022-05-03,,[],positive,0.0,12.0,0.2916666666666666
animation,GeminiGemii,RT Ahmedmedhat000 How the Hunter x Hunter 99 adapted kurapikas chain fighting style into animationis one of the most creative,en,2022-05-03,0nt4r10,[],positive,0.0,1786.0,0.5
animation,KarateManCombos,RT PacificRyn BIG NEWS The Animation Production Workers on Clone High aka the Production Managers Coordinators amp Assistants have suc,en,2022-05-03,,[],positive,0.0,229.0,0.08
animation,Mona1363S,RT yasrebifatima DROP ALERT Dear friends The wait is over HELTISHIA 02 Now Available on foundation You should know her famil,en,2022-05-03,"Los Angeles, CA",[],positive,0.0,16.0,0.4
animation,MediaComposer,RT Animeditor Got to sit down with MattFeury and talk about making The Bad Guys Great conversation that I think will be well worth y,en,2022-05-03,Worldwide,[],positive,0.0,3.0,0.0611111111111111
animation,blessedmandiary,RT VirallySocial Do you like this adWell get in touch with VirallySocial and will hook you upOh and we also do Product photogr,en,2022-05-03,"Durban, South Africa",[],neutral,0.0,118.0,0.0
animation,warararaN,RT DailyMangas Gun Animation,en,2022-05-03,北陸の関西,[],neutral,0.0,10618.0,0.0
animation,cal4ire,RT PencilWorkshop justiceforspongebob We all worked on this project for 2 years and poured in original animation art voice acting mus,en,2022-05-03,ic brightgoat,['justiceforspongebob'],positive,0.0,11100.0,0.1875
animation,bri23013093,RT histobean I found a really old animation practise I did omg,en,2022-05-03,"Texas, USA",[],positive,0.0,4.0,0.1
animation,Aamuge0330,RT haiyan331 kaelucHappy birthday to DilucGenshin Impact MV KaeLuc fan animation Night KnightArtAnimation HaiyanCompo,en,2022-05-03,,"['ガイディル', 'kaeluc']",positive,0.0,60.0,0.8
animation,AlensonyFan,OO0OO000000 Check software version And compare animation and camera with my phone,en,2022-05-03,IN,[],neutral,1.0,0.0,0.0
animation,t_u_melancholy,RT naturlichturism New NFT The only purpose of a gun is to kill1 xtz1010 edGIF AnimationNFT nft,en,2022-05-03,Polnareffland ,"['NFT', 'nft']",positive,0.0,11.0,0.0681818181818181
animation,bbomppsahapab,RT MontioMotion Roboto Bar is now available on foundation Be a new owner of this place or just enjoy the drinksRT amp like is app,en,2022-05-03,,[],positive,0.0,61.0,0.3787878787878787
animation,pid987,RT haiyan331 kaelucHappy birthday to DilucGenshin Impact MV KaeLuc fan animation Night KnightArtAnimation HaiyanCompo,en,2022-05-03,что за фигня,"['ガイディル', 'kaeluc']",positive,0.0,60.0,0.8
animation,MrDazAnimation,RT themiladrahimi Crimson TideRivers of absurdity will flow from withinCrimson tide upon warp and weft of washed cleansaturates out,en,2022-05-03,,[],positive,0.0,1.0,0.3666666666666667
animation,lisalover_,RT GoroDaily Persona 5 The Animation Artbook,en,2022-05-03,,[],neutral,0.0,6.0,0.0
animation,IndieGameFan1,RT ChillPandaGame Did you know today is WriteAReviewDayReviews are so important for small indie studios like ours If you play Chill,en,2022-05-03,,['WriteAReviewDay'],positive,0.0,7.0,0.05
animation,mp_artlady,RT BoomCryp Shout out to my bro for this dope animation art ToiletSenpai,en,2022-05-03,"Bangkok, Thailand",[],neutral,0.0,7.0,0.0
animation,JfFrances,GBNEWS BM disaster after the cancellation of just one animation show out of several expected pieces of content from Archewell BTW ALL animated content has been cancelled by Netflix Im trying to figure out if you lot dont know how content distribution works or youre just crazy,en,2022-05-03,London W1U,[],negative,0.0,0.0,-0.2333333333333333
animation,GrinningStar,RT AIRNews01 Kamen Rider anime FUUTO PI begins streaming weekly in Japan on August 1 Animation Studio KAITheyve also unveiled a,en,2022-05-03,,[],neutral,0.0,19.0,0.0
animation,uraura1549,Ayaka wants to meet Traveler Ayato wont let her GoAnimation YouTube,en,2022-05-03,,[],positive,0.0,0.0,0.3125
animation,TammyTuckey,Its all about the Little Wonders The Robinson family the cast amp crew of the film are reuniting for the 15th anniversary this Friday night May 6th at 8PM EST5PM PST Join the family reunion here Interview MeettheRobinsons Disney Animation,en,2022-05-03,www.tammytuckey.com,"['Interview', 'MeettheRobinsons', 'Disney', 'Animation']",negative,1.0,1.0,-0.29296875
animation,_daily_bendy_,RT Cart0nC0f33 ARTANIMATIONTesting,en,2022-05-03,,[],negative,0.0,1.0,-0.75
animation,dapkegaretahana,RT haiyan331 kaelucHappy birthday to DilucGenshin Impact MV KaeLuc fan animation Night KnightArtAnimation HaiyanCompo,en,2022-05-03,KaeLuc nation,"['ガイディル', 'kaeluc']",positive,0.0,154.0,0.8
animation,__________succ,RT haiyan331 kaelucHappy birthday to DilucGenshin Impact MV KaeLuc fan animation Night KnightArtAnimation HaiyanCompo,en,2022-05-03,,"['ガイディル', 'kaeluc']",positive,0.0,154.0,0.8
animation,AnthonyLaFauci,RT MattSpectro We rarely leave the MarvelDC bubble but thats what happening on our upcoming episode The Tick is going to be topic o,en,2022-05-03,"Cape Coral, Florida",[],positive,0.0,3.0,0.5859375
animation,brobotnfts,NFTtrendy1 PASTE ETH ADDRESS FREE NFT GIVEAWAY LIKEBUY FOLLOW brobotnfts JOIN NFTs NFTCommunity brobots NFTGiveaway BTC Solana nftcollectors NFTAirdrop animation web3,en,2022-05-03,,"['ETH', 'NFT', 'NFTs', 'NFTCommunity', 'brobots', 'NFTGiveaway', 'BTC', 'Solana', 'nftcollectors', 'NFTAirdrop', 'animation', 'web3']",positive,1.0,1.0,0.625
animation,llaheo,RT haiyan331 kaelucHappy birthday to DilucGenshin Impact MV KaeLuc fan animation Night KnightArtAnimation HaiyanCompo,en,2022-05-03,tràng • 20yrs,"['ガイディル', 'kaeluc']",positive,0.0,60.0,0.8
animation,Cursednameworm,RT Saberspark For the last 2 years this dedicated team of passionate fans recreated the SpongeBob movie brick by brick with unique anima,en,2022-05-03,,[],positive,0.0,12651.0,0.1083333333333333
animation,Shie_Sempai,Day 151Today we have Hi Score Girlanime animation animegirl animetwt anitwit anitwt couple Crunchyroll Darling Funimation Animeart manga lightnovel animated,en,2022-05-03,Gran Crevasse,"['anime', 'animation', 'animegirl', 'animetwt', 'anitwit', 'anitwt', 'couple', 'Crunchyroll', 'Darling', 'Funimation', 'Animeart', 'manga', 'lightnovel', 'animated']",neutral,0.0,1.0,0.0
animation,wazzy_zxn,RT SlimeSenju Which anime has the best animation,en,2022-05-03,Soul Society,[],positive,0.0,7.0,1.0
animation,JoyceTakako,RT ChronicLoaf MaeDayJ ChronicCommFund ChronicDigest Tinu NormalFreeZone meldeauohana moniquedhooghe Aoiferocksitout audreyrsu,en,2022-05-03,,[],neutral,0.0,7.0,0.0
animation,SpoonzyEdits,RT SpoonzyEdits May the 4th be with you A short star wars animation StarWarsDay,en,2022-05-03,𝓕𝓸𝓻𝓴𝓼,['StarWarsDay'],neutral,0.0,4.0,0.0
animation,moongyeongguk,RT ThePossessedNFT Say hello to the latest ThePossessedNFT X shamanzs creative collaboration Watch out for this beauty making an,en,2022-05-03,인천 서구,[],positive,0.0,1956.0,0.5
animation,lstrNFT,RT ThePossessedNFT Say hello to the latest ThePossessedNFT X shamanzs creative collaboration Watch out for this beauty making an,en,2022-05-03,,[],positive,0.0,1876.0,0.5
animation,diamondprima,RT PencilWorkshop justiceforspongebob We all worked on this project for 2 years and poured in original animation art voice acting mus,en,2022-05-03,your mom,['justiceforspongebob'],positive,0.0,11209.0,0.1875
animation,Mark24Marky,RT AlexSkela2 Think beyond antivirus think Protegentalso i may or may not use it in an animation,en,2022-05-03,,[],neutral,0.0,2.0,0.0
animation,GirishBorkar11,RT stufflistings There should be an Alwayson charging animation option for all the devices flaunting crazy charging speeds IMO,en,2022-05-03,"Nagpur, India",[],negative,0.0,75.0,-0.6
animation,skelefart,RT Saberspark For the last 2 years this dedicated team of passionate fans recreated the SpongeBob movie brick by brick with unique anima,en,2022-05-03,,[],positive,0.0,12633.0,0.1083333333333333
animation,hourlyluchi,crystalline tap showroom animation,en,2022-05-03,mod: she/he/it,[],neutral,0.0,0.0,0.0
animation,kaiizokushanks,Roofpiece animation is top budget no doubts,en,2022-05-03,,[],positive,0.0,0.0,0.5
animation,i8wangji,RT soukatsu do you ever watch an animation and keep getting distracted by the photography and settings because DAMN,en,2022-05-03,,[],neutral,0.0,2208.0,0.0
animation,Nima_Mobin,RT NimaMobin The lighthouseAnimation Voxel Art11003 ETH NFT NFTCommunity NFTs 3D animation vox,en,2022-05-03,,"['NFT', 'NFTCommunity', 'NFTs', '3D', 'animation', 'vox']",neutral,0.0,3.0,0.0
animation,GavinW05444564,cometwtf Whale into losmuertosNFT Strong communitygreat art 700 traitsvisionary team2 Otherdeeds 30 NFTworlds staked for 50kmth holder rewardsP2E NFTworld opened1k pc 0x collection airdrop soonAnimation soon with award winning studiovivalosmuertos,en,2022-05-03,,['vivalosmuertos'],positive,0.0,0.0,0.6510416666666666
animation,Klols_NFT,RT ThePossessedNFT Say hello to the latest ThePossessedNFT X shamanzs creative collaboration Watch out for this beauty making an,en,2022-05-03,,[],positive,0.0,1795.0,0.5
animation,80Level,Have a look at this adorable procedurally animated isopod made by rileypneville in Unreal Enginegamedev indiedev unrealengine proceduralart animation 3dart UnrealEngine,en,2022-05-03,Los Angeles,"['gamedev', 'indiedev', 'unrealengine', 'proceduralart', 'animation', '3dart']",positive,0.0,1.0,0.5
animation,lunama21,RT ThePossessedNFT Say hello to the latest ThePossessedNFT X shamanzs creative collaboration Watch out for this beauty making an,en,2022-05-03,,[],positive,0.0,1773.0,0.5
animation,kxmblue,RT Ahmedmedhat000 How the Hunter x Hunter 99 adapted kurapikas chain fighting style into animationis one of the most creative,en,2022-05-03,ˢᵃⁿᵍʸᵒ/สหภาพแมวดำจงเจริญ ,[],positive,0.0,1811.0,0.5
animation,jupiterjavelin,RT Ahmedmedhat000 How the Hunter x Hunter 99 adapted kurapikas chain fighting style into animationis one of the most creative,en,2022-05-03,,[],positive,0.0,1289.0,0.5
animation,jiggyblocc_ng,RT shansyney Rate me in my animation AviLets follow each other,en,2022-05-03,"Lagos, Nigeria",[],negative,0.0,56.0,-0.125
animation,artann_ash,ideartisteth foundation Your artwork is amazing The animation and the color palette it just captured my heart,en,2022-05-03,,[],positive,0.0,0.0,0.875
animation,Pomuwu,RT ArtistMoonCrows Made a small animation for HarxMLeth s Brooke BrookeClub Portfolio piece,en,2022-05-03,,['BrookeClub'],negative,0.0,77.0,-0.390625
animation,RiceInTheMech,RT DallienceRNG Little bit of a speechexpression animation practiceMight come back to make it look all nice voice act it but for no,en,2022-05-03,"England, United Kingdom",[],positive,0.0,1826.0,0.1374999999999999
animation,Malaika254,RT shansyney Rate me in my animation AviLets follow each other,en,2022-05-03,,[],negative,0.0,101.0,-0.125
animation,cauchemarow,XAZEEZ3 all i said was when he started the dash into f2 cancel the animation for f2 didnt even come out so it LOOKED LIKE he punished the dash i cant be wrong rn azeez3,en,2022-05-03,where u ben? he/him 18+,[],negative,0.0,0.0,-0.5
animation,DoktorOffline,RT WryCritic Seriously recommending Chinese fantasy epic Jing Zy 2020 Its actually great Chinese animation has really evolv,en,2022-05-03,Finland,[],positive,0.0,128.0,0.1277777777777778
animation,nohainhiding,heres an article abt it,en,2022-05-03,sweden / stay st.,[],neutral,0.0,0.0,0.0
animation,JiUnicorn,RT Ahmedmedhat000 How the Hunter x Hunter 99 adapted kurapikas chain fighting style into animationis one of the most creative,en,2022-05-03,Sunshine Starlight,[],positive,0.0,1378.0,0.5
animation,OnlyMcFisherMan,NowWatching Godzilla The Series 19982000Best animated take on the character providing a whole host of memorable new monsters and interesting takes on some old ones I already really enjoy the 98 film so this was basically that but even better Love the animation style,en,2022-05-03,Southern CA,['NowWatching'],positive,1.0,0.0,0.4262626262626263
animation,MeLxthor,RT golly4 Supercorp sunday I tried to do a sketch animation supergirl supercorp supercorpsequel dccomics i think we deserve to see,en,2022-05-03,,"['supergirl', 'supercorp', 'supercorpsequel', 'dccomics']",neutral,0.0,76.0,0.0
animation,MrDazAnimation,RT hhh89569658 Minecraft ParodyPH intro SEE YOU AGAIN 5minecraft anime animation game gamer 3D youtube,en,2022-05-03,,"['minecraft', 'anime', 'animation', 'game', 'gamer', '3D', 'youtube']",negative,0.0,1.0,-0.4
animation,heImJ3y5SrnD0em,RT Crycode MiloInu May the force be with you MiloInu MILO MiloInu MiloInuArmy BSC BNB Binance Crypto BTC BinanceSmartChain,en,2022-05-03,,"['MiloInu', 'MiloInuArmy', 'BSC', 'BNB', 'Binance', 'Crypto', 'BTC', 'BinanceSmartChain']",neutral,0.0,3.0,0.0
animation,marjori09326710,RT Mitaverse INTRODUCE CORE TEAM MEMBERSGOLD CEOampCOFOUNDERCEO Gold is Business strategist and successful entrepreneur He has exte,en,2022-05-03,,[],positive,0.0,2.0,0.75
animation,Klols_NFT,RT ThePossessedNFT Say hello to the latest ThePossessedNFT X shamanzs creative collaboration Watch out for this beauty making an,en,2022-05-03,,[],positive,0.0,1808.0,0.5
animation,RemonKan_143,RT DailyMangas Gun Animation,en,2022-05-03,愛知県,[],neutral,0.0,10397.0,0.0
animation,Slappyys,RT ApeReunion This is not a test I repeat this is not a test We are here to rewrite the past and make historyAnimation pipeline,en,2022-05-03,,[],negative,0.0,151.0,-0.25
animation,moiyayaya,the animation is killing me,en,2022-05-03,"London, England",[],neutral,0.0,0.0,0.0
animation,ChelseafcLong,RT DwightTurf Irish media omg Russian TV showed an animation of Ireland being nukedAlso Irish media Fuck Russia everyone should a,en,2022-05-03,,[],negative,0.0,16.0,-0.1
animation,DarrylDeo,RT tuyoki more progress on this animation,en,2022-05-03,"Cebu, Philippines",[],positive,0.0,2339.0,0.5
animation,FrozieArtz,animationSefrain aztechhy welp i am animating i guess P,en,2022-05-03,Any Pronouns,['animation'],positive,0.0,0.0,0.75
animation,lihongxin7,RT NFTAssociation BUBBLE FRIENDS NFT Giveaway A 5555 communitydriven animation project GIVING AWAY x 3 WL SPOTSRules,en,2022-05-03,,['NFT'],neutral,0.0,131.0,0.0
animation,Gustavo45664940,RT tuyoki more progress on this animation,en,2022-05-03,,[],positive,0.0,2244.0,0.5
animation,VIT4LS,animation got better w this higashi fight it aint ever been bad but yk,en,2022-05-03,,[],negative,0.0,0.0,-0.0999999999999999
animation,HeadBones2,RT DailyMangas Gun Animation,en,2022-05-03,,[],neutral,0.0,10397.0,0.0
animation,ayam_tiarap,RT GrandGuerrilla Sandman jojo jojoanime SBRanimation,en,2022-05-03,memeland in 199 '22,"['jojo', 'jojo_anime', 'SBR_animation']",neutral,0.0,329.0,0.0
animation,DOUCHENEWT,the animation is the Disney one I was talking about,en,2022-05-03,#ᴛᴡᴀᴛᴡᴀꜰꜰʟᴇ,[],neutral,0.0,0.0,0.0
animation,MSGumelar,NFT Giveaway InstantEvolution for new followers only 1 Like RT2 Follow MSGumelar3 Tag Friends4 Drop Eth Wallet on replyI always post the winner check my profileNFT NFTs publication NFTGiveaway NFTcollector animation nftart Artists,en,2022-05-03,Bali,"['InstantEvolution', 'Eth', 'NFT', 'NFTs', 'publication', 'NFTGiveaway', 'NFTcollector', 'animation', 'nftart', 'Artists']",positive,0.0,1.0,0.0681818181818181
animation,yongchapchap,solarblues Sjhzvsv but i hope the animation gets better cause it was really weird at s4 and i also miss the old art style in s1s3 like thats not the hinata i know,en,2022-05-03,☀️ ✨ 🍃 🌺,[],positive,0.0,0.0,0.0333333333333333
animation,distorted_teen,RT FNAssist New Klombo files updated in Fortnite v2030AddedFootstep effectsDance animationSpawn overlay maps,en,2022-05-03,,['Fortnite'],positive,0.0,15.0,0.1704545454545454
animation,bustahwoalf,RT Ahmedmedhat000 How the Hunter x Hunter 99 adapted kurapikas chain fighting style into animationis one of the most creative,en,2022-05-03,finger pistols,[],positive,0.0,1454.0,0.5
animation,Forreignss,TheLegendOfLame toasty73 Numberman20 SpongeBob Thats not parody Parody entails exaggeration of certain characteristics within a story or a satirical recreation of something This was the same exact story with the voices swapped out and the animation redrawn by someone else,en,2022-05-03,,[],positive,0.0,0.0,0.1547619047619047
animation,sexlesshumanoid,RT Saberspark For the last 2 years this dedicated team of passionate fans recreated the SpongeBob movie brick by brick with unique anima,en,2022-05-03,tomboy mine,[],positive,0.0,12484.0,0.1083333333333333
