Keyword,User,Tweet,Language,Time,User Location,Hashtag,Polarity,Likes,Retweet,Sentiment
animation,newton_omb,RT GariToken Web3 folks in India The following roles are open at GariToken Social Media Manager Content Writer cryptonft Em,en,2022-04-24,,[],positive,0.0,20.0,0.0111111111111111
animation,Nacht_Silver,RT aarnav96 Every second of this Episode was PEAKK Fiction Animation Direction and Emotions 10 Episode Hands down the Best Episod,en,2022-04-24,"Berlin, Deutschland",[],positive,0.0,2.0,0.2814814814814815
animation,_RedRift,RT KaiZenKDP Netflix heavily increases subscription priceUsers unsubscribeNetflix Ah I see it was animation that was the pro,en,2022-04-24,she/her/ella,[],negative,0.0,37160.0,-0.2
animation,TheWeb3Pulse,RT SolBooNFT Sol Boo is an upcoming P2E game using Clay art animation coming to Solana Blockchain by November 12022Follow for early,en,2022-04-24,,[],negative,0.0,1.0,-0.4
animation,CurvysCarvahall,RT basimbasimbas Just finished watching ONEPIECE1015 and oh god I loved it The animation of yamato seeing the past was just so satis,en,2022-04-24,Inside,['ONEPIECE1015'],positive,0.0,1.0,0.2249999999999999
animation,sleepykit,RT DisneyAPromos Eric Goldberg on the return of 2D handdrawn animation to Walt Disney Animation StudiosNow we have an atmosphere an,en,2022-04-24,,[],neutral,0.0,913.0,0.0
animation,AnimatorsPal,RT scarletmonahan Alans UK tour Aberdare wales SouthWales scifi animation animetrap stopframe stopfra,en,2022-04-24,Berlin,"['wales', 'SouthWales', 'scifi', 'animation', 'animetrap', 'stopframe', 'stopfra']",neutral,0.0,1.0,0.0
animation,david_wodeck,RT bymoonlightea ONEPIECE1015This whole sequence is insane I just cant believe this is the level of animation we are gettinghttps,en,2022-04-24,,['ONEPIECE1015'],negative,0.0,5.0,-0.4
animation,AnimatorsPal,RT NorusArtBook failed walking animation animation CLIPSTUDIOPAINT animator,en,2022-04-24,Berlin,"['animation', 'CLIPSTUDIOPAINT', 'animator']",negative,0.0,1.0,-0.5
animation,SilverWind847,Im halfway through Keep Your Hands off Eizouken and its so beautifully animated I feel like anyone who enjoys seeing and discussing animation would really enjoy it,en,2022-04-24,,[],positive,0.0,0.0,0.625
animation,itsmehnlol,RT NitroSpidey Styalised CGI animation that is a hybrid of 3D and 2D gtgtgtgtgtgtgtgtgtgtgtgtgtgtgtgtgtgtgtgtgtgtgtgtgtgt CGI being used for realism,en,2022-04-24,joe mama,[],neutral,0.0,1586.0,0.0
animation,DamionCar2,RT LKlemmbaustein The looped version of my EmetSelch in Amaurot Animation is finally upon us Added some music and stuff Sadly twitt,en,2022-04-24,,[],negative,0.0,132.0,-0.25
animation,Allamas_Llamas,RT MittsumiA Practice animation peeking D,en,2022-04-24,,[],positive,0.0,41.0,1.0
animation,VictorTolulope_,RT NitroSpidey Styalised CGI animation that is a hybrid of 3D and 2D gtgtgtgtgtgtgtgtgtgtgtgtgtgtgtgtgtgtgtgtgtgtgtgtgtgt CGI being used for realism,en,2022-04-24,Paper Inc,[],neutral,0.0,1543.0,0.0
animation,Ramblingproses,RT NonsenseIsland An aria of Rossinis Barber of Seville that shows up constantly in animation is Largo al Factotum which introduces,en,2022-04-24,UK,[],neutral,0.0,1625.0,0.0
animation,bodoqueOe,RT Variety DreamWorks Animations TheBadGuys is opening above projections targeting a 25 million debut at the domestic box office Wit,en,2022-04-24,"Indio, CA",['TheBadGuys'],neutral,0.0,21.0,0.0
animation,CallMeOkok,Better filler Dragon BallAnimation Dragin BallCharacters Dragon ball Power ups Dragon ballStrength and IQ Dragon BallFunny Dragon ballEz dbz win,en,2022-04-24,your moms house,[],positive,0.0,0.0,0.5166666666666667
animation,2banana1egg,RT DisneyAPromos Eric Goldberg on the return of 2D handdrawn animation to Walt Disney Animation StudiosNow we have an atmosphere an,en,2022-04-24,,[],neutral,0.0,900.0,0.0
animation,Orion_Allman,RT KaiZenKDP Netflix heavily increases subscription priceUsers unsubscribeNetflix Ah I see it was animation that was the pro,en,2022-04-24,STL | Wano,[],negative,0.0,36292.0,-0.2
animation,pjiminvh,RT KaiZenKDP Netflix heavily increases subscription priceUsers unsubscribeNetflix Ah I see it was animation that was the pro,en,2022-04-24,,[],negative,0.0,36293.0,-0.2
animation,IceHilux,RT genshinxianxia Art by morsgnText by kingshiouLayout by cytaoplasmAnimation by Kuro no TwitterVoice by Tang Yajing CN VAMu,en,2022-04-24,,[],neutral,0.0,28.0,0.0
animation,iS_ISisNT,RT CorbinRainbolt Pteroplanes on the move My first attempt at animation,en,2022-04-24,Thailand,[],positive,0.0,1230.0,0.25
animation,ovaettrart,RT bauerpower Reading through Tom Sitos Drawing the Line THE best account of the history of the Animation Guild Local 839 amp somethi,en,2022-04-24,tx // comms full+in progress ,[],positive,0.0,42.0,0.5
animation,bmoat3,Megumi Ishitani the best for animation director One Piece,en,2022-04-24,Bandung,[],positive,0.0,0.0,1.0
animation,pantherlove1865,RT KaiZenKDP Netflix heavily increases subscription priceUsers unsubscribeNetflix Ah I see it was animation that was the pro,en,2022-04-24,,[],negative,0.0,38140.0,-0.2
animation,dhjshi_shi,lessgradedalg zgershkoff im glad he survived the battle of Animator vs Animation III,en,2022-04-24,,[],positive,0.0,0.0,0.5
animation,CreativeT_Art,RT DisneyAPromos Eric Goldberg on the return of 2D handdrawn animation to Walt Disney Animation StudiosNow we have an atmosphere an,en,2022-04-24,Earth,[],neutral,0.0,857.0,0.0
animation,panicrayne,ONEPIECE1015 1 underrated aspect of Ishitanis direction is her ability to come up with endearing filler scenes Ace falling asleep and Yamatos reaction to his death adds so much to their bond even with lower quality animation those scenes would still be gt all the still frames,en,2022-04-24,Valenzuela City,['ONEPIECE1015'],positive,0.0,0.0,0.35
animation,selthemoonchild,RT KaiZenKDP Netflix heavily increases subscription priceUsers unsubscribeNetflix Ah I see it was animation that was the pro,en,2022-04-24,26 years old,[],negative,0.0,35597.0,-0.2
animation,Tallflipkick,RT NitroSpidey Styalised CGI animation that is a hybrid of 3D and 2D gtgtgtgtgtgtgtgtgtgtgtgtgtgtgtgtgtgtgtgtgtgtgtgtgtgt CGI being used for realism,en,2022-04-24,2DS Aquired. More SMT games,[],neutral,0.0,1114.0,0.0
animation,Animayson,RT Animayson Twilight being a Spy dadFan animation Ive made after watching the first and second episodes SPYFAMILY SPYxFamily a,en,2022-04-24,,"['SPY_FAMILY', 'SPYxFamily', 'a']",positive,0.0,9.0,0.125
animation,CheyennePlayz,RT HumanFox030 TOHSPOILERS TheOwlHouseSpoilers They did NOT have to go that hard for the transformation animation https,en,2022-04-24,Philippines,"['TOHSPOILERS', 'TheOwlHouseSpoilers']",negative,0.0,4.0,-0.2916666666666667
animation,rodentl0ser,RT NooBB3D Although IK makes animating arms easier it can get pretty messy since Im not that experienced with it Animation is based o,en,2022-04-24,u mom house lol,[],positive,0.0,1994.0,0.2833333333333334
animation,PrinceVegeta126,Didnt think people would be so damn stupid but my last line says maybe not as good in terms of looks Im saying it right there But something along those lines meaning a lower tier enemy with great animation I deal with idiots daily,en,2022-04-24,"Konahagakure, Land Of Fire",[],positive,0.0,0.0,0.0265306122448979
animation,xXBLEACHED_SOUL,RT SakugaLad Theres no better way to close the episode other than by Luffy directly defying 2 Yonkos at the same time because thats wh,en,2022-04-24,Jigoku,[],negative,0.0,2.0,-0.06875
animation,satsyuin,LukaALT02 after all this time if it doesnt come back with good animation Im gonna be sick,en,2022-04-24,East Blue,[],negative,0.0,0.0,-0.0047619047619047
animation,The_Door_Kun,NeenLevi Ah my bad then SorryAlthough I do look forward to the Regulus Corneas rant in animation,en,2022-04-24,The Great Seal,[],negative,0.0,0.0,-0.5999999999999999
animation,Kalashnikov_74U,RT kingbealestreet instead of touching the animation why doesnt Netflix start cutting down on those dumb movies they make every week an,en,2022-04-24,"Nairobi, Kenya",[],negative,0.0,3141.0,-0.1576388888888888
animation,glitch_pix18,RT JambeeBot Animation test because FUN FACT Animating in an animation software is better than animating in a movie editorAphroDesia,en,2022-04-24,,['AphroDesia'],positive,0.0,36.0,0.4
animation,MrOrigin,RT CorbinRainbolt Pteroplanes on the move My first attempt at animation,en,2022-04-24,"Madcity, Wiscompton⚡",[],positive,0.0,1246.0,0.25
animation,aeonbloom1,RT ArtLucinda scottysart aestheticofnft mattipietarart MayaS rossoarte seekingsonja MoeinKhatteSiah VigilanteArtist 00p,en,2022-04-24,🇿🇦,[],neutral,0.0,6.0,0.0
animation,CryptoStykz,Junaid02493545CrytpoStykz is THE hidden gem of all NFTs My stickfigure warrior NFTs come from world famous pivotflash animation forums from the mid 2000s There is a play to earn fighting game as well,en,2022-04-24,,[],negative,0.0,0.0,-0.0166666666666666
animation,kalendrakumar49,RT AwanishSharan Make Time For Your Children Before Its Too LateBrilliant animation And a very deep and powerful message,en,2022-04-24,"Bareilly, India",[],positive,0.0,1473.0,0.225
animation,nyamdara,RT Kiecaburn ELDENRING Maliketh The Black Blade Vs Tarnished Animation,en,2022-04-24,,"['ELDENRING', 'Animation']",negative,0.0,31325.0,-0.1666666666666666
animation,AndyJosy1132,RT MelonTeee god this animation and style was so stunning,en,2022-04-24,,[],positive,0.0,8.0,0.5
animation,kjp48GG,RT MAgho Taking a shot in the dark butIm opening character animation commissionsltltDM for additional detailsgtgt,en,2022-04-24,,[],negative,0.0,1944.0,-0.1875
animation,TiredBearowl,RT MAgho Taking a shot in the dark butIm opening character animation commissionsltltDM for additional detailsgtgt,en,2022-04-24,"Hamilton, NJ",[],negative,0.0,1664.0,-0.1875
animation,JudgeMAD1,RT pleasingnesss Needle Felt Stop Motion Animation,en,2022-04-24,,[],neutral,0.0,378.0,0.0
animation,leocirius,RT AncelWolf Another animation practice This time with my oc Giovanni Animation BringItBackComic,en,2022-04-24,,"['Animation', 'BringItBackComic']",neutral,0.0,3.0,0.0
animation,CountedGlitter,RT AbeAnimated TRADITIONAL ANIMATION IS COMING BACK LETS FRICKEN GOOOOOOOOOOO,en,2022-04-24,,[],neutral,0.0,78.0,0.0
animation,t17moneyy,RT KaiZenKDP Netflix heavily increases subscription priceUsers unsubscribeNetflix Ah I see it was animation that was the pro,en,2022-04-24,222,[],negative,0.0,36022.0,-0.2
animation,hameed_shahir,RT CorbinRainbolt Pteroplanes on the move My first attempt at animation,en,2022-04-24,,[],positive,0.0,1230.0,0.25
animation,zentruthmusic,crypto888crypto Hi got this spaced out animation availableCosmic Breath 11 edition at 01 ETH,en,2022-04-24,Kenya,[],positive,0.0,0.0,0.4
animation,Sense8Saviour,RT DarthCharmant Me when someone disrespects Star Wars animation,en,2022-04-24,,[],neutral,0.0,175.0,0.0
animation,IWANTCM,RT KaiZenKDP Netflix heavily increases subscription priceUsers unsubscribeNetflix Ah I see it was animation that was the pro,en,2022-04-24,,[],negative,0.0,36582.0,-0.2
animation,Arctechfox,RT aalong64 Digital animation allows perfectionist tendencies to run rampant compared to traditional which can obviously be revised too,en,2022-04-24,nonyabuisness,[],neutral,0.0,160.0,0.0
animation,Du_tc_he_ss,RT LilliBugg animated alert commissions for PearlOtter Thank you so much for commissioning me Vtuber VTuberEN Commission,en,2022-04-24,In your closet,"['Vtuber', 'VTuberEN', 'Commission']",positive,0.0,94.0,0.3125
animation,Fill86824802,RT ZahidAliJeelani Quick look into my animation graph which is all performed from a single jump and no further input indie indiedev,en,2022-04-24,,"['indie', 'indiedev']",positive,0.0,65.0,0.0654761904761904
animation,Muhamad03271571,RT RiseFallNickBck Animation for Adults is just cartoons being ugly and saying swear wordsbeing raunchierOnly if you want it to be,en,2022-04-24,"Grogol Petamburan, Indonesia",[],negative,0.0,3362.0,-0.35
animation,In4pitude,I made a Super Sonic idle animation concept,en,2022-04-24,Earth... I think,[],positive,0.0,0.0,0.5208333333333333
animation,zapp12347,RT Edward733 CATHERENI GercinoGer fukayaqui BootsieBoutique JeanetteJoy AntonCountrySup FreebyrdWil carolyn660 Snowflake07 NexW,en,2022-04-24,Versailles-France,[],neutral,0.0,1.0,0.0
animation,TCB_NYC,This episode was what I liked about this show to begin with Titans fckin things up decent animation and fights People looking badass AttackOnTitan,en,2022-04-24,"NYC born & raised, now in NoVA",['AttackOnTitan'],positive,1.0,1.0,0.3833333333333333
animation,Minhthu32488966,RT NanoxYB John Doe than proceed to pull out his comically large penis animation i did for fun bcz of last night funny long cock draw,en,2022-04-24,,[],positive,0.0,44.0,0.1428571428571428
animation,UliMolter,RT pleasingnesss Needle Felt Stop Motion Animation,en,2022-04-24,FRA,[],neutral,0.0,306.0,0.0
animation,kl76174343,RT yukiyagami RT GreenL3gacy I remade the switch There was no animation in the previous versionpixelart indiegame indiedev gamedev gzdoom,en,2022-04-24,,"['pixelart', 'indiegame', 'indiedev', 'gamedev', 'gzdoom', 'アクションゲーム', 'ゲーム開発', 'ゲーム制作', 'ドット絵']",negative,0.0,0.0,-0.1666666666666666
animation,FirstDopplepony,RT LuxArume quick lil fluttershy animation i made in like 2 hours,en,2022-04-24,Twilight's old castle ,[],positive,0.0,55.0,0.3333333333333333
animation,Red_Morgue,RT gaysony24 Im practicing my story boarding and animation so please take this Fantasy Bakugo work,en,2022-04-24,In my bed,[],neutral,0.0,152.0,0.0
animation,ladyammy91,Design credit to my friend Da Eun Kim MostlyBread for bringing this crazy idea to life and the KotLTAnimation for the original Starlight Brigade Meouch,en,2022-04-24,,[],negative,0.0,0.0,-0.1124999999999999
animation,TylerDashArt,RT lilpotatoken April Commission batch is open 05 Do All but NSFW Gore MechaBustups 65Half body 80Fullbody 120Smal,en,2022-04-24,Undercity,[],negative,0.0,6.0,-0.0833333333333333
animation,MuhAlpArslan,RT EldenDarkinWolf ONEPIECE1015 Its extremely hard to describe with words how peak this episode was Had tears in my eyes from start,en,2022-04-24,,['ONEPIECE1015'],negative,0.0,112.0,-0.2916666666666667
animation,CapeCodGiftShop,RT spaceageoracle Music VideoBook Trailer 4 for The Quitters by Al Handa Adds animation to the mix of stills effects and musichttp,en,2022-04-24,United States Dromomaniac ,['4'],neutral,0.0,142.0,0.0
animation,AnimatorsPal,RT animationjobs 2D Production Supervisor job with M2 Animation a Bangkok based studio Working on creating TV Series TVCs and Hig,en,2022-04-24,Berlin,[],neutral,0.0,1.0,0.0
animation,iijensii,RT MAgho Taking a shot in the dark butIm opening character animation commissionsltltDM for additional detailsgtgt,en,2022-04-24,🇰🇷,[],negative,0.0,1697.0,-0.1875
animation,nabeelNFT,RT dhilkrishnadk New drop Transcendent Is available on foundation for 045 ETHThe work is about Embracing both of your feminine and m,en,2022-04-24,Metaverse,[],positive,0.0,27.0,0.2681818181818182
animation,SupremeSoviet1,Ang3rMgmt AnarchoMayo breakfastv0dka MakeItRayn Also its not my source my source is that I was there The just did a very accurate animation of it,en,2022-04-24,Agartha,[],positive,0.0,0.0,0.5200000000000001
animation,BritishTinnitus,Watch our animation to find out how a TinnitusBiobank could make a huge difference to people with tinnitusSign up to register your support,en,2022-04-24,UK,"['TinnitusBiobank', 'tinnitus']",positive,0.0,0.0,0.4000000000000001
animation,PunjKumar1,RT AnimeAfsar Still speechless by this episode It was a overkill for Toei to set a pedestal that wont be surpassed by any possible stu,en,2022-04-24,,[],neutral,0.0,7.0,0.0
animation,CRYPTOM48101825,RT purpledudenft NonFungible Films is a Web3 entertainment studio They have a world class board of former Studio Heads creatives and V,en,2022-04-24,,[],neutral,0.0,369.0,0.0
animation,vhsdreamscape,Like I really like Halo 2 a lot but if they randomly updated it to remove something like BXR animation canceling id be kind of pissed like imagine if nintendo put out a remaster of melee but removed wave dashing,en,2022-04-24,on the puter,[],positive,0.0,0.0,0.0999999999999999
animation,DeadLock_21,Orojapan1 As much as I like the animation The coloring makes it dark red Does everyone like this,en,2022-04-24,,[],positive,0.0,0.0,0.0166666666666666
animation,MID_LATONG,Sugar falling Smiley Cubes Drop the dnb beat 3d blender3d blender animation short illustration loop dnb smiley sunday video drawing sugar,en,2022-04-24,"Grenoble, France","['3d', 'blender3d', 'blender', 'animation', 'short', 'illustration', 'loop', 'dnb', 'smiley', 'sunday', 'video', 'drawing', 'sugar']",neutral,0.0,2.0,0.0
animation,MeuRefugioNerd,Joy e Wong de Shenmue II em Shenmue the Animation,en,2022-04-24,A Minha Terra Tinha Palmeiras,[],positive,0.0,0.0,0.8
animation,jitsukoan,001studios Amazing Pixelart Animation,en,2022-04-24,Germany,[],positive,0.0,0.0,0.7500000000000001
animation,GayPunkBleater,RT Tytofi Daddy Rex Cookin PrehistoricPlanet animation,en,2022-04-24,,"['PrehistoricPlanet', 'animation']",neutral,0.0,2351.0,0.0
animation,ReinaMitsuki,RT RemKoshmar I made a super early birthday presentanimation for Shu It also briefly features some other nijiEN livers cThe gif is,en,2022-04-24,,[],positive,0.0,87.0,0.0755208333333333
animation,tstupid_,And they switched the animation up,en,2022-04-24,504,[],neutral,0.0,0.0,0.0
animation,Yannapii,RT MAgho Taking a shot in the dark butIm opening character animation commissionsltltDM for additional detailsgtgt,en,2022-04-24,Under your bed,[],negative,0.0,1805.0,-0.1875
animation,_chibuzorr,RT KaiZenKDP Netflix heavily increases subscription priceUsers unsubscribeNetflix Ah I see it was animation that was the pro,en,2022-04-24,nigeria,[],negative,0.0,36022.0,-0.2
animation,CassandraPleida,RT XaviBros The rotation of Jupiter is huge only 10 hours with jet speeds reaching 100 msec Its huge for a planet with a diameter o,en,2022-04-24,,[],positive,0.0,184.0,0.2666666666666667
animation,Idea282821441,RT bubblegumelar Instant EvolutionChapter 3 free to read you read the story collect the NFT everybody can still enjoy the comics ht,en,2022-04-24,,[],positive,0.0,2.0,0.2666666666666666
animation,thepixeldevs,RT DivineStudi0s a boss that can control space and teleport to anywhere would be a channeling valorous ga,en,2022-04-24,Raspberry Pi,"['valorous', 'ga']",neutral,0.0,12.0,0.0
animation,Dreamscape_17,RT tuyoki work in progress animation,en,2022-04-24,,[],neutral,0.0,1420.0,0.0
animation,Menang100Juta,RT kellershiller NonFungible Films is a Web3 entertainment studio They have a world class board of former Studio Heads creatives and V,en,2022-04-24,"Bogor Barat, Indonesia",[],neutral,0.0,1011.0,0.0
animation,ChimeraXYZ,I also had a walking animation error after the Stormbird disappeared where Aloy would just kind of glide across the ground with no leg movements It was fixed in the middle of the fight with the second Stormbird shrug,en,2022-04-24,"New York, USA",[],positive,0.0,0.0,0.175
animation,NEOtwigs,RT JamiUwUs OnePieceSakuga Everything about this is perfect the animation Voice acting music UGHHH LOVE IT,en,2022-04-24,Wybie for lyfe,[],positive,0.0,1.0,0.5416666666666666
animation,Mba_1421,RT AniTrendz Kokyu no Karasu Teaser PVThe anime is scheduled for October 2022Animation Studio BN Pictures,en,2022-04-24,مكة المكرمة,[],neutral,0.0,53.0,0.0
animation,CollectableUK,Dragon Ball Z Animation Cel Goten and Trunks Akira Toriyama Japan Vintage 1 eBay,en,2022-04-24,,[],neutral,0.0,0.0,0.0
animation,jade_spidy,RT RiseFallNickBck Per Indiewire Eric Goldberg says Disney Animation will have 2D Animated projects taking shape ranging from originals,en,2022-04-24,I am the worst,[],neutral,0.0,360.0,0.0
animation,acwilder26,RT AbeAnimated TRADITIONAL ANIMATION IS COMING BACK LETS FRICKEN GOOOOOOOOOOO,en,2022-04-24,It doesnt matter,[],neutral,0.0,78.0,0.0
animation,rizajpg,the animation of one piece gets more stunning everytime i revisit the anime this shit is so beautiful bro,en,2022-04-24,los angeles | 20 he/him,[],positive,0.0,0.0,0.4125
animation,Tengoku_Noa,RT MAgho Taking a shot in the dark butIm opening character animation commissionsltltDM for additional detailsgtgt,en,2022-04-24,,[],negative,0.0,1493.0,-0.1875
animation,SuwucideTM,RT MAgho Taking a shot in the dark butIm opening character animation commissionsltltDM for additional detailsgtgt,en,2022-04-24,"someone's thighs, probably.",[],negative,0.0,1664.0,-0.1875
animation,Mba_1421,RT AniTrendz Oniichan wa Oshimai Onimai Im Now Your Sister is receiving an anime adaptationAnimation Studio Studio Bindhtt,en,2022-04-24,مكة المكرمة,[],neutral,0.0,216.0,0.0
animation,_sidra___,RT KaiZenKDP Netflix heavily increases subscription priceUsers unsubscribeNetflix Ah I see it was animation that was the pro,en,2022-04-24,"Sahiwal, Pakistan",[],negative,0.0,36582.0,-0.2
animation,Nanamikii_,RT LeaCOfficial This comment was a response under a post I made about supporting animation workers on my community tab When creators ge,en,2022-04-24,✪ They/Them ✪ 23 yo,[],positive,0.0,13.0,0.25
animation,ScarletSpiders1,RT OctoSunComic I like Netflixs way of thinking Stopping production animation besides Big Mouth Price increase Cutting shows,en,2022-04-24,Everywhere at once,[],negative,0.0,1.0,-0.3
animation,rafae_317,RT DisneyAPromos Eric Goldberg on the return of 2D handdrawn animation to Walt Disney Animation StudiosNow we have an atmosphere an,en,2022-04-24,Brasil🇧🇷,[],neutral,0.0,830.0,0.0
animation,Chika_nft4ever,RT IamSatoshii If CryptoPunks is for 2D PixelArt and BoredApeYachtClub is for 2D PFP InvsbleFriends is for 2D AnimationThats It,en,2022-04-24,,[],neutral,0.0,21.0,0.0
animation,Lee_Guardian1,RT tuyoki work in progress animation,en,2022-04-24,Kakariko Village ,[],neutral,0.0,1282.0,0.0
animation,ColinNelsonVO,Hooooooo boy This weeks episode of One Piece took the animation to a whole New Level,en,2022-04-24,"Los Angeles, CA",[],positive,0.0,0.0,0.1681818181818181
animation,dumbdotcomm,RT DisneyAPromos Eric Goldberg on the return of 2D handdrawn animation to Walt Disney Animation StudiosNow we have an atmosphere an,en,2022-04-24,,[],neutral,0.0,1098.0,0.0
animation,CaitSloth,Reply if u wanna be tagged for angelduo bird art tonight gtDIts an animation,en,2022-04-24,h,[],neutral,3.0,0.0,0.0
animation,MarvinPohl4,RT DarthCharmant Me when someone disrespects Star Wars animation,en,2022-04-24,"Berlin, Deutschland",[],neutral,0.0,187.0,0.0
animation,Calvinstephh,m1nn1er1dsy BFParty IamParallex AgentJHC nanoverseHQ cleannnnn animation thanks m1nn1er1dsy MathewSurya3552 Jerjo17 marmoriesss,en,2022-04-24,Indonesia 🇮🇩,[],positive,0.0,0.0,0.2
animation,brad0108,RT kse332official Boxing rough animation,en,2022-04-24,,[],negative,0.0,22594.0,-0.1
animation,HeroofChaosX,H8Wot shrinkybee Lovely idle animation for such a giantess,en,2022-04-24,,[],positive,0.0,0.0,0.25
animation,OneshotBots,RT fruttymoment I am working on a very stupid animation and im already kinda cryingHeres a small wip OneshotGame,en,2022-04-24,,['OneshotGame'],negative,0.0,1.0,-0.4833333333333333
animation,scaelatte_,RT MAgho Taking a shot in the dark butIm opening character animation commissionsltltDM for additional detailsgtgt,en,2022-04-24,,[],negative,0.0,1463.0,-0.1875
animation,briedabaddie,i think stays should step up their game and create an animation of them or their story on tour it would be so wholesome and cool stay artists and animators pls make it happen,en,2022-04-24,hanji,[],negative,0.0,0.0,-0.025
animation,tiiraminsu,RT KaiZenKDP Netflix heavily increases subscription priceUsers unsubscribeNetflix Ah I see it was animation that was the pro,en,2022-04-24,mbb world,[],negative,0.0,36582.0,-0.2
animation,r00ki33,RT GoddessAwe Concept menu for Friday Rythym Nights animation by VoltageXerionFNFNewsAnnounc1 NewsFunkin FNFModNews fnf fridayn,en,2022-04-24,,"['fnf', 'fridayn']",neutral,0.0,18.0,0.0
animation,tGzdMcQ0hgiwNgS,RT jellowpaws Hello from jellowpaws NFTCommunity and NFT world Jellowpaws makes a short animation of cuties that they have,en,2022-04-24,,"['NFTCommunity', 'NFT']",neutral,0.0,16.0,0.0
animation,AnimatorsPal,RT DivSpect Check out much more on Bilibili Comics search My Unexpected Wife and favorite animation SPYFAMILY manhua comics,en,2022-04-24,Berlin,"['animation', 'SPY_FAMILY', 'manhua', 'comics']",positive,0.0,1.0,0.4083333333333334
animation,BlackAce_za,vtownanimation YouTube Shout out bro,en,2022-04-24,"Johannesburg, South Africa",[],neutral,0.0,0.0,0.0
animation,nasaie_nur,RT ekkojnx me typing a 3 page essay on why ekkojinx is one of the best written relationships in animation history,en,2022-04-24,ekko's house😏,[],positive,0.0,1.0,1.0
animation,rainbowshuvox,RT RemKoshmar I made a super early birthday presentanimation for Shu It also briefly features some other nijiEN livers cThe gif is,en,2022-04-24,icon:kurakichi36,[],positive,0.0,87.0,0.0755208333333333
animation,humanmorph,LRT man that genuinely looks so fucking good the animation,en,2022-04-24,,[],positive,0.0,0.0,0.55
animation,hxh_shami,SEKARINAID aespaofficial AnimationFEEL THE COACHELLA AENERGYKARINAatCoachella KARINA,en,2022-04-24,,"['KARINAatCoachella', 'KARINA', '카리나']",neutral,0.0,0.0,0.0
animation,Marlutte1,RT dinoraye Yessssssssss finally Ive missed Disneys 2D animation so much,en,2022-04-24,"Puebla, México",[],neutral,0.0,4.0,0.0
animation,ToaAntan,allosaurusboy10 Eddache Mel only voiced the character Bob Clampett is the one who did the animation,en,2022-04-24,USA,[],neutral,0.0,0.0,0.0
animation,josueaguilera_,RT kldIaw This whole scene had me screaming shaking and crying The animation RogerLuffy parallels the music literally everything was,en,2022-04-24,"wandering w/ Mugen, Fuu + Jin",[],neutral,0.0,862.0,0.0
