Keyword,User,Tweet,Language,Time,User Location,Hashtag,Polarity,Likes,Retweet,Sentiment
harem,SusanneLeist,RT aharemboysaga True fairy tales are stories of triumph transformation and love all things I fervently believe inTURPITUDE,en,2022-04-15,New York,[],positive,0.0,23.0,0.425
harem,bernardfoong,Jump and youll find out how to unfold your wings when you fallUNBRIDLED is the sequel to a sensually captivating amp enlightening true story about a young man coming of age in a secret society amp a male haremAuthorUpRoar Memoir,en,2022-04-15,,"['AuthorUpRoar', 'Memoir']",positive,0.0,0.0,0.1416666666666666
harem,Garnet9899,RT GMSquadNFT Whitelist Giveaway Giving away 5x whitelist spots for Waifu Harem ClubEnter for your chance to winEnds in 12 hou,en,2022-04-15,,[],positive,0.0,23.0,1.0
harem,nikkikomori,lrt how is uki living in a harem anime,en,2022-04-15,Republic of the Philippines,['lrt'],neutral,0.0,0.0,0.0
harem,UKEAD_EN,The footages from the moments when the invading Israeli forces attacked the Qibla Masjid in Masjid alAqsa at the time of the morning prayer today The ummahs harem is under occupation jerusalem Palestine,en,2022-04-15,"Zeytinburnu, İstanbul","['jerusalem', 'Palestine']",neutral,1.0,2.0,0.0
harem,tiffeejasso,RT bernardfoong Jump and youll find out how to unfold your wings when you fallMETANOIA New Release is the,en,2022-04-15,Northern California,[],positive,0.0,2.0,0.1363636363636363
harem,DIEBO37RT2,RT bernardfoong I was delighted to blossom early in lifeA Harem Boys Saga a memoir by Young a 5book series,en,2022-04-15,United States - Boston,[],positive,0.0,4.0,0.3
harem,BridgitteLesley,RT bernardfoong My job is to live an extraordinary lifeINITIATION is a sensually captivating autobiography abou,en,2022-04-15,South Africa,[],positive,0.0,13.0,0.3232323232323232
harem,RedOppaiDragon,ST0LENFATES Knew I was too experienced for you just so you know you are talking to the future Harem King,en,2022-04-15,Mun is 21. He/Him.,[],positive,0.0,0.0,0.4
harem,Kh527q,RT aharemboysaga Life is 10 what happens to you and 90 on how you react to itA Harem Boys Saga a memoir by Young a 5book series,en,2022-04-15,"Bantul, Indonesia",[],positive,0.0,1.0,0.1
harem,Harem_king_21,Mamake RihannaDaily wairimu1 essteeem Moseskiprop denooh022 AtwoliYa Itsfanuel cyntchepto laura254 nakurugoatOG Gods plan,en,2022-04-15,,[],neutral,0.0,0.0,0.0
harem,AlFanaGryphon,YungFandango CrowFluff ASmallAngryBird taleofnobody A bird harem I need that,en,2022-04-15,NYC,[],neutral,0.0,0.0,0.0
harem,KaranAwtani1,Frankisalegend1 And they will do all they can to sabotage any budding relationship between any other nation amp the USThey latch onto their special relationship in same manner as alpha concubine in a harem Any new entrant is seen as threat to be subdued ASAP lest they become the new favourite,en,2022-04-15,1984,[],positive,0.0,0.0,0.1064935064935064
harem,nka979,Chief Servant of the HaremHenry Guillaume Schlesinger 18141893,en,2022-04-15,İzmir,[],neutral,0.0,0.0,0.0
harem,VengePlayz,The Harem Is In Danger,en,2022-04-15,,[],neutral,0.0,0.0,0.0
harem,beardedladytoe,RT GMSquadNFT Whitelist Giveaway Giving away 5x whitelist spots for Waifu Harem ClubEnter for your chance to winEnds in 12 hou,en,2022-04-15,,[],positive,0.0,23.0,1.0
harem,weiyingdpr,RT NANATOKYUU NSFWwelcome to the sj harem,en,2022-04-15,NSFW | 19,[],positive,0.0,36.0,0.8
harem,Barbarabxj349,RT aharemboysaga Every flower is a soul blossoming in natureDEBAUCHERY is the 3rd book to a sensually illuminat,en,2022-04-15,"Georgia, USA",[],neutral,0.0,3.0,0.0
harem,JBBlanket23,The More My Harem Grows the More My Harem GrowsHarem anime where girls grow bigger when they fall in love with the MC The more girls that fall in love with them the bigger the girls become,en,2022-04-15,,[],positive,1.0,0.0,0.375
harem,W_Angels_Wings,RT bernardfoong A Harem Boys Saga a memoir by Young a 5book series is a sensually captivating true story a,en,2022-04-15,"Kirkland, WA",[],positive,0.0,8512.0,0.3166666666666666
harem,RiteBoss,RT bernardfoong An incredible fairy tale became my realityINITIATION is an autobiography of a young mans enlig,en,2022-04-15,City of London Capetown Lima,[],positive,0.0,10.0,0.5
harem,itsdamintttt_t,If another harbinger droped after Scaramouche what should I do I do want to collect them all to build my scara harem but i want to spend all my primos on him too,en,2022-04-15,I ship All x Scaramouche,[],neutral,0.0,0.0,0.0
harem,Gabriel_Tanm,RT GMSquadNFT Whitelist Giveaway Giving away 5x whitelist spots for Waifu Harem ClubEnter for your chance to winEnds in 12 hou,en,2022-04-15,,[],positive,0.0,29.0,1.0
harem,cantonagiggs1,RT GMSquadNFT Whitelist Giveaway Giving away 5x whitelist spots for Waifu Harem ClubEnter for your chance to winEnds in 12 hou,en,2022-04-15,,[],positive,0.0,43.0,1.0
harem,Natalie74440094,RT bernardfoong Secrets like cats will reveal themselves when the time is ripeINITIATION is a sensually cap,en,2022-04-15,,[],neutral,0.0,4.0,0.0
harem,Stephan28511851,I am suggesting you to wear Amethyst color sweater and Lavender color Harem Pants with nothing,en,2022-04-15,,[],neutral,0.0,0.0,0.0
harem,AshRite2,RT bernardfoong An incredible fairy tale became my realityINITIATION is an autobiography of a young mans enlig,en,2022-04-15,,[],positive,0.0,10.0,0.5
harem,novasyumes,M4RUNYAS Ur harem happening in tl,en,2022-04-15,"   ✧         yumes
                    
              🫧 Kye (twst) ✧
              ⚛️ Yuuna (twst yuusona ; wip)",[],neutral,0.0,0.0,0.0
harem,harem_eater,RT NPBEAR1010 2022 Happy birthday,en,2022-04-15,Indonesia,"['律可誕生日2022', 'りつあーと']",neutral,0.0,163.0,0.0
harem,danesaandag,RT wreckedtwice Eunbi turns into such a weirdo as soon as she sees Minju and Minju cant stop laughing through the embarrassment as soon,en,2022-04-15,,[],neutral,0.0,11.0,0.0
harem,animewesl,neokkri Baleygr086 i dont like this new member of the harem,en,2022-04-15,,[],positive,2.0,0.0,0.1363636363636363
harem,musalybb,RT NANATOKYUU NSFWwelcome to the sj harem,en,2022-04-15,,[],positive,0.0,41.0,0.8
harem,seanomack_,Y The Last Man Volume 1Very excited to read more of this dont worry its not some harem stuff its actually quite an in depth idea of what the world may be without men especially back for when the book was written Really great story so far45,en,2022-04-15,"South East, England",[],positive,1.0,0.0,0.2696428571428572
harem,FXrespectsU,Due to reasons I cant discloseIm bringing back the harem application form,en,2022-04-15,18↓,[],negative,3.0,0.0,-0.0625
harem,EvaFarohi,RT bernardfoong Keep loving because love is a beautiful thingINITIATION This book is a sensually captivating a,en,2022-04-15,"Wien,Niederösterreich,Mallorca",[],positive,0.0,3.0,0.6125
harem,kay_tee_kat,neergyhehe My bad our harem,en,2022-04-15,,[],negative,0.0,0.0,-0.6999999999999998
harem,EvaFarohi,RT aharemboysaga What a beautiful feeling to be alive under the blooms of the cherry blossom treesA Harem Boys Saga a memoir by Young,en,2022-04-15,"Wien,Niederösterreich,Mallorca",[],positive,0.0,1.0,0.475
harem,yaezores,tojigumi onetweet au slight megumi haremwarn incest bxb lot of sange words and hatihati takut sange beneran,en,2022-04-15,yae's boobs,['tojigumi'],negative,0.0,0.0,-0.1666666666666666
harem,Natalie74440094,RT bernardfoong Elusive is a butterfly when pursued is beyond your grasp but may alight upon you when youre quietTURPITUDE,en,2022-04-15,,[],neutral,0.0,3.0,0.0
harem,seokjin_harem,RT knjgIoss hoseok gets in the car thinking hes going somewhere by himself and he turns around to see vminkook in the backseat with thei,en,2022-04-15,,[],neutral,0.0,4631.0,0.0
harem,icy_hooon,jongrakista im sitting GAWAIN MO NA TO ill prolly write it when im finally done with my sunoo harem agenda,en,2022-04-15,rps. dni minors! strictly 18+.,[],negative,0.0,0.0,-0.25
harem,4rcalendercafe,TWICE is a 9 member girl group from jyp entertainement also known as myoui minas harem,en,2022-04-15,,[],neutral,1.0,0.0,0.0
harem,jgmacleodauthor,RT aharemboysaga True fairy tales are stories of triumph transformation and love all things I fervently believe inA Harem Boys Saga,en,2022-04-15,"Ontario, Canada",[],positive,0.0,6.0,0.425
harem,harem_zello,RT itmydefinition จริง,th,2022-04-15,,[],neutral,0.0,11941.0,0.0
harem,dream_harem,RT ByronWan two NYT articles written by Li Yuan L Chinas success in containing the outbreak burnished Beijings image o,en,2022-04-15,,[],positive,0.0,7.0,0.3
harem,xToraishii,kurehaalpha he really be building his harem so proud,en,2022-04-15,follow my art account,[],positive,0.0,0.0,0.5
harem,HarmonyPebble,RT bernardfoong An incredible fairy tale became my realityINITIATION is an autobiography of a young mans enlig,en,2022-04-15,,[],positive,0.0,2.0,0.5
harem,cloud_eth,RT GMSquadNFT Whitelist Giveaway Giving away 5x whitelist spots for Waifu Harem ClubEnter for your chance to winEnds in 12 hou,en,2022-04-15,USA,[],positive,0.0,36.0,1.0
harem,tiddienthusias1,RT NANATOKYUU NSFWwelcome to the sj harem,en,2022-04-15,,[],positive,0.0,19.0,0.8
harem,bratzread,theres no way for me to sit through a love triangle ever again when i can just read reverse harem and be on my merry way,en,2022-04-15,,[],positive,0.0,0.0,0.5
harem,SusanneLeist,RT aharemboysaga Always deliver more than expectedA Harem Boys Saga a memoir by Young a 5book series is,en,2022-04-15,New York,[],positive,0.0,17.0,0.1666666666666666
harem,pawgers_,With the rest of the harem who put that there,en,2022-04-15,Ny,[],neutral,3.0,0.0,0.0
harem,violetisima,RT NANATOKYUU NSFWwelcome to the sj harem,en,2022-04-15,Infierno from Para-why,[],positive,0.0,41.0,0.8
harem,Phaphuphnick,RT GMSquadNFT Whitelist Giveaway Giving away 5x whitelist spots for Waifu Harem ClubEnter for your chance to winEnds in 12 hou,en,2022-04-15,,[],positive,0.0,69.0,1.0
harem,harem_eater,RT noyaariho 2022,en,2022-04-15,Indonesia,['律可誕生日2022'],neutral,0.0,119.0,0.0
harem,MravikPal,RT bernardfoong An incredible fairy tale became my realityINITIATION is an autobiography of a young mans enlig,en,2022-04-15,Germany,[],positive,0.0,10.0,0.5
harem,TrueUltimateArt,RT aharemboysaga A Harem Boys Saga a memoir by Young a 5book series is a sensually captivating true story,en,2022-04-15,,[],positive,0.0,8396.0,0.3166666666666666
harem,CuriousEte,3rdWorldNFT BohemiaArtFair Feel you mate hope the harem makes us well off 07,en,2022-04-15,BOHEMIA ,[],neutral,0.0,0.0,0.0
harem,MravikPal,RT aharemboysaga Every flower is a soul blossoming in natureDEBAUCHERY is the 3rd book to a sensually illuminat,en,2022-04-15,Germany,[],neutral,0.0,3.0,0.0
harem,jjyoung05,RT jaeminspuzzle morning kisses a jm harem au,en,2022-04-15,MY,[],neutral,0.0,41.0,0.0
harem,prayash_giria,The Harem is particularly arresting with a series of porticoes allotted to the Khans various queens Each features beautifully carved wooden doors columns and roofs as well as sumptuous blue tiles The lesser concubines meanwhile made do with shared balconies,en,2022-04-15,Delhi,[],positive,0.0,0.0,0.1694444444444444
harem,baesthel,paulinebabaud Pauline harem arc incrr,en,2022-04-15,Sur la canebière,[],neutral,0.0,0.0,0.0
harem,Jacqthehermit,Lrt Sakura never beating the Harem Queen allegationsAlso thats KakaSaku 20 sksksksks,en,2022-04-15,ko-fi.com/jacqthehermit,[],neutral,0.0,0.0,0.0
harem,SmokedMomo,lgnoramus7 Where is your harem,en,2022-04-15,Bharat 🛕,[],neutral,1.0,0.0,0.0
harem,grandpa_harem,sleep,en,2022-04-15,,[],neutral,3.0,1.0,0.0
harem,babywangji,RT NANATOKYUU NSFWwelcome to the sj harem,en,2022-04-15,,[],positive,0.0,25.0,0.8
harem,harem_zello,RT am สำหรับเรา เพื่อนแท้คือคนที่กล้าเตือนเราเวลาเราทำในสิ่งที่ผิดอะ ไม่จำเป็นต้องเข้าข้างเราทุกเรื่องเลย ถ้าตอนไหนที่เราทำตัวไม่ดีก็,th,2022-04-15,,[],neutral,0.0,14500.0,0.0
harem,TudorTweep,RT aharemboysaga A Harem Boys Saga a memoir by Young a 5book series is a sensually captivating true story,en,2022-04-15,Wild and wonderful Wales ,[],positive,0.0,8396.0,0.3166666666666666
harem,harem_zello,RT kaenakeng อย่าลืมใช้ชีวิตในช่วงวัยนี้ให้คุ้ม อย่าลืมว่าเราจะไม่ได้อายุเท่านี้ไปตลอด แกจะโตขึ้นในทุกวันและมันน่าเสียดายที่พอคิดกลับมาแ,th,2022-04-15,,[],neutral,0.0,24127.0,0.0
harem,harem_zello,RT onceagaininmemo มีเรื่องอุทาหรณ์สำหรับคนที่ขึ้นรถแล้วไม่ชอบล็อครถ วันนี้คือที่คอนโดฉันเอง ระหว่างที่ชะลอรถเพราะรถขันหน้าจอดส่งของ พอเร,th,2022-04-15,,[],neutral,0.0,50857.0,0.0
harem,ofintimateism,Hes got an armymaybe hell make a harem out of queens,en,2022-04-15,18+,[],neutral,0.0,0.0,0.0
harem,dream_harem,RT ResusCGMedia Good Morning Putin The Mosvka Effect on The Kremlin,en,2022-04-15,,[],positive,0.0,998.0,0.875
harem,harem_zello,RT itmydefinition จริง,th,2022-04-15,,[],neutral,0.0,11806.0,0.0
harem,Novaelys_,TophBoom Yes lets go to the Cafe Finished downloading it but have to finish Harem Kingdom,en,2022-04-15,May Waifus bless your day~,[],neutral,0.0,0.0,0.0
harem,harem_eater,RT GirlsFrontlineE Dear Commanders FO12 will be added to the heavy production pool starting Apr 19th A searcher and bodyguard she o,en,2022-04-15,Indonesia,[],negative,0.0,26.0,-0.1
harem,NyxcryptoSG,RT GMSquadNFT Whitelist Giveaway Giving away 5x whitelist spots for Waifu Harem ClubEnter for your chance to winEnds in 12 hou,en,2022-04-15,Singapore,[],positive,0.0,44.0,1.0
harem,DIEBO37RT2,RT bernardfoong April dressed in all its trims hath put a spirit of youth in everythingTURPITUDE is the 4th,en,2022-04-15,United States - Boston,[],neutral,0.0,2.0,0.0
harem,Radha93154152,RT CBKissess95 Enjoyingmyself9 thatblaxican The fact that she was fucking both of yall is hilarious She got a whole little harem,en,2022-04-15,,[],negative,0.0,1.0,-0.0218749999999999
harem,periodsof,RT NANATOKYUU NSFWwelcome to the sj harem,en,2022-04-15,,[],positive,0.0,15.0,0.8
harem,rollingeuthunda,xradioblood No wonder his harem losing their shit i am so full of envy rn i wanna bang him,en,2022-04-15,tower,[],positive,0.0,0.0,0.0749999999999999
harem,harem_zello,RT miketaninrat แก๊งคอลเซ็นเตอร์โทรมาบอกว่า ขอรบกวนวันหยุด มีแก้งานตรง เรารู้ทันก็เลยกดวางสายทันที,th,2022-04-15,,[],neutral,0.0,54492.0,0.0
harem,PrinceKaguyo,Polyandry is probably heresyThe girls and their harem of clients or boyslover should be bannedA kind of goddess and her servantBut their is no god above God bunch of heretics,en,2022-04-15,Here,[],positive,0.0,0.0,0.3
harem,ArbieNFT,Whitelist Giveaway Giving away 2 whitelist spots for Waifu Harem ClubEnter for your chance to winEnds in 10 hours1 Like amp Retweet 2 Follow ArbieNFT GMSquadNFT amp AMVWaifuHC 3 Tag some friendsNFTGiveaway NFTs WhitelistGiveaway,en,2022-04-15,GM KEY SOLD OUT,"['NFTGiveaway', 'NFTs', 'WhitelistGiveaway']",positive,6.0,3.0,1.0
harem,shannyg25,Check out this listing I just added to my Poshmark closet Harem Pants LXL shopmycloset poshmarkapp,en,2022-04-15,"Lavon, TX","['Poshmark', 'shopmycloset']",neutral,0.0,0.0,0.0
harem,poddar_pipette,13StarSoul Ye to revolution laane ki soch raha hai wants to be in a harem,en,2022-04-15,"भारत, ভারত ",[],positive,2.0,0.0,0.2
harem,AIunhinged,piedpipeerr astiluor SeaSandsNic hajojoxx Its okay So am I Its a harem thing,en,2022-04-15,,[],positive,1.0,0.0,0.5
harem,simran_mahto,The plot of Im the Chief of the Harem is like a roller coaster of emotion Its riveting and full of surprises DoctorStrange drawing theflash animation,en,2022-04-15,,"['DoctorStrange', 'drawing', 'theflash', 'animation']",positive,0.0,0.0,0.46875
harem,seoltang_q,RT NANATOKYUU NSFWwelcome to the sj harem,en,2022-04-15,"she/they, 23",[],positive,0.0,36.0,0.8
harem,classylazy,RT seojoeyya jaemin harem,en,2022-04-15,jenjaem,[],neutral,0.0,1.0,0.0
harem,bullshitCha,Where is my proplayer harem,en,2022-04-15,,[],neutral,6.0,0.0,0.0
harem,owen_author,RT aharemboysaga Always deliver more than expectedA Harem Boys Saga a memoir by Young a 5book series is,en,2022-04-15,All Over,[],positive,0.0,18.0,0.1666666666666666
harem,gentpepper_kat,From all stupid asshole geisha communal harem etcetera that dont practice 1 man amp 1 woman marriages and not touching unmarried people above the knee deliver us oh Lord,en,2022-04-15,"Oregon, USA",[],negative,0.0,0.0,-0.3499999999999999
harem,HarmonyPebble,RT bernardfoong The rainbow gave thee birth and left thee her lovely huesINITIATION is a sensually captivating,en,2022-04-15,,[],positive,0.0,5.0,0.25
harem,QueenTiyetiti,They tried to just make it seem house bringing about Harem,en,2022-04-15,,[],neutral,0.0,0.0,0.0
harem,SmartB0ss,RT bernardfoong An incredible fairy tale became my realityINITIATION is an autobiography of a young mans enlig,en,2022-04-15,Paris Panama Seoul London ,[],positive,0.0,10.0,0.5
harem,harem_zello,RT nchdaq เราต่างก็เป็นทั้งคนที่ทำใครสักคนหล่นหายไปจากชีวิต และเป็นคนที่หล่นหายออกมาจากชีวิตใครบางคน,th,2022-04-15,,[],neutral,0.0,2028.0,0.0
harem,jwycentric,wooyoung harem au promptheroteez competing on who will capture the infamous villainwoo firstthe only reason woo does crimes is because he wants the heroes attention which worked,en,2022-04-15,she/they 18,[],negative,3.0,0.0,-0.0124999999999999
harem,aharemboysaga,Life is 10 what happens to you and 90 on how you react to itINITIATION is a sensually illuminating true story about a young man comingofage in a secret society amp a male haremBookBoostAuthorUpROAR,en,2022-04-15,"Maui, Hawaii","['BookBoost', 'AuthorUpROAR']",positive,0.0,0.0,0.0124999999999999
harem,mobilefoot,RT aharemboysaga TURPITUDE is the 4th book to a sensually captivating autobiography about a young man coming of a,en,2022-04-15,"Sunderland, Tyne and Wear, UK",[],positive,0.0,1.0,0.3
harem,kirbycurby_,Mitsumine249 priparansns ukivioleta IKR and Uki hasnt barely even touched him yet and rpr is already joining the harem willingly,en,2022-04-15,,[],positive,0.0,0.0,0.15
harem,IceTigerETH,RT ArbieNFT Whitelist Giveaway Giving away 2 whitelist spots for Waifu Harem ClubEnter for your chance to winEnds in 10 hours,en,2022-04-15,,[],positive,0.0,7.0,1.0
harem,nijironatsu,DEnvy026 harem king behaviour,en,2022-04-15,she/they/xe/vae/star,[],neutral,0.0,0.0,0.0
harem,_asterlily,RT loneregressor Kdj harem supremacy modern au with the different regressions of yjh as part of the same family And they own this lar,en,2022-04-15,,[],positive,0.0,98.0,0.2
harem,Lord_Goldmane_I,RT JListPeter Who are the best and worst main character in harem anime Heres a blog post,en,2022-04-15,"Portland, OR",[],positive,0.0,1.0,0.0694444444444444
harem,bernardfoong,Save a boyfriend for a rainy and another in case it doesnt rainINITIATION is a sensually captivating and illuminating autobiography about a young man coming of age in a secret society amp a male haremAuthorUproarLGBTQ,en,2022-04-15,,"['AuthorUproar', 'LGBTQ']",positive,0.0,0.0,0.0499999999999999
harem,AminVdt,RT AMVWaifuHC Our VIP Minting will start at Saturday April 16th at 1000 AM EST Weeb3s dont miss itGiving away 1 Waifu Harem Club,en,2022-04-15,,[],neutral,0.0,231.0,0.0
harem,GMSquadNFT,Whitelist Giveaway Giving away 5x whitelist spots for Waifu Harem ClubEnter for your chance to winEnds in 12 hours1 Like amp Retweet 2 Follow GMSquadNFT amp AMVWaifuHC 3 Tag some friendsNFTGiveaway NFTs,en,2022-04-15,SOLD OUT!,"['NFTGiveaway', 'NFTs']",positive,29.0,29.0,1.0
harem,DIEBO37RT2,RT bernardfoong INITIATION is a sensually captivating autobiography about a young man coming of age in a secret s,en,2022-04-15,United States - Boston,[],positive,0.0,3.0,0.0666666666666666
harem,Timothy68211325,13StarSoul I could be a guy in your harem but you wouldnt be a woman in mine Right,en,2022-04-15,Keetoowah Territory.,[],positive,0.0,0.0,0.2857142857142857
harem,dnfdaze,no bc this made me chuckle but at same time it makes me wish him and his own harem good outcomes around themselves,en,2022-04-15,16 HeWeep+ c: leakyheart !,[],positive,0.0,0.0,0.4333333333333333
harem,anya4ger,what made me frustated maybe because its a harem storyI REALLY DIDNT READ THE TAGS I JUST WANT CUTEASS ROMANTIC STORY BUT I STILL READ IT BCS I WANT TO KNOW THE ENDING the development between male lead and female lead really slooooow like its been 100 chap,en,2022-04-15,,[],positive,0.0,0.0,0.08
harem,DIEBO37RT2,RT bernardfoong The new year is here like a books chapter waiting to be writtenTURPITUDE is the 4th book t,en,2022-04-15,United States - Boston,[],positive,0.0,2.0,0.1363636363636363
harem,patrokalos,again my life is just a kim heewoo harem,en,2022-04-15,she/her 19,[],neutral,0.0,0.0,0.0
harem,aharemboysaga,I was delighted to blossom early in lifeA Harem Boys Saga IV TURPITUDE a memoir by Young is the 4th book to an autobiography of a young mans enlightening comingofage secret education in a male harem known only to a fewFreshInkGroupLGBTQ,en,2022-04-15,"Maui, Hawaii","['FreshInkGroup', 'LGBTQ']",positive,0.0,0.0,0.0777777777777777
harem,CheezNG,JJBAscreenshots Yuyas trying to expand his harem,en,2022-04-15,Outer Heaven,[],neutral,1.0,0.0,0.0
harem,chesh4k,PhungErika at least her character wont be thrown into the traveler simp harem if she doesnt become playable that is,en,2022-04-15,he/him,[],negative,1.0,0.0,-0.3
harem,nyoonberry,springpinks doncrymoonchild Hahahahahaaaaaa whalien harem I like the sound of that,en,2022-04-15,under Min Yoongi's skirt,[],positive,0.0,0.0,0.4
harem,shopeewoy,Benhill Casual Harem,en,2022-04-15,"Jakarta Pusat, DKI Jakarta",[],negative,0.0,0.0,-0.5000000000000001
harem,bernardfoong,What a beautiful feeling to be alive under the blooms of the cherry blossom treesUNBRIDLED is the sequel to an autobiography of a young mans enlightening comingofage secret education in a male harem known only to a fewBookBoost AuthorUpRoar,en,2022-04-15,,"['BookBoost', 'AuthorUpRoar']",positive,0.0,0.0,0.09375
harem,DIEBO37RT2,RT bernardfoong Losing yourself in new surroundings is the best way to find yourselfTURPITUDE is the 4th book t,en,2022-04-15,United States - Boston,[],positive,0.0,3.0,0.5681818181818181
harem,harem_eater,RT seiqw why do youwhyuhhso why do you think this is okay,en,2022-04-15,Indonesia,[],positive,0.0,46.0,0.5
harem,Fel_Piedra,rxoymar pitapitzz It seems like a usual harem and ecchi anime but its not Its actually quite good and beautiful if you finish it and then watch the movie,en,2022-04-15,"Puerto Rico, USA",[],positive,0.0,0.0,0.3249999999999999
harem,HouseofArts_Nr1,RT aharemboysaga Every flower is a soul blossoming in natureDEBAUCHERY is the 3rd book to a sensually illuminat,en,2022-04-15,Worldwide,[],neutral,0.0,4.0,0.0
harem,aetherictides,sallyxiv JustallmeDark Sally I think you might be a harem protagonist,en,2022-04-15,Exodus,[],neutral,1.0,0.0,0.0
harem,MoriInuzuka,I dont want a harem the family i grow up in nor the people who got the inheritance No no What I want is a family of my own a family of my choice moritakainuzukaspeaksupforhimself moritakainuzuka moritakainuzukaart housamo tokyoafterschoolsummoners lifewonders,en,2022-04-15,,"['moritakainuzukaspeaksupforhimself', 'moritakainuzuka', 'moritakainuzukaart', 'housamo', 'tokyoafterschoolsummoners', 'lifewonders']",positive,0.0,0.0,0.6
harem,90yzzs,Yxrei 935Wiper 816NOT we we garde ton harem loin de Sou,en,2022-04-15,,[],neutral,0.0,0.0,0.0
harem,DIEBO37RT2,RT bernardfoong Elusive is a butterfly when pursued is beyond your grasp but may alight upon you when youre quietTURPITUDE,en,2022-04-15,United States - Boston,[],neutral,0.0,3.0,0.0
harem,37DIEBO,RT bernardfoong Secrets like cats will reveal themselves when the time is ripeINITIATION is a sensually cap,en,2022-04-15,Boston ,[],neutral,0.0,1.0,0.0
harem,DIEBO37RT2,RT bernardfoong Secrets like cats will reveal themselves when the time is ripeINITIATION is a sensually cap,en,2022-04-15,United States - Boston,[],neutral,0.0,4.0,0.0
harem,Little__Droplet,RT ArbieNFT Whitelist Giveaway Giving away 2 whitelist spots for Waifu Harem ClubEnter for your chance to winEnds in 10 hours,en,2022-04-15,,[],positive,0.0,12.0,1.0
harem,suhpreme209,RT No0ne00 Renjun harem promptLike mk hc jm jn are lifeguards and they keep eyeing the new pretty beach goer rj whos always a,en,2022-04-15,쟌윈런🇸🇬🇹🇭,[],positive,0.0,1.0,0.1931818181818181
harem,kaeyastidds,lrt damn we be living in uki violetas world and his harem of men down bad for him,en,2022-04-15,read pinned byf,[],negative,0.0,0.0,-0.4277777777777777
harem,rnaissances,in the past few weeks jeno has been married to haechan married and with child mark with chenle now engaged to jisung maybe jeno harem isnt that outlandish an idea,en,2022-04-15,renaissances @ ao3,[],positive,2.0,3.0,0.0124999999999999
harem,beardedladytoe,RT GMSquadNFT Whitelist Giveaway Giving away 5x whitelist spots for Waifu Harem ClubEnter for your chance to winEnds in 12 hou,en,2022-04-15,,[],positive,0.0,36.0,1.0
harem,Suibian905,Im in Miras harem omgg thankyouuu dahailuoyin,en,2022-04-15,21 | she/her ,[],neutral,0.0,0.0,0.0
