Keyword,User,Tweet,Language,Time,User Location,Hashtag,Polarity,Likes,Retweet,Sentiment
harem,criwisbrisik,RT UKEADEN The footages from the moments when the invading Israeli forces attacked the Qibla Masjid in Masjid alAqsa at the time of the,en,2022-04-15,in your heart,[],neutral,0.0,2.0,0.0
harem,SusanneLeist,RT bernardfoong Truth amp roses have thornsUNBRIDLED is the sequel to an autobiography of a young mans enlighten,en,2022-04-15,New York,[],positive,0.0,25.0,0.1
harem,harem_eater,RT ADMONlSHMENT arknights Ashknights,en,2022-04-15,Indonesia,['arknights'],neutral,0.0,218.0,0.0
harem,StarboyFola,RT GMSquadNFT Whitelist Giveaway Giving away 5x whitelist spots for Waifu Harem ClubEnter for your chance to winEnds in 12 hou,en,2022-04-15,Africa,[],positive,0.0,47.0,1.0
harem,jupiterjavelin,Namaryuu Im sorry but this anime was so damn boring lol but thats probably also because of me being fed up with the oversaturation of isekais and harem during that time and now still lol,en,2022-04-15,,[],positive,0.0,0.0,0.025
harem,SouthernGays666,Rachel from metropolitan harem got pretty mad just now,en,2022-04-15,,[],negative,0.0,0.0,-0.1875
harem,AmeliaStark_18,RT AmeliaStark18 Trained to Obey Part Nine The FinaleThe Princes Thrall Series has reached the final book Part One only 199,en,2022-04-15,Lincolnshire,['Series'],neutral,0.0,9.0,0.0
harem,harem_zello,RT linlinSsakura อยากได้นิยายที่พระเอกขึ้นอย่างหงส์ลงอย่างหมา แต่ชั่วแค่พอดีไม่ต้องเป็นตำนาน,th,2022-04-15,,[],neutral,0.0,13600.0,0.0
harem,suhpreme209,RT No0ne00 Renjun harem promptLike mk hc jm jn are lifeguards and they keep eyeing the new pretty beach goer rj whos always a,en,2022-04-15,쟌윈런🇸🇬🇹🇭,[],positive,0.0,2.0,0.1931818181818181
harem,Natalie74440094,RT bernardfoong Elusive is a butterfly when pursued is beyond your grasp but may alight upon you when youre quietTURPITUDE,en,2022-04-15,,[],neutral,0.0,4.0,0.0
harem,poke_harem,Tsareena creates a reverse harem of altersex Groudon that it lives with,en,2022-04-15,Route 69,[],neutral,0.0,0.0,0.0
harem,Milliformemes,I always thought the concept of harem of sqq a bit funny in retrospect because in the end its the same thing as pidwBingbing isnt it That none of them like sqq for who he is,en,2022-04-15,None of anyone's business,[],positive,0.0,0.0,0.125
harem,harem_eater,RT ADMONlSHMENT arknights Ashknights,en,2022-04-15,Indonesia,['arknights'],neutral,0.0,245.0,0.0
harem,MBamba2020,RT GMSquadNFT Whitelist Giveaway Giving away 5x whitelist spots for Waifu Harem ClubEnter for your chance to winEnds in 12 hou,en,2022-04-15,,[],positive,0.0,36.0,1.0
harem,jinmaoshu219,RT iroiro3843 harem GenshinImpact,en,2022-04-15,,"['GenshinImpact', '原神']",neutral,0.0,3473.0,0.0
harem,hyeonyist,OH AND I also had this dream casting for a manhwa I read before Kim Taeri Shownu Kwak Dongyeon maybe Ahn Hyoseop and Choi Woosik for a fun harem bdsm type beat,en,2022-04-15,they.,[],positive,0.0,0.0,0.3
harem,Azaleedreen,RT AMVWaifuHC Waifu Harem Club X Makari Clan We are dropping 5 WL spots for Makari Clan 5 WL spots for Waifu Harem Clu,en,2022-04-15,,[],neutral,0.0,59.0,0.0
harem,grollaze,RT wreckedtwice Eunbi turns into such a weirdo as soon as she sees Minju and Minju cant stop laughing through the embarrassment as soon,en,2022-04-15,Liverpool,[],neutral,0.0,8.0,0.0
harem,mymymyexol,RT jaeminspuzzle morning kisses a jm harem au,en,2022-04-15,Jakarta,[],neutral,0.0,36.0,0.0
harem,dagangsosis,jaypendaki harem,en,2022-04-15,,[],neutral,0.0,0.0,0.0
harem,RedOppaiDragon,The worst this devil does is try to build a harem Well there may be the fact he has stripping powers but thats not against all of humanity in the way she means,en,2022-04-15,Mun is 21. He/Him.,[],negative,0.0,0.0,-1.0
harem,cantonagiggs1,RT GMSquadNFT Whitelist Giveaway Giving away 5x whitelist spots for Waifu Harem ClubEnter for your chance to winEnds in 12 hou,en,2022-04-15,,[],positive,0.0,44.0,1.0
harem,aharemboysaga,Ive never been a social bunny I thrive on workMETANOIA Latest Release is the final volume to a true story of a young mans enlightening comingofage secret education in a male harem known only to a fewAuthorUpROARGay,en,2022-04-15,"Maui, Hawaii","['AuthorUpROAR', 'Gay']",positive,0.0,0.0,0.0999999999999999
harem,No_0ne_00,Renjun harem promptLike mk hc jm jn are lifeguards and they keep eyeing the new pretty beach goer rj whos always accompanied by 2 kids chenji at the beach The lifeguards compete on who catches his attentionBondi rescue on yt lead me down the rabbit hole,en,2022-04-15,Here,[],positive,3.0,2.0,0.0769360269360269
harem,sdmnm11,RT GMSquadNFT Whitelist Giveaway Giving away 5x whitelist spots for Waifu Harem ClubEnter for your chance to winEnds in 12 hou,en,2022-04-15,,[],positive,0.0,52.0,1.0
harem,KaranAwtani1,Frankisalegend1 And they will do all they can to sabotage any budding relationship between any other nation amp the USThey latch onto their special relationship in same manner as alpha concubine in a harem Any new entrant is seen as threat to be subdued ASAP lest they become the new favourite,en,2022-04-15,1984,[],positive,1.0,0.0,0.1064935064935064
harem,cloud_eth,RT ArbieNFT Whitelist Giveaway Giving away 2 whitelist spots for Waifu Harem ClubEnter for your chance to winEnds in 10 hours,en,2022-04-15,USA,[],positive,0.0,6.0,1.0
harem,cloud_eth,RT GMSquadNFT Whitelist Giveaway Giving away 5x whitelist spots for Waifu Harem ClubEnter for your chance to winEnds in 12 hou,en,2022-04-15,USA,[],positive,0.0,39.0,1.0
harem,hamilbots,Laughin at my sister cuz she wants to form a harem Im just sayin if you really loved me you would share him,en,2022-04-15,dm requests/corrections,[],positive,5.0,0.0,0.4499999999999999
harem,elusive_6788,RT bernardfoong Jump and youll find out how to unfold your wings when you fallMETANOIA New Release is the,en,2022-04-15,Norway,[],positive,0.0,4.0,0.1363636363636363
harem,queen_misaki,My honey Misaki will learn to be a member of your harem I aspire to be as respectable as Saffronoujo,en,2022-04-15,Academy City,[],positive,0.0,0.0,0.5
harem,JudasFalling666,RT aharemboysaga Celebrate the Beauty of Love INITIATION is a sensually captivating and illuminating autobiogra,en,2022-04-15,"Sydney, Australia",[],positive,0.0,4.0,0.5
harem,DTien,RT GMSquadNFT Whitelist Giveaway Giving away 5x whitelist spots for Waifu Harem ClubEnter for your chance to winEnds in 12 hou,en,2022-04-15,"San Diego, CA",[],positive,0.0,23.0,1.0
harem,ReadingJust4,AniTrendz The Trapped in an Otome game show is definitely trash but Im kind of enjoying it anyway Welding stupid harem power fantasy into an Otome school setting is very stupid but the novelty sort of works,en,2022-04-15,,[],negative,0.0,0.0,-0.1857142857142857
harem,YunmengHarlottt,RT NANATOKYUU NSFWwelcome to the sj harem,en,2022-04-15,probably on Earth,[],positive,0.0,38.0,0.8
harem,KawaiiopeStan44,RT PrinniesRock moricalliope We gotta add to the Adam harem,en,2022-04-15,,[],neutral,0.0,1.0,0.0
harem,higudoesntexist,Kagegoroshihen In a world where Tatsuyoshi Kasai discriminates against Mions gun Teppei Houjou must understand Harem Royale and save Hinamizawa,en,2022-04-15,,[],neutral,0.0,0.0,0.0
harem,CherryleneRox,RT ArbieNFT Whitelist Giveaway Giving away 2 whitelist spots for Waifu Harem ClubEnter for your chance to winEnds in 10 hours,en,2022-04-15,Malaysia,[],positive,0.0,7.0,1.0
harem,ArtemDimitri,I just realised how much of a reverse harem slut I am because Im going through my favourite manhwa list anddear lord,en,2022-04-15,,[],positive,0.0,0.0,0.2
harem,JimBrazil,RT aharemboysaga I was delighted to blossom early in lifeA Harem Boys Saga IV TURPITUDE a memoir by Young,en,2022-04-15,Brazil,[],positive,0.0,6.0,0.3
harem,dcwing2009,RT AMVWaifuHC Waifu Harem Club X Makari Clan We are dropping 5 WL spots for Makari Clan 5 WL spots for Waifu Harem Clu,en,2022-04-15,Hong Kong,[],neutral,0.0,56.0,0.0
harem,mijingyi,badbitchlolly Damn a whole ass harem or what,en,2022-04-15,𝗎𝗇𝗄𝗈𝗐𝗇 𝗅𝗈𝖼𝖺𝗍𝗂𝗈𝗇,[],positive,0.0,0.0,0.2
harem,cadisxiao,this is why i hate harem huhu,en,2022-04-15,she 🇵🇭▪minor,[],negative,0.0,0.0,-0.8
harem,mathonwy,WritingLefty BayouPhilosophy takes notes Beer league hockey you say Showering with a harem of husbands you say,en,2022-04-15,Abalnās,[],neutral,2.0,0.0,0.0
harem,Gusuesposa,RT i8chen New chapter for my concubine milfSQQ AU fic is out SQQ tries to wrangle the harem into shape LBH goes to school and wrangles,en,2022-04-15,姑苏蓝氏,[],positive,0.0,12.0,0.0352272727272727
harem,Amirhashmian,RT GMSquadNFT Whitelist Giveaway Giving away 5x whitelist spots for Waifu Harem ClubEnter for your chance to winEnds in 12 hou,en,2022-04-15,,[],positive,0.0,29.0,1.0
harem,cloud_eth,RT ArbieNFT Whitelist Giveaway Giving away 2 whitelist spots for Waifu Harem ClubEnter for your chance to winEnds in 10 hours,en,2022-04-15,USA,[],positive,0.0,3.0,1.0
harem,aharemboysaga,RT bernardfoong Anyone who lives within their means suffers from a lack of imaginationINITIATION INITIATION h,en,2022-04-15,"Maui, Hawaii",[],negative,0.0,1.0,-0.6
harem,aharemboysaga,RT bernardfoong Losing yourself in new surroundings is the best way to find yourselfUNBRIDLED is the sequel to,en,2022-04-15,"Maui, Hawaii",[],positive,0.0,2.0,0.5681818181818181
harem,rainclouded_,i think conceptually theres something really fun about a dating sim where theres a bunch of routes or a harem anime where all of the girls have their own arc not that i really like much of that stuff in practice but still,en,2022-04-15,,[],positive,0.0,0.0,0.3374999999999999
harem,leungkc07,RT GMSquadNFT Whitelist Giveaway Giving away 5x whitelist spots for Waifu Harem ClubEnter for your chance to winEnds in 12 hou,en,2022-04-15,Hong Kong,[],positive,0.0,36.0,1.0
harem,elusive_6788,RT aharemboysaga April in Paris chestnuts in blossom and holiday tables under the tree BlissA Harem Boys Saga a memoir by Young a,en,2022-04-15,Norway,[],positive,0.0,1.0,0.1
harem,hov_ian,RT aharemboysaga I love Paris in the Spring when it drizzles Cole PorterA Harem Boys Saga a memoir by Young a 5book series http,en,2022-04-15,Kenya,[],positive,0.0,3.0,0.3
harem,LittlefingerKoi,เรื่องนี้เด้อทุกคนน มีหนุ่มๆ หลากสไตล์ให้เลือกมาก แปะให้ๆ,th,2022-04-15,BKK,[],,0.0,0.0,0.0
harem,Rajeshkaundle,nandtara DrMohanBhagwat RSSOrg The hatred that Hindus have in them now is a reaction to the inherent hatred of Hindus in jihadis amp proselytisers who seek to buy a ticket to heaven by offering a Hindu soul to the Merciful amp the appeasement of master by the secular jihadi brides to earn a bedtime in harem,en,2022-04-15,Mumbai,[],neutral,0.0,0.0,0.0
harem,Pizzazz_Books,RT bernardfoong Ive ruffled a few feathers at the institutions Ive led It is part of leadershipTURPITUDE is,en,2022-04-15,South Africa,[],negative,0.0,12.0,-0.2
harem,xenogears1234,Lets fucking goooo the trashiest most power fantasyharem isekai is back,en,2022-04-15,Tempe AZ,[],negative,0.0,0.0,-0.0333333333333333
harem,cloud_eth,RT GMSquadNFT Whitelist Giveaway Giving away 5x whitelist spots for Waifu Harem ClubEnter for your chance to winEnds in 12 hou,en,2022-04-15,USA,[],positive,0.0,43.0,1.0
harem,JusticeTalkz,goobydont I cant believe Peters friend group is his harem,en,2022-04-15,UL Universe,[],neutral,1.0,0.0,0.0
harem,liumingyanliu,cryingshizun do you wanna join mine and hualings harem then,en,2022-04-15,rp acc / admin is 17       ,[],neutral,0.0,0.0,0.0
harem,adosoukogalife,Ships are listed at the bottom at the doc for the kaoru harem one Its not actually everyone,en,2022-04-15,,[],neutral,1.0,0.0,0.0
harem,ArbieNFT,RT GMSquadNFT Whitelist Giveaway Giving away 5x whitelist spots for Waifu Harem ClubEnter for your chance to winEnds in 12 hou,en,2022-04-15,GM KEY SOLD OUT,[],positive,0.0,23.0,1.0
harem,SlutteaH,RT loneregressor Kdj harem supremacy modern au with the different regressions of yjh as part of the same family And they own this lar,en,2022-04-15,"any pronouns, i like to cry",[],positive,0.0,97.0,0.2
harem,NyxcryptoSG,GMSquadNFT AMVWaifuHC Harem niceee CriptoeKernsee brianmok mootACC,en,2022-04-15,Singapore,[],neutral,0.0,0.0,0.0
harem,czerwonyrower,the 100 girlfriends is truly unhinged harem manga without power limiters,en,2022-04-15,haunted eastern european woods,[],neutral,0.0,0.0,0.0
harem,susanamper,RT bernardfoong I love Paris in the Spring when it drizzles Cole PorterTURPITUDE is the 4th book to a sensual,en,2022-04-15,"New York, NY",[],positive,0.0,18.0,0.5
harem,dream_harem,RT MarcoSmileP FPWellman The actual towing operation of the Russian Warship Moscow,en,2022-04-15,,[],neutral,0.0,1.0,0.0
harem,marksugarbag,RT GMSquadNFT Whitelist Giveaway Giving away 5x whitelist spots for Waifu Harem ClubEnter for your chance to winEnds in 12 hou,en,2022-04-15,,[],positive,0.0,36.0,1.0
harem,amitycats,RT yaemilkrs Komore Teahouse Hooters is totally a thing in Modern AUSara harem ft Manager Ayato somewhere herekujousara eisara kok,en,2022-04-15,ღ read the card ღ,"['kujousara', 'eisara', 'kok']",positive,0.0,285.0,0.1
harem,StacyNi90756287,RT aharemboysaga A Harem Boys Saga a memoir by Young a 5book series is a sensually captivating true story,en,2022-04-15,"Melbourne, Australia ",[],positive,0.0,8384.0,0.3166666666666666
harem,harem_eater,RT lenmarciii m ah off collabs we dont really do itr this kind of atmosphere is nice righta we want to show off that were 1s,en,2022-04-15,Indonesia,[],positive,0.0,8.0,0.4214285714285714
harem,maho_oshi,ITS A HAREM,en,2022-04-15,,[],neutral,0.0,0.0,0.0
harem,Serim_01,RT NANATOKYUU NSFWwelcome to the sj harem,en,2022-04-15,ประเทศไทย,[],positive,0.0,25.0,0.8
harem,AkbarYoso,RT nka979 Chief Servant of the HaremHenry Guillaume Schlesinger 18141893,en,2022-04-15,"Sawangan, West Java",[],neutral,0.0,1.0,0.0
harem,TheAnon35236136,WarmHueOfBlue HWQranXIII So hilarious Shizun is shocked ShizunHow did I got a harem instead of harem Lord and How did the original harem Lord also became a part of my harem and I became the Harem Lord,en,2022-04-15,,[],positive,0.0,0.0,0.0583333333333333
harem,PaulaClarkey,NicolaJaney Leggings leggings and more leggings I lived in mine When Id just given birth my best friend bought me a pair of black harem pants from next The best gift ever I could have cried They are super comfy but look stylish too if you have a look for those x,en,2022-04-15,,[],positive,0.0,0.0,0.4925595238095238
harem,needledolly,For those up for a pseudoharem with an uptight middleaged femboy therapist for an mc Stick around,en,2022-04-15,,[],positive,5.0,0.0,0.5
harem,MoonTsuki01,RT maitakeheart maitake short au slight takemichi haremwarning,en,2022-04-15,,['maitake'],negative,0.0,47.0,-0.0833333333333333
harem,hajarrnizamm,Carnage by Sarah Bailey giving me Den of Vipers and Devils Night series reverse harem four horsemen,en,2022-04-15,,[],neutral,0.0,0.0,0.0
harem,bigcphx,Ima start a harem lol all this girlfriend shit for the birds,en,2022-04-15,On Da Souf,[],positive,0.0,0.0,0.3
harem,bschillace,Facebook what have I done to deserve your Harem Pants ads,en,2022-04-15,Cleveland,[],neutral,1.0,0.0,0.0
harem,Dazaisekai,Shizun shizunyour binghe has no interest in creating any harem,en,2022-04-15,🎐under the haitang blossom 🌸,[],neutral,0.0,0.0,0.0
harem,nijideeznuts_0,we livin for uk1 harem,en,2022-04-15,"—𝘢𝘴𝘪𝘢(+63) | 𝘦𝘯𝘨/fil 🆗
—𝘵𝘩𝘦𝘺/𝘵𝘩𝘦𝘮
—𝘮𝘪𝘯𝘰𝘳 (15-17)
—👹🦊/ ✒️🦁👟 / 🐑🔮 / 🔗🎭
°💛💙❤️🧡💜° / 𝘕𝘐𝘑𝘐𝘚𝘈𝘕𝘑𝘐 𝘌𝘕",[],neutral,0.0,0.0,0.0
harem,seokjin_harem,RT seokjinnieselca how ppl survive these live visual attacks from seokjin,en,2022-04-15,,[],positive,0.0,760.0,0.0681818181818181
harem,seokjin_harem,RT rkiveknj WE SEEN HOSEOK jhope hobi ptd bts,en,2022-04-15,,"['jhope', 'hobi', 'ptd', 'bts']",neutral,0.0,4952.0,0.0
harem,FXrespectsU,Due to reasons I cant discloseIm bringing back the harem application form,en,2022-04-15,18↓,[],negative,5.0,0.0,-0.0625
harem,aharemboysaga,Every flower is a soul blossoming in natureDEBAUCHERY is the 3rd book to a sensually illuminating true story about a young man comingofage in a secret society amp a male haremFreshInkGroupLGBTQ,en,2022-04-15,"Maui, Hawaii","['FreshInkGroup', 'LGBTQ']",positive,2.0,3.0,0.0099999999999999
harem,HarmonyPebble,RT bernardfoong What a beautiful feeling to be alive under the blooms of the cherry blossom treesUNBRIDLED is t,en,2022-04-15,,[],positive,0.0,1.0,0.475
harem,Kicchin2day,liu changs harem,en,2022-04-15,,[],neutral,1.0,0.0,0.0
harem,icuzo23,Among other parallelisms Kaichou wa Maidsama is just Ouran High School Host Club minus the harem,en,2022-04-15,,[],negative,0.0,0.0,-0.0216666666666666
harem,harem_eater,RT noyaariho 2022,en,2022-04-15,Indonesia,['律可誕生日2022'],neutral,0.0,113.0,0.0
harem,tn_daki,8 hours of harem managementIm not sure Im playing Yakuza anymore,en,2022-04-15,,[],negative,0.0,0.0,-0.25
harem,NathanyaisraelS,RT iuicphoenix Today at 6PM Deacon Eythan will be bringing fire to todays sabbath class Grab your bibles pens amp notebooks and pr,en,2022-04-15,,"['Deacon', 'fire', 'sabbath', 'bibles']",neutral,0.0,1.0,0.0
harem,harem_zello,RT nchdaq เราต่างก็เป็นทั้งคนที่ทำใครสักคนหล่นหายไปจากชีวิต และเป็นคนที่หล่นหายออกมาจากชีวิตใครบางคน,th,2022-04-15,,[],neutral,0.0,1856.0,0.0
harem,DeaDreaMuRR,Maki346 ArtificialLuma GiggukAZ Sydsnap Thats why I said harem tropes Common trope being main girl and MC are close af and the girls know about it yet they stick around the MC never really backing off or making a move stuck in a limbo until the story nears the climax or ends,en,2022-04-15,,[],negative,0.0,0.0,-0.0777777777777777
harem,yexger,Want a harem but I only attract obsessive girls,en,2022-04-15,Above you cause ur short / 19,[],neutral,1.0,0.0,0.0
harem,AnArtisticGamer,ukivioleta And the harem grows,en,2022-04-15,they/she,[],neutral,1.0,0.0,0.0
harem,asdwaas21,RT akamirETH Waifu Harem Club x Akamir CollabWaifu Harem Club 10WL spots giveawayHow to enter1 Join mission,en,2022-04-15,Korea,[],neutral,0.0,41.0,0.0
harem,rollingeuthunda,xradioblood No wonder his harem losing their shit i am so full of envy rn i wanna bang him,en,2022-04-15,tower,[],positive,1.0,0.0,0.0749999999999999
harem,Tacosushi2,RT GMSquadNFT Whitelist Giveaway Giving away 5x whitelist spots for Waifu Harem ClubEnter for your chance to winEnds in 12 hou,en,2022-04-15,,[],positive,0.0,23.0,1.0
harem,AuthorJRose,RT bernardfoong The still beauty of dawn is natures finest balmDEBAUCHERY is the 3rd book to a sensually cap,en,2022-04-15,My work is copyrighted! No DMs,[],neutral,0.0,6.0,0.0
harem,aharemboysaga,RT bernardfoong Easter is a symbol of hope renewal amp new beginningsDEBAUCHERY is the 3rd book to a sensually c,en,2022-04-15,"Maui, Hawaii",[],positive,0.0,4.0,0.0681818181818181
harem,harem_eater,RT lenmarciii a izr laughed just now he definitely thinks it wont happenr but i would like you to pls think about it m0motetsu ha,en,2022-04-15,Indonesia,[],positive,0.0,6.0,0.35
harem,KvetchinQueen,The ego of the nonmonogamous and poly male is so grating to me Oh you have a wife and two girlfriends Why are you here Bold of you to presume Id want to join your harem Nah if Im going to put in the effort to date I want the full experience I want an active presence,en,2022-04-15,the Paris of Appalacia ,[],positive,1.0,0.0,0.1375
harem,BaetoriaTTV,ishibumiddd HAREM KINGS BIRTHDAY LETS GO,en,2022-04-15,,[],neutral,0.0,0.0,0.0
harem,abynoban,heroharem hiii you gonna post new update TGO,en,2022-04-15,,[],positive,0.0,0.0,0.1363636363636363
harem,belen_1905,All I need from a man is someone with flexible hips and long lasting staminaOMG I didnt expect she say that and I think that Siger can do that hehehe,en,2022-04-15,"Buenos Aires, Argentina",[],negative,1.0,0.0,-0.025
harem,MConan110488,The anime with clean HAREM is getting season 2,en,2022-04-15,"North Battleford, Saskatchewan",[],positive,0.0,0.0,0.3666666666666667
harem,susanamper,RT aharemboysaga The month of May has come when every lusty heart beginneth to blossom and to bring forth fruit DEBAUCHERY,en,2022-04-15,"New York, NY",[],neutral,0.0,5.0,0.0
harem,TonyaWrites,RT aharemboysaga The month of May has come when every lusty heart beginneth to blossom and to bring forth fruit DEBAUCHERY,en,2022-04-15,,[],neutral,0.0,5.0,0.0
harem,Jewelsbybunch,RT aharemboysaga Life is 10 what happens to you and 90 on how you react to itINITIATION is a sensually illumi,en,2022-04-15,"Clementon, NJ",[],neutral,0.0,2.0,0.0
harem,Jewelsbybunch,RT aharemboysaga The month of May has come when every lusty heart beginneth to blossom and to bring forth fruit DEBAUCHERY,en,2022-04-15,"Clementon, NJ",[],neutral,0.0,5.0,0.0
harem,huerayy,this man be collecting his harem like pokemons,en,2022-04-15,,[],neutral,1.0,0.0,0.0
harem,KengKleng,I played The Forest with the harem The most hilarious moment they did is while I was swimming,en,2022-04-15,Twitter,[],positive,0.0,0.0,0.5
harem,harem_eater,RT punipuninyaaa Myb Dont do this Its a bday stream I dont wanna cry but then again totally understand where hes coming from,en,2022-04-15,Indonesia,[],neutral,0.0,15.0,0.0
harem,harem_eater,RT lenmarciii m but it said to say something you wouldnt normall sayi thats true buta its something thats better left unsaid,en,2022-04-15,Indonesia,[],positive,0.0,25.0,0.2833333333333333
harem,aharemboysaga,RT aharemboysaga The month of May has come when every lusty heart beginneth to blossom and to bring forth fruit DEBAUCHERY,en,2022-04-15,"Maui, Hawaii",[],neutral,0.0,5.0,0.0
harem,harem_eater,RT lenmarciii m as for me i was thinking it would be better if we could all collab moreair OII who are you producerm well i don,en,2022-04-15,Indonesia,[],positive,0.0,19.0,0.5
harem,harem_eater,RT lenmarciii r as for me we dont usually gather so i really want us to gather like this morea ahh true the feeling of wanting to pr,en,2022-04-15,Indonesia,[],positive,0.0,7.0,0.2
harem,harem_eater,RT lenmarciii a ah recently ive been going to voice training i really felt that that rkk and izrs singing shows their individual colo,en,2022-04-15,Indonesia,[],positive,0.0,8.0,0.0666666666666666
harem,harem_eater,RT lenmarciii lets talk about something we wouldnt normally saya ah well thats true we dont normally gather as 1st genr i reme,en,2022-04-15,Indonesia,[],positive,0.0,27.0,0.2166666666666666
harem,AnjoKeMo,Best girl finally appearsAnd her appearance makes this the best episode of this season so farDATEALIVE datealive harem spirit bestgirl kurumi KurumiTokisaki nightmare worstspirit zafkiel time waifu anime,en,2022-04-15,Philippines,"['DATEALIVE', 'デート', 'date_a_live', 'harem', 'spirit', 'bestgirl', 'kurumi', 'KurumiTokisaki', 'nightmare', 'worstspirit', 'zafkiel', 'time', 'waifu', 'anime']",positive,0.0,0.0,0.5390625
harem,HoltenHm,RT bernardfoong Easter is a symbol of hope renewal amp new beginningsDEBAUCHERY is the 3rd book to a sensually c,en,2022-04-15,,[],positive,0.0,4.0,0.0681818181818181
harem,patalliro_en,Ill make a harem in Malyneras palace Therell be debauchery every night,en,2022-04-15,Malynera,[],neutral,0.0,0.0,0.0
harem,kangsunbae,RT rnaissances in the past few weeks jeno has been married to haechan married and with child mark with chenle now engaged to jisung,en,2022-04-15,,[],positive,0.0,4.0,0.0124999999999999
harem,TudorTweep,RT bernardfoong Easter is a symbol of hope renewal amp new beginningsDEBAUCHERY is the 3rd book to a sensually c,en,2022-04-15,Wild and wonderful Wales ,[],positive,0.0,4.0,0.0681818181818181
harem,TudorTweep,RT bernardfoong Losing yourself in new surroundings is the best way to find yourselfUNBRIDLED is the sequel to,en,2022-04-15,Wild and wonderful Wales ,[],positive,0.0,2.0,0.5681818181818181
harem,Asahiwhitehair,RT sweetlolixo Have Mercy On This Cute NineTailed Fox BingGege bingjiu BingJiuWeek2021a heavy liujiu arc rated M 16k ong,en,2022-04-15,,['BingJiuWeek2021'],positive,0.0,121.0,0.290625
harem,Yuriko2608,imbrainrotten miyamang You have suna harem list Dang bestie,en,2022-04-15,,[],neutral,0.0,0.0,0.0
harem,WilliamChico23,Crunchyroll A Couple of Cuckoos will be the hottest garbage harem anime of 2022,en,2022-04-15,,[],neutral,0.0,0.0,0.0
harem,AnjoKeMo,Who had the best drawing DATEALIVE datealive harem manga sketch spirit drawing anime,en,2022-04-15,Philippines,"['DATEALIVE', 'デート', 'date_a_live', 'harem', 'manga', 'sketch', 'spirit', 'drawing', 'anime']",positive,1.0,2.0,1.0
harem,AnjoKeMo,But the true winner is Natsumis drawing DATEALIVE datealive harem manga sketch spirit drawing anime,en,2022-04-15,Philippines,"['DATEALIVE', 'デート', 'date_a_live', 'harem', 'manga', 'sketch', 'spirit', 'drawing', 'anime']",positive,0.0,0.0,0.35
harem,SketchRetweets,RT AnjoKeMo Who had the best drawing DATEALIVE datealive harem manga sketch spirit drawing anime,en,2022-04-15,DeviantArt,"['DATEALIVE', 'デート', 'date_a_live', 'harem', 'manga', 'sketch', 'spirit', 'drawing', 'anime']",positive,0.0,2.0,1.0
harem,harem_eater,RT akiraskyy its all cute and funny but when myb said i want us to stay as four i dont want to lose anyone and rkka replied cause we,en,2022-04-15,Indonesia,[],positive,0.0,3.0,0.375
harem,yuckycore,eds harem last updated june 24 2002 all links are dead unfortunately,en,2022-04-15,any pronouns // minors dni,[],negative,2.0,0.0,-0.2333333333333333
