Keyword,User,Tweet,Language,Time,User Location,Hashtag,Polarity,Likes,Retweet,Sentiment
shounen,Shounen_AIAI,RT Wowwlog คนมักจะเข้าใจว่าที่เต่ามันเผลอกินพลาสติกเข้าไป เพราะคิดว่าพลาสติกหน้าตาเหมือนแมงกะพรุน แต่จริงๆแล้วน้องได้กลิ่นจากสาหร่ายและแบ,th,2022-04-18,"พระนคร, กรุงเทพมหานคร",[],positive,0.0,22786.0,66.67
shounen,EZZYLAFLAME,Yusuke Urameshi is the shounen GOAT and if you disagree argue with ya mother,en,2022-04-18,United States,[],neutral,0.0,0.0,0.0
shounen,Shounen_AIAI,RT meawmio อีกคนที่ไม่ธัมดาคือแครี่ปามิวปามิว คนดูโคตรรจอย อย่าลบหลู่ลัทธิปามิวนะ ลองชิมทีออกไม่ได้ไปเลย ตอนร้อง PONPONPON คนดูทั้ง,th,2022-04-18,"พระนคร, กรุงเทพมหานคร",[],negative,0.0,14775.0,66.67
shounen,Shounen_AIAI,RT meawmio อีกคนที่ไม่ธัมดาคือแครี่ปามิวปามิว คนดูโคตรรจอย อย่าลบหลู่ลัทธิปามิวนะ ลองชิมทีออกไม่ได้ไปเลย ตอนร้อง PONPONPON คนดูทั้ง,th,2022-04-18,"พระนคร, กรุงเทพมหานคร",[],negative,0.0,15052.0,66.67
shounen,Rebecca88960065,MIKATHINKER ppl in the comments saying its fictional are probably the same ppl who write long threads defending their fav shounen anime,en,2022-04-18,,[],negative,4.0,0.0,-0.0166666666666666
shounen,akamarulover,Maskorane2 VIZMedia Jigokuraku is one of my favs Deadman Wonderland manga is great for dark shounen,en,2022-04-18,"California, USA",[],positive,2.0,0.0,0.325
shounen,cyf45510047,RT NFTSHOUNEN Shounen x Project PXN Giveaway Giving away 2 PXN whitelist spots courtesy of team1 Follow projectPXN NFTSHOUNE,en,2022-04-18,,[],neutral,0.0,43421.0,0.0
shounen,Shounen_AIAI,RT HyxYet The show the fandom,en,2022-04-18,"พระนคร, กรุงเทพมหานคร",[],neutral,0.0,1050.0,0.0
shounen,DolkkiDolkki,so Im not asking this in bad faith or anything just genuinely curious if there are any men in genshin you do l A lot of the men in Genshin fall under either power fantasy bait or literal shounen character neither of whi,en,2022-04-18,,[],negative,6.0,1.0,-0.3999999999999999
shounen,08Jarro,RT 08Jarro You are looking at best protagonist best deuteragonist and best antagonist in shounen,en,2022-04-18,,[],positive,0.0,10.0,1.0
shounen,_chuunibyous,Im always a bit sad but at the same time grateful that my faves in anime are usually men because1 I almost never have a fave girl to cosplay from shounen animes2 I dont have to spend money on cosplay Vso I guess its mostly positive since I keep my money for figures,en,2022-04-18,,[],negative,0.0,0.0,-0.1306818181818181
shounen,SHOUNEN_YOUTH,Habulin mo akoo jkjk Thank youuu for the follow,en,2022-04-18,Send help,[],neutral,2.0,0.0,0.0
shounen,isntkiss,i luv shoujo but shounen gtgt,en,2022-04-18,higaan,[],neutral,0.0,0.0,0.0
shounen,icblues,Kalau sekarang2Witch Hat AtelierThe Girl from the Other SideJibaku Shounen HanakokunGo with the Clouds North by Northwest,en,2022-04-18,Indonesia/Japan,[],negative,0.0,0.0,-0.125
shounen,masurao2004,aceingenue mfwmy face when i compare a shounen to a mahou shoujo anime,en,2022-04-18,egyptian ☆ she mews,[],neutral,0.0,0.0,0.0
shounen,Shounen_AIAI,RT meawmio อีกคนที่ไม่ธัมดาคือแครี่ปามิวปามิว คนดูโคตรรจอย อย่าลบหลู่ลัทธิปามิวนะ ลองชิมทีออกไม่ได้ไปเลย ตอนร้อง PONPONPON คนดูทั้ง,th,2022-04-18,"พระนคร, กรุงเทพมหานคร",[],negative,0.0,14225.0,66.67
shounen,shounen_visuals,grindfacetv i kinda wanna see his phones pov lmao,en,2022-04-18,"Florida, USA",[],positive,2.0,0.0,0.6
shounen,berserker144,GinOne9 romance has always been an issue in battle shounen so this doesnt surprise me,en,2022-04-18,,[],neutral,1.0,0.0,0.0
shounen,crawlpipe,The moment I fell in love with jojo was probably during the Joseph vs Wamuu fight Maybe its because Ive never read old school shounen b4 but Ive never seen the concept of honor between two opposing warriors play out like that before,en,2022-04-18,,[],positive,1.0,0.0,0.3
shounen,meigui_hikaru,VIZMedia Shounen manga For an easy reading try Kimi to Boku,en,2022-04-18,"jakarta, indonesia",[],positive,0.0,0.0,0.4333333333333333
shounen,Lake_not_pond,BorutoVisual Boruto and Naruto are shounen theyre for an audience of teens,en,2022-04-18,♋ infp-t,[],neutral,0.0,0.0,0.0
shounen,AgentSaucy,Ugh I miss my big screen o shounen ai anime So much to consume now Totally grateful for that,en,2022-04-18,,[],positive,0.0,0.0,0.0666666666666666
shounen,Shounen_AIAI,RT EarthOscar เบเนดิกต์ คัมเบอร์แบตช์ ลงรูปนี้ในเฟสบุ๊ก เมนต์ไทย กว่าเมนต์แล้ว แกมาเห็นคง งง ว่ากูโพสต์อะไรผิดไปรึเปล่าวะ http,th,2022-04-18,"พระนคร, กรุงเทพมหานคร",[],negative,0.0,2954.0,80.0
shounen,mypananon_en,RedclawDraws You thought you were the senpai When all along you were secretly being senpaiedGet noticed you kawaii shounen,en,2022-04-18,🇺🇸,[],negative,0.0,0.0,-0.4
shounen,ThePaul25,RT jeffbcraven Episode 73 of Dragon Quest Adventure of Dai might be the best half hour of shounen Ive ever seen and I dont think its,en,2022-04-18,"New York, New York",[],positive,0.0,7.0,0.4166666666666667
shounen,Shounen_w,RT Jomeimei421 IM JUST SAYING LIKE,en,2022-04-18,V O I D,[],neutral,0.0,89.0,0.0
shounen,Rebecca88960065,MIKATHINKER ppl in the comments saying its fictional are probably the same ppl who write long threads defending their fav shounen anime,en,2022-04-18,,[],negative,0.0,0.0,-0.0166666666666666
shounen,SHOUNEN_YOUTH,RT WendyLiZard Sizzlipede finally got his own Kabu plushie w,en,2022-04-18,Send help,[],positive,0.0,6782.0,0.375
shounen,HeIIrizer,bonkmi lowkey a solid anime if you like shounen but I understand,en,2022-04-18,Anilist: Hellrizer,[],neutral,0.0,0.0,0.0
shounen,Shounen_AIAI,RT EarthOscar เบเนดิกต์ คัมเบอร์แบตช์ ลงรูปนี้ในเฟสบุ๊ก เมนต์ไทย กว่าเมนต์แล้ว แกมาเห็นคง งง ว่ากูโพสต์อะไรผิดไปรึเปล่าวะ http,th,2022-04-18,"พระนคร, กรุงเทพมหานคร",[],negative,0.0,3245.0,80.0
shounen,taengooosgirl,ppl who dont like romance in sports shounen are losers idc idc,en,2022-04-18,,[],negative,0.0,0.0,-0.2
shounen,DeadwoodDale,I wonder if Japanese school kids live vicariously through shounen protagonists,en,2022-04-18,Japan,[],positive,3.0,0.0,0.0681818181818181
shounen,08Jarro,You are looking at best protagonist best deuteragonist and best antagonist in shounen,en,2022-04-18,,[],positive,28.0,5.0,1.0
shounen,Gamboa__7,RT 08Jarro You are looking at best protagonist best deuteragonist and best antagonist in shounen,en,2022-04-18,Od Texas,[],positive,0.0,8.0,1.0
shounen,Kacchansbabee,kyorusgf BKDK ARE SHOUJO DISGUISING AS SHOUNEN WBK WBK,en,2022-04-18,Somewhere on earth,[],neutral,0.0,0.0,0.0
shounen,shinlonered,OnlyMagnetic Mystery or Shounen primarily,en,2022-04-18,"Everywhere & Nowhere, NYC",[],positive,0.0,0.0,0.4
shounen,DonnWoon,RT NFTSHOUNEN Shounen x Project PXN Giveaway Giving away 2 PXN whitelist spots courtesy of team1 Follow projectPXN NFTSHOUNE,en,2022-04-18,,[],neutral,0.0,43427.0,0.0
shounen,Shounen_AIAI,RT EarthOscar เบเนดิกต์ คัมเบอร์แบตช์ ลงรูปนี้ในเฟสบุ๊ก เมนต์ไทย กว่าเมนต์แล้ว แกมาเห็นคง งง ว่ากูโพสต์อะไรผิดไปรึเปล่าวะ http,th,2022-04-18,"พระนคร, กรุงเทพมหานคร",[],negative,0.0,3025.0,80.0
shounen,atspii,RT SakuraCounting it has been 1370 days since Nanamine Sakura has last showed up in Jibaku ShounenToilet Bound HanakoKun,en,2022-04-18,byf ⇢,[],neutral,0.0,2.0,0.0
shounen,Shounen_AIAI,RT simbamelon คือเพื่อนสนิทแม่งจะรู้ไส้รู้พุงหมดแบบนี้แหละ,th,2022-04-18,"พระนคร, กรุงเทพมหานคร",[],negative,0.0,3907.0,80.0
shounen,Shounen_w,RT HBwean Jihye appreciation post my adorable lovely girl orv leejihye,en,2022-04-18,V O I D,"['orv', '전독시', 'leejihye']",positive,0.0,58.0,0.5
shounen,ratishumantrash,Yep Dr Stone is probably the best shounen I have ever read yet so far,en,2022-04-18,,[],positive,0.0,0.0,0.55
shounen,akamarulover,Maskorane2 VIZMedia Jigokuraku is one of my favs Deadman Wonderland manga is great for dark shounen,en,2022-04-18,"California, USA",[],positive,1.0,0.0,0.325
shounen,yanyan_Naruto,RT 08Jarro You are looking at best protagonist best deuteragonist and best antagonist in shounen,en,2022-04-18,🇵🇭 • She • 21,[],positive,0.0,8.0,1.0
shounen,RPolynya,tfw youre trying to process the fact that you have recently smooched someone youve been pining over for a really long time and you keep getting interrupted by various shounen battles and blood wars,en,2022-04-18,Squad 6 weight room,[],negative,5.0,0.0,-0.0166666666666666
shounen,Ascention07,RT 08Jarro You are looking at best protagonist best deuteragonist and best antagonist in shounen,en,2022-04-18,,[],positive,0.0,14.0,1.0
shounen,ChutneyXCVII,How do these mid shounen romcoms keep getting high quality productions and its a fucking harem too Im tired,en,2022-04-18,,[],negative,7.0,0.0,-0.21
shounen,Tyrocks12ty,GeoAW3 Yep our job to remind them again that one piece and any other peer of shounen are not the same,en,2022-04-18,,[],negative,4.0,0.0,-0.0625
shounen,AbhiDragonite,RT XpZayed This three images sum up the greatest development any shounen protagonist has ever got,en,2022-04-18,,[],positive,0.0,3.0,1.0
shounen,SHOUNEN_YOUTH,RT WendyLiZard Sizzlipede finally got his own Kabu plushie w,en,2022-04-18,Send help,[],positive,0.0,6723.0,0.375
shounen,SHOUNEN_YOUTH,RT FromHappyRock Watching Erika play knowing I will never design anything as good as Kirby,en,2022-04-18,Send help,[],positive,0.0,19.0,0.7
shounen,Coder_k24,RT 08Jarro You are looking at best protagonist best deuteragonist and best antagonist in shounen,en,2022-04-18,"Pune, India",[],positive,0.0,7.0,1.0
shounen,Gamboa__7,RT 08Jarro You are looking at best protagonist best deuteragonist and best antagonist in shounen,en,2022-04-18,Od Texas,[],positive,0.0,11.0,1.0
shounen,azziah_russell,RT 08Jarro You are looking at best protagonist best deuteragonist and best antagonist in shounen,en,2022-04-18,Hidden Cloud Village ,[],positive,0.0,11.0,1.0
shounen,slickshot_60,RT 08Jarro You are looking at best protagonist best deuteragonist and best antagonist in shounen,en,2022-04-18,The City of Joy,[],positive,0.0,11.0,1.0
shounen,dradrianperez,RT 08Jarro You are looking at best protagonist best deuteragonist and best antagonist in shounen,en,2022-04-18,Raiders Fans Heads,[],positive,0.0,14.0,1.0
shounen,m4scuud,RT 08Jarro You are looking at best protagonist best deuteragonist and best antagonist in shounen,en,2022-04-18,,[],positive,0.0,14.0,1.0
shounen,Shounen_AIAI,RT PJamor อยากดูเวอร์นี้อ่ะ,th,2022-04-18,"พระนคร, กรุงเทพมหานคร",[],,0.0,2119.0,0.0
shounen,Shounen_AIAI,RT lowkeyhungry เหมือนเกิ้นนนน สเวนเซ่นออกไอติมไก่ทอดใหม่ แต่รู้สึกมันเหมือนไอติมที่ร้านเราทำมาตั้งแต่พฤษภา จังเลย แปะรูปเทียบ ไ,th,2022-04-18,"พระนคร, กรุงเทพมหานคร",[],,0.0,9968.0,0.0
shounen,Shounen_AIAI,RT nostalgia ประทับใจความรักของเรื่องนี้มาก คลาดกัน ชาติ ความอิพี่เป็นแม่ทัพไร้ใจ แต่เห็นน้องเปลือยต้องท่องพุทโธธัมโมสังโฆกลั้นฟิน เ,th,2022-04-18,"พระนคร, กรุงเทพมหานคร",[],positive,0.0,736.0,90.0
shounen,Shounen_AIAI,RT takeasipofkorea นั่งดูรูปยื่นวีซ่าของตัวเองทั้งหมด อันตั้งแต่มาอยู่เกาหลีละตัดสินใจมาพลีชีพแนะนำเลยว่าThings to do in korea คือการ,th,2022-04-18,"พระนคร, กรุงเทพมหานคร",[],,0.0,6677.0,0.0
shounen,Shounen_AIAI,RT Thamboon ทุกวันเป็นแบบนี้ พอเห็นรถเราก็วิ่งกันแล้วคนไร้บ้าน Homeless,th,2022-04-18,"พระนคร, กรุงเทพมหานคร","['คนไร', 'Homeless']",,0.0,14933.0,0.0
shounen,yanyan_Naruto,RT 08Jarro You are looking at best protagonist best deuteragonist and best antagonist in shounen,en,2022-04-18,🇵🇭 • She • 21,[],positive,0.0,11.0,1.0
shounen,ZusukoR,shounenf sure it is,en,2022-04-18,,[],positive,1.0,0.0,0.5
shounen,cyf45510047,RT NFTSHOUNEN Shounen x Project PXN Giveaway Giving away 2 PXN whitelist spots courtesy of team1 Follow projectPXN NFTSHOUNE,en,2022-04-18,,[],neutral,0.0,43424.0,0.0
shounen,K1korotofu,SHOUNENYOUTH thinking tubero was the tagalog of vtuber,en,2022-04-18,,[],neutral,1.0,0.0,0.0
shounen,Rebecca88960065,MIKATHINKER ppl in the comments saying its fictional are probably the same ppl who write long threads defending their fav shounen anime,en,2022-04-18,,[],negative,3.0,0.0,-0.0166666666666666
shounen,yolandaasn,RT MangaMoguraRE A new special chapter of Haikyuu by Haruichi Furudate titled Haikyuu Tokubetsuhen Matsuri Futatabi with focus on Kur,en,2022-04-18,,[],positive,0.0,1035.0,0.2467532467532467
shounen,Greasy_Armor,Shounen no abyss,en,2022-04-18,,[],neutral,0.0,0.0,0.0
shounen,yanyan_Naruto,RT 08Jarro You are looking at best protagonist best deuteragonist and best antagonist in shounen,en,2022-04-18,🇵🇭 • She • 21,[],positive,0.0,7.0,1.0
shounen,Shounen_AIAI,RT ycppspnn ค่ะนี่คือคำตอบจากความหวังของเรา dek,th,2022-04-18,"พระนคร, กรุงเทพมหานคร",['dek65'],,0.0,10867.0,0.0
shounen,Otaku_Anime_Ind,MamahAnime Spy x FamilyGenre Action Comedy ShounenScore 908Status Currently AiringOtakuAnimeIndonesia spyxfamily yorforger wibu otaku animeindo,en,2022-04-18,,"['Otaku_Anime_Indonesia', 'spyxfamily', 'yorforger', 'wibu', 'otaku', 'animeindo']",positive,3.0,0.0,0.05
shounen,shounen_visuals,grindfacetv i kinda wanna see his phones pov lmao,en,2022-04-18,"Florida, USA",[],positive,1.0,0.0,0.6
shounen,MonyDono,RT Flowkom hulkgamerxx I swear to God ever since demon slayer got hype these people act like they know studios its kinda annoying the,en,2022-04-18,المملكة العربية السعودية,[],negative,0.0,1.0,-0.8
shounen,cyf45510047,RT NFTSHOUNEN Shounen x Project PXN Giveaway Giving away 2 PXN whitelist spots courtesy of team1 Follow projectPXN NFTSHOUNE,en,2022-04-18,,[],neutral,0.0,43422.0,0.0
shounen,m4scuud,RT 08Jarro You are looking at best protagonist best deuteragonist and best antagonist in shounen,en,2022-04-18,,[],positive,0.0,13.0,1.0
shounen,napcakes2,Mentroxene Bitches be like I hate shounen 5 minutes later Me and my tropes,en,2022-04-18,Read Witch Watch,[],negative,2.0,1.0,-0.4
shounen,Shounen_AIAI,RT Coach365 Technical detail looks like this,en,2022-04-18,"พระนคร, กรุงเทพมหานคร",[],neutral,0.0,64379.0,0.0
shounen,RPolynya,tfw youre trying to process the fact that you have recently smooched someone youve been pining over for a really long time and you keep getting interrupted by various shounen battles and blood wars,en,2022-04-18,Squad 6 weight room,[],negative,4.0,0.0,-0.0166666666666666
shounen,meganekkomeguca,Trying to read MP100 and its good and all but I just dont have the stamina for shounen,en,2022-04-18,Steel City,[],positive,1.0,0.0,0.7
shounen,Ascention07,RT 08Jarro You are looking at best protagonist best deuteragonist and best antagonist in shounen,en,2022-04-18,,[],positive,0.0,13.0,1.0
shounen,shounen_f,ZusukoR certainly,en,2022-04-18,,[],positive,0.0,0.0,0.2142857142857142
shounen,08Jarro,RT 08Jarro You are looking at best protagonist best deuteragonist and best antagonist in shounen,en,2022-04-18,,[],positive,0.0,5.0,1.0
shounen,MonarchBriliant,Demon Slayer Entertainment District arc another enjoyable shounen does what it does well probably like a 9 just off entertainment and thats all it needs to be tbh,en,2022-04-18,18,[],positive,0.0,0.0,0.5
shounen,shounen_otaku,RT jihadydon Jaden Smith when he sees kids going to birthday parties instead of discussing politics and the economic state of the world,en,2022-04-18,,[],positive,0.0,14139.0,0.2
shounen,Christinetwt_,RT orkikiro hello genshintwt and anitwt def not new but looking for new moots hehim 16 ar 58 asia filo engfilcebfr,en,2022-04-18,she/they,"['genshintwt', 'anitwt']",positive,0.0,3.0,0.0724431818181818
shounen,axo_iotl,rawrryuki Definitely watch itIts a really well paced romcom SoL anime and its genuinely goodAlso gojo the make protag actually is not your typical shounen mc he actually undergoes emotional growth and development and so does marin Its definitely worth the hype it got,en,2022-04-18,,[],positive,0.0,0.0,0.1502604166666666
shounen,seofloflo,RT MangaMoguraRE A new special chapter of Haikyuu by Haruichi Furudate titled Haikyuu Tokubetsuhen Matsuri Futatabi with focus on Kur,en,2022-04-18,,[],positive,0.0,1034.0,0.2467532467532467
shounen,Shounen_AIAI,RT wintersrain จนมาถึงวันนี้ก็ยังงงว่าทำไมไม่มีใครวิ่งไล่จับอี้ป๋อ ทำไมเหมือนเป็นคนล่องหนได้ อยู่คนเดียว คนอื่นวิ่งหนีหน้าตั้งกันไปสิ,th,2022-04-18,"พระนคร, กรุงเทพมหานคร",[],negative,0.0,401.0,88.89
shounen,08Jarro,RT 08Jarro You are looking at best protagonist best deuteragonist and best antagonist in shounen,en,2022-04-18,,[],positive,0.0,7.0,1.0
shounen,bikmisimdostlar,here u are gibi shounen ai webtoon onerir misinz,en,2022-04-18,bokutonun kucağı,[],neutral,0.0,0.0,0.0
shounen,cyf45510047,RT NFTSHOUNEN Shounen x Project PXN Giveaway Giving away 2 PXN whitelist spots courtesy of team1 Follow projectPXN NFTSHOUNE,en,2022-04-18,,[],neutral,0.0,43423.0,0.0
shounen,NC_KuroRaiden,Damn I hate all these Dragon Ball Super continuitycanon videos coming out late Damn funny when theres legit 3 different times from Dragon Ball Z and Super telling you that continuity dont matterFolks really be taking a shounen series too seriously,en,2022-04-18,"Greenville, NC",[],negative,1.0,0.0,-0.0395833333333333
shounen,L202_100,RT MangaMoguraRE Detective Mystery series Kindaichi Shounen no jikenbo Kindaichi Case Files by Amagi Seimaru Satou Fumiya has 100,en,2022-04-18,,[],neutral,0.0,26.0,0.0
shounen,napcakes2,Mentroxene Bitches be like I hate shounen 5 minutes later Me and my tropes,en,2022-04-18,Read Witch Watch,[],negative,2.0,0.0,-0.4
shounen,hirotakaswifee,The shounen hair reference,en,2022-04-18,+63,[],neutral,1.0,0.0,0.0
shounen,Adetomi59114978,postingtwink Oloni Lmfaooo Naruto for both men and women Even if it was shounengeared towards boysmen a lot of girlswomen has watched Naruto,en,2022-04-18,"New York, USA",[],neutral,3.0,0.0,0.0
shounen,taegixr,RT 08Jarro You are looking at best protagonist best deuteragonist and best antagonist in shounen,en,2022-04-18,كونوها,[],positive,0.0,14.0,1.0
shounen,bIoodrose,ceIegorm basically take apart shounen archetypes and tropes and peel open the genre brutal,en,2022-04-18,ondoelindë/gondoelin,[],negative,0.0,0.0,-0.4375
shounen,Gamboa__7,RT 08Jarro You are looking at best protagonist best deuteragonist and best antagonist in shounen,en,2022-04-18,Od Texas,[],positive,0.0,12.0,1.0
shounen,azziah_russell,RT 08Jarro You are looking at best protagonist best deuteragonist and best antagonist in shounen,en,2022-04-18,Hidden Cloud Village ,[],positive,0.0,12.0,1.0
shounen,berserker144,Nonbinatea fujonation fantasy shounen like black clover and fairy tail dont have it as much as others but its definitely there,en,2022-04-18,,[],positive,0.0,0.0,0.0111111111111111
shounen,_chuunibyous,Im always a bit sad but at the same time grateful that my faves in anime are usually men because1 I almost never have a fave girl to cosplay from shounen animes2 I dont have to spend money on cosplay Vso I guess its mostly positive since I keep my money for figures,en,2022-04-18,,[],negative,1.0,0.0,-0.1306818181818181
shounen,whimsycottt,Really dont like how much monologing there is though If feels like the characters need to narrate everything which is typical shounen but I just dont have too much patience for that sort of that sort thingI get why they do it but I prefer more quiet moments,en,2022-04-18,"Burbank, CA",[],positive,1.0,0.0,0.1555555555555555
shounen,AmJuLikesFoxes,Roshy1902 One of the best shounen anime out thereAlso the most untouchable world building,en,2022-04-18,,[],positive,0.0,0.0,0.75
shounen,Shounen_w,RT HBwean Jihye appreciation post my adorable lovely girl orv leejihye,en,2022-04-18,V O I D,"['orv', '전독시', 'leejihye']",positive,0.0,51.0,0.5
shounen,donial06,Why do Shounen fans care so fucking much about power levels and whos more powerful I find it annoying how comment sections are always like solos anime mid like just enjoy whatever you want and dont think you have superiority for thinking your favorite is most powerful,en,2022-04-18,,[],positive,0.0,0.0,0.2111111111111111
shounen,queerbluefae,yamadayuii What can I say as soon as I got pocket money i spent it on manga lol mostly shoujo amp shounen at the time but that evolved into GL BL amp slice of life as i got gayerolder Its so good I still need to read volume 5 tho not sure what chap that is but i cant wait,en,2022-04-18,antis dni ,[],positive,0.0,0.0,0.336875
shounen,KizzityKaito,but that wont be in here this is purely what I think and nothing else I loved this arc all the way throughI as a reader dont really care how much death or physical consequence a story has my favorite modern shounen series is Haikyuu and that has literally220,en,2022-04-18,,[],positive,2.0,0.0,0.2877551020408163
shounen,shounen_otaku,RT jihadydon Jaden Smith when he sees kids going to birthday parties instead of discussing politics and the economic state of the world,en,2022-04-18,,[],positive,0.0,13303.0,0.2
shounen,MajsterH3S,Leave it to anitwt shounen fans to ruin anything wholesome so they can say their stupid unfunny joke for 100th time,en,2022-04-18,,[],negative,16.0,1.0,-0.7999999999999999
shounen,KilluaZoldyck_1,Killua ranked first in all of the 3character popularity polls that havebeen conducted so far by WeeklyShounen Jump,en,2022-04-18,Rin World,[],positive,0.0,0.0,0.175
shounen,bibi_king10,RT 08Jarro You are looking at best protagonist best deuteragonist and best antagonist in shounen,en,2022-04-18,Konohagakure,[],positive,0.0,12.0,1.0
shounen,magicalboyspo,RT MoonieHilton see kids this is what only watching popular shounen does to your brain L ratio btw,en,2022-04-18,they/nya/precure/cure/solve,[],positive,0.0,4.0,0.3
shounen,VnTweeter,RT Lena5327 I finally finished reading all of the higurashi visual novels I am the ultimate early 2010s weeb I gate keep If you watch,en,2022-04-18,🌐The Internet,[],positive,0.0,1.0,0.025
shounen,Shounen_AIAI,RT Wowwlog คนมักจะเข้าใจว่าที่เต่ามันเผลอกินพลาสติกเข้าไป เพราะคิดว่าพลาสติกหน้าตาเหมือนแมงกะพรุน แต่จริงๆแล้วน้องได้กลิ่นจากสาหร่ายและแบ,th,2022-04-18,"พระนคร, กรุงเทพมหานคร",[],positive,0.0,23194.0,66.67
shounen,ManakaDaigo3,RT XpZayed This three images sum up the greatest development any shounen protagonist has ever got,en,2022-04-18,Neo Frontier Space,[],positive,0.0,1.0,1.0
shounen,shounen_visuals,grindfacetv trans people make their whole personality about their transition and cant shut the fuck up about it but they sure keep it hush hush when it actually fucking matters,en,2022-04-18,"Florida, USA",[],negative,0.0,0.0,-0.075
