Keyword,User,Tweet,Language,Time,User Location,Hashtag,Polarity,Likes,Retweet,Sentiment
shounen,Craig_Mershon,TotallyNotMark masoner789 You should definitely do bleach to complete the big 3 of naruto bleach and One piece Its one of my favorite series it does start off slow but it picks up fast and has arguably the best shounen villian ever created,en,2022-04-13,"Chicago, IL",[],positive,1.0,0.0,0.2142857142857142
shounen,DeathFeatherX,RT MangaMoguraRE Shounen no Abyss color page by Minenami Ryo in the latest Weekly Young Jump issue 202022 Image Shueisha Minenami,en,2022-04-13,Somewhere ,[],positive,0.0,18.0,0.3
shounen,natalie_sykes10,RT moonbinmemes126 This looks like a cover of some Shounen Ai Manga,en,2022-04-13,"New York, USA",[],neutral,0.0,4.0,0.0
shounen,sola_nin,In terms of themes One Piece takes a different approach from most shounen Whereas most shounen protagonists and their comrades promote themes of Justice and Righteousness One Piece has a central theme of Freedom and Liberation,en,2022-04-13,,[],positive,0.0,0.0,0.25
shounen,MangaMogura,RT MangaMoguraRE Shounen no Abyss color page by Minenami Ryo in the latest Weekly Young Jump issue 202022 Image Shueisha Minenami,en,2022-04-13,,[],positive,0.0,18.0,0.3
shounen,Shounen_AIAI,RT Cornettogod secret of Dumbledore ดีใจแทนป๋าเดปป์ ที่ไม่ต้องมาอยู่ในหนังแบบนี้นับวันยิ่งรู้สึกว่าคนเขียนบทเมาตด หรือถูกเร่งเด๊ดไลน์,th,2022-04-13,"พระนคร, กรุงเทพมหานคร",[],positive,0.0,433.0,75.0
shounen,Shounen_AIAI,RT littlejunep BLOmegaverse อัลฟ่าพิการคนนี้คือสามีผมนายเอกกำลังจะเอานิยายไปให้นักเขียนที่ชอบเซ็นแต่,th,2022-04-13,"พระนคร, กรุงเทพมหานคร",['อ'],negative,0.0,1075.0,66.67
shounen,shounen_otaku,RT WSJmanga According to leaks Haikyu by Haruichi Furudate will be receiving a special chapter with a Color Page in next weeks Weekl,en,2022-04-13,,[],positive,0.0,266.0,0.1785714285714285
shounen,igi_ari_k,was talking to a friend the other day and we have to agree that the reasons our oshis dont have many or any main anime roles is bc their voices arent the doutei shounen type,en,2022-04-13,成歩堂なんでも事務所,[],positive,0.0,0.0,0.1805555555555555
shounen,BonVantius,The25thBam notcjounin POV You enjoy the big 3 and all the newGen ShounenYeswe exist,en,2022-04-13,South Africa/Austria,[],positive,3.0,0.0,0.2
shounen,Notgonnafight2,uzimori moonknightbaby YoungwiMn BlackClovertwt Mob psycho isnt even a new ongoing shounen,en,2022-04-13,,[],positive,0.0,0.0,0.1363636363636363
shounen,_Donmel,MindOfRyann to get the shounen feel def Demon slayer its good and only has 2 seasons,en,2022-04-13,Greed Island,[],positive,0.0,0.0,0.35
shounen,archieotix,Food Wars is one of the best new gen shounen to come out animecourt TheFlowRiver,en,2022-04-13,,['animecourt'],positive,0.0,0.0,0.5681818181818181
shounen,TheMasterthatis,Baleygr086 ChibiReviews why are most female characters in shounen garbage God i fucking hate mal topics,en,2022-04-13,,[],negative,0.0,0.0,-0.1
shounen,shubynaru,RT MangaMoguraRE Shounen no Abyss color page by Minenami Ryo in the latest Weekly Young Jump issue 202022 Image Shueisha Minenami,en,2022-04-13,"L'Île-Perrot, Québec",[],positive,0.0,18.0,0.3
shounen,Shounen_AIAI,RT zeantoeiza วันนี้ไปพบจิตแพทย์ที่สถาบันกัลยามา ความเป็นผู้ป่วยใหม่คือต้องไปแต่เช้า เช้ามากๆ เราไปถึงเกือบหกโมงคือมีคนมารออยู่แล้วอะ วัน,th,2022-04-13,"พระนคร, กรุงเทพมหานคร",[],,0.0,697.0,0.0
shounen,Shounen_AIAI,RT tillwhensday uuuuuuuunlocking an c18th French safe,en,2022-04-13,"พระนคร, กรุงเทพมหานคร",[],positive,0.0,11713.0,0.25
shounen,Shounen_AIAI,RT Teenniiz ประวัคิคร่าวๆที่เคยๆได้ยิน นางเป็นหญิงชาวบ้าน ที่ไปขายของที่ตลาด แล้วของนายขายไม่ดี นางเลยนอนแต่นางใส่ผ้าถุงซึ่งสมัยนั้,th,2022-04-13,"พระนคร, กรุงเทพมหานคร",[],negative,0.0,1224.0,75.0
shounen,KherlenAltange1,25thMyles RyuStar12 Gintama serious arcs are really short compared to other shounen arcs Example SAFS both total only 16 episodes but in that short amount of episodes Author delivered everything you expect from an anime Cant believe all those peaks come from ComedyParody anime,en,2022-04-13,Edo,[],negative,0.0,0.0,-0.0763888888888888
shounen,Shounen_AIAI,RT themoonnback แล้วก็ห้ามทานพาราคู่พร้อมกับฟ้าทะลายโจรนะคะ ช่วยลดไข้เหมือนกัน แล้วก็สงสารตับด้วยทั้งฟ้าทะลายโจรและพาราไม่ควรทานติดต่,th,2022-04-13,"พระนคร, กรุงเทพมหานคร",[],negative,0.0,235.0,80.0
shounen,Shounen_AIAI,RT PisajElf แจกกกกก แจกเส้นเปล่า bg ฉากหลัง ขนาด dpi หลายรูปเลย เป็นงานที่เคยใช้หลายปีละ สามารถเอาไปใช้กับ webtoon manga หรืออะไรใด ๆ,th,2022-04-13,"พระนคร, กรุงเทพมหานคร",[],,0.0,351.0,0.0
shounen,Shounen_AIAI,RT thetukk กับคุณทักษิณบางเรื่องก็ชอบ บางเรื่องก็ไม่ชอบ ส่วนที่ดีก็ชื่นชม ส่วนที่ไม่เห็นด้วยก็ค้าน ไม่เคยหลับหูหลับตาเชียร์ไปเสียทุกเ,th,2022-04-13,"พระนคร, กรุงเทพมหานคร",[],negative,0.0,5214.0,62.5
shounen,Shounen_AIAI,RT warmspringxixi ไม่มีเพราะคนไทยกินทุกอย่างในทุกเทศกาล,th,2022-04-13,"พระนคร, กรุงเทพมหานคร",[],,0.0,1284.0,0.0
shounen,lebensmiude,Claudinga Kishimoto is not involved in anything anymore he doesnt draw even the current manga is it not canon for you He drew the coverart of all the novels aka written pieces the shounen doesnt look to make money out of the novels exclusively because then they would promote them,en,2022-04-13,islander,[],neutral,7.0,0.0,0.0
shounen,bryce_oates,The best new gen deuteragonist in Shounen jump,en,2022-04-13,,[],positive,1.0,0.0,0.5681818181818181
shounen,Shounen_AIAI,RT Poontany Exo planetarium amp data club th anniversary side tracks streaming in data ครบรอบ ปี ของวงที่อยู่คู่ความทรงจำทั้งที,th,2022-04-13,"พระนคร, กรุงเทพมหานคร",[],,0.0,989.0,0.0
shounen,Shounen_AIAI,RT acruxfushibg สงกรานต์หรือจะฮอตสู้พี่อะน้อง,th,2022-04-13,"พระนคร, กรุงเทพมหานคร",[],positive,0.0,2982.0,80.0
shounen,Shounen_AIAI,RT NOTF Soft power ของไทย ที่คนไทยมองข้าม คือหลังจากเที่ยว เทพบาร์แล้ว เพื่อนๆฝรั่งทุกคนบอกเหมือนกันหมด พาไปหาซื้อไอ้ขันแบบนี้,th,2022-04-13,"พระนคร, กรุงเทพมหานคร",[],,0.0,3731.0,0.0
shounen,RevVollachia,Based5656 Shounen in the mud frfr,en,2022-04-13,Vollachia,[],neutral,0.0,0.0,0.0
shounen,harsh_saga,RemsiHere Based5656 First of all why a OP account is doing a shounen polls Ofc voters will be biased,en,2022-04-13,,[],positive,13.0,1.0,0.25
shounen,Shounen_AIAI,RT thowstwt ดู คุณหมีปาฏิหาริย์ ย้อนหลังจบก็กลับไปอ่านนิยายอีกรอบ เพิ่งเห็นว่าคุณนักเขียนเขียน นิทานตุ๊กตา เป็นภาคพิเศษขึ้นมาอีกเล่มนึง,th,2022-04-13,"พระนคร, กรุงเทพมหานคร","['ค', 'น']",positive,0.0,4.0,66.67
shounen,harsh_saga,RemsiHere Based5656 I dont care about shounen in general but dont like the idea of conducting biased polls,en,2022-04-13,,[],positive,4.0,1.0,0.05
shounen,Shounen_AIAI,RT into1official INTO1 LIUYU rollingstonechinaApril 2022 Green issuecoverINTO1Wonderland,en,2022-04-13,"พระนคร, กรุงเทพมหานคร","['INTO1', '刘宇', 'LIUYU', 'rollingstonechina', 'INTO1_Wonderland']",negative,0.0,846.0,-0.2
shounen,RedReaperComet,RT MangaMoguraRE Debut color page of new Summer Time Render spinoff epilogue short story by Tanaka Yasuki titled Summer Time Render 2,en,2022-04-13,,[],positive,0.0,16.0,0.0681818181818181
shounen,alessandrozae,RT MangaMoguraRE Debut color page of new Summer Time Render spinoff epilogue short story by Tanaka Yasuki titled Summer Time Render 2,en,2022-04-13,"Perú, Lima",[],positive,0.0,16.0,0.0681818181818181
shounen,MangaMogura,RT MangaMoguraRE Debut color page of new Summer Time Render spinoff epilogue short story by Tanaka Yasuki titled Summer Time Render 2,en,2022-04-13,,[],positive,0.0,16.0,0.0681818181818181
shounen,MangaMoguraRE,Debut color page of new Summer Time Render spinoff epilogue short story by Tanaka Yasuki titled Summer Time Render 2026 Misen jiko bukken on Shounen Jump Plus web serviceFirst Part on April 14Second Part on April 15 151 pages in totalImage Shueisha Tanaka Yasuki,en,2022-04-13,,[],positive,69.0,16.0,0.0772727272727272
shounen,BlaqSad,Static season one is the best attempt at fusing Shounen and Superhero storytelling better than MHA better than the Teen Titans cartoon its perfect read this book,en,2022-04-13,,[],positive,0.0,0.0,0.5833333333333334
shounen,K132434S,RT MangaMoguraRE Debut color page of new Summer Time Render spinoff epilogue short story by Tanaka Yasuki titled Summer Time Render 2,en,2022-04-13,,[],positive,0.0,16.0,0.0681818181818181
shounen,CreativeMFreak,RT kaylee2908 The biggest retcon of shounen manga history,en,2022-04-13,,[],neutral,0.0,6.0,0.0
shounen,legendgaylol,FaithKuzunoha Executor451 May I recommend Hajime no Ippo again its not a shounen but up until like a year ago I thought it was it feels like a very tightly written shounen,en,2022-04-13,,[],negative,1.0,0.0,-0.2321428571428571
shounen,DovahDoge_Gumu,ChrisCutlip8 ZBalance GiggukAZ One piece is like the most normie showmanga out there Average shounen fan moment,en,2022-04-13,,[],positive,0.0,0.0,0.175
shounen,indomyphobe,RT MangaMoguraRE Debut color page of new Summer Time Render spinoff epilogue short story by Tanaka Yasuki titled Summer Time Render 2,en,2022-04-13,'98liners. ,[],positive,0.0,16.0,0.0681818181818181
shounen,WinInSty,RT MangaMoguraRE Shounen no Abyss color page by Minenami Ryo in the latest Weekly Young Jump issue 202022 Image Shueisha Minenami,en,2022-04-13,,[],positive,0.0,18.0,0.3
shounen,Artistic_Madman,SunsetBoy18 Now u gotta call the winner your rival and come back next time to take first The rules of shounen cant be broken,en,2022-04-13,United States,[],negative,0.0,0.0,-0.0375
shounen,Shounen_AIAI,RT jaeminesskk คู่หูนักสร้างตำนาน,th,2022-04-13,"พระนคร, กรุงเทพมหานคร",[],,0.0,871.0,0.0
shounen,Shounen_AIAI,RT iberbmyzr เธอ เธอมันคนไม่มีหัวใจนางเอกกุ หัวใจมีเอาไว้สูบฉีดโลหิตค่ะค่ะอิควาย,th,2022-04-13,"พระนคร, กรุงเทพมหานคร",[],,0.0,8949.0,0.0
shounen,nagaokagelol,yall cannot make fun of shounen and then fucking retweet shounen lmao actual little 2 year olds on my ass,en,2022-04-13,"i like arc, 15, lati#6999",[],positive,10.0,0.0,0.0225
shounen,Aoi_k1ng,I wouldve legit join into shounen twitter fanbase if it werent for so many retrds in it,en,2022-04-13,,[],positive,1.0,0.0,0.5
shounen,Uchihaboy316,Ill never be able to bring myself to read HxH untilif its finished The anime is peak shounen and I just cant get invested again if I wont get a conclusion,en,2022-04-13,Britannia,[],positive,10.0,0.0,0.5
shounen,Shounen_AIAI,RT heyheedie what was that backflip supposed to prove you still cant dance,en,2022-04-13,"พระนคร, กรุงเทพมหานคร",[],neutral,0.0,36297.0,0.0
shounen,Pettan_Enjoyer,HoboTheSequel that was the funniest shit the cope from battle shounen twitter was deliciousI hope we keep getting more and more animes like dress up darling it might run them out faster,en,2022-04-13,,[],positive,2.0,0.0,0.45
shounen,Shounen_AIAI,RT bkkbus ป้ายรถเมล์ หายไปแล้วช่วงไม่กี่วันมานี้ใครที่เดินทางผ่านย่านสยามคงเห็นว่าบริเวณนั้นมีการปรับปรุงทางเท้าใหม่ครับ แต่สังเกตห,th,2022-04-13,"พระนคร, กรุงเทพมหานคร",[],negative,0.0,711.0,75.0
shounen,sensei_shounen,ShanksTTV cringe didnt mode me in chat W Friend L streamer,en,2022-04-13,,[],neutral,2.0,0.0,0.0
shounen,Shounen_AIAI,RT viewclub เคยมีผัวก็โดนว่าว่าหีพรุน ไม่เคยมีผัวก็โดนว่าว่าหยากไย่เกาะหี สรุปปัญหามันอยู่ที่ไหน อยู่ที่หีหรืออยู่ที่หัวแม่มึงนะ,th,2022-04-13,"พระนคร, กรุงเทพมหานคร",[],negative,0.0,15072.0,88.89
shounen,JC_vtuber,PetraOnAirI tune in and it goes from embarrassing millie and alban with kindness to alban angry shounen character,en,2022-04-13,翻訳のアドバイスをしてくれてもいいんです,['PetraOnAir'],negative,2.0,1.0,-0.5
shounen,ConfusedYuno,Man Shounen no Abyss got me FUCKED UP I feel so bad for all the characters,en,2022-04-13,"Kentucky, USA",[],negative,5.0,0.0,-0.6499999999999999
shounen,S4GoddessOfLust,RT TheKnownOtaku Top 10 is nearly all current shounenseasonal or has an OnlyFans,en,2022-04-13,The Expanding Universe ॐ,[],positive,0.0,2.0,0.1999999999999999
shounen,Shounen_w,RT ugliestking who are you im you but stronger and depressed,en,2022-04-13,V O I D,[],neutral,0.0,124.0,0.0
shounen,Shounen_AIAI,RT dozhark Hello open fai soong har por you ror,en,2022-04-13,"พระนคร, กรุงเทพมหานคร",[],neutral,0.0,10992.0,0.0
shounen,inventoryworm,plus I just know deep in my bones that if hed known that Tomoko was pregnant hed have been there for Josuke and u can tell he wanted a relationship with his son after finding out he existed Joseph best dad in shounen I fear,en,2022-04-13,cr: jojolion,[],positive,4.0,0.0,0.4444444444444444
shounen,Mqthagod,Roshy1902 Why are people hating on dbz its one of the best shounen anime of all time,en,2022-04-13,,[],positive,1.0,0.0,1.0
shounen,Shounen_AIAI,RT joilshop แมสรุ่นนี้น่ารักมากกกกกกกกดแพคละชิ้น บาท แพคส่งฟรี,th,2022-04-13,"พระนคร, กรุงเทพมหานคร",[],positive,0.0,3067.0,88.89
shounen,Shounen_AIAI,RT IpreferMiracle ทุกคนคะ คือทางเน็ตฟลิก มาขอให้เราช่วย ทวีต โปรโมทหนังไทย ทวีตไปแล้วเมื่อวาน ซึ่งค่าจ้างในการโปรโมทครั้งนี้เราจะนำไปใ,th,2022-04-13,"พระนคร, กรุงเทพมหานคร",[],,0.0,4642.0,0.0
shounen,cionkeiasta,Shounenw HE A FOXgo back to ur origins,en,2022-04-13,i:saku_hypearl | h:keitoshiero,[],neutral,0.0,0.0,0.0
shounen,Shounen_AIAI,RT moonbackk พสยุนอามาบอกวิธีพับถุงขนมเก็บไว้กิน แบบที่พับแล้วมากินอีกรอบขนมยังกรอบอยู่ค่ะ,th,2022-04-13,"พระนคร, กรุงเทพมหานคร",[],,0.0,8275.0,0.0
shounen,Shounen_AIAI,RT Poontany Exo planetarium amp data club th anniversary side tracks streaming in data ครบรอบ ปี ของวงที่อยู่คู่ความทรงจำทั้งที,th,2022-04-13,"พระนคร, กรุงเทพมหานคร",[],,0.0,1031.0,0.0
shounen,Shounen_AIAI,RT nolikebananazz คือลงรีวิวโดที่สั่งมาแล้วก็ชอบมีเม้นแนวนี้อ่ะ เห็นแล้วขัดใจมากเลยคือทำไมต้องอวดอ่ะ,th,2022-04-13,"พระนคร, กรุงเทพมหานคร",[],negative,0.0,1216.0,66.67
shounen,ID74160846,HiShinQin I havent gone too far But I watched the anime and he annoyed the hell out of meHe was too shounen for kingdom,en,2022-04-13,,[],negative,0.0,0.0,-0.15
shounen,Zarts_327,Which shounen characterdynamic is Oda gonna surpass next,en,2022-04-13,Thousand Sunny ,[],neutral,6.0,1.0,0.0
shounen,abasu0819,RT weebams My Love Letter to Hunter x Hunter A Shounen Masterpiece A video of me fanboying over Hunter x Hu,en,2022-04-13,Kolkata,[],positive,0.0,32.0,0.5
shounen,Shounen_AIAI,RT NooMori SecretsOfDumbledore รีวิวแบบหนังถือว่าดูสนุก ดูเพลินบทพยายามแก้จุดด้อยจากภาคที่แล้ว แต่ก็ยังออกกลางๆ หลายๆจุดพยายามจะให้ติด,th,2022-04-13,"พระนคร, กรุงเทพมหานคร",['SecretsOfDumbledore'],,0.0,15.0,0.0
shounen,Shounen_AIAI,RT nostalgia รวมวายจีนพีเรียดใน readawrite ภาษาบรรยายดีงามอุยปังควรชิมซักหลายๆคำ ส่วนใหญ่จะเป็นแนวพระเอกคลั่งรักมากๆ แอบมีดราม่าปมซับ,th,2022-04-13,"พระนคร, กรุงเทพมหานคร",[],positive,0.0,2860.0,75.0
shounen,Shounen_AIAI,RT zeantoeiza วันนี้ไปพบจิตแพทย์ที่สถาบันกัลยามา ความเป็นผู้ป่วยใหม่คือต้องไปแต่เช้า เช้ามากๆ เราไปถึงเกือบหกโมงคือมีคนมารออยู่แล้วอะ วัน,th,2022-04-13,"พระนคร, กรุงเทพมหานคร",[],,0.0,919.0,0.0
shounen,inventoryworm,plus I just know deep in my bones that if hed known that Tomoko was pregnant hed have been there for Josuke and u can tell he wanted a relationship with his son after finding out he existed Joseph best dad in shounen I fear,en,2022-04-13,cr: jojolion,[],positive,2.0,0.0,0.4444444444444444
shounen,Shounen_AIAI,RT WaltzForZizi I has brought an important scientific observation,en,2022-04-13,"พระนคร, กรุงเทพมหานคร",[],positive,0.0,1116.0,0.4
shounen,AndyAsterion,BLACKHANGESTANN The comments here is more rational than when kids compare shounen lol,en,2022-04-13,,[],positive,0.0,0.0,0.65
shounen,leons108,ixyman riyakoo AniTrendz Depends what you compare it to There are certainly a lot of shounen more ecchiMaybe ecchi isnt the right term I was referring not only to the visual scenes but also to the plot highly based on romantic and physical attraction that seems purposely made to allow fanservice,en,2022-04-13,,[],positive,0.0,0.0,0.145
shounen,Shounen_AIAI,RT littlejunep BLOmegaverse อัลฟ่าพิการคนนี้คือสามีผมนายเอกกำลังจะเอานิยายไปให้นักเขียนที่ชอบเซ็นแต่,th,2022-04-13,"พระนคร, กรุงเทพมหานคร",['อ'],negative,0.0,915.0,66.67
shounen,GodOfAnitwtt,RT harshsaga RemsiHere Based5656 First of all why a OP account is doing a shounen polls Ofc voters will be biased,en,2022-04-13,,[],positive,0.0,1.0,0.25
shounen,Shounen_AIAI,RT Khunneung ตรงไปตรงไป ให้ตรงไปไหน,th,2022-04-13,"พระนคร, กรุงเทพมหานคร",[],,0.0,47614.0,0.0
shounen,Elf_Thyself,instead of shounen characters we should be talking about what would happen if comedy anime characters fight could Mai from Nichijou beat Osaka in a fist fight,en,2022-04-13,"Elfland, Philippines",[],neutral,0.0,0.0,0.0
shounen,Shounen_AIAI,RT Teenniiz ประวัคิคร่าวๆที่เคยๆได้ยิน นางเป็นหญิงชาวบ้าน ที่ไปขายของที่ตลาด แล้วของนายขายไม่ดี นางเลยนอนแต่นางใส่ผ้าถุงซึ่งสมัยนั้,th,2022-04-13,"พระนคร, กรุงเทพมหานคร",[],negative,0.0,2086.0,75.0
shounen,Shounen_AIAI,RT pammu28 Today last year they filmed amx commercial ads but 365 days later still no HYX,en,2022-04-13,"พระนคร, กรุงเทพมหานคร",[],neutral,0.0,43.0,0.0
shounen,JoseTheElite,whatcler have you seen what anime has been popular for the last few years aside from shounen lmao,en,2022-04-13,Xbox 360 Dashboard,[],positive,0.0,0.0,0.25
shounen,Shounen_AIAI,RT Khunneung ตรงไปตรงไป ให้ตรงไปไหน,th,2022-04-13,"พระนคร, กรุงเทพมหานคร",[],,0.0,54644.0,0.0
shounen,Shounen_AIAI,RT Cornettogod secret of Dumbledore ดีใจแทนป๋าเดปป์ ที่ไม่ต้องมาอยู่ในหนังแบบนี้นับวันยิ่งรู้สึกว่าคนเขียนบทเมาตด หรือถูกเร่งเด๊ดไลน์,th,2022-04-13,"พระนคร, กรุงเทพมหานคร",[],positive,0.0,615.0,75.0
shounen,Shounen_AIAI,RT NOTF Soft power ของไทย ที่คนไทยมองข้าม คือหลังจากเที่ยว เทพบาร์แล้ว เพื่อนๆฝรั่งทุกคนบอกเหมือนกันหมด พาไปหาซื้อไอ้ขันแบบนี้,th,2022-04-13,"พระนคร, กรุงเทพมหานคร",[],,0.0,4929.0,0.0
shounen,Shounen_AIAI,RT pinglebread แม้ง,th,2022-04-13,"พระนคร, กรุงเทพมหานคร",[],,0.0,17851.0,0.0
shounen,TheeUusual,You havent seen a good shounen until you watch ultimate muscle and kinnikuman best manly anime ever beats jojo in every way kinnikuman ultimatemuscle anime manga,en,2022-04-13,Dunno I'm somewhere ,"['kinnikuman', 'ultimatemuscle', 'anime', 'manga']",positive,0.0,0.0,0.5666666666666667
shounen,imoniln,Im never going to not judge shounen authors for how they write strong bonds between their mcs and their bestfriend,en,2022-04-13,+249 ♡ 23 ♡ she/they ,[],positive,0.0,0.0,0.4333333333333333
shounen,AmoEmo5,RT MangaMoguraRE Debut color page of new fantasy manga series Golden Spiral by Tsubasa Fukuchi in Weekly Shounen Sunday issue 202022,en,2022-04-13,,[],positive,0.0,28.0,0.2181818181818181
shounen,Shounen_AIAI,RT Unrulycat นาทีชีวิตคลิปยอดคุณครูในรัฐนิวเจอร์ซีย์ช่วยชีวิตลูกศิษย์นักเรียนชั้นประถมศึกษาปีที่ ที่อุบัติเหตุฝาขวดติดคอ,th,2022-04-13,"พระนคร, กรุงเทพมหานคร",[],negative,0.0,5941.0,66.67
shounen,Shounen_AIAI,RT Poontany Exo planetarium amp data club th anniversary side tracks streaming in data ครบรอบ ปี ของวงที่อยู่คู่ความทรงจำทั้งที,th,2022-04-13,"พระนคร, กรุงเทพมหานคร",[],,0.0,1315.0,0.0
shounen,Shounen_AIAI,RT IpreferMiracle ทุกคนคะ คือทางเน็ตฟลิก มาขอให้เราช่วย ทวีต โปรโมทหนังไทย ทวีตไปแล้วเมื่อวาน ซึ่งค่าจ้างในการโปรโมทครั้งนี้เราจะนำไปใ,th,2022-04-13,"พระนคร, กรุงเทพมหานคร",[],,0.0,5222.0,0.0
