Keyword,User,Tweet,Language,Time,User Location,Hashtag,Polarity,Likes,Retweet,Sentiment
อนิเมะ,punpuk309,พร้อมส่งbilibiliวัน ฿เปรียบเสมือนยูทูปของจีนอนิเมะเยอะมากไม่มีโฆษณา หรือ หารbilibili bilibiliหาร อนิเมะญี่ปุ่น อนิเมะ หารbilibiliราคาถูก,th,2022-04-30,ทักไลน์ตอบเร็วน้า,"['หารbilibili', 'bilibiliหาร', 'อน', 'อน', 'หารbilibiliราคาถ']",neutral,0.0,0.0,0.0
อนิเมะ,nailbycara,เล็บปลอมราคาเดียว ฿ รวมส่งรับทำตามแบบที่ส่งมาด้วยคับเลือกไซซ์ได้ตามขนาดเล็บลูกค้า แถมกาวตะไบเล็บปลอมสําเร็จรูป เล็บปลอม แจกลายเล็บ ส่งต่อ ส่งต่อสกินแคร์ ตลาดนัดบังทัน ตลาดนัดJJK ตลาดนัดnct ตลาดนัดอากาเซ่ ตลาดนัดtreasure ตลาดนัดEXO ตลาดนัดไฮคิว อนิเมะ,th,2022-04-30,สั่งทำรอประมาณ 5-7 วัน🖇,"['เล', 'เล', 'แจกลายเล', 'ส', 'ส', 'ตลาดน', 'ตลาดน', 'ตลาดน', 'ตลาดน', 'ตลาดน', 'ตลาดน', 'ตลาดน', 'อน']",negative,0.0,0.0,80.0
อนิเมะ,longlivedbc14_,RT bilibilith มาเล่นกันเถอะ ว่าชื่อภาษาญี่ปุ่นของคุณชื่อว่าอะไร ของใครได้ชื่ออะไรแวะมาบอกกันด้วยนะ แอดมินรอดูชื่อของทุกคนอ,th,2022-04-30,,[],,0.0,1.0,0.0
อนิเมะ,MurakiLifestyle,รีวิวอนิเมะ แนะนำอนิเมะ อนิเมะเรื่อง ยอดอัศวินจากแดนไกล The Faraway Paladin รีวิวจากคนชอบดูแนวแฟนตาซี เรื่องนี้ธรรมดามาก ภาพสวยแค่นั้น แล้วมันมีเรื่องศาสนาและพระเจ้าแค่ในเรื่องมาเกี่ยว มันดูไม่สนุกเลย ดูแล้วปวดหัวด้วยซ้ำ ตัวเอกก็ใช้พลังจากเทพมากเกินไป ไม่ได้โชว์อะไรให้ดูเลย,th,2022-04-30,Work: DM ,"['ร', 'แนะนำอน', 'อน']",positive,0.0,0.0,57.14
อนิเมะ,dlsel1106,แต่มาเมะที่คิโนะโคตรถูก ตัดมาอนิเมท เปนกุกุยอมถ่อไปเซนเวิล,th,2022-04-30,,[],,0.0,0.0,0.0
อนิเมะ,jdnmttmhy,RT BxAmmG ภาพตัวอย่าง EP อีพีนี้มีถังเฉินด้วยนะคั้บบ เห็นว่าในอีพีนี้ตามฆ่าหลานตัวเองเพราะไปทำเเสบที่เมืองสังหาร ถังซานจะช่วยดึงส,th,2022-04-30,"jd,nm,tt,mhyk,yw,jn,lj,dr,sl, ",[],negative,0.0,30.0,66.67
อนิเมะ,m3idhr,barbiefairyy แต่ในอนิเมะ ปวดตับ,th,2022-04-30,แล้วแต่จะคิด ชีวิตคนละแบบ,[],negative,0.0,0.0,66.67
อนิเมะ,nnpxtsxq,RT bemymayysh หล่อหน้าเป๊ะจริงๆ ฟีลแบบร็อคสตาร์เจแปนมากเว่อร์ แล้วก็ถ้าเอาไปเทียบกับอนิเมะซักเรื่องก็กลมกลืนไปกับตัวละครในนั้นได้เลย ฮื่อ,th,2022-04-30,,[],positive,0.0,5.0,88.89
อนิเมะ,polytroop,RT sixtysix ผู้ชายที่หลุดออกมาจากมังงะ เว็ปตูน อนิเมะ,th,2022-04-30,"ที่วัง, ประเทศไทย",[],negative,0.0,763.0,75.0
อนิเมะ,T_nnop47,RT BxAmmG พรางตัวยังไงให้สวยขนาดนี้ตํานานจอมยุทธ์ภูตถังซาน อนิเมะตํานานจอมยุทธ์ภูตถังซาน ดินเเดนพรมยุทธ์ อนิเมะ DouluoDalu Do,th,2022-04-30,,"['ต', 'อน', 'ด', 'อน', 'DouluoDalu', 'Do']",positive,0.0,12.0,80.0
อนิเมะ,GmieHmie,RT BxAmmG พรางตัวยังไงให้สวยขนาดนี้ตํานานจอมยุทธ์ภูตถังซาน อนิเมะตํานานจอมยุทธ์ภูตถังซาน ดินเเดนพรมยุทธ์ อนิเมะ DouluoDalu Do,th,2022-04-30,,"['ต', 'อน', 'ด', 'อน', 'DouluoDalu', 'Do']",neutral,0.0,12.0,0.0
อนิเมะ,sumuo__,RT BxAmmG ภาพตัวอย่าง EP อีพีนี้มีถังเฉินด้วยนะคั้บบ เห็นว่าในอีพีนี้ตามฆ่าหลานตัวเองเพราะไปทำเเสบที่เมืองสังหาร ถังซานจะช่วยดึงส,th,2022-04-30,200x,[],negative,0.0,30.0,66.67
อนิเมะ,minniee1234,RT iQIYIThailand สิ้นสุดการรอคอย กินทามะ พากย์ไทย ซีซั่น ฉายแล้วตอนนี้สาวกคุณกินรีบตามมาดูกันนะ อ้ายฉีอี้ตัวจริงเรื่องอนิเมะ,th,2022-04-30,,"['ก', 'พากย', 'อ']",neutral,0.0,66.0,0.0
อนิเมะ,museacg_th,กำหนดการอนิเมะในวันนี้ Black Bullet ตอนที่ เวลา ยอดกุ๊กแดนมังกร ตอนที่ เวลา เรื่องเล่าผีญี่ปุ่น ภาคที่ ตอนที่ เวลา SPY X FAMILY ตอนที่ เวลา MuseThailand อนิเมะ,th,2022-04-30,,"['MuseThailand', 'อน']",,21.0,16.0,0.0
อนิเมะ,bell_VIIXMM,RT sixtysix ผู้ชายที่หลุดออกมาจากมังงะ เว็ปตูน อนิเมะ,th,2022-04-30,ประเทศไทย,[],negative,0.0,546.0,75.0
อนิเมะ,tznhso,WeTV days ฿ days ฿ ซีรีส์ละครอนิเมะ ฯลฯ ดูตอน vip ไม่มีโฆษณา ซื้อที่ สะสมแต้ม แลกแอพส่วนลด หารwetvราคาถูก หารwetvหารwetvvip หารวีทีวี wetvหารวีทีวีราคาถูก wetvvipราคาถูก,th,2022-04-30,ติดต่อทางไลน์เท่านั้น,"['หารwetvราคาถ', 'หารwetv', 'หารwetvvip', 'หารว', 'wetv', 'หารว', 'wetvvipราคาถ']",positive,0.0,0.0,94.12
อนิเมะ,sunn_inthemood,คามิยะซังเส้นมังงะคือหล่อโฮกอนิเมะก็หล่อนะ เเต่มังงะสุดกว่า,th,2022-04-30,🎮Narumi Gen simp & supremacy,[],positive,0.0,0.0,80.0
อนิเมะ,bumblepb,BILIBILI วัน บาทอนิเมะเยอะมากมีซับไทยพากย์ไทยถูกลิขสิทธิ์ทุกเรื่องหารบิลิบิลิ หารบิลิบิลิราคาถูก หารbilibili,th,2022-04-30,,"['หารบ', 'หารบ', 'หารbilibili']",positive,0.0,0.0,66.67
อนิเมะ,NutTamble,พร้อมส่งแผ่นพลาสติกพี่เรน รวมส่งตลาดนัดอนิเมะ ตลาดนัดอนิเมะรวมด้อม ดาบพิฆาตอสูร ตลาดนัดไยบะ kimetsunoyaiba ตลาดนัดดาบพิฆาตอสูร อนิเมะ ไยบะ,th,2022-04-30,,"['ตลาดน', 'ตลาดน', 'ดาบพ', 'ตลาดน', 'kimetsunoyaiba', 'ตลาดน', 'อน', 'ไยบะ']",neutral,0.0,0.0,0.0
อนิเมะ,bumblepb,BILIBILI วัน บาทอนิเมะเยอะมากมีซับไทยพากย์ไทยถูกลิขสิทธิ์ทุกเรื่องหารบิลิบิลิ หารบิลิบิลิราคาถูก หารbilibili,th,2022-04-30,,"['หารบ', 'หารบ', 'หารbilibili']",positive,0.0,0.0,66.67
อนิเมะ,thatxx28,RT BxAmmG ภาพตัวอย่าง EP อีพีนี้มีถังเฉินด้วยนะคั้บบ เห็นว่าในอีพีนี้ตามฆ่าหลานตัวเองเพราะไปทำเเสบที่เมืองสังหาร ถังซานจะช่วยดึงส,th,2022-04-30,,[],negative,0.0,29.0,66.67
อนิเมะ,area23shop,เสื้อลิขสิทธิ์แท้จากอนิเมะ นารูโตะ นินจาจอมคาถา กับลาย GAARA คาเซะคาเงะรุ่นที่ แห่งหมู่บ้านสึนะงาคุเระ ใครสนใจมาจัดกันไปได้ครับ ส่งฟรีชำระเงินปลายทางAreaShop Anime NarutoShippuden Gaara,th,2022-04-30,Bangkok,"['Area23Shop', 'Anime', 'NarutoShippuden', 'Gaara']",positive,0.0,0.0,85.71
อนิเมะ,anime_seiko,Rikei Ga Koi Ni Ochita No De Shoumei Shitemita Heart ภาค ตอนที่ อนิเมะซับไทย อนิเมะพากย์ไทย อนิเมะ Anime animeseiko Animeseiko ดูAnime ตอนใหม่ล่าสุด ดูอนิเมะ ดูอนิเมะซับไทย ดูอนิเมะพากย์ไทย ดูการ์ตูนซับไทย ดูการ์ตูนพากย์ไทย,th,2022-04-30,,"['อน', 'อน', 'อน', 'Anime', 'animeseiko']",,0.0,0.0,0.0
อนิเมะ,natsumi_007,RT scarlettebandth น เพลงมา อนิเมะม้ามืดแห่งซีซั่น Paripi Koumei ขงเบ้งไอดอลกับเพลง Chitty Chitty Bang Bangแปลไทย เวอร์ชั่,th,2022-04-30,"กรุงเทพมหานคร, ประเทศไทย",[],positive,0.0,3.0,66.67
อนิเมะ,Mylifeismyown4,RT jamthofficial รวมรวมอนิเมะมูฟวี่ที่ควรค่าแก่การดูเป็นอย่างยิ่ง รีทวิตเก็บกันไว้เลยยภาพยนตร์ในเธรดเป็นเรื่องที่มีช่องทางรับชมแบบ,th,2022-04-30,,[],positive,0.0,724.0,80.0
อนิเมะ,juneebooboi,RT ashapricot พี่โยชิเหมือนหลุดมาจากโลกอนิเมะของจริง,th,2022-04-30, ꒰ikon treasure hanbin꒱,[],negative,0.0,4.0,75.0
อนิเมะ,Aom_318,bilibili vip days baht สายอนิเมะห้ามพลาดอนิเมะถูกลิขสิทธิ์ทุกเรื่อง ดูvipได้หมด มีทั้งซับไทย พากย์ไทยภาพคมชัดHDหารbilibili หารbilibiliราคาถูก bilibili ด,th,2022-04-30,,"['หารbilibili', 'หารbilibiliราคาถ', 'bilibili']",positive,0.0,0.0,88.89
อนิเมะ,wass_shi,RT BxAmmG พรางตัวยังไงให้สวยขนาดนี้ตํานานจอมยุทธ์ภูตถังซาน อนิเมะตํานานจอมยุทธ์ภูตถังซาน ดินเเดนพรมยุทธ์ อนิเมะ DouluoDalu Do,th,2022-04-30,,"['ต', 'อน', 'ด', 'อน', 'DouluoDalu', 'Do']",neutral,0.0,12.0,0.0
อนิเมะ,bumblepb,BILIBILI วัน บาทอนิเมะเยอะมากมีซับไทยพากย์ไทยถูกลิขสิทธิ์ทุกเรื่องหารบิลิบิลิ หารบิลิบิลิราคาถูก หารbilibili,th,2022-04-30,,"['หารบ', 'หารบ', 'หารbilibili']",positive,0.0,0.0,66.67
อนิเมะ,WangYiBoZhan1,RT BxAmmG พรางตัวยังไงให้สวยขนาดนี้ตํานานจอมยุทธ์ภูตถังซาน อนิเมะตํานานจอมยุทธ์ภูตถังซาน ดินเเดนพรมยุทธ์ อนิเมะ DouluoDalu Do,th,2022-04-30,,"['ต', 'อน', 'ด', 'อน', 'DouluoDalu', 'Do']",positive,0.0,7.0,80.0
อนิเมะ,baebeyour_1997,RT Bnyboo มู้บออนจากอนิเมะไม่ได้เรย,th,2022-04-30,*late reply* jd nm tt 24/7,[],,0.0,101.0,0.0
อนิเมะ,flrustrx,IQIYI VIP days ที่ละ ฿ gold ซีรีส์เกาหลี จีน ไทย รายการวาไรตี้ ไม่มีโฆษณาคั่น สนใจทัก dmline ลิ้งค์บนไบโอหารiQiyi หารiqiyivip หารiqiyigoldราคาถูก หารIQIYIราคาถูก KinnPorsche คินน์พอร์ช ONEPIECE ซีรีส์จีน พิษรักรอยอดีต วันพีช อนิเมะ,th,2022-04-30,,"['หารiQiyi', 'หารiqiyivip', 'หารiqiyigoldราคาถ', 'หารIQIYIราคาถ', 'KinnPorsche', 'ค', 'ONEPIECE', 'ซ', 'พ', 'ว', 'อน']",neutral,0.0,0.0,0.0
อนิเมะ,thankQ02,RT patterofficial เดือนนี้อนิเมะ ล้วน โฮมุ้monthly,th,2022-04-30,,['โฮม'],,0.0,3.0,0.0
อนิเมะ,IHateUButILikeU,ก็มีแต่แกแหละอนิเมะที่ไม่เทฉัน แกไม่เทเราแต่เราเทและดองแกแทนด้วย,th,2022-04-30,,[],,0.0,0.0,0.0
อนิเมะ,jaygallx,RT KHnadear แทยงคือเหมือนหลุดออกจากอนิเมะจริงๆโอ้ยความเครื่องหน้าชุดผมปังมาก,th,2022-04-30,,[],negative,0.0,56.0,75.0
อนิเมะ,clairefile,หาเพื่อนที่เป็นติ่งกับตามอนิเมะในมอค่ะ คณะไหนก็ได้เลยค่ะฮิฮิ bu,th,2022-04-30,"
ㅤ♡︎ㅤㅤֺㅤ ﾟ｡ ₍ ꙳⸌♡⸍꙳ ₎ ｡ﾟ.  ㅤִㅤ✧ ⠀   

｡ﾟﾟ･｡･ﾟﾟ｡
ﾟ。  そばにいるだけで 本当幸せだったな
　ﾟ･｡･ﾟ

.   ݁  ˖ ࣪ .                   (🫧).                    .   ݁  ˖ ࣪ .  ",['bu65'],positive,0.0,0.0,66.67
อนิเมะ,pppcccorn,RT sixtysix ผู้ชายที่หลุดออกมาจากมังงะ เว็ปตูน อนิเมะ,th,2022-04-30,,[],negative,0.0,676.0,75.0
อนิเมะ,PraewPw4,RT BxAmmG พรางตัวยังไงให้สวยขนาดนี้ตํานานจอมยุทธ์ภูตถังซาน อนิเมะตํานานจอมยุทธ์ภูตถังซาน ดินเเดนพรมยุทธ์ อนิเมะ DouluoDalu Do,th,2022-04-30,,"['ต', 'อน', 'ด', 'อน', 'DouluoDalu', 'Do']",positive,0.0,12.0,80.0
อนิเมะ,PreorderBz,Mitsuya cm ตัวเปล่า เมจTakashi Mitsuya อนิเมะ tokyorevengers ตุ๊กตาเปิด฿ ไม่รวมส่ง สนใจคลิ๊กเลยงั้บ รับผ่อนโอนปุ๊ป สั่งปั๊ปไม่ต้องรอปิดรอบจ้า รอสินค้า วัน ช้าเร็วขึ้นกับร้านจีนและขนส่ง,th,2022-04-30,,"['อน', 'tokyorevengers', 'ต']",positive,0.0,1.0,60.0
อนิเมะ,museacg_th,กำหนดการอนิเมะในวันนี้ Black Bullet ตอนที่ เวลา ยอดกุ๊กแดนมังกร ตอนที่ เวลา เรื่องเล่าผีญี่ปุ่น ภาคที่ ตอนที่ เวลา SPY X FAMILY ตอนที่ เวลา MuseThailand อนิเมะ,th,2022-04-30,,"['MuseThailand', 'อน']",,18.0,14.0,0.0
อนิเมะ,aYuWanNo_,RT BxAmmG พรางตัวยังไงให้สวยขนาดนี้ตํานานจอมยุทธ์ภูตถังซาน อนิเมะตํานานจอมยุทธ์ภูตถังซาน ดินเเดนพรมยุทธ์ อนิเมะ DouluoDalu Do,th,2022-04-30,,"['ต', 'อน', 'ด', 'อน', 'DouluoDalu', 'Do']",positive,0.0,7.0,80.0
อนิเมะ,NutTamble,พร้อมส่งน้องมุยน้องหมูกุจิแผ่นละ รวมส่งแล้วงับตลาดนัดอนิเมะ ตลาดนัดอนิเมะรวมด้อม ดาบพิฆาตอสูร ตลาดนัดไยบะ kimetsunoyaiba ตลาดนัดดาบพิฆาตอสูร อนิเมะ ไยบะ,th,2022-04-30,,"['ตลาดน', 'ตลาดน', 'ดาบพ', 'ตลาดน', 'kimetsunoyaiba', 'ตลาดน', 'อน', 'ไยบะ']",,0.0,0.0,0.0
อนิเมะ,_nrkptw,RT hxxbiiD เรารู้ ทุกคนรู้ ว่าใครๆต่างให้บอกว่าโยชิเหมือนหลุดออกมาจากอนิเมะ หลุดออกมาจากตัวละครในการ์ตูนเรื่องใดเรื่องนึง วันนี้พี่เ,th,2022-04-30,,[],negative,0.0,32.0,90.0
อนิเมะ,nailbycara,เล็บปลอมราคาเดียว ฿ รวมส่งรับทำตามแบบที่ส่งมาด้วยคับเลือกไซซ์ได้ตามขนาดเล็บลูกค้า แถมกาวตะไบเล็บปลอมสําเร็จรูป เล็บปลอม แจกลายเล็บ ส่งต่อ ส่งต่อสกินแคร์ ตลาดนัดบังทัน ตลาดนัดJJK ตลาดนัดnct ตลาดนัดอากาเซ่ ตลาดนัดtreasure ตลาดนัดEXO ตลาดนัดไฮคิว อนิเมะ,th,2022-04-30,สั่งทำรอประมาณ 5-7 วัน🖇,"['เล', 'เล', 'แจกลายเล', 'ส', 'ส', 'ตลาดน', 'ตลาดน', 'ตลาดน', 'ตลาดน', 'ตลาดน', 'ตลาดน', 'ตลาดน', 'อน']",neutral,2.0,0.0,0.0
อนิเมะ,maybeimvacant,RT minny อิเคี้ยวงการอนิเมะจีนไปไกลขนาดนี้แล้วหรอ แม่เจ้าหัวใจกุเกือบวายเพราะความหล่อ คนแรกหล่อร้ายๆอิตาเยี่ยนจาก พันสารท ส่ว,th,2022-04-30,หม่ามี๊น้องฮีซึง,['พ'],positive,0.0,23.0,66.67
อนิเมะ,B_1TAO,RT disneyplusth หลบหน่อยเอลซ่า ไยบะมาแล้ว ตื่นตา ตื่นใจกับอนิเมะหลายสไตล์ สตรีมทั้งหมดได้บน DisneyPlusHotstarTH ดูนี่สนุกแน่ htt,th,2022-04-30,,"['DisneyPlusHotstarTH', 'ด']",positive,0.0,438.0,80.0
อนิเมะ,Princenini_,RT bemymayysh หล่อหน้าเป๊ะจริงๆ ฟีลแบบร็อคสตาร์เจแปนมากเว่อร์ แล้วก็ถ้าเอาไปเทียบกับอนิเมะซักเรื่องก็กลมกลืนไปกับตัวละครในนั้นได้เลย ฮื่อ,th,2022-04-30,,[],positive,0.0,26.0,88.89
อนิเมะ,bilibilith,มาเล่นกันเถอะ ว่าชื่อภาษาญี่ปุ่นของคุณชื่อว่าอะไร ของใครได้ชื่ออะไรแวะมาบอกกันด้วยนะ แอดมินรอดูชื่อของทุกคนอยู่bilibili bilibilith Bilibili SPYFAMILY หนุ่มเย็บผ้ากับสาวนักคอสเพลย์ บิลิบิลิ anime อนิเมะ อนิเมะญี่ปุ่น animeart animelover animememes,th,2022-04-30,,"['bilibili', 'bilibilith', 'Bilibili', 'SPY_FAMILY', 'หน', 'บ', 'anime', 'อน', 'อน', 'animeart', 'animelover', 'animememes']",neutral,2.0,1.0,0.0
อนิเมะ,chachachicchic,RT leetyhi ละพี่แทยงเค้าร้ายกาจมากเลยนะ มาในร่างแจ็คฟรอส ร่างแวมไพร์ เออ เดินผ่านต้องเหลียวมอง ต้องโดนตกอะพูดเลย อนิเมะค่ดดดดดๆๆๆๆ อันเ,th,2022-04-30,มะเตนล์ พิแทยง พิน้อนจ้าน,[],neutral,0.0,243.0,0.0
อนิเมะ,Gwiiiiiz,RT pu จิ้งเสวียน ท็อปวิชวลสาขาอนิเมะ ปะทะหยางหยาง ท็อปวิชวลสาขาการละคร หล่อไม่มีอยู่จริงกับหล่อเหมือนไม่มีอยู่จริงจะว่าไป หยางห,th,2022-04-30,,[],positive,0.0,84.0,80.0
อนิเมะ,imeanyouwell,RT sixtysix ผู้ชายที่หลุดออกมาจากมังงะ เว็ปตูน อนิเมะ,th,2022-04-30,,[],negative,0.0,662.0,75.0
อนิเมะ,Jelloshynee,RT YJmoaaa อันดับศิลปินที่อยากไปคอนมากที่สุดทีเร้ก TXT TOMORROW X TOGETHER ทูบาทู ทีบายทีวงที่มีลีดเดอร์เก่งๆ,th,2022-04-30,BILLKIN / ENHYPEN / TXT / BTS,[],positive,0.0,143.0,85.71
อนิเมะ,fhazpoonya,RT dadamacgal อนิเมะเรื่องbig windup หรือ Ookiku Furikabutte หากใครชอบไฮคิว เรื่องนี้คือดีมากกกก บอกเล่าเรื่องราวของมิฮาชิจอมขี้แย ที่ต,th,2022-04-30,"Paris, France",[],positive,0.0,35.0,95.74
อนิเมะ,Grace25091502,RT pu จิ้งเสวียน ท็อปวิชวลสาขาอนิเมะ ปะทะหยางหยาง ท็อปวิชวลสาขาการละคร หล่อไม่มีอยู่จริงกับหล่อเหมือนไม่มีอยู่จริงจะว่าไป หยางห,th,2022-04-30,,[],positive,0.0,121.0,80.0
อนิเมะ,pampamppp1,RT museacgth กำหนดการอนิเมะในวันนี้ Black Bullet ตอนที่ เวลา ยอดกุ๊กแดนมังกร ตอนที่ เวลา เรื่องเล่าผีญี่,th,2022-04-30,,[],,0.0,16.0,0.0
อนิเมะ,_sticker9,iQiYi Gold วัน ราคา บาทแพลตฟอร์มรวบรวมซีรีส์ อนิเมะ รายการดังมากมาย รับชมได้ไม่อั้น สายจีนแนะนำต้องแอพนี้เลยรับประกันตลอดการรับชมงับiqiyiหาร iQIYIราคาถูก iQiyiพรีเมี่ยม,th,2022-04-30,,"['iqiyiหาร', 'iQIYIราคาถ', 'iQiyiพร']",positive,0.0,0.0,96.97
อนิเมะ,cutespace_,RT teihtarauqA ไม่เคยอะไรกับหูนี่เลยอ่ะ โอเค อยู่วงการอนิเมะ เห็นคนคอสบ่อย ก็เฉยๆมาตลอด จนคุณซีเอามาใส่ มันมีอะไรขึ้นมาทันที หูแงวของเล่,th,2022-04-30,,[],,0.0,311.0,0.0
อนิเมะ,ilovetentenlee,หล่อแบบพระเอกอนิเมะครับ,th,2022-04-30,♱ 10vely tyongf mark lee ♱,[],positive,0.0,0.0,66.67
