Keyword,User,Tweet,Language,Time,User Location,Hashtag,Polarity,Likes,Retweet,Sentiment
อนิเมะ,nailbycara,เล็บปลอมราคาเดียว ฿ รวมส่งรับทำตามแบบที่ส่งมาด้วยคับเลือกไซซ์ได้ตามขนาดเล็บลูกค้า แถมกาวตะไบเล็บปลอมสําเร็จรูป เล็บปลอม แจกลายเล็บ ส่งต่อ ส่งต่อสกินแคร์ ตลาดนัดบังทัน ตลาดนัดJJK ตลาดนัดnct ตลาดนัดอากาเซ่ ตลาดนัดtreasure ตลาดนัดEXO ตลาดนัดไฮคิว อนิเมะ,th,2022-04-30,สั่งทำรอประมาณ 5-7 วัน🖇,"['เล', 'เล', 'แจกลายเล', 'ส', 'ส', 'ตลาดน', 'ตลาดน', 'ตลาดน', 'ตลาดน', 'ตลาดน', 'ตลาดน', 'ตลาดน', 'อน']",negative,0.0,0.0,80.0
อนิเมะ,untilthe_dawn,foryouxpj หาอะไรทำให้ยุ่งๆมั้งครับ แต่ถ้าโหมดปกติก็อยู่กับตัวเองเก่งมากแหละครับ จะสิงกับอะไรบางอย่างได้นานเป็นวันๆ ออกมายากเลยแหละ เช่นดูอนิเมะติดๆกันนาน ได้ทั้งคู่เลย แบบไหนก็ดีครับ,th,2022-04-30,"𓈒♰ too 𝓬ool to believe in 𝓰od
and also too 𝓱ot to 𝓱andle ༅",[],,0.0,0.0,0.0
อนิเมะ,pimtaebak,RT sixtysix ผู้ชายที่หลุดออกมาจากมังงะ เว็ปตูน อนิเมะ,th,2022-04-30,เป็นติ่งเล็กๆที่ไม่ค่อยมีดวงคว,[],negative,0.0,636.0,75.0
อนิเมะ,T_12070,RT leetyhi ละพี่แทยงเค้าร้ายกาจมากเลยนะ มาในร่างแจ็คฟรอส ร่างแวมไพร์ เออ เดินผ่านต้องเหลียวมอง ต้องโดนตกอะพูดเลย อนิเมะค่ดดดดดๆๆๆๆ อันเ,th,2022-04-30,,[],negative,0.0,308.0,85.71
อนิเมะ,Pockyy_g,RT naxkles เราโสดนะคะ ชอบดูอนิเมะ อ่านมังงะ เล่นเกมแนวริทึ่ม ชอบอ่านนิยายกับนอนที่สุด จะไม่จีบเราจริง ๆ หรอคะ,th,2022-04-30, ꔛ ꕤ ˚   Lionheart   ˗ˏˋ ♡ ´ˎ˗,[],positive,0.0,1.0,90.0
อนิเมะ,AniINFOTH,TODAYS ANIME ตารางอนิเมะวันนี้ ชั่วโมงจาก น ของวันที่ Anime อนิเมะ อนิเมะใหม่ อนิเมะซับไทย อนิเมะถูกลิขสิทธิ์,th,2022-04-30,,"['アニメ', 'Anime', 'อน', 'อน', 'อน', 'อน']",,4.0,2.0,0.0
อนิเมะ,ST88IBq9wFHJeCk,RT animeyoko Ao Ashi แข้งเด็กหัวใจนักสู้ ตอนที่ ซับไทยอนิเมะ ดูอนิเมะ อนิเมะซับไทย อนิเมะพากย์ไทย a,th,2022-04-30,,"['อน', 'ด', 'อน', 'อน', 'a']",neutral,0.0,2.0,0.0
อนิเมะ,sumuo__,RT BxAmmG ภาพตัวอย่าง EP อีพีนี้มีถังเฉินด้วยนะคั้บบ เห็นว่าในอีพีนี้ตามฆ่าหลานตัวเองเพราะไปทำเเสบที่เมืองสังหาร ถังซานจะช่วยดึงส,th,2022-04-30,200x,[],negative,0.0,31.0,66.67
อนิเมะ,jabellom,RT bemymayysh หล่อหน้าเป๊ะจริงๆ ฟีลแบบร็อคสตาร์เจแปนมากเว่อร์ แล้วก็ถ้าเอาไปเทียบกับอนิเมะซักเรื่องก็กลมกลืนไปกับตัวละครในนั้นได้เลย ฮื่อ,th,2022-04-30,,[],positive,0.0,5.0,88.89
อนิเมะ,nj909673,RT sixtysix ผู้ชายที่หลุดออกมาจากมังงะ เว็ปตูน อนิเมะ,th,2022-04-30,,[],negative,0.0,546.0,75.0
อนิเมะ,BL_bromine,Fire Force ซี จะมีอนิเมะแล้ว แต่กูยังดองฟิคแชทคู่ป้าม๊าอยู่เลย นุจะรีบกลับไปเขียนนะคะ,th,2022-04-30,Writer FanFictions ,[],,0.0,0.0,0.0
อนิเมะ,ayoungmermaid,RT leetyhi ละพี่แทยงเค้าร้ายกาจมากเลยนะ มาในร่างแจ็คฟรอส ร่างแวมไพร์ เออ เดินผ่านต้องเหลียวมอง ต้องโดนตกอะพูดเลย อนิเมะค่ดดดดดๆๆๆๆ อันเ,th,2022-04-30, ,[],negative,0.0,369.0,85.71
อนิเมะ,chalin_94,ช่วงนี้เป็นแบบนี้ ตอนอยู่ที่ทำงานคือฟูลเอเนอจี้มาก เหมือนเป็น extrovert เลย แต่พอเลิกงานก็คือไม่อยากเจอใครเลย อยากอยู่ในห้อง ทำไรคนเดียว เล่นเกม ดูซีรีย์ อนิเมะ อ่านหนังสืออะไรก็ว่าไป แต่ก็คือไม่อยากเจอใคร ใครโทรมาก็ไม่อยากรับ ไม่อยากคุย จะชาร์ตแบต,th,2022-04-30,"Roissy-en-France, France",[],,0.0,0.0,0.0
อนิเมะ,torchor_ktudoc,พี่โยหล่อมากกกอ่ะเหมือนหลุดดออกมาจากอนิเมะเลยยย,th,2022-04-30,,[],negative,0.0,0.0,75.0
อนิเมะ,kr_swmn,RT Bnyboo มู้บออนจากอนิเมะไม่ได้เรย,th,2022-04-30,somewhere only me know,[],,0.0,89.0,0.0
อนิเมะ,hiblzb,Givenคืออนิเมะเรื่องนึงที่ควรดูเลยนะ ในขณะที่มาฟุยุมูฟออนจากพี่ยูกิได้แล้วแต่มัมหมีอย่างเราก็คิดถึงพี่ยูกิอยู่ดี ต้องขอบคุณอุเอะโนะมากที่อยู่กับมาฟุยุจนมูฟออนได้,th,2022-04-30,,[],positive,0.0,0.0,60.0
อนิเมะ,Trayler_T,baebulleooo อนิเมะ,th,2022-04-30,กำลังเหยียบหัวอีเอสเอ็ม,[],,0.0,0.0,0.0
อนิเมะ,myondaearth,RT jamthofficial รวมรวมอนิเมะมูฟวี่ที่ควรค่าแก่การดูเป็นอย่างยิ่ง รีทวิตเก็บกันไว้เลยยภาพยนตร์ในเธรดเป็นเรื่องที่มีช่องทางรับชมแบบ,th,2022-04-30,비스트/ตึกเช่า/aespa,[],positive,0.0,724.0,80.0
อนิเมะ,LakiLz,Paripiri Kongmin ขงเบ้งปั้นดาว อนิเมะฤดูนี้ที่ดูแบบไม่ได้หวังอะไรปรากฎเมะทำมาดีเกินคาดเพลงในเรื่องก็เพราะ คุณภาพโอเลย คือไม่ได้แย่อ่ะแล้วขงเบ้ง คอนเน็คชั่นเยอะเหลินเกิน,th,2022-04-30,The Hell,[],positive,0.0,0.0,97.96
อนิเมะ,still_even,RT bemababiikumi แรร์มาก Hongjue live เดียว ร้องแค่นี้แค่ครั้งเดียวเท่านั้น Ost สวรรค์ประทานพร TGCF ยังหวังอยู่ตลอดให้ได้มีสเตจสวย,th,2022-04-30,,['สวรรค'],positive,0.0,25.0,80.0
อนิเมะ,20lostinsep,RT jnttp เป็นอนิเมะที่จังหวะโบ๊ะบ๊ะเยอะมาก,th,2022-04-30,genshin dm 24/7,[],,0.0,59.0,0.0
อนิเมะ,FernFairyTail,RT pu จิ้งเสวียน ท็อปวิชวลสาขาอนิเมะ ปะทะหยางหยาง ท็อปวิชวลสาขาการละคร หล่อไม่มีอยู่จริงกับหล่อเหมือนไม่มีอยู่จริงจะว่าไป หยางห,th,2022-04-30,,[],positive,0.0,147.0,80.0
อนิเมะ,JbeRm6OpkD6bqp5,RT Keyofme จริงๆซีนแนะนำบ้านพวกนี้มันไม่มีในมังงะนะ อนิเมะเสริมมาให้ คือเสริมได้โอเคเลย ชอบมาก น้องอาเนียแนะนำบ้านได้น่าเอ็นดูมาก ได้เ,th,2022-04-30,,[],positive,0.0,1221.0,94.74
อนิเมะ,szeretlek947,รู้สึกผิดอ่ะ เพื่อนถามว่าจะลงเซคไหนแต่ยังไม่ตอบไปแปรงฟันก่อน พอแปรงเสร็จก็ลืมว่าเพื่อนถามเลยดูอนิเมะต่อ สุดท้ายเพื่อนยกเลิกข้อความไปแล้ว,th,2022-04-30,Sainua | Exo | Anime,[],negative,0.0,0.0,92.31
อนิเมะ,anime_yoko,Spy x Family สปาย x แฟมิลี่ ตอนที่ ซับไทยลิ้งค์รับชม อนิเมะ ดูอนิเมะ อนิเมะซับไทย อนิเมะพากย์ไทย anime animeyoko SPYxFamily สปายxแฟมิลี่ SPYFAMILY SPYFAMILY สปายแฟมมิลี่,th,2022-04-30,,"['อน', 'ด', 'อน', 'อน', 'anime', 'animeyoko', 'SPYxFamily', 'สปายxแฟม', 'SPY_FAMILY', 'SPYFAMILY', 'สปายแฟมม']",positive,0.0,0.0,66.67
อนิเมะ,chyanan_k,RT sixtysix ผู้ชายที่หลุดออกมาจากมังงะ เว็ปตูน อนิเมะ,th,2022-04-30,เธรดแนะนำ 𝕁𝕌𝕊𝕋 𝔹 จัสบี👇,[],negative,0.0,606.0,75.0
อนิเมะ,_ThousandG,กุประทับใจการฟรีซของทีมนี้มาก ก้อเต้นเบรคกิ้งเพลงญปไปเรยซิค๊า ใครติดใจแนวนี้แนะนำสเตจ aki baccano เป็นการแข่งแบทเทิลที่ใช้เพลงญปล้วนๆเลย แกจะได้เห็นคนเต้นเบรคกิ้งในเพลงอนิเมะอะอย่างเท่ แล้วที่อยากขายเพราะชั้นชอบจิ๋วมากน้องได้แชมป์ปีด้วย โคตรเก่ง,th,2022-04-30,,[],positive,0.0,0.0,99.69
อนิเมะ,manakayuT,RT nyamdhh จะเป็นลม พี่แทยงเขาหล่อเหมือนหลุดออกมาจากอนิเมะเลยอะ,th,2022-04-30,,[],negative,0.0,675.0,60.0
อนิเมะ,nynnynynny,RT leetyhi ละพี่แทยงเค้าร้ายกาจมากเลยนะ มาในร่างแจ็คฟรอส ร่างแวมไพร์ เออ เดินผ่านต้องเหลียวมอง ต้องโดนตกอะพูดเลย อนิเมะค่ดดดดดๆๆๆๆ อันเ,th,2022-04-30,jd tt mm nr sl ji lj yw ,[],negative,0.0,354.0,85.71
อนิเมะ,Pmprwg,RT museacgth บันทึกการเดินทางต่างโลกของท่านอัศวินกระดูก ฉบับรวบรัด ตอนที่ หลังจากอนิเมะฉายไปแล้วก็มารับชมฉบับรวบรัดของตอนที่ กันเ,th,2022-04-30,(づ｡◕‿‿◕｡)づ BTS 💜,['บ'],positive,0.0,1.0,88.89
อนิเมะ,babebluemoon,RT mmmrnn มึงจริง หนุ่มญีปุ่นพ่ออนิเมะบอย,th,2022-04-30,Hyunjin,[],,0.0,20.0,0.0
อนิเมะ,Torokozz,RT bemymayysh หล่อหน้าเป๊ะจริงๆ ฟีลแบบร็อคสตาร์เจแปนมากเว่อร์ แล้วก็ถ้าเอาไปเทียบกับอนิเมะซักเรื่องก็กลมกลืนไปกับตัวละครในนั้นได้เลย ฮื่อ,th,2022-04-30,#รีวิวของแจกtorokozz,[],positive,0.0,26.0,88.89
อนิเมะ,bymindme,รีวิวหนัง สปอยหนัง หนังดีบอกต่อ รีวิวnetflix รีวิวอนิเมชั่น แนะนำการ์ตูน อนิเมะ แนะนำอนิเมชั่นใหม่และดี ติดTop ในNetflixBubble แนวไซไฟ โรแมนติก ดราม่าๆ ภาพสวยตัวละครน่ารัก เนื้อเรื่องล้ำๆแต่แฝงไปด้วยพลังแห่งมิตรภาพ ดูได้เพลินๆแนะนำ ปลตอนพระเอกเขินน่ารักไม่ไหว,th,2022-04-30,,"['ร', 'สปอยหน', 'หน', 'ร', 'ร', 'แนะนำการ', 'อน']",neutral,0.0,0.0,0.0
อนิเมะ,hivzaa999,RT aommmtns ดูสเตจเพลงของขวัญของโอมนนนแล้วนึกถึงอนิเมะเรื่อง Given เลยอะ,th,2022-04-30,,[],,0.0,4.0,0.0
อนิเมะ,ntthpn_,RT itsatur But you ประกอบอนิเมะDragon เปิดในผับได้For real รับบทหลอนหู ฮัมไม่รู้ตัวGold ฟังตอนทำงานเพลินๆดีมากมีความไวป์วิน,th,2022-04-30,,[],negative,0.0,27.0,64.29
อนิเมะ,Ming_Yujie_,RT sixtysix ผู้ชายที่หลุดออกมาจากมังงะ เว็ปตูน อนิเมะ,th,2022-04-30,,[],negative,0.0,783.0,75.0
อนิเมะ,everydayand365,RT asaasahiather ตอนนี้ที่น้องบอกว่า อยากอยู่ด้วยกันตลอดไป เราร้องไห้เลย กับตอนน้องร้องไห้ก็ร้อง ฮืออ ถึงแม้จะเป็นครอบครัวที่เกิดขึ้นเพร,th,2022-04-30,In your heart :3,[],negative,0.0,17.0,94.12
อนิเมะ,mrchtosep,ลืมดูอนิเมะ,th,2022-04-30,baby star candy and aurora,[],,0.0,0.0,0.0
อนิเมะ,Aonpz1,RT sixtysix ผู้ชายที่หลุดออกมาจากมังงะ เว็ปตูน อนิเมะ,th,2022-04-30,,[],negative,0.0,783.0,75.0
อนิเมะ,itreasureyo,RT sixtysix ผู้ชายที่หลุดออกมาจากมังงะ เว็ปตูน อนิเมะ,th,2022-04-30,,[],negative,0.0,783.0,75.0
อนิเมะ,rabbitforjennie,อนิเมะเข้าดิสนีย์แล้ว เน็ตฟิกแกต้องระวังตัวนะเพราะดิสนีย์ถูกกว่าเยอะมากกกกกก ทำการตลาดดีๆๆ,th,2022-04-30,มีหวานใจแล้วค่ะคนดี,[],negative,0.0,0.0,60.0
อนิเมะ,TopRobo1,RT widmura รีวิว Bubbleเป็นอนิเมะ original Netflix ที่ดีเกินคาดไปมากๆๆ WIT Studio ทำภาพและ visual ต่างๆ ได้ดีมากๆ คนเขียนบทอย่างจอมมารเ,th,2022-04-30,,[],positive,0.0,2.0,80.0
อนิเมะ,chaaaa_la,Bilibili VIP days จอละ ฿ ดูอนิเมะได้ทุกเรื่องจุใจ โอนแล้วรับรหัสทันที สั่งซื้อสอบถาม dm onlyหารbilibili bilibiliหาร bilibilivip bilibiliหารราคาถูก bilibiliราคาถูก bilibili หารbilibiliราคาถูก หารbilibilivip,th,2022-04-30,ทักไลน์อย่างเดียวDMไม่เด้ง,"['หารbilibili', 'bilibiliหาร', 'bilibilivip', 'bilibiliหารราคาถ', 'bilibiliราคาถ', 'bilibili', 'หารbilibiliราคาถ', 'หารbilibilivip']",positive,0.0,0.0,94.12
อนิเมะ,Cavelyshimnamja,RT pu จิ้งเสวียน ท็อปวิชวลสาขาอนิเมะ ปะทะหยางหยาง ท็อปวิชวลสาขาการละคร หล่อไม่มีอยู่จริงกับหล่อเหมือนไม่มีอยู่จริงจะว่าไป หยางห,th,2022-04-30,thailand,[],positive,0.0,164.0,80.0
อนิเมะ,jaylerrr__,RT aommmtns ดูสเตจเพลงของขวัญของโอมนนนแล้วนึกถึงอนิเมะเรื่อง Given เลยอะ,th,2022-04-30,เน้นรีทวิต,[],,0.0,4.0,0.0
อนิเมะ,keikeikeykey,RT meldiox แจก Spyxfamily เล่มต่อจากอนิเมะตอน กติกา รีฟอลผชดไม่ต้องเสียค่าอะไรเลย ค่าส่งเราออกให้ค่ะ,th,2022-04-30,,[],positive,0.0,393.0,75.0
อนิเมะ,u70888251,RT sticker iQiYi Gold วัน ราคา บาทแพลตฟอร์มรวบรวมซีรีส์ อนิเมะ รายการดังมากมาย รับชมได้ไม่อั้น สายจีนแนะนำต้องแอพนี้เล,th,2022-04-30,,[],positive,0.0,1.0,80.0
อนิเมะ,anime_yoko,Word of Honor บัญญัติวีรชน ตอนที่ ซับไทยลิ้งค์รับชม อนิเมะ ดูอนิเมะ อนิเมะซับไทย อนิเมะพากย์ไทย anime animeyoko WordofHonor JunYouYun บัญญัติวีรชน,th,2022-04-30,,"['อน', 'ด', 'อน', 'อน', 'anime', 'animeyoko', 'WordofHonor', 'JunYouYun', 'บ']",positive,0.0,0.0,66.67
อนิเมะ,folt_yy,RT shopbook ขาย PASH ILLUSTRATION FILE ในเล่มจะมีรูปภาพจาก ปรมาจารย์ลัทธิมาร สวรรค์ประทานพร และ อนิเมะเรื่องอื่นๆ ที่เคย,th,2022-04-30,,"['ปรมาจารย', 'สวรรค']",,0.0,1.0,0.0
อนิเมะ,anime_yoko,Qian Cong Shou The Indomitable ตำนานนักล่าพลังคาถา ตอนที่ ซับไทยลิ้งค์รับชม อนิเมะ ดูอนิเมะ อนิเมะซับไทย อนิเมะพากย์ไทย anime animeyoko QianCongShou TheIndomitable ตำนานนักล่าพลังคาถา,th,2022-04-30,,"['อน', 'ด', 'อน', 'อน', 'anime', 'animeyoko', 'QianCongShou', 'TheIndomitable', 'ตำนานน']",positive,0.0,0.0,66.67
อนิเมะ,Magane_POT,RT sansuwen ถ้ามีครั้งหน้า ทายรูปขอเป็นภาพในอนิเมะได้ไหมคะ นุว่าคนน่าจะตามเรื่องจากอนิเมะมากกว่ามังงะอะค่ะ แง้ กีฬาสีด้อมเทนนิส,th,2022-04-30,เป็นทุกอย่างให้เธอแล้ว,['ก'],,0.0,3.0,0.0
อนิเมะ,cho37845990,เเลกอนิเมะที่ชอบกันมั๊ย จะทําความรู้จักกับnctzenที่มารีทวิต,th,2022-04-30,allren  johnjae doten,['จะท'],,0.0,0.0,0.0
อนิเมะ,Little_Alice07,RT sunghooncute IQiyi Gold day ฿ ส่วนใหญ่เป็นหนังซีรีส์จีน และยังมีรายการวาไรตี้ อนิเมะจีนเหมาะสําหรับคนที่ชอบดูร,th,2022-04-30,,[],positive,0.0,1.0,66.67
อนิเมะ,hoorayxaz,RT museacgth กำหนดการอนิเมะในวันนี้ Black Bullet ตอนที่ เวลา ยอดกุ๊กแดนมังกร ตอนที่ เวลา เรื่องเล่าผีญี่,th,2022-04-30,,[],,0.0,14.0,0.0
อนิเมะ,TreX_ddiza,RT sixtysix ผู้ชายที่หลุดออกมาจากมังงะ เว็ปตูน อนิเมะ,th,2022-04-30,,[],negative,0.0,759.0,75.0
อนิเมะ,ai_unj,RT YJmoaaa อันดับศิลปินที่อยากไปคอนมากที่สุดทีเร้ก TXT TOMORROW X TOGETHER ทูบาทู ทีบายทีวงที่มีลีดเดอร์เก่งๆ,th,2022-04-30,,[],positive,0.0,194.0,85.71
อนิเมะ,idea5225,RT jamthofficial รวมรวมอนิเมะมูฟวี่ที่ควรค่าแก่การดูเป็นอย่างยิ่ง รีทวิตเก็บกันไว้เลยยภาพยนตร์ในเธรดเป็นเรื่องที่มีช่องทางรับชมแบบ,th,2022-04-30,,[],positive,0.0,765.0,80.0
อนิเมะ,sawneko,RT iQIYIThailand แฟนๆ Tokyo Ghoul ห้ามพลาดพฤษภาคมนี้มาให้รับชมแน่ ติดตามได้ที่ iQiyi เลยน้าใครที่กำลังรออยู่ดาวโหลดแอปรอได้เลย,th,2022-04-30,IG : jwxxsnxx,[],positive,0.0,7.0,80.0
อนิเมะ,MmayyB_,RT sixtysix ผู้ชายที่หลุดออกมาจากมังงะ เว็ปตูน อนิเมะ,th,2022-04-30,ม่ายฟิกคู่และม่ายฟิกโพคับ(•ㅅ•),[],negative,0.0,546.0,75.0
อนิเมะ,nanewp,RT BxAmmG พรางตัวยังไงให้สวยขนาดนี้ตํานานจอมยุทธ์ภูตถังซาน อนิเมะตํานานจอมยุทธ์ภูตถังซาน ดินเเดนพรมยุทธ์ อนิเมะ DouluoDalu Do,th,2022-04-30,"กรุงเทพมหานคร, ประเทศไทย","['ต', 'อน', 'ด', 'อน', 'DouluoDalu', 'Do']",positive,0.0,12.0,80.0
อนิเมะ,matxchalast,RT sixtysix ผู้ชายที่หลุดออกมาจากมังงะ เว็ปตูน อนิเมะ,th,2022-04-30,Treasure 💎💥☄️,[],negative,0.0,488.0,75.0
อนิเมะ,daisuki_yeonjun,RT YJmoaaa อันดับศิลปินที่อยากไปคอนมากที่สุดทีเร้ก TXT TOMORROW X TOGETHER ทูบาทู ทีบายทีวงที่มีลีดเดอร์เก่งๆ,th,2022-04-30,ติ่งหลายด้อม,[],positive,0.0,146.0,85.71
อนิเมะ,SICKNERV6,RT leetyhi ละพี่แทยงเค้าร้ายกาจมากเลยนะ มาในร่างแจ็คฟรอส ร่างแวมไพร์ เออ เดินผ่านต้องเหลียวมอง ต้องโดนตกอะพูดเลย อนิเมะค่ดดดดดๆๆๆๆ อันเ,th,2022-04-30,"⠀✮ ✮ ✮
⠀envy╺leviathan
⠀
⠀similar to serpent d҉emons is 
⠀✟⃝ the demon o𝖋 envy in 
⠀
⠀⠀⠀⠀⠀⠀⠀⠀⠀⠀⠀⠀⠀⠀the 7 deadly 𝖘ins⠀
",[],negative,0.0,257.0,85.71
อนิเมะ,Hinasuru_AD,อ่านมังงะว่าดีแล้วพอเป็นอนิเมะตอนนี้ทำน้ำตาซึ่มเลยสงสารน้อง,th,2022-04-30,นักอยากพากย์,[],positive,0.0,0.0,60.0
อนิเมะ,hadmeatsep,RT jnttp เป็นอนิเมะที่จังหวะโบ๊ะบ๊ะเยอะมาก,th,2022-04-30,Portgas D. Ace,[],,0.0,59.0,0.0
